{"organizations": ["EarthLink Holdings Corporation", "Telefonica", "RSI", "Chartered Financial Analyst", "About Equity Research Institute", "ELNK", "Orange Stocks Coverage", "EarthLink", "EarthLink Holdings", "S&P", "Telefonica S.A.", "Windstream Holdings", "CenturyLink Inc.", "Windstream Holdings Inc.", "CFA Institute", "EarthLink Holdings Corp.", "Orange", "Equity Research Institute"], "uuid": "0d15dcd45a75248ade7d4b563fdb64eecf2c6280", "thread": {"social": {"gplus": {"shares": 0}, "pinterest": {"shares": 0}, "vk": {"shares": 0}, "linkedin": {"shares": 0}, "facebook": {"likes": 0, "shares": 0, "comments": 0}, "stumbledupon": {"shares": 0}}, "site_full": "science-technology.news-articles.net", "main_image": "", "site_section": "http://science-technology.news-articles.net/content/rss.php", "section_title": "Science and Technology @ News Articles Network", "url": "http://science-technology.news-articles.net/content/stocks-coverage-the-technology-sector-centurylink-windstream-holdings-telefonica-earthlink-orange.xhtml", "country": "US", "title": "Stocks Coverage on the Technology Sector -- CenturyLink, Windstream Holdings, Telefonica, EarthLink Holdings, and Orange", "performance_score": 0, "site": "news-articles.net", "participants_count": 0, "title_full": "Stocks Coverage on the Technology Sector -- CenturyLink, Windstream Holdings, Telefonica, EarthLink Holdings, and Orange", "spam_score": 0.0, "site_type": "news", "published": "2015-09-11T22:33:00.000+03:00", "replies_count": 0, "uuid": "0d15dcd45a75248ade7d4b563fdb64eecf2c6280"}, "author": "", "url": "http://science-technology.news-articles.net/content/stocks-coverage-the-technology-sector-centurylink-windstream-holdings-telefonica-earthlink-orange.xhtml", "ord_in_thread": 0, "title": "Stocks Coverage on the Technology Sector -- CenturyLink, Windstream Holdings, Telefonica, EarthLink Holdings, and Orange", "locations": ["Belarus", "Iran", "Cuba", "Canada", "Syria", "North Korea", "NEW YORK", "Sudan", "ORAN", "Somalia"], "entities": {"persons": [], "locations": [], "organizations": []}, "highlightText": "", "language": "english", "persons": ["ERI", "Rohit Tuli"], "text": "Stocks Coverage on the Technology Sector -- CenturyLink, Windstream Holdings, Telefonica, EarthLink Holdings, and Orange   Published on 2015-09-11 07:02:51 Stocks Coverage on the Technology Sector -- CenturyLink, Windstream Holdings, Telefonica, EarthLink... -- NEW YORK, September   <-   NEW YORK , September   Equity Research Institute has initiated coverage on the following equities: CenturyLink Inc. (NYSE: CTL ), Windstream Holdings Inc. (NASDAQ: WIN ), Telefonica S.A. (NYSE: TEF ), EarthLink Holdings Corporation (NASDAQ: ELNK ), and Orange (NYSE: ORAN ). Free research report on CenturyLink can be accessed at https://www.erionline.net/reports?keyword=CTL On Thursday, September 10, 2015 , the NASDAQ Composite ended at 4,796.25, up 0.84%, the Dow Jones Industrial Average edged 0.47% higher, to finish the day at 16,330.40, and the S&P 500 closed at 1,952.29, up 0.53%. The gains were broad based as eight out of nine sectors ended the session in positive. Register for your complimentary reports at the links given below. On Thursday, shares in CenturyLink Inc. recorded a trading volume of 7.83 million shares, higher than their three months average volume of 5.97 million shares. The stock ended the day 0.70% lower at $26.78 . Shares of the company traded at a PE ratio of 21.25. CenturyLink Inc.'s stock has lost 3.23% in the last one month, 16.51% in the previous three months and 28.83% on YTD basis. The company is trading below its 50-day and 200-day moving averages by 3.68% and 19.30%, respectively. Furthermore, shares of CenturyLink Inc. have a Relative Strength Index (RSI) of 48.08. Sign up and read the free notes on CTL at: https://www.erionline.net/reports?keyword=CTL Windstream Holdings Inc.'s stock advanced 1.19%, to close Thursday's session at $7.64 . The stock recorded a trading volume of 3.22 million shares, below its three months average volume of 4.50 million shares. Over the last one month and over the previous three months, Windstream Holdings Inc.'s shares have surged 26.49% and 2.26%, respectively. However, the stock has declined 37.55% since the start of this year. The company is trading 26.76% above its 50-day moving average. Furthermore, Windstream Holdings Inc.'s stock has an RSI of 66.58. The complimentary notes on WIN can be downloaded in PDF format at: https://www.erionline.net/reports?keyword=WIN Telefonica S.A.'s stock finished Thursday's session 1.19% lower at $13.30 . A total of 0.96 million shares were traded, which was below its three months average volume of 1.56 million shares. Over the last one month and the previous three months, Telefonica S.A.'s shares have lost 13.64% and 8.47%, respectively. Furthermore, the stock has lost 2.51% since the beginning of 2015. The company's shares are trading below their 50-day and 200-day moving averages by 8.69% and 7.46%, respectively. Telefonica S.A.'s stock traded at a PE ratio of 21.11 and has an RSI of 32.15. Register for free on Equity Research Institute and access the latest research on TEF at: https://www.erionline.net/reports?keyword=TEF On Thursday, shares in EarthLink Holdings Corp. ended the session 2.20% higher at $8.84 . The stock reported a trading volume of 0.72 million shares, below its three months average volume of 1.16 million shares. EarthLink Holdings Corp.'s shares have gained 0.68% in the last one month and 22.94% in the previous three months. Furthermore, the stock has rallied 105.01% since the start of this year. The company is trading 8.88% above its 50-day moving average and 52.58% above its 200-day moving average. Moreover, shares of EarthLink Holdings Corp. have an RSI of 58.96. The complete research on ELNK is available for free at: https://www.erionline.net/reports?keyword=ELNK Orange 's stock advanced 1.64%, to close the day at $16.08 . The stock recorded a trading volume of 0.45 million shares, below its three months average volume of 0.57 million shares. Over the last one month and since the start of this year, Orange's shares have declined 3.31% and 2.22%, respectively. However, the stock has gained 1.77% in the previous three months. The company's shares are trading 0.41% above their 50-day moving average. Additionally, Orange traded at a PE ratio of 41.23 and has an RSI of 54.19. Free in-depth research on ORAN is available at: -- About Equity Research Institute: Equity Research Institute (\"ERI\") produces regular sponsored and non-sponsored reports, articles, stock market blogs, and popular investment newsletters covering equities listed on NYSE and NASDAQ and micro-cap stocks. ERI has two distinct and independent departments. One department produces non-sponsored analyst certified content generally in the form of press releases, articles and reports covering equities listed on NYSE and NASDAQ and the other produces sponsored content (in most cases not reviewed by a registered analyst), which typically consists of compensated investment newsletters, articles and reports covering listed stocks and micro-caps. Such sponsored content is outside the scope of procedures detailed below. ERI has not been compensated; directly or indirectly; for producing or publishing this document. PRESS RELEASE PROCEDURES: The non-sponsored content contained herein has been prepared by a writer (the \"Author\") and is fact checked and reviewed by a third party research service company (the \"Reviewer\"). Rohit Tuli , a CFA® charter holder (the \"CFA®\"), provides necessary guidance in preparing the document templates. The Reviewer has reviewed and revised the content, as necessary, based on sound investment judgment and publicly available information which is believed to be reliable. The Reviewer and the CFA® have not performed any independent investigations or forensic audits to validate the information herein. Unless otherwise noted, any content outside of this document has no association with the Author, the Reviewer, or the CFA® (collectively referred to as the \"Production Team\") in any way. The Production Team is compensated on a fixed monthly basis and do not hold any positions of interest in any of the securities mentioned herein. NO WARRANTY ERI, the Author, the Reviewer and the CFA® (collectively referred to as the \"Publishers\") are not responsible for any error which may be occasioned at the time of printing of this document or any error, mistake or shortcoming. No liability is accepted by the Publishers whatsoever for any direct, indirect or consequential loss arising from the use of this document. The Publishers expressly disclaim any fiduciary responsibility or liability for any consequences, financial or otherwise arising from any reliance placed on the information in this document. Additionally, the Publishers do not (1) guarantee the accuracy, timeliness, completeness or correct sequencing of the information, or (2) warrant any results from use of the information. The included information is subject to change without notice. NOT AN OFFERING This document is not intended as an offering, recommendation, or a solicitation of an offer to buy or sell the securities mentioned or discussed, and is to be used for informational purposes only. Please read all associated disclosures and disclaimers in full before investing. Neither ERI nor any party affiliated with us is a registered investment adviser or broker-dealer with any agency or in any jurisdiction whatsoever. To download our report(s), read our disclosures, or for more information, visit www.erionline.net . RESTRICTIONS ERI is not available to residents of Belarus , Cuba , Canada , Iran , North Korea , Sudan , Syria or Somalia . Do not send email to robottrap (at) erionline.net. CFA® and Chartered Financial Analyst® are registered trademarks owned by CFA Institute.", "external_links": [], "published": "2015-09-11T22:33:00.000+03:00", "crawled": "2015-09-11T22:21:01.578+03:00", "highlightTitle": ""}