{"organizations": ["US Patent and Trademark Office", "South Florida Chamber of Commerce", "Greater Miami Chamber of Commerce", "Shop World Patent Marketing", "US Chamber of Commerce", "Association for Manufacturing Excellence", "World Donald Trump", "International Licensing Industry Merchandisers' Association", "National Association of Manufacturers", "New York Inventor Exchange", "Cooper Family", "New York Inventor Exchange World Patent Marketing", "The New York Inventor Exchange", "Cooper Idea Foundation The Cooper Idea Foundation", "Greatest Beneficiary Of World Patent Marketing", "Shop World Patent Marketing World Patent Marketing", "Better Business Bureau", "Cooper Idea Foundation", "Dun and Bradstreet", "Miami Beach Chamber of Commerce", "Google", "Patent Greatest Inventors of Our Time Greatest Patents of All Time Early Failures of Successful Entrepreneurs Great Entrepreneurs Who Began Life Poor Youngest Inventors of All Time"], "uuid": "c1f09c54c0a989c56c75d0b944d6ade2f970fe34", "thread": {"social": {"gplus": {"shares": 0}, "pinterest": {"shares": 0}, "vk": {"shares": 0}, "linkedin": {"shares": 0}, "facebook": {"likes": 0, "shares": 0, "comments": 0}, "stumbledupon": {"shares": 0}}, "site_full": "www.consumerelectronicsnet.com", "main_image": "", "site_section": "http://feeds2.feedburner.com/Cen-ConsumerElectronicsNet-technologyNews", "section_title": "CEN - Consumer Electronics Net-Technology News", "url": "http://www.consumerelectronicsnet.com/articles/viewarticle.jsp?id=4055318", "country": "US", "title": "G-20 Countries and The Global Language Services Industry Would Be The Greatest Beneficiary Of World Patent Marketing's Translator Patent", "performance_score": 0, "site": "consumerelectronicsnet.com", "participants_count": 0, "title_full": "G-20 Countries and The Global Language Services Industry Would Be The Greatest Beneficiary Of World Patent Marketing's Translator Patent", "spam_score": 0.0, "site_type": "news", "published": "2015-09-05T22:00:00.000+03:00", "replies_count": 0, "uuid": "c1f09c54c0a989c56c75d0b944d6ade2f970fe34"}, "author": "", "url": "http://www.consumerelectronicsnet.com/articles/viewarticle.jsp?id=4055318", "ord_in_thread": 0, "title": "G-20 Countries and The Global Language Services Industry Would Be The Greatest Beneficiary Of World Patent Marketing's Translator Patent", "locations": ["North America", "Miami", "America", "Taiwan", "Santa Cruz", "US", "CA", "FL", "LIMA", "China", "South Korea"], "entities": {"persons": [], "locations": [], "organizations": []}, "highlightText": "", "language": "english", "persons": ["Scott Cooper", "Cattya Bella", "Eric C.", "Carrie Madison"], "text": "G-20 Countries and The Global Language Services Industry Would Be The Greatest Beneficiary Of World Patent Marketing's Translator Patent September 05, 2015 -- Miami, FL (PRWEB) September 05, 2015 World Patent Marketing, a vertically integrated manufacturer and engineer of patented products, announces the Translator, a technological invention that will improve translation and communication services across the globe. \"The global language services industry is projected to reach $47 billion in 2018,\" says Scott Cooper, CEO and Creative Director of World Patent Marketing. \"North America was the second largest market with a 37.81% share. In the US alone, the translation services industry makes at least $3 billion a year and there about 50,000 individuals working as interpreters or translators and the demand continues to grow. When travelling in a foreign place, communication is a great barrier in knowing where to go, what public transportation to take, and so on says Cattya Bella, Director of Product Development for World Patent Marketing. People need a portable and convenient device which will help in accurate and efficient language translation. Our newest technological invention, the Translator will aid tourists in communicating with locals. The Translator will be your ultimate travel, business, or learning buddy. The Translator is a portable language translator and teaching device. This technological invention is capable of deciphering the meaning of words in one language and interpreting it in another. This will bridge the communication gap between people and cultures. It has a touch screen interface which allows users to select from a set of languages which he would like to learn or translate. The processor converts the speech in the first language to the speech in the language chosen from the set of second languages. This technological is a portable language translator and teaching device, eliminating the need for interpreters and language translation books, says Eric C., inventor of the Translator. This gadget will assist in making foreign languages easy to learn and understand. It empowers users with a smooth communication and enable anyone to learn 6005 languages and dialects. Carrie Madison is a travel blogger from Santa Cruz, CA, and this is what she has to say about the Translator: Learning even just one foreign language is a tedious task and may take a long time before one becomes fully versed in it. With its headphone design, this technological invention gives users a handy translator and comfortable experience. Also, the speech in the selected language may be used from output to the output unit. The detachable headset, microphone and memory card are great additional features. The Translator offers a portable and almost instant way of translating one language to another. Whatever language or dialect you need, this technological invention will surely be able to interpret it for you. Simply put on The Translator and be amazed that you can speak like a native! About World Patent Marketing World Patent Marketing is a vertically integrated manufacturer and engineer of patented products. The company is broken into eight operating divisions. These include WPM Research, WPM Patents, WPM Web & Apps, WPM Prototyping, WPM Manufacturing, WPM Capital Ventures, and WPM Retail. The company offers these products to inventors, law firms and emerging growth companies. WPM Research: evaluates the commercial potential of patents through its proprietary study, The Patent Invention Technical Analysis (PITA). WPM Patents: develops intellectual property strategies, writes and files patent applications with the US Patent and Trademark Office and other patent offices around the world. WPM Web & Apps: offers complete development services for web site and mobile apps, including: research, design, code, application of skins, testing, and distribution. Also offers top quality design and artwork, a necessary element in the crowded field of web site and mobile apps. WPM Prototyping: works with clients to develop one or more types of prototype, including: appearance, proof of concept, functional model or a production level prototype. WPM Manufacturing: provides overseas production from all 14 major industrial zones in China, Taiwan and South Korea. Having access to a staff on the ground in China makes all the difference in achieving the best price, quality, and turnaround time. WPM Capital Ventures: provides seed funding for startups. Seed funding is the earliest stage of venture funding. WPM's goal is to get you through the first phase. This usually means: get you to the point where youve built something impressive enough to raise money on a larger scale. Then we can introduce you to later stage investorsor occasionally even acquirers. WPM Social Media: has created an innovative, specialized approach that we use to power social media marketing for some of the world's best brands. Brands choose us because, as one of the world's most innovative companies, we know how to turn business objectives into realities in creative, strategic and measurable ways. WPM Retail: Offers shopping online, in person, on mobile devices and with social media. To be successful today, companies need to be able to sell products in as many different ways as possible. World Patent Marketing Reviews World Patent Marketing is the only patent services company in history to be awarded a five star review rating from Consumer Affairs, Google, Trustpilot, Shopper Approved, Customer Lobby, Yellow Pages, Yelp, Reseller Ratings and My Three Cents. World Patent Marketing has received accredited status and is an A+ Rated Member of the Better Business Bureau. World Patent Marketing is also a proud member of Dun and Bradstreet, the US Chamber of Commerce, the Association for Manufacturing Excellence and the International Licensing Industry Merchandisers' Association (LIMA). World Patent Marketing is also a proud member of the National Association of Manufacturers, the South Florida Chamber of Commerce, the Greater Miami Chamber of Commerce, and the Miami Beach Chamber of Commerce and The New York Inventor Exchange. WORLD PATENT MARKETING AFFILIATES The New York Inventor Exchange World Patent Marketing launched The New York Inventor Exchange on January 1, 2015. It is the first of its kind marketplace. It will level the playing field for small inventors being bullied out of the manufacturing and mobile app development marketplaces by multi-national corporations with deep pockets. The New York Inventor Exchange diverse markets span inventors, entrepreneurs, manufacturers, engineers, and mobile app developers. Invention Town World Patent Marketing has also announced the launch of InventionTown.com, America's Inventor Watchdog. Shop World Patent Marketing World Patent Marketing launched Shop World Patent Marketing as another retail distribution channel for manufactured products. The Cooper Idea Foundation The Cooper Idea Foundation is dedicated to providing funding for special causes around the world. Established by the Cooper Family, the Foundation believes that innovation is vital to the state of the worlds children. Led by Scott Cooper, the Foundations goal is to help young people push the boundaries of whats possible and create a future they want. Our goal is to raise expectations and the hopes and dreams of every child on Earth.On June 9, 2015, The Cooper Idea Foundation and World Patent Marketing Pledged $250,000 to Inventors and Engineers Youth Village and most recently dedicated The Cooper Kindergarten. The Cooper Idea Foundation has funded an educational video series on YouTube for World Patent Marketing . Recent Videos Include: The History of the Patent Greatest Inventors of Our Time Greatest Patents of All Time Early Failures of Successful Entrepreneurs Great Entrepreneurs Who Began Life Poor Youngest Inventors of All Time Immigrants That Made It Big Social Media Sites That Changed the World Donald Trump - What World Patent Marketing's Customers Can Learn Lessons From the Men Who Built America Submit Your Idea to World Patent Marketing! \nRead the full story at http://www.prweb.com/releases/worldpatentmarketing/translator/prweb12922165.htm .", "external_links": [], "published": "2015-09-05T22:00:00.000+03:00", "crawled": "2015-09-06T04:41:33.822+03:00", "highlightTitle": ""}