{"organizations": ["Agiloft, Inc.", "Clarity Ventures", "Custom Workflow", "Partner Program", "Clarity Ventures Joins Agiloft", "Service Desk"], "uuid": "cbf268f93ef2378c32b1d121bd72fcaf593846a8", "thread": {"social": {"gplus": {"shares": 0}, "pinterest": {"shares": 0}, "vk": {"shares": 0}, "linkedin": {"shares": 0}, "facebook": {"likes": 0, "shares": 0, "comments": 0}, "stumbledupon": {"shares": 0}}, "site_full": "www.prnewswire.com", "main_image": "http://content.prnewswire.com/designimages/logo-prn-01_PRN.gif", "site_section": "http://www.prnewswire.com/rss/business-technology/all-business-technology-news.rss", "section_title": "PR Newswire: Business Technology", "url": "http://www.prnewswire.com/news-releases/clarity-ventures-joins-agilofts-global-partner-program-as-certified-reseller-300143405.html", "country": "US", "title": "Clarity Ventures Joins Agiloft's Global Partner Program as Certified Reseller", "performance_score": 0, "site": "prnewswire.com", "participants_count": 0, "title_full": "Clarity Ventures Joins Agiloft's Global Partner Program as Certified Reseller", "spam_score": 0.0, "site_type": "news", "published": "2015-09-16T15:45:00.000+03:00", "replies_count": 0, "uuid": "cbf268f93ef2378c32b1d121bd72fcaf593846a8"}, "author": "", "url": "http://www.prnewswire.com/news-releases/clarity-ventures-joins-agilofts-global-partner-program-as-certified-reseller-300143405.html", "ord_in_thread": 0, "title": "Clarity Ventures Joins Agiloft's Global Partner Program as Certified Reseller", "locations": ["Calif.", "U.S.", "Austin", "REDWOOD CITY", "Texas", "Agiloft REDWOOD CITY"], "entities": {"persons": [], "locations": [], "organizations": []}, "highlightText": "", "language": "english", "persons": ["Colin Earl", "Ron Halversen", "Agiloft"], "text": "Clarity Ventures Joins Agiloft's Global Partner Program as Certified Reseller -- REDWOOD CITY, Calif., Sept. 16, 2015 /PRNewswire/ -- Clarity Ventures Joins Agiloft's Global Partner Program as Certified Reseller Custom web application designers to feature Agiloft's award-winning Contract Management solution within their extensive eCommerce and mobile web design offerings 08:45 ET from Agiloft REDWOOD CITY, Calif. , Sept. 16, 2015 /PRNewswire/ -- Agiloft, Inc., a trusted provider of agile business process software, announced today that Austin, Texas -based Clarity Ventures has joined Agiloft's growing Partner Program as a Certified Reseller. Agiloft's award-winning solutions for Contract Lifecycle Management, Service Desk, and custom Workflow/BPM will round out Clarity's best-in-class custom eCommerce and mobile web design offerings. \"Clarity is a welcome addition to our rapidly growing partner ecosystem,\" said Colin Earl , CEO of Agiloft. \"Clarity's extensive experience in custom web application development and dedication to providing robust, effective, and timely solutions make them a perfect complement to Agiloft's top-rated suite of business process applications, and we are pleased to have them on board as a Certified Reseller.\" \"We are delighted to join Agiloft's Partner Program,\" said Ron Halversen , Vice President, Sales and Marketing for Clarity Ventures. \"The limitless adaptability of Agiloft's custom development platform and highly configurable out-of-the-box applications will enable us to deliver rapid, cutting-edge solutions for our clients' most complex business challenges. Agiloft's enterprise-level scalability and integration capabilities make it a great match for our full range of customers, from startups to the Fortune 500.\" Agiloft's Partner Program offers resellers industry-leading revenue margins of 35 to 45 percent, with ongoing revenue for the life of each contract. Certified Resellers also retain 100 percent of Professional Services revenue. Other benefits of partnership with Agiloft include: Referral, reseller, and white label opportunities Deal registration and lead assignment for customer exclusivity No sales quotas or minimum sales requirements Free Agiloft development license for partner (10 staff users and 50 end users) Co-branded sales and marketing collateral Free online training For more information on Agiloft's Partner Program, visit http://www.agiloft.com/partner-programs.htm . About Agiloft Over 2.5 million users at organizations ranging from small enterprises to U.S. government agencies and Fortune 100 companies depend on Agiloft's innovative applications for Help Desk , Contract Management , Custom Workflow , and more. Agiloft specializes in automating processes that are too complex for competing vendors. Our best practice templates and agile technology ensure rapid deployment and a fully extensible system. For more information, visit http://www.agiloft.com . Media Contact:", "external_links": [], "published": "2015-09-16T15:45:00.000+03:00", "crawled": "2015-09-16T16:05:07.141+03:00", "highlightTitle": ""}