{"organizations": ["Chairs of TRB", "National Academies", "Congress", "New York Department of Transportation", "Case Western Reserve University", "Department of Transportation", "Louisiana State University", "Florida Board of Professional Engineers", "Texas A&M Transportation Institute Xiong Yu", "TRB Sponsors"], "uuid": "3d565d3568803f57aeb4809a23cd4b5b26d0adc3", "thread": {"social": {"gplus": {"shares": 0}, "pinterest": {"shares": 0}, "vk": {"shares": 0}, "linkedin": {"shares": 0}, "facebook": {"likes": 0, "shares": 0, "comments": 0}, "stumbledupon": {"shares": 0}}, "site_full": "www.trb.org", "main_image": "", "site_section": "http://www.trb.org/Rss.aspx?sn=DataandInformationTechnologyRSSFeed", "section_title": "Data and Information Technology RSS Feed", "url": "http://www.trb.org/Main/Blurbs/173240.aspx", "country": "US", "title": "TRB Webinar: Nanotechnology- New methods and materials coming to a Department of Transportation near you", "performance_score": 0, "site": "trb.org", "participants_count": 0, "title_full": "TRB Webinar: Nanotechnology- New methods and materials coming to a Department of Transportation near you", "spam_score": 0.0, "site_type": "news", "published": "2015-09-21T21:59:00.000+03:00", "replies_count": 0, "uuid": "3d565d3568803f57aeb4809a23cd4b5b26d0adc3"}, "author": "", "url": "http://www.trb.org/Main/Blurbs/173240.aspx", "ord_in_thread": 0, "title": "TRB Webinar: Nanotechnology- New methods and materials coming to a Department of Transportation near you", "locations": ["Washington", "NW", "DC", "Florida"], "entities": {"persons": [], "locations": [], "organizations": []}, "highlightText": "", "language": "english", "persons": ["Anol Mukhopadhyay", "Georgene Geary", "Don Streeter", "Marwa Hassan", "Reggie Gillum"], "text": "  TRB Webinar: Nanotechnology- New methods and materials coming to a Department of Transportation near you Text Size: TRB Webinar: Nanotechnology- New methods and materials coming to a Department of Transportation near you 173240 TRB Webinar: Nanotechnology- New methods and materials coming to a Department of Transportation near you TRB will conduct a webinar on Thursday, December 10, 2015, from 2:00-3:30PM ET that will provide an overview of what nanotechnology is, including: what is nanoscale, what tools are used in nanotechnology, and how these tools can impact transportation. This webinar is based on E-Circular Number E-C170, Nanotechnology in Concrete Materials: A Synopsis . This webinar was organized by the TRB Task Force on Nanotechnology-Based Concrete Materials. Participants must register in advance of the webinar, and there is a fee for non-TRB Sponsor or non-TRB Sustaining Affiliate employees. A certificate for 1.5 Professional Development Hours (PDHs) will be provided to attendees who register and attend the webinar as an individual. Webinar Presenters Marwa Hassan, Louisiana State University Don Streeter, New York Department of Transportation Anol Mukhopadhyay, Texas A&M Transportation Institute Xiong Yu, Case Western Reserve University Moderator: Georgene Geary, GGfGA Engineering, LLC Webinar Outline What is nanoscale and why is it important? How do we differentiate material at the nano level? Nano-scale Characterization The National Nanotechnology Initiative (NNI) Question and answer session The first 60 minutes of the webinar will be for presentations and the final 30 minutes will be reserved for audience questions. The Registered Continuing Education Program (RCEP) categorizes this webinar activity as relating to health, safety, and welfare including core technical. Learning Objectives At the end of this webinar, participants will be able to: Understand what nanotechnology is and how it can be used in transportation applications Describe different examples of nanotechnology in use Assess possible future benefits of nanotechnology Registration Information There is no fee for employees of TRB Sponsors or TRB Sustaining Affiliates who register using their work email address. In addition to employees of TRB sponsor organizations, the following are eligible to receive complimentary webinar registration: TRB and National Academies employees; Chairs of TRB standing committees, sections, or groups; Members of the media; Employees of tribal governments; and Members of Congress or their staff. Other sites must pay $89 per site. View our pricing page for details. After registering you will receive a confirmation email containing information about joining the webinar. Professional Development Hour Information A certificate for 1.5 Professional Development Hours (PDHs) will be provided to Professional Engineers (PEs) who register and attend the webinar as an individual. For groups, only the person that registers and attends the session will receive a PDH certificate. Individuals registered as Florida PEs are no longer required to email TRB with your license number to report your attendance. Instead, please use your certificate that TRB provides through RCEP.net as verification of your attendance to the Florida Board of Professional Engineers. Please check with your licensing board to ensure that TRB webinar PDHs are approved by your board. This webinar was developed in March 2015. TRB has met the standards and requirements of the Registered Continuing Education Program (RCEP). Credit earned on completion of this program will be reported to RCEP by TRB. Certificates of Completion will be issued to individuals who register for and attend the entire webinar session. Complaints about registered providers may be sent to RCEP, 1015 15th Street, NW, 8th Floor, Washington, DC 20005. Website: www.RCEP.net . Registration questions? Contact Reggie Gillum at RGillum@nas.edu .   9/24/2015  ", "external_links": [], "published": "2015-09-21T21:59:00.000+03:00", "crawled": "2015-09-25T09:56:22.416+03:00", "highlightTitle": ""}