{"organizations": ["University of La Verne and Other Education", "AxioMx Inc", "Pixel Film Studios Releases TransTunnel", "ARUP", "EMV Migration Forum", "Health Care Leaders Unite to Boost Inland Health Jobs", "The Smart Card Alliance", "American Workers Ready", "Caldon Biotech, Inc", "ImaginAb Inc.", "ARUP Laboratories", "Inc", "Equitech-Bio", "University of Gothenburg", "Lake Placid Biologicals", "Digital Wallet Devices & Mobile Payment Management Services Gain", "Motility & Application", "Lantheus Medical Imaging Inc.", "NDA", "CTI BioPharma Corp.", "Smart Card Alliance", "Apple Inc.", "Compliance in Home Health Care", "Says Beverly Hills Physicians   Guinea Pig"], "uuid": "c45100097abfafc9386ec16f80286374b3241dfc", "thread": {"social": {"gplus": {"shares": 0}, "pinterest": {"shares": 0}, "vk": {"shares": 0}, "linkedin": {"shares": 0}, "facebook": {"likes": 0, "shares": 0, "comments": 0}, "stumbledupon": {"shares": 0}}, "site_full": "www.bio-medicine.org", "main_image": "", "site_section": "http://feeds.bio-medicine.org/latest-biology-technology", "section_title": "Latest Biology Technology from Bio-Medicine.Org", "url": "http://www.bio-medicine.org/biology-technology-1/AxioMx-Inc--Launches-AxioMx-MembraneProSelect-u2122-34111-1/", "country": "US", "title": "AxioMx Inc. Launches AxioMx MembraneProSelect™", "performance_score": 0, "site": "bio-medicine.org", "participants_count": 0, "title_full": "AxioMx Inc. Launches AxioMx MembraneProSelect™", "spam_score": 0.0, "site_type": "news", "published": "2015-09-22T16:40:00.000+03:00", "replies_count": 0, "uuid": "c45100097abfafc9386ec16f80286374b3241dfc"}, "author": "", "url": "http://www.bio-medicine.org/biology-technology-1/AxioMx-Inc--Launches-AxioMx-MembraneProSelect-u2122-34111-1/", "ord_in_thread": 0, "title": "AxioMx Inc. Launches AxioMx MembraneProSelect™", "locations": ["Sweden"], "entities": {"persons": [], "locations": [], "organizations": []}, "highlightText": "", "language": "english", "persons": ["Aliso Viejo", "Jeff Bailey", "Jeff"], "text": "Web www.bio-medicine.org (Date:8/20/2015)... OXFORD, CT ., Aug. 20, 2015 ... \"Company\"), a biometric authentication company focused on the growing ... wallet, announces it has joined The Smart Card Alliance ... the Smart Card Alliance and the Smart Card Alliance ... and visibility to industry peers and thought leaders promoting ... (Date:8/18/2015)... Aug. 17, 2015 Research and Markets ... the \"Global Biometric Authentication & Identification Market: ... & Forecast, 2015-2020\" report to their offering. ... identification systems market is expected to grow at ... 2020 and generate over $25 billion (approximately) by ... (Date:8/12/2015)... 2015 As the digital payment ... and advanced biometrics technology is accelerating beyond expectations. While ... on using their credit cards, the digital currency, mobile ... payment services led by companies in the space such ... Inc. (NASDAQ: GOOG ), Apple Inc. (NASDAQ: ... [ 0 ] NXT-ID, Inc. Joins Smart Card Alliance and EMV Migration Forum [ 0 ] Global Biometric Authentication & Identification Market 2015: Focus On Modality, Motility & Application - Estimation & Forecasts to 2020 for the $25 Billion Industry [ 2 ] Digital Wallet Devices & Mobile Payment Management Services Gain a Distinct Advantage in the Digital Payment Evolution as Demand Continues to Grow (Date:9/24/2015)... ... ... Many career men and women are still seeking work even though the unemployment rate ... huge need to reengage the American dream of hope and prosperity through fulfilling jobs. ... on October 14th to seek new job opportunities. During this one day event, ... (Date:9/24/2015)... ... 2015 , ... HEALTHCAREfirst , the leading provider of ... for the home care industry, announced the official launch of the most advanced ... HEALTHCAREfirst’s mobile solution, available now to home health providers nationwide, introduces a number ... (Date:9/23/2015)... Aliso Viejo, CA (PRWEB) , ... September 23, 2015 , ... ... effect with a click of a mouse all within Final Cut Pro X ... shape radius, and more leaving room for endless possibilities. TransTunnel offers more than 30 ... (Date:9/23/2015)... ... September 23, 2015 , ... ... commitment to Convergence, an initiative dedicated to establishing programs that produce a larger ... is the largest initiative of its kind in the nation. , The Convergence ... (Date:9/23/2015)... ... September 23, 2015 , ... ... conducted by researchers at University of Gothenburg, Sweden that provided further evidence that ... with Type 2 diabetes. While many past studies have examined the connection between ... [ 0 ] American Workers Ready to Re-Establish their Careers [ 0 ] HEALTHCAREfirst Unveils Mobile Solution Designed to Improve Productivity and Compliance in Home Health Care [ 0 ] Pixel Film Studios Releases TransTunnel for Final Cut Pro X. [ 0 ] University of La Verne and Other Education, Health Care Leaders Unite to Boost Inland Health Jobs [ 0 ] Article on Weight Loss Surgery and Diabetes Reinforces the Positive Effects of Bariatric Weight Loss, Says Beverly Hills Physicians   Guinea Pig Complement Lyophilized Powder from Equitech-Bio Stat-Pack Sputolysin Reagent from Caldon Biotech, Inc. Rabbit Anti-Human Histone H3, phospho (Ser10 / Ser28) Polyclonal Antibody, Unconjugated from Lake Placid Biologicals DeadEnd Fluorometric TUNEL System from Promega ... is a national reference laboratory and a ... development. ARUP offers an extensive test menu ... in clinical and anatomic pathology. Owned by ... include more than half of the nation's ... ... ARUP Laboratories is a national reference ... laboratory research and development. ARUP offers an ... unique medical tests in clinical and anatomic ... ARUP Laboratories' clients include more than half ... ... is a national reference laboratory and a ... development. ARUP offers an extensive test menu ... in clinical and anatomic pathology. Owned by ... include more than half of the nation's ... ... Laboratories is a national reference laboratory and ... and development. ARUP offers an extensive test ... tests in clinical and anatomic pathology. Owned ... clients include more than half of the ... Effexor Echovirus Culture EBV by PCR EBV Antibody To Viral Capsid Antigen, IgM   (Date:9/23/2015)... , Sept. 23, 2015 Research and ... of the \"Global Targeted Drug Delivery Partnering ... Targeted Drug Delivery Partnering 2010-2015 provides understanding ... deals and agreements entered into by the world,s ... provides a detailed understanding and analysis of how ... (Date:9/23/2015)... , Sept. 23, 2015 CTI BioPharma Corp. (CTI ... to submit a new drug application (NDA) to the ... pre-NDA meeting for pacritinib, an investigational oral kinase inhibitor ... company expects to submit the NDA in the fourth ... the treatment of patients with intermediate and high-risk myelofibrosis ... (Date:9/23/2015)... 23, 2015 ImaginAb Inc., a clinical-stage immune ... Jeff Bailey to its board of directors. ... in pharmaceuticals and diagnostic imaging. He most recently ... Lantheus Medical Imaging Inc. \"Jeff,s ... imaging products is a tremendous asset to ImaginAb, ...", "external_links": [], "published": "2015-09-22T16:40:00.000+03:00", "crawled": "2015-09-24T16:04:04.221+03:00", "highlightTitle": ""}