{"organizations": ["SDS", "Inc", "NFS", "Intel", "Facebook", "Data Center", "Ultrastar", "HGST"], "uuid": "55f9be53c9f117cd0c570cf37b8314f82d43a4c5", "thread": {"social": {"gplus": {"shares": 0}, "pinterest": {"shares": 0}, "vk": {"shares": 0}, "linkedin": {"shares": 0}, "facebook": {"likes": 0, "shares": 0, "comments": 0}, "stumbledupon": {"shares": 0}}, "site_full": "science-technology.news-articles.net", "main_image": "", "site_section": "http://science-technology.news-articles.net/content/rss.php", "section_title": "Science and Technology @ News Articles Network", "url": "http://science-technology.news-articles.net/content/supermicro-debuts-all-flash-software-defined-storage-solution-enterprise-cloud-scale-environments.xhtml", "country": "US", "title": "Supermicro Debuts 115TB All-Flash Software-Defined Storage Solution for Enterprise and Cloud Scale Environments", "performance_score": 0, "site": "news-articles.net", "participants_count": 0, "title_full": "Supermicro Debuts 115TB All-Flash Software-Defined Storage Solution for Enterprise and Cloud Scale Environments", "spam_score": 0.0, "site_type": "news", "published": "2015-09-02T08:34:00.000+03:00", "replies_count": 0, "uuid": "55f9be53c9f117cd0c570cf37b8314f82d43a4c5"}, "author": "", "url": "http://science-technology.news-articles.net/content/supermicro-debuts-all-flash-software-defined-storage-solution-enterprise-cloud-scale-environments.xhtml", "ord_in_thread": 0, "title": "Supermicro Debuts 115TB All-Flash Software-Defined Storage Solution for Enterprise and Cloud Scale Environments", "locations": ["Calif", "Nexenta", "SAN JOSE"], "entities": {"persons": [], "locations": [], "organizations": []}, "highlightText": "", "language": "english", "persons": ["Renate Quigley", "Supermicro", "Tarkan Maner", "Wally Liaw", "Nexenta"], "text": "Supermicro Debuts 115TB All-Flash Software-Defined Storage Solution for Enterprise and Cloud Scale Environments   Published on 2015-09-01 14:48:18 Supermicro Debuts 115TB All-Flash Software-Defined Storage Solution for Enterprise and Cloud... -- SAN JOSE, Calif.   > SAN JOSE, Calif.   Super Micro Computer, Inc. (NASDAQ: SMCI ), a global leader in high-performance, high-efficiency server, storage technology and green computing, in collaboration with Nexenta and HGST , has developed a turnkey scale-up high performance unified block and file storage solution optimized for high performance data-centric environments. Supermicro's 2U Ultra SuperServer® integrates NexentaStor , Nexenta's flagship Open Source-driven Software-Defined Storage (OpenSDS) platform combined with 2U SuperStorage featuring HGST's Ultrastar® SSD800MH.B and Ultrastar® SSD1600MM high-performance Flash-based storage delivers cluster solutions in 19TB, 38TB, 76TB and 115TB configurations. NexentaStor OpenSDS, designed for Enterprise class performance provides unified file (NFS and SMB) and block (FC and iSCSI) storage services and robust data management functions for maximum data integrity and high availability. The all-SSD solution supports the most demanding mission-critical applications in physical or virtualized infrastructure environments. \"Supermicro's best-in-class server, storage and networking solutions optimized for Enterprise, Data Center and Cloud scale environments drive business growth and innovation,\" said Wally Liaw, Sr. Vice President of Sales at Supermicro. \"Collaboration with Nexenta and HGST offers choices to our customers who are looking for high-performance all-flash SDS solutions and this highlights our strengths in advanced technology integration for high performance data workloads of any scale. This unified storage solution provides customers a scalable high IOPS storage infrastructure that delivers performance, reliability and cost effectiveness as well as ease of management with robust automation features.\" \"Nexenta is unrivaled in the industry as the only pure software-only provider of SDS for all platforms, stacks and workloads,\" said Tarkan Maner , Chairman and CEO of Nexenta. \"For businesses to scale with the exponential growth demands of data and analytics the industry needs to evolve from appliance-based storage to the dynamic flexibility of software-defined storage. Our collaboration with Supermicro and HGST on this new all-flash solution opens the door for organizations to accelerate business applications and dramatically increase performance, visibility and control across their storage infrastructure and lower both CAPEX/OPEX to reduce overall TCO.\" \"With decades of proven expertise, HGST is the de-facto market leader of high-performance and high-reliability enterprise-class SAS SSDs,\" said Renate Quigley , senior vice president of product marketing, HGST. \"Organizations are contending with both a growing data deluge and the need for instant data accessibility to drive real-time insight. Our collaboration with Nexenta and Supermicro on this new, all-flash SDS solution delivers the acceleration, reliability and scalability required to handle today's demanding enterprise and cloud scale storage requirements.\" Solution SpecificationsController Node 2x 2U Ultra SuperServer® (SYS-6028U-NEX2) – dual Intel® Xeon® processor E5-2643 v3 (3.4GHz, 6-core), 256GB (16x 16GB DIMMs), NexentaStor 4.0 software, 12Gbps SAS HBAs, 2x dual 10GbE SFP+ ports (NFSv3, NFSv4, CIFS, SMB 2.1, iSCSI) Storage Enclosures 19TB JBOD Cluster (SRS-NSM019-HGST-01-NS017) – 24x 2.5\" hot-swap HGST 800GB SSDs 38TB JBOD Cluster (SRS-NSM038-HGST-01-NS017) – 24x 2.5\" hot-swap HGST 1600GB SSDs 76TB JBOD Cluster (SRS-NSM076-HGST-01-NS017) – 48x 2.5\" hot-swap HGST 1600GB SSDs 115TB JBOD Cluster (SRS-NSM115-HGST-01-NS017) – 72x 2.5\" hot-swap HGST 1600GB SSDs Performance Up to 200,000 32KB IOPS and 6 GB/s maximum throughput List price ranges between $2 /Raw GB to $3.5 /Raw GB depending on the configuration Visit http://www.supermicro.com/Nexenta/ for more information on Supermicro/Nexenta SDS solutions. Visit www.supermicro.com for more information on Supermicro's complete range of high performance, high-efficiency Server, Storage and Networking solutions. Follow Supermicro on Facebook and Twitter to receive their latest news and announcements. About Super Micro Computer, Inc. Supermicro® (NASDAQ: SMCI ), the leading innovator in high-performance, high-efficiency server technology is a premier provider of advanced server Building Block Solutions® for Data Center, Cloud Computing, Enterprise IT, Hadoop/Big Data, HPC and Embedded Systems worldwide. Supermicro is committed to protecting the environment through its \"We Keep IT Green ® \" initiative and provides customers with the most energy-efficient, environmentally-friendly solutions available on the market. Supermicro, Building Block Solutions and We Keep IT Green are trademarks and/or registered trademarks of Super Micro Computer, Inc. All other brands, names and trademarks are the property of their respective owners. SMCI-F \nSOURCE Super Micro Computer, Inc. RELATED LINKS", "external_links": [], "published": "2015-09-02T08:34:00.000+03:00", "crawled": "2015-09-02T08:22:20.664+03:00", "highlightTitle": ""}