{"organizations": ["Big Data & Its Implications for Organizations", "Big Data", "Sarder TV", "New York Times Technology", "National Venture Capital Association", "Big Data & Its Implications for Organizations in Sarder TV Interview New York Times Technology", "Sarder TV Seeking Additional Leaders for Interviews Sarder TV", "Corner Office", "NetCom", "New York Times"], "uuid": "e8d5065a2e411553929cd8d10fb6f199167ed8b7", "thread": {"social": {"gplus": {"shares": 0}, "pinterest": {"shares": 0}, "vk": {"shares": 0}, "linkedin": {"shares": 0}, "facebook": {"likes": 0, "shares": 0, "comments": 0}, "stumbledupon": {"shares": 0}}, "site_full": "www.consumerelectronicsnet.com", "main_image": "", "site_section": "http://feeds2.feedburner.com/Cen-ConsumerElectronicsNet-technologyNews", "section_title": "CEN - Consumer Electronics Net-Technology News", "url": "http://www.consumerelectronicsnet.com/articles/viewarticle.jsp?id=4046643", "country": "US", "title": "New York Times Technology Reporter Steve Lohr Looks at the Future of Big Data & Its Implications for Organizations in Sarder TV Interview", "performance_score": 0, "site": "consumerelectronicsnet.com", "participants_count": 0, "title_full": "New York Times Technology Reporter Steve Lohr Looks at the Future of Big Data & Its Implications for Organizations in Sarder TV Interview", "spam_score": 0.0, "site_type": "news", "published": "2015-08-31T22:00:00.000+03:00", "replies_count": 0, "uuid": "e8d5065a2e411553929cd8d10fb6f199167ed8b7"}, "author": "", "url": "http://www.consumerelectronicsnet.com/articles/viewarticle.jsp?id=4046643", "ord_in_thread": 0, "title": "New York Times Technology Reporter Steve Lohr Looks at the Future of Big Data & Its Implications for Organizations in Sarder TV Interview", "locations": ["USA", "New York", "Sarder"], "entities": {"persons": [], "locations": [], "organizations": []}, "highlightText": "", "language": "english", "persons": ["Lohr", "Jennifer Crumpton", "Bill Clinton", "Steve Lohr Looks", "Susan Davis", "David Hershfield", "Bergdorf Goodman", "Warren Buffet", "Bill Gates", "Dan Hoffman", "Steve Lohr", "Russell Sarder", "Russ Edelman", "Ira Neimark", "Sarder", "Jim Collins", "Oprah Winfrey"], "text": "New York Times Technology Reporter Steve Lohr Looks at the Future of Big Data & Its Implications for Organizations in Sarder TV Interview August 31, 2015 -- New York, New York (PRWEB) August 31, 2015 Steve Lohr, long time journalist and the current technology and economics reporter for the New York Times, recently provided a thought provoking interview for Sarder TV , the independent online media learning channel. Speaking with Jennifer Crumpton, Sarder TV correspondent, Steve Lohr talks about the emerging world of what he refers to as Data-ism in which Big Data is used for critical decision making across companies, fields and countries. Lohr discusses his latest book, entitled Data-ism: The Revolution: Transforming Decision Making, Consumer Behavior, and Almost Everything Else, that looks at the opportunities and the dark side of a world driven by data. Steve Lohr is an experienced journalist and author with a pulse on the latest trends in technology and the expertise to see how this is changing the world economy and our daily lives, said Russell Sarder, CEO of NetCom Learning and creator of Sarder TV. We are delighted to add this interview with Steve Lohr with his unique perspective on life to the Sarder TV database of video interviews, said Sarder. In the interview for Sarder TV, Steve Lohr discusses the subject of Big Data or Data-ism in depth. He provides his forecasts for the changes that will occur in everyday life, and the challenges and opportunities it provides for individuals, corporations, and governments. He addresses the downside of Big Data including privacy issues, and possible misinterpretation of data and what that could mean in terms of business decisions, individual credit, and intelligence data. Lohr also offers an optimistic look at the use of data to provide new jobs, better customer service, new types of businesses, and improved products. The interview provides a visionary look at the future of technology and Big Data in terms of its importance to the future global economy and everyday life. Sarder TV offers stimulating, educational and candid interviews so that new entrepreneurs and aspiring business people can learn from them. The database is part of the international Learning Movement created by Russell Sarder to help spread knowledge and inspire a passion for lifelong learning. Operating on the premise that motivated individuals can learn from the experience, the success and the mistakes of others, Sarder TV provides a unique opportunity to see and hear influential personalities talk about the subjects that matter to them. Some of the past interviewees have included Ira Neimark, former CEO of Bergdorf Goodman, Susan Davis, CEO of BRAC USA, and Dan Hoffman, President and CEO of M5 Don't miss this interesting and provocative interview with Steve Lohr on Sarder TV by clicking here. Sarder TV Seeking Additional Leaders for Interviews Sarder TV is also seeking leaders to interview and is targeting leaders from Fortune 500 companies, and exceptional public figures like Bill Clinton, Oprah Winfrey, Jim Collins, Bill Gates, Warren Buffet and many more. According to the National Venture Capital Association, more than 30 percent to $600 million this year has been invested in Web-based education. For investors seeking an opportunity to participate in a multimillion dollar idea, Sarder TV presents an excellent investment and is actively seeking investors. Several investors have already expressed an interest in this innovative idea. Investors interested in becoming a part of Sarder TV are invited to get in touch as well, contact us at russellsarder(at)netcomlearning(dot)com. About Sarder TV Sarder TV is a learning channel that contains a series of exclusive educational interview videos from top leaders in their industries, as well as motivational videos encouraging our public to succeed in their personal and professional lives, and many more. Russell Sarder, CEO of Sarder TV, has interviewed a series of leaders, who have shared their experiences and how they were able to achieve their success. Some of the names that Sarder has interviewed are: Ira Neimark, former CEO of Bergdorf Goodman; Russ Edelman, co-author of Nice Guys Can Get the Corner Office, Dan Hoffman, and David Hershfield, SVP Online Technology at RedCats. \nRead the full story at http://www.prweb.com/releases/2015/09/prweb12933825.htm .", "external_links": [], "published": "2015-08-31T22:00:00.000+03:00", "crawled": "2015-09-01T04:15:27.469+03:00", "highlightTitle": ""}