{"organizations": ["PR Newswire", "Asia Netflix", "PayPal", "Netflix", "Business Wire India"], "uuid": "4fa902073230e3c99c8f853e2d6018aa3ac949a4", "thread": {"social": {"gplus": {"shares": 0}, "pinterest": {"shares": 0}, "vk": {"shares": 0}, "linkedin": {"shares": 0}, "facebook": {"likes": 0, "shares": 0, "comments": 0}, "stumbledupon": {"shares": 0}}, "site_full": "www.onenewspage.com", "main_image": "http://cdn.newsserve.net/ONPglobe256.jpg", "site_section": "http://www.onenewspage.com/rss/latest/Technology.rss", "section_title": "Latest Technology News on One News Page", "url": "http://www.onenewspage.com/n/Technology/7558963cl/Netflix-continues-global-expansion-with-launches-across-Asia.htm", "country": "US", "title": "Netflix continues global expansion with launches across Asia", "performance_score": 0, "site": "onenewspage.com", "participants_count": 0, "title_full": "Netflix continues global expansion with launches across Asia", "spam_score": 0.0, "site_type": "news", "published": "2015-09-09T09:44:00.000+03:00", "replies_count": 0, "uuid": "4fa902073230e3c99c8f853e2d6018aa3ac949a4"}, "author": "", "url": "http://www.onenewspage.com/n/Technology/7558963cl/Netflix-continues-global-expansion-with-launches-across-Asia.htm", "ord_in_thread": 0, "title": "Netflix continues global expansion with launches across Asia", "locations": ["Portugal", "Hong Kong", "Taiwan", "SINGAPORE", "Spain", "Italy", "TOKYO", "U.S.", "Singapore", "Los Gatos", "Australia", "Amazon", "Asia", "Japan", "New Zealand", "South Korea"], "entities": {"persons": [], "locations": [], "organizations": []}, "highlightText": "", "language": "english", "persons": [], "text": "Netflix continues global expansion with launches across Asia Wednesday, 9 September 2015 (27 minutes ago) Netflix this week announced plans to expand its streaming service to Hong Kong, Singapore, South Korea , and Taiwan, as the company continues its push across Asia. In a press release, Netflix said it would launch in its four new Asian markets in early 2016, though details on programming and pricing have yet to be announced. Netflix first entered Asia this month, when it launched in Japan. The Los Gatos, California-based company has made international expansion a priority in recent months. It launched in Australia and New Zealand earlier this year, and will debut in Italy, Portugal, and Spain next month. At the beginning of this year, Netflix said it aims to be present in 200 countries by the end of 2016, as it looks to expand its s... Netflix Faces Headwinds in Japan 01:00 Netflix launched in Japan this week, entering a crowded and difficult market in which VOD profits have been hard to come by and where some of its flagship content is already available.Japan represents Netflixâ€™s debut in Asia, and the young, fast-growing region that is home to two-thirds of the... Recent related news Netflix just dipped its toes into Asia with a launch in Japan this month, and now the U.S. video streaming service has revealed plans for a major expansion... TechCrunch 2 hours ago - Technology SINGAPORE, Sept. 9, 2015 /PRNewswire/-- PayPal, the global leader in payments, announced today that it will be making a significant expansion to its Seller... PR Newswire Asia 6 hours ago - Press Releases *Business Wire India*ZTE, a leading global mobile device maker, today announced the launch of the international version of its new global flagship smartphone,... Business Wire India 5 days ago - Press Releases September is turning out to be a significant month for Amazon on the international expansion front. The e-commerce giant announced the availability of its... VentureBeat 1 week ago - Technology TOKYO, August 31, 2015 /PRNewswire/ -- Software quality firm continues expansion in Asia with key sales and support office in Japan TestPlant, the maker of... PR Newswire 1 week ago - Press Releases You Might Like Other recent news in Technology", "external_links": [], "published": "2015-09-09T09:44:00.000+03:00", "crawled": "2015-09-09T10:10:02.027+03:00", "highlightTitle": ""}