{"organizations": ["KBC", "Transaction Signing for Mobile Banking   Published", "KBC Group", "VASCO Data Security International, Inc.", "KBC Bank Ireland Selects VASCO", "Bank of You", "Cork", "Transaction Signing for Mobile Banking KBC Bank Ireland", "Facebook", "VASCO VASCO", "KBC KBC Bank"], "uuid": "29e99b9d93d73ada5a3c832d429560ec42fa75c8", "thread": {"social": {"gplus": {"shares": 0}, "pinterest": {"shares": 0}, "vk": {"shares": 0}, "linkedin": {"shares": 0}, "facebook": {"likes": 0, "shares": 0, "comments": 0}, "stumbledupon": {"shares": 0}}, "site_full": "science-technology.news-articles.net", "main_image": "", "site_section": "http://science-technology.news-articles.net/content/rss.php", "section_title": "Science and Technology @ News Articles Network", "url": "http://science-technology.news-articles.net/content/kbc-bank-ireland-selects-vasco-enable-apple-touchid-support-transaction-signing-mobile-banking.xhtml", "country": "US", "title": "KBC Bank Ireland Selects VASCO to Enable Apple TouchID Support and Transaction Signing for Mobile Banking", "performance_score": 0, "site": "news-articles.net", "participants_count": 0, "title_full": "KBC Bank Ireland Selects VASCO to Enable Apple TouchID Support and Transaction Signing for Mobile Banking", "spam_score": 0.0, "site_type": "news", "published": "2015-09-16T15:34:00.000+03:00", "replies_count": 0, "uuid": "29e99b9d93d73ada5a3c832d429560ec42fa75c8"}, "author": "", "url": "http://science-technology.news-articles.net/content/kbc-bank-ireland-selects-vasco-enable-apple-touchid-support-transaction-signing-mobile-banking.xhtml", "ord_in_thread": 0, "title": "KBC Bank Ireland Selects VASCO to Enable Apple TouchID Support and Transaction Signing for Mobile Banking", "locations": ["Limerick", "Ill.", "KBC Bank Ireland", "Ireland", "Dublin", "Europe", "OAKBROOK TERRACE", "Galway", "DUBLIN"], "entities": {"persons": [], "locations": [], "organizations": []}, "highlightText": "", "language": "english", "persons": ["Evert Vandenbussche", "Jan Valcke", "Kildare", "Kilkenny"], "text": "KBC Bank Ireland Selects VASCO to Enable Apple TouchID Support and Transaction Signing for Mobile Banking   Published on 2015-09-16 05:17:57 KBC Bank Ireland Selects VASCO to Enable Apple TouchID... -- OAKBROOK TERRACE, Ill. and DUBLIN, Sept.    > OAKBROOK TERRACE, Ill. and DUBLIN , Sept.   VASCO Data Security International, Inc. (NASDAQ: VDSI ), a global leader in authentication, electronic signatures, and identity management, announced today that KBC has integrated the VASCO DIGIPASS for Apps security solution into its mobile banking application. The move allows KBC Bank Ireland customers to use the TouchID functionality of their iPhones instead of a PIN code for transparent security and enhanced convenience. DIGIPASS for Apps is a software development kit (SDK) that allows mobile application developers to easily integrate advanced security solutions into their mobile applications. The solution includes two-factor authentication, electronic transaction signing, one-time passwords, device binding and many other features that strengthen security while improving user convenience. KBC is an established customer of VASCO and uses VACMAN Controller, an API-based authentication platform that serves as the backend for all DIGIPASS authenticators. KBC has previously deployed DIGIPASS 275 hardware authenticators to their banking customers. The bank's implementation of DIGIPASS for Apps protects KBC's mobile banking transactions and also allows users of web-based banking applications to generate a one-time password on their phone for secure online banking. \"At KBC Bank Ireland, we are committed to giving customers a digital banking experience that is convenient, intuitive and above all, secure,\" stated Evert Vandenbussche , Chief Operations Officer, KBC Bank Ireland. \"We are always looking for new ways to innovate and build on this experience for consumers as they move away from traditional banking methods to embrace new technologies. With the addition of DIGIPASS for Apps to KBC's mobile offering, our customers can now enjoy swift, secure mobile banking at their fingertips, making account access and paying for goods and services even easier than before.\" \"The movement to mobile banking has been rapid and far reaching, and it has brought new challenges and new opportunities,\" stated Jan Valcke , President and COO of VASCO Data Security. \"By leveraging the advanced technology embedded in mobile phones, we can protect banks and their customers better than ever while improving the ease of conducting transactions.\" A demo video of the app on KBC's website: https://www.kbc.ie/Why-KBC/Online-and-Mobile-Banking/The-new-KBC-Mobile-Banking-App About KBC KBC Bank has been providing banking services in Ireland for over 40 years and is part of the KBC Group, one of Europe's most recognizable financial institutions since 1978. With over 1,000 employees in Dublin , Cork , Limerick, Galway, Kilkenny, Waterford and Kildare, we are dedicated to creating a bank where the customer comes first. We take a Bank of You approach to all our products and services and in our dealings with customers, shareholders, staff and communities. A member of one of Europe's largest banking groups, KBC is committed to delivering responsible but innovative banking that is grounded in customer and shareholder value. About VASCO VASCO is a world leader in providing two-factor authentication and digital signature solutions to financial institutions. Many of the top 100 global banks rely on VASCO solutions to enhance security, protect mobile applications and meet regulatory requirements. VASCO also secures access to data and applications in enterprise environments, and provides tools for application developers to easily integrate security functions into their web-based and mobile applications. VASCO enables more than 10,000 customers in 100 countries to secure access, manage identities, verify transactions, and protect assets across financial, enterprise, E-commerce, government and healthcare markets. Learn more about VASCO at vasco.com and on Twitter , LinkedIn and Facebook . For more information:", "external_links": [], "published": "2015-09-16T15:34:00.000+03:00", "crawled": "2015-09-16T15:21:28.852+03:00", "highlightTitle": ""}