{"organizations": ["Goldman, Sachs & Co.", "Credit Suisse Securities", "SEC", "Credit Suisse Prospectus Department", "Inc", "Inc.", "Robert W. Baird & Co", "Barrington Research Associates, Inc.", "Prospectus Department", "LLC", "Pacific Crest Securities", "2U, Inc.", "Public Offering of Common Stock 2U, Inc", "KeyBanc Capital Markets Inc.", "Needham & Company", "Public Offering of Common Stock   Published", "First Analysis Securities Corporation", "Compass Point Research & Trading", "Oppenheimer & Co", "Securities and Exchange Commission"], "uuid": "0a1b73904bdb4f8f99e9e3b8cb52d2f6081058b0", "thread": {"social": {"gplus": {"shares": 0}, "pinterest": {"shares": 0}, "vk": {"shares": 0}, "linkedin": {"shares": 0}, "facebook": {"likes": 0, "shares": 0, "comments": 0}, "stumbledupon": {"shares": 0}}, "site_full": "science-technology.news-articles.net", "main_image": "", "site_section": "http://science-technology.news-articles.net/content/rss.php", "section_title": "Science and Technology @ News Articles Network", "url": "http://science-technology.news-articles.net/content/announces-pricing-public-offering-common-stock.xhtml", "country": "US", "title": "2U, Inc. Announces Pricing of Public Offering of Common Stock", "performance_score": 0, "site": "news-articles.net", "participants_count": 0, "title_full": "2U, Inc. Announces Pricing of Public Offering of Common Stock", "spam_score": 0.0, "site_type": "news", "published": "2015-09-25T09:38:00.000+03:00", "replies_count": 0, "uuid": "0a1b73904bdb4f8f99e9e3b8cb52d2f6081058b0"}, "author": "", "url": "http://science-technology.news-articles.net/content/announces-pricing-public-offering-common-stock.xhtml", "ord_in_thread": 0, "title": "2U, Inc. Announces Pricing of Public Offering of Common Stock", "locations": ["West Street", "New York", "USA", "LANDOVER", "Md"], "entities": {"persons": [], "locations": [], "organizations": []}, "highlightText": "", "language": "english", "persons": ["Cassie France-Kelly", "Ed Goodwin"], "text": "2U, Inc. Announces Pricing of Public Offering of Common Stock   Published on 2015-09-24 17:46:28 2U, Inc. Announces Pricing of Public Offering of Common Stock -- LANDOVER, Md.  <-   LANDOVER, Md.   2U, Inc. (the \"Company\") announced today the pricing of its previously announced public offering of 3,500,000 shares of its common stock at a price to the public of $34.00 per share. A total of 3,100,000 shares are being offered by the Company and 400,000 shares are being offered by the selling stockholders named in the registration statement (the \"selling stockholders\"). The offering is expected to close on or about September 30, 2015 , subject to customary closing conditions. In addition, the Company has granted the underwriters a 30-day option to purchase up to 525,000 additional shares of common stock from the Company at the public offering price. The Company expects to receive gross proceeds of approximately $105,400,000 . The proceeds of the offering will be used by the Company for general corporate purposes, including expenditures for program marketing, sales, technology, and content development, in connection with new program launches and growing existing programs. The Company will not receive any proceeds from shares of common stock to be sold by the selling stockholders. Goldman, Sachs & Co. and Credit Suisse Securities ( USA ), LLC are acting as joint book-running managers for the proposed offering. Needham & Company, LLC, Oppenheimer & Co. Inc., Pacific Crest Securities, a division of KeyBanc Capital Markets Inc., Robert W. Baird & Co. Incorporated, Barrington Research Associates, Inc., Compass Point Research & Trading, LLC and First Analysis Securities Corporation are acting as co-managers. A copy of the prospectus supplement and accompanying prospectus may be obtained, when available, by mail from the offices of Goldman, Sachs & Co., Prospectus Department, 200 West Street, New York, NY 10282, telephone: 1-866-471-2526, facsimile: 212-902-9316 or by emailing prospectus-ny@ny.email.gs.com , or from the Credit Suisse Prospectus Department, One Madison Avenue, New York, NY 10010, telephone: 1-800-221-1037 or by emailing newyork.prospectus@credit-suisse.com . The common stock will be issued and sold pursuant to an effective automatic shelf registration statement on Form S-3 previously filed with the Securities and Exchange Commission (\"SEC\"). Before you invest, you should read the prospectus in that registration statement and other documents filed with the SEC for more information about the Company and this offering. You may obtain these documents free of charge by visiting the SEC's website at www.sec.gov . This press release does not constitute an offer to sell or a solicitation of an offer to buy, nor shall there be any sale of these securities in any state or jurisdiction in which such an offer, solicitation or sale would be unlawful prior to registration or qualification under the securities laws of any such state or jurisdiction. About 2U, Inc. (NASDAQ: TWOU ) 2U partners with leading colleges and universities to deliver the world's best online degree programs so students everywhere can reach their full potential. Our Platform, a fusion of cloud-based software-as-a-service technology and technology-enabled services, provides schools with the comprehensive operating infrastructure they need to attract, enroll, educate, support and graduate students globally. Cautionary Language Concerning Forward-Looking Statements This press release contains forward-looking statements regarding our future business expectations, which are subject to the safe harbor provisions of the Private Securities Litigation Reform Act of 1995. All statements other than statements of historical facts contained in this press release, including statements regarding future results of the operations and financial position of 2U, Inc., including financial targets, business strategy, plans and objectives for future operations, the anticipated closing of the common stock offering and the application of the gross proceeds to the Company are forward-looking statements. 2U has based these forward-looking statements largely on its estimates of its financial results and its current expectations and projections about future events and financial trends that it believes may affect its financial condition, results of operations, business strategy, short term and long-term business operations and objectives, and financial needs as of the date of this press release. We undertake no obligation to update these statements as a result of new information or future events. These forward-looking statements are subject to a number of risks, uncertainties and assumptions that could cause actual results to differ materially from the results predicted, including, our failure to attract new colleges and universities as clients; our failure to acquire qualified students for our clients' programs; failure of clients' students to remain enrolled in their programs; loss, or material underperformance, of any one client; our ability to compete against current and future competitors; disruption to, or failure of, our Platform; and data privacy or security breaches. These and other potential risks and uncertainties that could cause actual results to differ from the results predicted are more fully detailed under the heading \"Risk Factors\" in our Annual Report on Form 10-K for the year ended December 31, 2014 , and other reports filed with the Securities and Exchange Commission. Moreover, 2U operates in a very competitive and rapidly changing environment. New risks emerge from time to time. It is not possible for 2U management to predict all risks, nor can 2U assess the impact of all factors on its business or the extent to which any factor, or combination of factors, may cause actual results to differ materially from those contained in any forward-looking statements 2U may make. In light of these risks, uncertainties and assumptions, the forward-looking events and circumstances discussed in this press release may not occur and actual results could differ materially and adversely from those anticipated. Media Contact: Cassie France-Kelly , VP PR, 2U, Inc., (443) 710-9373, cfrance-kelly@2u.com Investor Relations Contact: Ed Goodwin , Sr. Director of Investor Relations, 2U, Inc., (301) 892-4239, egoodwin@2u.com \nSOURCE 2U", "external_links": [], "published": "2015-09-25T09:38:00.000+03:00", "crawled": "2015-09-25T09:24:49.988+03:00", "highlightTitle": ""}