{"organizations": ["EMEA", "Accelerize Inc.", "Nielsen Media Research", "Securities and Exchange Commission"], "uuid": "323f5ceb6f529e85cb920603edfad2cd02f3761c", "thread": {"social": {"gplus": {"shares": 0}, "pinterest": {"shares": 0}, "vk": {"shares": 0}, "linkedin": {"shares": 0}, "facebook": {"likes": 0, "shares": 0, "comments": 0}, "stumbledupon": {"shares": 0}}, "site_full": "science-technology.news-articles.net", "main_image": "", "site_section": "http://science-technology.news-articles.net/content/rss.php", "section_title": "Science and Technology @ News Articles Network", "url": "http://science-technology.news-articles.net/content/cake-accelerize-appoints-london-based-general-manager-emea.xhtml", "country": "US", "title": "CAKE by Accelerize Appoints London-Based General Manager for EMEA", "performance_score": 0, "site": "news-articles.net", "participants_count": 0, "title_full": "CAKE by Accelerize Appoints London-Based General Manager for EMEA", "spam_score": 0.0, "site_type": "news", "published": "2015-09-16T17:33:00.000+03:00", "replies_count": 0, "uuid": "323f5ceb6f529e85cb920603edfad2cd02f3761c"}, "author": "", "url": "http://science-technology.news-articles.net/content/cake-accelerize-appoints-london-based-general-manager-emea.xhtml", "ord_in_thread": 0, "title": "CAKE by Accelerize Appoints London-Based General Manager for EMEA", "locations": ["California", "New York", "Calif.", "Ogilvy New York", "U.S.", "NEWPORT BEACH", "Australia", "Newport Beach", "U.K.", "London", "Sydney", "India"], "entities": {"persons": [], "locations": [], "organizations": []}, "highlightText": "", "language": "english", "persons": ["Darby", "Ogilvy", "Santi Pierini", "Ewan Darby", "Ewan", "Accelerize"], "text": "CAKE by Accelerize Appoints London-Based General Manager for EMEA   Published on 2015-09-16 06:47:44 CAKE by Accelerize Appoints London-Based General Manager for EMEA -- NEWPORT BEACH, California, September   <-   NEWPORT BEACH, California , September   Accelerize (OTCQB: ACLZ) (OTCBB: ACLZ) and its digital marketing software division CAKE , today announced the appointment of Ewan Darby as General Manager, EMEA. Most recently Senior Partner, Global Affiliate Marketing at Ogilvy New York, Darby brings more than 20 years of business development and client management experience in both digital and traditional marketing to CAKE. He is based at CAKE's EMEA headquarters in London . CAKE's SaaS-based technology enables marketers to be more profitable and competitive by providing insights into their multi-channel campaign performance. Since opening its London office in 2014, CAKE's EMEA operations continue to achieve significant client growth with 28% of overall revenue being derived outside the U.S. in Q2 2015 up from 24% in Q2 2014. As General Manager, Darby will be responsible for shaping the vision of the CAKE EMEA operations as well as helping clients grow and transform their insight about the end-to-end consumer journey into improved marketing performance. At Ogilvy New York, Darby was responsible for the growth and development of the agency's affiliate marketing channel across an extensive international network. In addition, Ewan developed mutually beneficial partnerships with multiple vendors to expand the organization's partner ecosystem. During his seven years with Ogilvy, he also worked in the London office and in both regions was instrumental in driving the rise of the agency's affiliate business. Prior to that, he held positions at a number of respected digital marketing and media firms, including Affiliate Window and Nielsen Media Research. \"Ewan has generated results for clients in more than 100 global markets and adds valuable international expertise to our EMEA operation with his forward-thinking approach to performance marketing,\" said Santi Pierini , CAKE President and Chief Operating Officer of Accelerize. \"eMarketer ranks the U.K. as one of the top five spenders in digital marketing, and we are thrilled to add Ewan to our team as we continue to expand our reach in this important market.\" Tweet this: @cakemark appoints Ewan Darby @TheOnlyEwan as new GM of the CAKE EMEA office http://bit.ly/1OVwW4I Supporting Resources Join the Conversation About CAKE by Accelerize CAKE, a division of Accelerize Inc., provides a SaaS-based solution to track, attribute and optimize the performance of digital marketing spend, in real-time. Bringing clarity to multi-channel marketing campaigns, we empower advertisers, agencies, publishers and networks from more than 30 countries worldwide with the insight to make intelligent marketing decisions. CAKE by Accelerize is headquartered in Newport Beach, Calif. with operations in New York , London , India and Sydney, Australia . For more information, visit http://www.getCAKE.com . About Accelerize Accelerize Inc. (OTCQB: ACLZ) (OTCBB: ACLZ) offers marketing technology solutions that revolutionize the way advertisers leverage their digital advertising data. For more information, visit http://www.accelerize.com . Use of Forward-looking Statements This press release may contain forward-looking statements from Accelerize Inc. within the meaning of the \"safe harbor\" provisions of the Private Securities Litigation Reform Act of 1995 and federal securities laws. For example, when Accelerize describes the growth of its EMEA operations, and uses other statements containing the words \"believes,\" \"anticipates,\" \"plans,\" \"expects,\" \"will\" and similar expressions, Accelerize is using forward-looking statements. These forward-looking statements are based on the current expectations of the management of Accelerize only, and are subject to a number of factors and uncertainties that could cause actual results to differ materially from those described in the forward-looking statements. The following factors, among others, could cause actual results to differ materially from those described in the forward-looking statements: changes in technology and market requirements; our technology may not be validated as we progress further; we may be unable to retain or attract key employees whose knowledge is essential to the development of our products and services; unforeseen market and technological difficulties may develop with our products and services; inability to timely develop and introduce new technologies, products and applications; or, loss of market share and pressure on pricing resulting from competition, which could cause the actual results or performance of Accelerize to differ materially from those contemplated in such forward-looking statements. Except as otherwise required by law, Accelerize undertakes no obligation to publicly release any revisions to these forward-looking statements to reflect events or circumstances after the date hereof or to reflect the occurrence of unanticipated events. For a more detailed description of the risk and uncertainties affecting Accelerize, reference is made to Accelerize's reports filed from time to time with the Securities and Exchange Commission. Media Contact", "external_links": [], "published": "2015-09-16T17:33:00.000+03:00", "crawled": "2015-09-16T17:20:34.967+03:00", "highlightTitle": ""}