{"organizations": ["Huawei", "Huawei Consumer Business Group", "Google Store", "Google Play Store", "Google"], "uuid": "2679f6367c3bc95fe4f5816c9845f6fbfe1288ce", "thread": {"social": {"gplus": {"shares": 0}, "pinterest": {"shares": 0}, "vk": {"shares": 0}, "linkedin": {"shares": 0}, "facebook": {"likes": 0, "shares": 0, "comments": 0}, "stumbledupon": {"shares": 0}}, "site_full": "www.geekzone.co.nz", "main_image": "http://images.geekzone.co.nz/imagessubs/f920abdb9936b250a8ddacad57dfae15.jpg", "site_section": "http://feeds.geekzone.co.nz/geekzone", "section_title": "Geekzone Technology Community", "url": "http://www.geekzone.co.nz/content.asp?contentId=18573", "country": "US", "title": "Huawei and Google unveil premium Nexus 6P smartphone", "performance_score": 0, "site": "geekzone.co.nz", "participants_count": 0, "title_full": "Huawei and Google unveil premium Nexus 6P smartphone", "spam_score": 0.0, "site_type": "news", "published": "2015-09-30T02:23:00.000+03:00", "replies_count": 0, "uuid": "2679f6367c3bc95fe4f5816c9845f6fbfe1288ce"}, "author": "", "url": "http://www.geekzone.co.nz/content.asp?contentId=18573", "ord_in_thread": 0, "title": "Huawei and Google unveil premium Nexus 6P smartphone", "locations": ["US", "U.S.", "Canada", "Ireland", "UK", "New Zealand", "Japan"], "entities": {"persons": [], "locations": [], "organizations": []}, "highlightText": "", "language": "english", "persons": ["Richard Yu", "Harvey Norman", "Noel Leeming.Equipped", "Hiroshi Lockheimer"], "text": "You haven't logged in yet. If you don't have an account you can register now . Huawei and Google unveil premium Nexus 6P smartphone Posted on 30-Sep-2015 11:23. | Filed under: News : Mobile : Android . Huawei and Google introduced the Nexus 6P, a premium smartphone featuring Android 6.0 Marshmallow, Google’s newest operating system for mobile devices.“Huawei is very excited to collaborate with Google and deliver a premium Nexus experience for the global market,” said Richard Yu, CEO of Huawei Consumer Business Group. “We value the way consumers embrace mobile technology in all parts of their lives and have created a smartphone with great design, performance and seamless integration of Android 6.0 Marshmallow, the latest Android release.”“We're excited to partner with Huawei to introduce customers to Nexus 6P, our most premium phone yet and Android 6.0, Marshmallow, our most polished and highest-performing OS ever,\" said Hiroshi Lockheimer, VP Android, Chromecast and Chrome OS at Google.The Nexus 6P is designed with an all-metal unibody, crafted from aeronautical-grade anodised aluminium with diamond chamfers encircling its edges. The new smartpone features a 5.7” WQHD 518ppi AMOLED display and front-facing stereo speakers for crisp, clear sound. With the latest version of the octa-core Qualcomm Snapdragon 810 v2.1 processor under the hood, Nexus 6P delivers enhanced performance with a 3450mAh battery. Also notable is the reversible USB Type-C port. The included Type-C fast charger gives up to seven hours of battery life from a 10-minute charge.The Nexus 6P camera has a larger 1.55um pixels sensor, capable of recording 4K and high-frame-rate slow-motion videos. It also features an 8MP front facing camera with Google’s HDR+ technology.Nexus Imprint is a new feature placed on the back of your device to complement the way you naturally hold it. One touch will turn on the phone and unlock apps for smooth, easy access. For users in the US, Nexus Imprint will also work with Android Pay for quick and easy purchases at thousands of locations nationwide.The Nexus 6P will be available in more than 30 countries and available for pre-order in the U.S., Canada, the UK, Ireland and Japan through the Google Store beginning on Sept 29.It will be available in New Zealand from November 2 through the Google Play Store, and at selected retailers including 2degrees, Harvey Norman, and Noel Leeming.Equipped with 32/64/128GB of storage, the phone comes in Aluminum (Silver), Graphite (Black), and Frost (White) and is priced as follows:New Zealand RRP", "external_links": [], "published": "2015-09-30T02:23:00.000+03:00", "crawled": "2015-09-30T10:37:15.237+03:00", "highlightTitle": ""}