{"organizations": ["Emergency Management & Business Contingency", "Safety & Prevention", "Environment Agency", "International Council", "Emergency Coordination Unit", "Dubai Police", "Emergency Management & Business Contingency Summit", "IAEM", "IAEM Global Board", "Dubai Municipality", "Dubai Tourism Authority", "Emergency Coordinator", "Kuwait Oil Company", "IAEM Host", "Ellis Stanley Sr.", "Emergency Management Summit IAEM", "Dubai Municipality and Dubai Tourism Authority", "NATO", "Emergency Management", "General Director Smart Services"], "uuid": "a4f95468ae03dd70191ff5bcd19cfd719120b451", "thread": {"social": {"gplus": {"shares": 0}, "pinterest": {"shares": 0}, "vk": {"shares": 0}, "linkedin": {"shares": 0}, "facebook": {"likes": 0, "shares": 0, "comments": 0}, "stumbledupon": {"shares": 0}}, "site_full": "energy.einnews.com", "main_image": "", "site_section": "http://feeds.feedburner.com/EnergyTechnologyNews", "section_title": "Energy Technology News", "url": "http://energy.einnews.com/pr_news/288512406/dubai-municipality-and-dubai-tourism-authority-support-iaem-s-emergency-management-summit?ref=rss&lcode=Q8Z974Xrm3E5GSKZmElRYNfdOF_bPLVe50Qnj3WwjgM%3D", "country": "US", "title": "Dubai Municipality and Dubai Tourism Authority support IAEM’s Emergency Management Summit", "performance_score": 0, "site": "einnews.com", "participants_count": 0, "title_full": "Dubai Municipality and Dubai Tourism Authority support IAEM’s Emergency Management Summit", "spam_score": 0.0, "site_type": "news", "published": "2015-09-27T14:23:00.000+03:00", "replies_count": 0, "uuid": "a4f95468ae03dd70191ff5bcd19cfd719120b451"}, "author": "", "url": "http://energy.einnews.com/pr_news/288512406/dubai-municipality-and-dubai-tourism-authority-support-iaem-s-emergency-management-summit?ref=rss&lcode=Q8Z974Xrm3E5GSKZmElRYNfdOF_bPLVe50Qnj3WwjgM%3D", "ord_in_thread": 0, "title": "Dubai Municipality and Dubai Tourism Authority support IAEM’s Emergency Management Summit", "locations": ["United Arab Emirates", "UAE", "NCEMA", "Dubai", "DUBAI", "Netherlands"], "entities": {"persons": [], "locations": [], "organizations": []}, "highlightText": "", "language": "english", "persons": ["Naseem Mohammed Refee", "Abu Dhabi", "Vidhya Suman", "Nasser Al Buhairy", "Hassan Mashhadi", "Saif Juma Aldhaheri", "Al Mansouri", "H.E. Khaled Al Mansouri", "Humaid Al Kindi", "Khalid Nasser Al Razooqui"], "text": "Distribution channels: Business & Economy , Energy ... Dubai Municipality and Dubai Tourism Authority support IAEM’s Emergency Management Summit IAEM hosted Emergency Management & Business Contingency Summit 2015 to taking place from 7-8 October 2015 to learn about best practices emergency management. The summit provides a platform for professionals on how to improve security resilience, determine best practices for planning and executing a comprehensive crisis management plan for an organisation. — H.E. Khaled Al Mansouri, President, IAEM DUBAI, UNITED ARAB EMIRATES, September 27,   IAEM and IQPC are teaming up to produce the Emergency Management & Business Contingency Summit 2015 supported by the Dubai Municipality and Dubai Tourism Authority, taking place from 7-8 October at Grand Habtoor Hotel, Dubai. This event will gather industry experts with first-hand experience in dealing with disasters - from small-scale fires to large-scale terrorist attacks – to share best practice with their peers. www.emergencymanagementme.com/news This event is designed for emergency managers and related professionals seeking to learn about best practices emergency management, security enhancements, centralised command center coordination, business contingency resilience and much more. IAEM’s President, International Council, His Excellency Khaled Al Mansouri, Chairman of the Summit and IAEM Host, shared: “I am very pleased to bring IAEM and our vast global resources to Dubai for this important inaugural event. The summit provides a platform for professionals to learn how to improve security resilience, determine best practices for planning and executing a comprehensive crisis management plan and ensure preparedness at all levels of an organisation or nation. IAEM’s mission is to serve its members by providing information, networking and professional opportunities, and to advance the emergency management profession. If you are involved in emergency management or related industries, this is a must-attend event.” Speakers at the Emergency Management & Business Contingency Summit include: • His Excellency Khaled Al Mansouri, President, International Council, IAEM • Ellis Stanley Sr., Chairman of IAEM Global Board • Colonel Khalid Nasser Al Razooqui, General Director Smart Services, Dubai Police, UAE • Dr. Saif Juma Aldhaheri, Director of Safety & Prevention, NCEMA, UAE • Ms. Naseem Mohammed Refee, Head of Consumer Products Safety Section, Dubai Municipality, UAE • Nasser Al Buhairy, Chief Security Officer & Head of Emergency Coordination Unit, Kuwait Oil Company • Humaid Al Kindi, Manager – Emergency Management, Environment Agency, Abu Dhabi • Hassan Mashhadi, Emergency Coordinator, NATO, Netherlands • And many more... The Emergency Management & Business Contingency Summit will take place on 7-8 October 2015 in Dubai, United Arab Emirates. Find the full programme, speaker list and registration form at www.emergencymanagementme.com/news , call + 971 4 364 2975 or email enquiry@iqpc.ae. - ENDS – Media contact: Vidhya Suman, +971 4 374 8265, Vidhya.suman@iqpc.ae or visit www.emergencymanagementme.com/news . Press are invited to attend this important industry forum. If you would like a complimentary press pass please email Vidhya Suman at Vidhya.suman@iqpc.ae. Lakshyadeep Nival", "external_links": [], "published": "2015-09-27T14:23:00.000+03:00", "crawled": "2015-09-28T06:30:50.115+03:00", "highlightTitle": ""}