{"organizations": ["EMV Debit Card Processing", "Jack Henry & Associates, Inc.", "JHA Payment Solutions", "Inc.", "About Jack Henry & Associates, Inc", "EMV", "EMV Debit Card Processing   Jack Henry & Associates Live", "Winona National Bank", "MasterCard", "Jack Henry & Associates Live", "Securities and Exchange Commission", "EMV Debit Card Processing Jack Henry & Associates Live", "Jack Henry & Associates", "Samsung"], "uuid": "d67a093175a2ca600618f614f5c3e59011d6609f", "thread": {"social": {"gplus": {"shares": 0}, "pinterest": {"shares": 0}, "vk": {"shares": 0}, "linkedin": {"shares": 0}, "facebook": {"likes": 0, "shares": 0, "comments": 0}, "stumbledupon": {"shares": 0}}, "site_full": "science-technology.news-articles.net", "main_image": "", "site_section": "http://science-technology.news-articles.net/content/rss.php", "section_title": "Science and Technology @ News Articles Network", "url": "http://science-technology.news-articles.net/content/jack-henry-associates-live-emv-debit-card-processing.xhtml", "country": "US", "title": "Jack Henry & Associates Live for EMV Debit Card Processing", "performance_score": 0, "site": "news-articles.net", "participants_count": 0, "title_full": "Jack Henry & Associates Live for EMV Debit Card Processing", "spam_score": 0.0, "site_type": "news", "published": "2015-09-29T19:14:00.000+03:00", "replies_count": 0, "uuid": "d67a093175a2ca600618f614f5c3e59011d6609f"}, "author": "", "url": "http://science-technology.news-articles.net/content/jack-henry-associates-live-emv-debit-card-processing.xhtml", "ord_in_thread": 0, "title": "Jack Henry & Associates Live for EMV Debit Card Processing", "locations": ["Minnesota", "U.S.", "MONETT", "Mo"], "entities": {"persons": [], "locations": [], "organizations": []}, "highlightText": "", "language": "english", "persons": ["Greg Adelson", "Jack Henry Banking", "Jack Henry", "Kim Duitsman"], "text": "Jack Henry & Associates Live for EMV Debit Card Processing   Jack Henry & Associates Live for EMV Debit Card Processing -- MONETT, Mo.  <-   MONETT, Mo.   Jack Henry & Associates, Inc. (NASDAQ: JKHY ) is a leading provider of technology solutions and payment processing services primarily for the financial services industry. Today the company confirmed that its JHA Payment Solutions group is live with MasterCard and Visa for EMV debit card processing, and will soon support Discover. JHA Payment Solutions is actively processing EMV debit transactions today, and has been processing EMV credit transactions for more than four years. The group is committed to large scale EMV debit implementations, with hundreds currently in progress, and to helping its financial institution clients be ahead of the industry pace for EMV card issuance. Minnesota -based Winona National Bank is one of the banks that JHA Payment Solutions has supported with EMV debit activity. Kim Duitsman , its vice president of operations, said, \"Jack Henry has helped our institution be at the forefront of preparing for the U.S. EMV changeover. By deploying EMV debit, we do expect our reported fraud incidences with these cards to drastically decline.\" JHA Payment Solutions drives early adoption of new technologies, particularly when it impacts the security of a financial transaction and of the end cardholder. For this reason, Jack Henry & Associates has also aggressively helped take clients live with Apple Pay; of the 400 financial institutions now active with Apple Pay, more than 65 of them are Jack Henry & Associates clients, and there are an additional 200 in the queue. JHA Payment Solutions is also in development to support Samsung and Android Pay, the latest in device-based wallets. Greg Adelson , general manager of JHA Payment Solutions, said, \"While the Oct. 1, 2015 , deadline was set as a firm recommendation for all payment processing parties to be EMV compliant, we recognize that it is a long-term initiative for the entire ecosystem to be ready. At Jack Henry & Associates, we have been working with the networks and card manufacturers to ensure what was in our control was completed on time, allowing our financial institutions to take advantage of the liability shift when they were ready to do so. We will continue to partner with our banks and credit unions on EMV or any other payment processing developments, providing the superior support and service they have come to expect from Jack Henry & Associates.\" About Jack Henry & Associates, Inc. Jack Henry & Associates, Inc. 速 (NASDAQ: JKHY ) is a leading provider of technology solutions and payment processing services primarily for the financial services industry. Its solutions serve almost 11,300 customers nationwide, and are marketed and supported through three primary brands. Jack Henry Banking 速 supports banks ranging from community banks to multi-billion dollar institutions with information processing solutions. Symitar 速 is a leading provider of information processing solutions for credit unions of all sizes. ProfitStars 速 provides highly specialized products and services that enable financial institutions of every asset size and charter, and diverse corporate entities to mitigate and control risks, optimize revenue and growth opportunities, and contain costs. Additional information is available at www.jackhenry.com . Statements made in this news release that are not historical facts are forward-looking information. Actual results may differ materially from those projected in any forward-looking information. Specifically, there are a number of important factors that could cause actual results to differ materially from those anticipated by any forward-looking information. Additional information on these and other factors, which could affect the Company's financial results, are included in its Securities and Exchange Commission (SEC) filings on Form 10-K, and potential investors should review these statements. Finally, there may be other factors not mentioned above or included in the Company's SEC filings that may cause actual results to differ materially from any forward-looking information. JKHY \nSOURCE Jack Henry & Associates, Inc. RELATED LINKS", "external_links": [], "published": "2015-09-29T19:14:00.000+03:00", "crawled": "2015-09-29T18:59:34.768+03:00", "highlightTitle": ""}