{"organizations": ["Verizon", "Verizon Communications Inc.", "Verizon Board of Directors", "Verizon Board", "Deloitte", "VERIZON", "Verizon Board of Directors Former Deloitte & Touche", "Deloitte & Touche LLP", "Verizon Board of Directors   07:17:53 Former Deloitte & Touche", "Deloitte & Touche", "Board of Directors of Deloitte", "Verizon Wireless", "Albright College", "Rutgers University"], "uuid": "a5f212ed1ec08d9679f780c0552f5dc5dd7e2421", "thread": {"social": {"gplus": {"shares": 0}, "pinterest": {"shares": 0}, "vk": {"shares": 0}, "linkedin": {"shares": 0}, "facebook": {"likes": 0, "shares": 0, "comments": 0}, "stumbledupon": {"shares": 0}}, "site_full": "science-technology.news-articles.net", "main_image": "", "site_section": "http://science-technology.news-articles.net/content/rss.php", "section_title": "Science and Technology @ News Articles Network", "url": "http://science-technology.news-articles.net/content/former-deloitte-touche-ceo-gregory-weaver-elected-verizon-board-directors.xhtml", "country": "US", "title": "Former Deloitte & Touche CEO Gregory G. Weaver elected to Verizon Board of Directors", "performance_score": 0, "site": "news-articles.net", "participants_count": 0, "title_full": "Former Deloitte & Touche CEO Gregory G. Weaver elected to Verizon Board of Directors", "spam_score": 0.0, "site_type": "news", "published": "2015-09-03T18:10:00.000+03:00", "replies_count": 0, "uuid": "a5f212ed1ec08d9679f780c0552f5dc5dd7e2421"}, "author": "", "url": "http://science-technology.news-articles.net/content/former-deloitte-touche-ceo-gregory-weaver-elected-verizon-board-directors.xhtml", "ord_in_thread": 0, "title": "Former Deloitte & Touche CEO Gregory G. Weaver elected to Verizon Board of Directors", "locations": ["America", "New York", "U.S.", "NEW YORK"], "entities": {"persons": [], "locations": [], "organizations": []}, "highlightText": "", "language": "english", "persons": ["Greg", "Gregory G. Weaver", "Lowell McAdam", "Weaver"], "text": "Former Deloitte & Touche CEO Gregory G. Weaver elected to Verizon Board of Directors   07:17:53 Former Deloitte & Touche CEO Gregory G. Weaver elected to Verizon Board... -- NEW YORK  <-   NEW YORK   Verizon Communications Inc. (NYSE, Nasdaq: VZ ) today announced the election of Gregory G. Weaver , former chairman and chief executive officer of Deloitte & Touche LLP, to the Verizon Board of Directors, effective September 2 . \"Greg is an accomplished executive who brings to Verizon 40 years of experience in public accounting and professional services. He has a deep working knowledge of the operational and governance issues that large, complex organizations must address to succeed in today's business environment,\" said Lowell McAdam , Verizon chairman and chief executive officer. \"We are very pleased to have Greg join our board.\" The addition of Weaver brings Verizon's total board membership to 12. Weaver served from 2012 to 2014 and from 2001 to 2005 as chairman and chief executive officer of Deloitte's audit and enterprise risk services firm, Deloitte & Touche LLP, overseeing all operations, strategic positioning, audit quality and talent matters. He served on the Board of Directors of Deloitte's U.S. organization from 2006 to 2012, and on numerous other committees within Deloitte that helped shape organizational priorities and interactions with clients and regulators. Weaver holds an undergraduate degree in mathematics from Albright College and an MBA from Rutgers University . Verizon Communications Inc. (NYSE, Nasdaq: VZ ), headquartered in New York , employs a diverse workforce of 178,500 and generated more than $127 billion in 2014 revenues. Verizon Wireless operates America's most reliable wireless network, with 109.5 million retail connections nationwide. Verizon also provides converged communications, information and entertainment services over America's most advanced fiber-optic network, and delivers integrated business solutions to customers worldwide. For more information, visit www.verizon.com/news/ . VERIZON'S ONLINE NEWS CENTER: Verizon news releases, executive speeches and biographies, media contacts and other information are available at Verizon's online News Center at www.verizon.com/news / . The news releases are available through an RSS feed. To subscribe, visit www.verizon.com/about/rss-feeds / . \nSOURCE Verizon Communications Inc. Served by: 127.0.0.1 ~ (c) 2004 - 2015, News Articles Network Â» Categories", "external_links": [], "published": "2015-09-03T18:10:00.000+03:00", "crawled": "2015-09-03T17:57:40.296+03:00", "highlightTitle": ""}