{"organizations": ["Mattel", "Corporate Responsibility Magazine", "Ethisphere Magazine", "Mattel, Inc.", "New York Stock Exchange", "Salesforce Marketing Cloud Mattel Drives Digital Transformation", "Mattel Drives Digital Transformation", "Fisher-Price", "Digital Initiatives Group"], "uuid": "1202570058d47f2f7bb6ef90e3e5b88af2b0d43c", "thread": {"social": {"gplus": {"shares": 0}, "pinterest": {"shares": 0}, "vk": {"shares": 0}, "linkedin": {"shares": 0}, "facebook": {"likes": 0, "shares": 0, "comments": 0}, "stumbledupon": {"shares": 0}}, "site_full": "science-technology.news-articles.net", "main_image": "", "site_section": "http://science-technology.news-articles.net/content/rss.php", "section_title": "Science and Technology @ News Articles Network", "url": "http://science-technology.news-articles.net/content/mattel-drives-digital-transformation-help-from-salesforce-marketing-cloud.xhtml", "country": "US", "title": "Mattel Drives Digital Transformation with Help from Salesforce Marketing Cloud", "performance_score": 0, "site": "news-articles.net", "participants_count": 0, "title_full": "Mattel Drives Digital Transformation with Help from Salesforce Marketing Cloud", "spam_score": 0.0, "site_type": "news", "published": "2015-09-16T15:34:00.000+03:00", "replies_count": 0, "uuid": "1202570058d47f2f7bb6ef90e3e5b88af2b0d43c"}, "author": "", "url": "http://science-technology.news-articles.net/content/mattel-drives-digital-transformation-help-from-salesforce-marketing-cloud.xhtml", "ord_in_thread": 0, "title": "Mattel Drives Digital Transformation with Help from Salesforce Marketing Cloud", "locations": ["San Francisco", "SAN FRANCISCO", "Calif.", "El Segundo", "Europe", "Asia"], "entities": {"persons": [], "locations": [], "organizations": []}, "highlightText": "", "language": "english", "persons": ["Scott McCorkle", "Carlson Choi", "Thomas"], "text": "Mattel Drives Digital Transformation with Help from Salesforce Marketing Cloud   Published on 2015-09-16 05:18:00 Mattel Drives Digital Transformation with Help from Salesforce Marketing Cloud -- SAN FRANCISCO, Sept.   www.salesforce.com www.salesforce.com  ><- stripped tags -> SAN FRANCISCO , Sept.   Salesforce [NYSE: CRM], the Customer Success Platform and world's #1 CRM company, announced today that Mattel, Inc. has implemented the Salesforce Marketing Cloud, helping the iconic toymaker to connect in new ways with millions of consumers, guiding them on journeys across its brands globally and from any device. \"For 70 years, parents have trusted Mattel to create safe, engaging play experiences for children and families,\" said Carlson Choi , Vice President and head of Mattel's Digital Initiatives Group. \"Today, we're harnessing that experience to create an equally safe and engaging digital ecosystem for our consumers. Using Salesforce is key to this process, helping us map a digital journey for parents and children based on how they engage with Mattel's apps, digital content and toys.\" The Salesforce Marketing Cloud gives digital marketers the tools needed to create exceptional brand experiences and service consumers as they move between channels, products and brands. Mattel will use Journey Builder, a core service in Marketing Cloud, to deliver personalized, targeted messages that will lead Mattel shoppers on personalized journeys across every stage of the customer lifecycle, from the physical store to digital experiences. \"In a competitive consumer market, Salesforce will help Mattel stand out and guide their consumers on journeys across channels and devices,\" said Scott McCorkle , CEO of Marketing Cloud. \"Few companies inspire creative imagination like Mattel, and Journey Builder's interface will make it easy for the company to visualize and map the path of each consumer's journey as they grow up with Mattel and explore new brands and gaming options.\" About Mattel The Mattel family of companies is a worldwide leader in the design, manufacture and marketing of toys and family products. Mattel's portfolio of best-selling brands includes Barbie®, the most popular fashion doll ever produced, Hot Wheels®, Monster High®, American Girl®, Thomas & Friends®, Fisher-Price® brands and MEGA® Brands, as well as a wide array of entertainment-inspired toy lines. In 2014, Mattel was named one of the \"World's Most Ethical Companies\" by Ethisphere Magazine and in 2014 ranked No. 5 on Corporate Responsibility Magazine's \"100 Best Corporate Citizens\" list. With worldwide headquarters in El Segundo, Calif. , Mattel's companies employ approximately 31,000 people in 40 countries and territories and sell products in more than 150 nations. Visit us at www.mattel.com , www.facebook.com/mattel or www.twitter.com/mattel . About Salesforce Salesforce, the Customer Success Platform and world's #1 CRM company, empowers companies to connect with their customers in a whole new way. For more information about Salesforce (NYSE: CRM ), visit: www.salesforce.com . Any unreleased services or features referenced in this or other press releases or public statements are not currently available and may not be delivered on time or at all. Customers who purchase Salesforce applications should make their purchase decisions based upon features that are currently available. Salesforce has headquarters in San Francisco , with offices in Europe and Asia , and trades on the New York Stock Exchange under the ticker symbol \"CRM.\" For more information please visit http://www.salesforce.com , or call 1-800-NO-SOFTWARE.", "external_links": [], "published": "2015-09-16T15:34:00.000+03:00", "crawled": "2015-09-16T15:20:45.032+03:00", "highlightTitle": ""}