{"organizations": ["U.S. Securities and Exchange Commission", "CSUN", "China Sunergy Co.", "Board of Directors » Science & Technology Published", "JPMorgan Chase Bank", "Ltd", "About China Sunergy Co.", "Jiangning Economic & Technical Development Zone", "Board of Directors China Sunergy", "Company Grant Thornton LLP", "Ltd.", "AGM"], "uuid": "d04633ae71401660762ddcbe6139ad6ed0795709", "thread": {"social": {"gplus": {"shares": 0}, "pinterest": {"shares": 0}, "vk": {"shares": 0}, "linkedin": {"shares": 0}, "facebook": {"likes": 0, "shares": 0, "comments": 0}, "stumbledupon": {"shares": 0}}, "site_full": "science-technology.news-articles.net", "main_image": "", "site_section": "http://science-technology.news-articles.net/content/rss.php", "section_title": "Science and Technology @ News Articles Network", "url": "http://science-technology.news-articles.net/content/china-sunergy-hold-annual-general-meeting-october-announces-changes-board-directors.xhtml", "country": "US", "title": "China Sunergy to Hold Annual General Meeting on October 30, 2015 and Announces Changes to Board of Directors", "performance_score": 0, "site": "news-articles.net", "participants_count": 0, "title_full": "China Sunergy to Hold Annual General Meeting on October 30, 2015 and Announces Changes to Board of Directors", "spam_score": 0.0, "site_type": "news", "published": "2015-09-14T13:53:00.000+03:00", "replies_count": 0, "uuid": "d04633ae71401660762ddcbe6139ad6ed0795709"}, "author": "", "url": "http://science-technology.news-articles.net/content/china-sunergy-hold-annual-general-meeting-october-announces-changes-board-directors.xhtml", "ord_in_thread": 0, "title": "China Sunergy to Hold Annual General Meeting on October 30, 2015 and Announces Changes to Board of Directors", "locations": ["China Sunergy", "Nanjing", "Focheng West Road", "Turkey", "Jiangsu", "China", "NANJING"], "entities": {"persons": [], "locations": [], "organizations": []}, "highlightText": "", "language": "english", "persons": ["Jianhua Zhao", "Merry Tang"], "text": "China Sunergy to Hold Annual General Meeting on October 30, 2015 and Announces Changes to Board of Directors » Science & Technology Published on 2015-09-14 03:32:48 China Sunergy to Hold Annual General Meeting on October 30, 2015 and... -- NANJING, China, Sept. 14,    > NANJING , China , Sept. 14,   China Sunergy Co., Ltd. (Nasdaq: CSUN ) (\"China Sunergy\" or \"the Company\"), a specialized solar cell and module manufacturer, today announced that it will hold its Annual General Meeting (\"AGM\") on October 30, 2015 at 9:00 a.m. (Beijing Time). The AGM will be held at No. 123, Focheng West Road, Jiangning Economic & Technical Development Zone, Nanjing , Jiangsu , 211100, the People's Republic of China . Holders of record of ordinary shares of the Company at the close of business on September 8, 2015 are entitled to notice of, and to vote at, the AGM or any adjournment or postponement thereof. Holders of the Company's American depositary shares (\"ADSs\") who wish to exercise their voting rights for the underlying ordinary shares must act through the depositary of the Company's ADS program, JPMorgan Chase Bank, N.A. The AGM will discuss and seek adoption of the following resolutions to be proposed by the Company: Proposal No. 1 -- Retirement and Re-election of Mr. Jianhua Zhao as a Class B director of the Company; Proposal No. 2 -- Retirement and Re-election of Ms. Merry Tang as a Class B director of the Company; Proposal No. 3 -- Appointment of the independent auditor of the Company Grant Thornton LLP for the fiscal year 2015; Proposal No. 4 -- Authorization of the board of directors of the Company to fix the remuneration of the auditors of the Company; and Proposal No. 5 -- The directors of the Company be, and hereby are, authorized to take any and every action that might be necessary to effect the foregoing resolutions 1 to 4 as such director of the Company, in his or her absolute discretion, thinks fit. For more details, please refer to this link to our corporate web site's Investor Room: http://investors.csun-solar.com/phoenix.zhtml?c=211846&p=irol-agm The Company has filed its annual report on Form 20-F (the \"20-F\"), which includes the Company's audited financial statements for the fiscal year ended December 31, 2014 , with the U.S. Securities and Exchange Commission (the \"SEC\"). If you would like to obtain a copy of the 20-F, you can (1) send your request for a physical copy by email to IR@chinasunergy.com ; (2) notify the Company of your e-mail address by sending your request to IR@chinasunergy.com and a softcopy will be sent to your e-mail address provided; and (3) you may also view the annual report at the Company's website at http://investors.csun-solar.com/phoenix.zhtml?c=211846&p=irol-reportsAnnual . About China Sunergy Co., Ltd. China Sunergy Co., Ltd. (NASDAQ: CSUN ) designs, manufactures and delivers high efficiency solar cells and modules to the world from its production centers based in China and Turkey . China Sunergy also invests in high potential solar projects. Founded in 2004, China Sunergy is well known for its advanced solar cell technology, reliable product quality, and excellent customer service. For more information, please visit http://www.csun-solar.com . Investor and Media Contacts:", "external_links": [], "published": "2015-09-14T13:53:00.000+03:00", "crawled": "2015-09-14T13:39:52.300+03:00", "highlightTitle": ""}