{"organizations": ["NBC News", "The Associated Press", "Christian Science Monitor", "AP", "New Zealand Herald", "State Department"], "uuid": "c28a23e1de1587e9f084da0a28f78ddae92af399", "thread": {"social": {"gplus": {"shares": 0}, "pinterest": {"shares": 0}, "vk": {"shares": 0}, "linkedin": {"shares": 0}, "facebook": {"likes": 0, "shares": 0, "comments": 0}, "stumbledupon": {"shares": 0}}, "site_full": "www.onenewspage.com", "main_image": "http://cdn.newsserve.net/ONPglobe256.jpg", "site_section": "http://www.onenewspage.com/rss/latest/Technology.rss", "section_title": "Latest Technology News on One News Page", "url": "http://www.onenewspage.com/n/Technology/7558951fh/Highlights-from-AP-interview-with-Hillary-Rodham.htm", "country": "US", "title": "Highlights from AP's interview with Hillary Rodham Clinton", "performance_score": 0, "site": "onenewspage.com", "participants_count": 0, "title_full": "Highlights from AP's interview with Hillary Rodham Clinton", "spam_score": 0.0, "site_type": "news", "published": "2015-09-08T00:23:00.000+03:00", "replies_count": 0, "uuid": "c28a23e1de1587e9f084da0a28f78ddae92af399"}, "author": "", "url": "http://www.onenewspage.com/n/Technology/7558951fh/Highlights-from-AP-interview-with-Hillary-Rodham.htm", "ord_in_thread": 0, "title": "Highlights from AP's interview with Hillary Rodham Clinton", "locations": ["L.A.", "New York City", "U.S.", "NEW YORK", "SeattlePI.com House Benghazi"], "entities": {"persons": [], "locations": [], "organizations": []}, "highlightText": "", "language": "english", "persons": ["Clinton", "Hillary Clinton", "Huffington Post Hillary Rodham Clinton", "Hillary Rodham Clinton", "Mark-Viverito", "Melissa Mark-Viverito", "Andrea Mitchell"], "text": "Highlights from AP's interview with Hillary Rodham Clinton Monday, 7 September 2015 (7 minutes ago) In an interview Monday with The Associated Press, Democratic presidential candidate Hillary Rodham Clinton said she has \"tried to not only take responsibility, because it was my decision, but to be as transparent as possible\" about her use of a private email server when she was secretary of state. MSNBC Scores Interview With Hillary Clinton 01:00 Hillary Clinton will give a sit-down interview to veteran NBC News correspondent Andrea Mitchell this Friday on MSNBC, in a coup for a cable-news network working to transform itself to generate bigger ratings. Clinton, the front-runner among Democrats vying for the office of U.S. President in the... Recent related news Hillary Rodham Clinton said Monday she does not need to apologise for using a private email account and server while at the State Department because \"what I did... New Zealand Herald 1 hour ago - World Also reported by • Huffington Post Hillary Rodham Clinton acknowledged that her private email system in the State Department wasn't the \"best choice\" in an interview with NBC News. But Clinton... Christian Science Monitor 2 days ago - Front Page Also reported by • CJME • SeattlePI.com House Benghazi panel to resume interviews with former top aides to Hillary Rodham Clinton ABCNews.com 4 days ago - Front Page NEW YORK (AP) — New York City Council Speaker Melissa Mark-Viverito is endorsing Hillary Rodham Clinton for president. Mark-Viverito, a Democrat, made the... Business Insider 5 days ago - Business Also reported by • NYTimes.com • L.A. Times You Might Like", "external_links": [], "published": "2015-09-08T00:23:00.000+03:00", "crawled": "2015-09-08T00:32:02.115+03:00", "highlightTitle": ""}