{"organizations": ["Apple", "Monaco"], "uuid": "813a11f9e563d7d4c94e4e91f942de1599104c87", "thread": {"social": {"gplus": {"shares": 0}, "pinterest": {"shares": 0}, "vk": {"shares": 0}, "linkedin": {"shares": 0}, "facebook": {"likes": 0, "shares": 0, "comments": 0}, "stumbledupon": {"shares": 0}}, "site_full": "www.nationmultimedia.com", "main_image": "http://www.nationmultimedia.com/new/2015/09/28/technology/images/30269768-01_big.jpg", "site_section": "http://www.nationmultimedia.com/home/rss/technology.rss", "section_title": "NationMultimedia.com - Technology", "url": "http://www.nationmultimedia.com/technology/Apple-Announces-Record-iPhone-6s-&-iPhone-6s-Plus--30269768.html", "country": "TH", "title": "Apple Announces Record iPhone 6s & iPhone 6s Plus Sales", "performance_score": 0, "site": "nationmultimedia.com", "participants_count": 0, "title_full": "Apple Announces Record iPhone 6s & iPhone 6s Plus Sales", "spam_score": 0.0, "site_type": "news", "published": "2015-09-28T18:29:00.000+03:00", "replies_count": 0, "uuid": "813a11f9e563d7d4c94e4e91f942de1599104c87"}, "author": "", "url": "http://www.nationmultimedia.com/technology/Apple-Announces-Record-iPhone-6s-&-iPhone-6s-Plus--30269768.html", "ord_in_thread": 0, "title": "Apple Announces Record iPhone 6s & iPhone 6s Plus Sales", "locations": ["Portugal", "United Arab Emirates", "Taiwan", "Slovakia", "Greece", "Maldives", "Luxembourg", "Chengdu", "Italy", "India", "California", "Greenland", "Bahrain", "Jordan", "Denmark", "Latvia", "Kuwait", "Shanghai", "Berlin", "Turkey", "Andorra", "CUPERTINO", "New York City", "Czech Republic", "Mexico", "Croatia", "Romania", "Beijing", "Iceland", "Sweden", "San Francisco Bay Area", "Qatar", "Estonia", "Saudi Arabia", "Spain", "Ireland", "Chicago", "London", "Switzerland", "Toronto", "Baltimore", "Malaysia", "Washington D.C.", "Liechtenstein", "Bosnia", "Netherlands", "China", "Slovenia", "Finland", "Philadelphia", "Mexico City", "Lithuania", "Austria", "Hungary", "Belgium", "Poland", "Russia", "Bulgaria", "Norway"], "entities": {"persons": [], "locations": [], "organizations": []}, "highlightText": "", "language": "english", "persons": ["Siri", "Tim Cook"], "text": "Home » technology » Apple Announces Record iPhone 6s & iPhone 6s Plus Sales Apple Announces Record iPhone 6s & iPhone 6s Plus Sales September 28, 2015 10:29 pm iPhone Available in 40 Additional Countries Beginning Friday, October 9 CUPERTINO, California — September 28, 2015 — Apple today announced it has sold more than 13 million new iPhone 6s and iPhone 6s Plus models, a new record, just three days after launch. iPhone 6s and iPhone 6s Plus will be available in more than 40 additional countries beginning October 9 including Italy, Mexico, Russia, Spain and Taiwan. The new iPhones will be available in over 130 countries by the end of the year. \"Sales for iPhone 6s and iPhone 6s Plus have been phenomenal, blowing past any previous first weekend sales results in Apple's history,\" said Tim Cook, Apple's CEO. \"Customers' feedback is incredible and they are loving 3D Touch and Live Photos, and we can't wait to bring iPhone 6s and iPhone 6s Plus to customers in even more countries on October 9.\" iPhone 6s and iPhone 6s Plus bring a powerful new dimension to iPhone's revolutionary Multi-Touch™ interface with 3D Touch, which senses how deeply you press the display, letting you do essential things more quickly and simply. The new iPhones introduce Live Photos, which bring still images to life, transforming instants frozen in time into unforgettable living memories. Live Photos, 3D Touch, 12-megapixel iSight® camera, 5-megapixel FaceTime® HD camera with Retina® Flash and more are powered by the Apple-designed A9 chip, the most advanced chip ever in a smartphone, delivering faster performance and great battery life. iPhone 6s and iPhone 6s Plus are designed with the strongest glass on any smartphone and 7000 series aluminum, the same alloy used in the aerospace industry, in gorgeous metallic finishes that now include rose gold. iOS 9, the world's most advanced mobile operating system, brings more intelligence to iPhone with proactive assistance, powerful search and improved Siri features, all while protecting users' privacy. Built-in apps become more powerful with a redesigned Notes app and detailed transit information in Maps*. The foundation of iOS is even stronger with software updates that require less space to install and advanced security features to further protect your devices. iPhone 6s and iPhone 6s Plus will roll out worldwide to more than 40 additional countries and territories beginning October 9 including Andorra, Austria, Belgium, Bosnia, Bulgaria, Croatia, Czech Republic, Denmark, Estonia, Finland, Greece, Greenland, Hungary, Iceland, Ireland, Isle of Man, Italy, Latvia, Liechtenstein, Lithuania, Luxembourg, Maldives, Mexico, Monaco, Netherlands, Norway, Poland, Portugal, Romania, Russia, Slovakia, Slovenia, Spain, Sweden, Switzerland and Taiwan. On October 10, countries include Bahrain, Jordan, Kuwait, Qatar, Saudi Arabia and United Arab Emirates. iPhone 6s and iPhone 6s Plus will be available in India, Malaysia and Turkey on Friday, October 16 and in over 130 countries by the end of the year. Sales completed by Saturday, September 26 will be included in Apple's 2015 fourth fiscal quarter results, and sales completed on Sunday, September 27 will be included in Apple's 2016 first fiscal quarter results. Availability• iPhone 6s and iPhone 6s Plus are available in gold, silver, space gray and the new rose gold metallic finishes.• Apple-designed accessories including leather and silicone cases in a range of colors and Lightning Docks in color-matched metallic finishes are also available. *Transit information in Maps will be available in select major cities including Baltimore, Berlin, Chicago, London, Mexico City, New York City, Philadelphia, the San Francisco Bay Area, Toronto and Washington D.C., as well as over 300 cities in China, including Beijing, Chengdu and Shanghai. 43 Viewed", "external_links": [], "published": "2015-09-28T18:29:00.000+03:00", "crawled": "2015-09-28T20:30:33.763+03:00", "highlightTitle": ""}