{"organizations": ["Inc", "Inc.", "OrCAD Engineering Data Management", "PCB", "Santa Clara Convention Center"], "uuid": "d78c4214d99ca38a23d46d8e763ea2747a87bf8b", "thread": {"social": {"gplus": {"shares": 0}, "pinterest": {"shares": 0}, "vk": {"shares": 0}, "linkedin": {"shares": 0}, "facebook": {"likes": 0, "shares": 0, "comments": 0}, "stumbledupon": {"shares": 0}}, "site_full": "science-technology.news-articles.net", "main_image": "", "site_section": "http://science-technology.news-articles.net/content/rss.php", "section_title": "Science and Technology @ News Articles Network", "url": "http://science-technology.news-articles.net/content/cadence-showcase-latest-pcb-design-tools-west.xhtml", "country": "US", "title": "Cadence to Showcase Latest PCB Design Tools at PCB West 2015", "performance_score": 0, "site": "news-articles.net", "participants_count": 0, "title_full": "Cadence to Showcase Latest PCB Design Tools at PCB West 2015", "spam_score": 0.0, "site_type": "news", "published": "2015-09-09T19:39:00.000+03:00", "replies_count": 0, "uuid": "d78c4214d99ca38a23d46d8e763ea2747a87bf8b"}, "author": "", "url": "http://science-technology.news-articles.net/content/cadence-showcase-latest-pcb-design-tools-west.xhtml", "ord_in_thread": 0, "title": "Cadence to Showcase Latest PCB Design Tools at PCB West 2015", "locations": ["United States", "Calif.", "San Jose", "Calif", "SAN JOSE", "Santa Clara"], "entities": {"persons": [], "locations": [], "organizations": []}, "highlightText": "", "language": "english", "persons": ["Sigrity", "Ed Acheson", "Hemant Shah", "Michael Catrambone", "John Carney"], "text": "Cadence to Showcase Latest PCB Design Tools at PCB West 2015   Published on 2015-09-09 08:02:46 Media Alert: Cadence to Showcase Latest PCB Design Tools at PCB... -- SAN JOSE, Calif., Sept. 9,   Cadence Logo. Cadence Logo. <-  <- stripped tags -> SAN JOSE, Calif. , Sept. 9,   Cadence Design Systems, Inc. (NASDAQ: [[UEdFZ2NtVnNQVndpYm05bWIyeHNiM2RjSWlCb2NtVm1QU2RvZEhSd09pOHZjM1IxWkdsdkxUVXVabWx1WVc1amFXRnNZMjl1ZEdWdWRDNWpiMjB2Y0hKdVpYZHpQMUJoWjJVOVVYVnZkR1VtVkdsamEyVnlQVU5FVGxNbklISmxiRDBuYm05bWIyeHNiM2NuSUhSaGNtZGxkRDBuWDJKc1lXNXJKeUIwYVhSc1pUMG5RMFJPVXljZ2IyNWpiR2xqYXowbmJHbHVhMDl1UTJ4cFkyc29kR2hwY3lrbklISmxiRDBuYm05bWIyeHNiM2NuUGtORVRsTThMMkUrfA==]]) plans to feature its latest scalable [[UEdFZ2NtVnNQVndpYm05bWIyeHNiM2RjSWlCdmJtTnNhV05yUFNkc2FXNXJUMjVEYkdsamF5aDBhR2x6S1NjZ2FISmxaajFjSW1oMGRIQTZMeTkzZDNjdVkyRmtaVzVqWlM1amIyMHZjSEp2WkhWamRITXZjR05pTDFCaFoyVnpMM0JqWWw5dmNtTmhaRjl6YVdkeWFYUjVMbUZ6Y0hoY0lpQnlaV3c5WENKdWIyWnZiR3h2ZDF3aUlIUmhjbWRsZEQxY0lsOWliR0Z1YTF3aVBrOXlRMEZFSmlNeE56UTdQQzloUGc9PXw=]] and [[UEdFZ2NtVnNQVndpYm05bWIyeHNiM2RjSWlCdmJtTnNhV05yUFNkc2FXNXJUMjVEYkdsamF5aDBhR2x6S1NjZ2FISmxaajFjSW1oMGRIQTZMeTkzZDNjdVkyRmtaVzVqWlM1amIyMHZjSEp2WkhWamRITXZjR05pTDFCaFoyVnpMM0JqWWw5dmNtTmhaRjl6YVdkeWFYUjVMbUZ6Y0hoY0lpQnlaV3c5WENKdWIyWnZiR3h2ZDF3aUlIUmhjbWRsZEQxY0lsOWliR0Z1YTF3aVBrRnNiR1ZuY204bUl6RTNORHM4TDJFK3w=]] technologies at [[UEdFZ2NtVnNQVndpYm05bWIyeHNiM2RjSWlCdmJtTnNhV05yUFNkc2FXNXJUMjVEYkdsamF5aDBhR2x6S1NjZ2FISmxaajFjSW1oMGRIQTZMeTkzZDNjdWNHTmlkMlZ6ZEM1amIyMHZYQ0lnY21Wc1BWd2libTltYjJ4c2IzZGNJaUIwWVhKblpYUTlYQ0pmWW14aGJtdGNJajVRUTBJZ1YyVnpkRHd2WVQ0PXw=]] 2015 in booth #406 from September 15-17, 2015 , in Santa Clara, Calif. WHAT: Cadence® is scheduled to hold demonstrations and presentations in its booth highlighting new technology offerings including: OrCAD Engineering Data Management (EDM) 2.0, the latest version of the PCB engineering data management tool that offers full OrCAD design data versioning capabilities, allowing users to manage iterations and revisions of OrCAD design files without having to leave the native OrCAD user interface Allegro 16.6-2015 products and features such as the Allegro PCB Designer Manufacturing Option, which provides a design-for-manufacture (DFM) signoff checker and a unique PCB fabrication plus a panel documentation editor to shorten documentation time up to 80 percent over traditional methods High-speed enabled PCB designer professional configurations in the OrCAD 30 th anniversary release 16.6-2015 Allegro and OrCAD PCB productivity toolbox option that reduces the implementation time of many complex editing tasks Expansion of the OrCAD platform's product creation solutions such as OrCAD Sigrity™ ERC, OrCAD Engineering Data Management and OrCAD Capture Constraint System Auto-interactive technologies that cut high-speed signal optimization time up to 80 percent Cadence is also scheduled to deliver several speaking sessions to discuss new technology developments and how they can help solve today's complex PCB and IC packaging challenges. The Cadence speaking sessions are: Power Delivery Network Design for PCB Designers: Tuesday, September 15 , 11:00am – 12:00pm PT , John Carney , staff application engineer Techniques to Route and Tune Advanced Interfaces in 1/4th the Time: Tuesday, September 15 , 4:00pm – 5:00pm PT , Michael Catrambone , principal product engineer, Allegro technologies Replacing IDF with IDX Baseline Flow: Wednesday, September 16 , 9:00am – 10:00am PT , Ed Acheson , principal product engineer An Update on Design Data Transfer Using IPC-2581: Wednesday, September 16 , 10:00am – 11:00am PT , Hemant Shah , product marketing group director for the Custom IC and PCB group To register for the conference, please visit http://www.pcbwest.com . WHEN: PCB West 2015 is on September 15-17, 2015 . WHERE: Santa Clara Convention Center in Santa Clara , Calif.Cadence is located in booth #406. Cadence is also planning to have representatives in the IPC-2581 Consortium's booth #610. About Cadence Cadence enables global electronic design innovation and plays an essential role in the creation of today's integrated circuits and electronics. Customers use Cadence software, hardware, IP and services to design and verify advanced semiconductors, consumer electronics, networking and telecommunications equipment, and computer systems. The company is headquartered in San Jose, Calif. , with sales offices, design centers and research facilities around the world to serve the global electronics industry. More information about the company, its products and its services is available at cadence.com . © 2015 Cadence Design Systems, Inc. All rights reserved worldwide. Cadence, the Cadence logo, Allegro and OrCAD are registered trademarks and Sigrity is a trademark of Cadence Design Systems, Inc. in the United States and other countries. All other trademarks are the property of their respective owners. For more information, please contact: Cadence Newsroom", "external_links": [], "published": "2015-09-09T19:39:00.000+03:00", "crawled": "2015-09-09T19:27:22.236+03:00", "highlightTitle": ""}