{"organizations": ["The Morgan Stanley Global Healthcare Conference ... Technologies, Inc.", "LLC", "Morgan Stanley Global Healthcare Conference", "Fisher Vista", "AB Orthodontics Announce Partnership and Australian Product Introduction Winner Medical Group Inc.", "Regado Biosciences", "OrthoAccel Technologies, Inc.", "Array BioPharma Inc.", "Innovation Industry", "Morgan Stanley Global Healthcare Conference   2015 Pathway Genomics", "International Focuses on Rebuilding Nepal and Creating Economic Development Opportunities", "First College Scholarship", "American Medical Association", "Morgan Stanley Global Healthcare", "Kovarus, Inc.", "Wharton Healthcare Business Conference Docs Override Most Electronic Drug Warnings"], "uuid": "972a14b28a1a1ca37471553d026ecee6308ba5ca", "thread": {"social": {"gplus": {"shares": 0}, "pinterest": {"shares": 0}, "vk": {"shares": 0}, "linkedin": {"shares": 0}, "facebook": {"likes": 0, "shares": 0, "comments": 0}, "stumbledupon": {"shares": 0}}, "site_full": "www.bio-medicine.org", "main_image": "", "site_section": "http://www.bio-medicine.org/inc/biomed/medicine-technology.asp", "section_title": "Latest Medical Technology from Bio-Medicine.Org", "url": "http://www.bio-medicine.org/medicine-technology-1/AbbVie-to-Present-at-2015-Morgan-Stanley-Global-Healthcare-Conference-48240-1/", "country": "US", "title": "AbbVie to Present at 2015 Morgan Stanley Global Healthcare Conference", "performance_score": 0, "site": "bio-medicine.org", "participants_count": 0, "title_full": "AbbVie to Present at 2015 Morgan Stanley Global Healthcare Conference", "spam_score": 0.0, "site_type": "news", "published": "2015-09-10T12:42:00.000+03:00", "replies_count": 0, "uuid": "972a14b28a1a1ca37471553d026ecee6308ba5ca"}, "author": "", "url": "http://www.bio-medicine.org/medicine-technology-1/AbbVie-to-Present-at-2015-Morgan-Stanley-Global-Healthcare-Conference-48240-1/", "ord_in_thread": 0, "title": "AbbVie to Present at 2015 Morgan Stanley Global Healthcare Conference", "locations": ["United States", "Va.", "Philadelphia", "ALEXANDRIA", "CHICAGO", "United Kingdom", "Nepal", "America", "New York", "Calif.", "Ill.", "N.J.", "PA"], "entities": {"persons": [], "locations": [], "organizations": []}, "highlightText": "", "language": "english", "persons": ["Krebs", "Berman", "Kevin Grossman", "Biopsietest zur Erkennung", "Ron Squarer", "Preis"], "text": "  2015 Pathway Genomics , ein weltweit ... Start von CancerIntercept™ , seiner ersten flüssigen ... für die Früherkennung und Überwachung von Krebs ... Preis von 299 US-Dollar verfügbar ist. ... tweeten Foto - http://photos.prnewswire.com/prnh/20150910/265244   NORTH CHICAGO, Ill. , Sept. 10, 2015 /PRNewswire/ ... 2015 Morgan Stanley Global Healthcare Conference on Friday, Sept. ... and chief financial officer, will participate in a question ... A live audio webcast of the presentation will ... www.abbvieinvestor.com . An archived edition of the session will   10, 2015 Array BioPharma Inc. (Nasdaq: ... Officer, Ron Squarer , will present at ... York. The public is welcome to participate in ... BioPharma website. Event:Morgan Stanley Global Healthcare ConferencePresenter:Ron Squarer, Chief ... Webcast: www.arraybiopharma.com About Array BioPharma ... [ 0 ] Pathway Genomics bringt ersten flüssigen Biopsietest zur Erkennung von mit Krebs assoziierten Mutationen bei Hochrisiko-Patienten heraus [ 0 ] AbbVie to Present at 2015 Morgan Stanley Global Healthcare Conference [ 0 ] Array BioPharma To Present At The Morgan Stanley Global Healthcare Conference ... Technologies, Inc. announced that it has entered into a partnership with AB ... to the Australian market. , , ... http://www.newscom.com/cgi-bin/prnh/20091029/DA01250LOGO ) , , , ... device to enhance orthodontics, was introduced to the United Kingdom last ... ... , May 5 /PRNewswire-Asia/ -- Winner Medical ... \"Company\"), a leading manufacturer of,medical dressings, medical disposables and ... today announced that it will,release financial results for the ... 11 , before the market open. Winner Medical,s senior ... OrthoAccel Technologies, Inc. and AB Orthodontics Announce Partnership and Australian Product Introduction Winner Medical Group Inc. to Host Second Quarter Fiscal Year 2010 Earnings Conference Call on Tuesday, May 11, 2010 at 5:00 p.m. EDT (Date:9/10/2015)... ,   ... of its kind on September 4th, 2015. Unique in its creation, InventPalooza™ ... one goal: innovation support. The program created a rare opportunity for listening to   What if one product could replace ... the cost--and even comes with a guarantee? Art Naturals' Jojoba Oil is the one ... failed. The qualities, benefits, and restorative advantages of Art Naturals’ Jojoba Oil are well-documented:,   PetPace, the provider ... vital signs and activity, today released the findings of a new medical case ... pets, available for download here , documents in detail how the PetPace collar   Utah-based international nonprofit ... the sourcing and distribution of singular-quality essential oils, are rolling out a new ... is working with rural Nepal villages in conjunction with its Co-Impact Sourcing initiative.   New York (PRWEB) , ... September 10, 2015 ... ... empowering younger generations living with Lupus and other invisible diseases, will award its ... United States who are attending college or technical schools have applied to win ... [ 0 ] The Inaugural InventPalooza™ Marked an Amazing Venture for the Innovation Industry [ 0 ] Simplify Your Anti-Aging Regimen - Jojoba Oil: One Product, Many Uses [ 1 ] A New Case Study Reveals that the Petpace Smart Collar Provides Real-Time Indication of Gastro-Intestinal Distress [ 0 ] Strategic Partnership between Choice Humanitarian and doTERRA International Focuses on Rebuilding Nepal and Creating Economic Development Opportunities [ 0 ] LupusChick to Award Nonprofit's First College Scholarship to Patient ... ALEXANDRIA, Va., Feb. 12 An article published in ... the American Medical Association helps physicians to better ... determine which end-of-life care options may be best for ... life have increased in recent years. With more ... ... Calif., Feb. 12 Fisher Vista, LLC, a marketing,and ... human resource,industries today announced that Kevin Grossman, who has ... president of its HRmarketer.com division. , ... overall responsibility of,HRmarketer.com and the HRmarketer Services Group. ... ... BASKING RIDGE, N.J., Feb. 12 Regado Biosciences, ... President and Chief Executive Officer, will be presenting ... Philadelphia, PA on Friday, February 20, 2009, at ... a review of the Company,s lead development product, ... ... of prescribing system to avoid ,alert fatigue, , , ... override electronic medication safety alerts and rely instead ... patients, which suggests that physicians find the alerts ... , Researchers looked at the electronic prescriptions ... ... 2009 Oral-B(R) Stages, the dental,professional,s #1 recommended ... a campaign in recognition of National Children,s Dental ... about the state of children,s,oral health in America, ... parents and,healthcare providers alike. In fact, tooth ... ... 12 Kovarus, Inc., a premier,technology consulting firm, and ... today jointly announced the launch of a new bike ... awareness of a good cause,the American Brain Tumor Association ... http://www.newscom.com/cgi-bin/prnh/20080708/AQTU138LOGO ) , The Studio ... JAMA Article Provides Guidance to Physicians on End-of-Life Care Kevin Grossman Named President of HRmarketer.com Regado Biosciences to Present at the 2009 Wharton Healthcare Business Conference Docs Override Most Electronic Drug Warnings Oral-B Addresses Children's Oral Health Needs at All Stages of Development During National Children's Dental Health Month Biking for Fun, Sport, and Brain Tumor Awareness Our soft guedel airway is clear and has a color coded bite block. Airway has a smooth finish and is Latex Free. Recommended for single use. Non-Sterile.... New - Color Coded Berman Airways. A simple idea makes size identification easier for you., ,Premium upgrade without a premium price. Color Coded Berman airways are latex-free., ,Plastic. Single use... Plastic Economical Single use. Non-Sterile.... ... Portex® Blue Line® uncuffed endotracheal ... or Murphy styles, in standard ... Line® adult and pediatric uncuffed ... implant-tested polyvinyl chloride with a ...", "external_links": [], "published": "2015-09-10T12:42:00.000+03:00", "crawled": "2015-09-11T01:04:30.724+03:00", "highlightTitle": ""}