{"organizations": ["NTIA", "ACI Association", "Infonetics", "U.S. Department of Defense", "UC APL", "Aviat Networks, Inc.", "Chartered Financial Analyst", "CFA Institute", "Inc.", "Active Charter Investors Association", "Defense Information Systems Agency", "IHS Infonetics", "National Telecommunications and Information Administration"], "uuid": "9f11b9848d8b6932ef6e14d5f86bef62f9294ffd", "thread": {"social": {"gplus": {"shares": 0}, "pinterest": {"shares": 0}, "vk": {"shares": 0}, "linkedin": {"shares": 0}, "facebook": {"likes": 0, "shares": 0, "comments": 0}, "stumbledupon": {"shares": 0}}, "site_full": "science-technology.news-articles.net", "main_image": "", "site_section": "http://science-technology.news-articles.net/content/rss.php", "section_title": "Science and Technology @ News Articles Network", "url": "http://science-technology.news-articles.net/content/recognitions-achievements-report-aviat-networks.xhtml", "country": "US", "title": "Recognitions and Achievements - Report on Aviat Networks", "performance_score": 0, "site": "news-articles.net", "participants_count": 0, "title_full": "Recognitions and Achievements - Report on Aviat Networks", "spam_score": 0.0, "site_type": "news", "published": "2015-09-16T17:33:00.000+03:00", "replies_count": 0, "uuid": "9f11b9848d8b6932ef6e14d5f86bef62f9294ffd"}, "author": "", "url": "http://science-technology.news-articles.net/content/recognitions-achievements-report-aviat-networks.xhtml", "ord_in_thread": 0, "title": "Recognitions and Achievements - Report on Aviat Networks", "locations": ["Belarus", "United States", "Iran", "Cuba", "U.S.", "Canada", "Syria", "North Korea", "NEW YORK", "Sudan", "Somalia"], "entities": {"persons": [], "locations": [], "organizations": []}, "highlightText": "", "language": "english", "persons": ["Rohit Tuli"], "text": "Recognitions and Achievements - Report on Aviat Networks   Recognitions and Achievements - Report on Aviat Networks -- NEW YORK, September   <-   NEW YORK , September   ACI Association has initiated research coverage on Aviat Networks, Inc. (NASDAQ: AVNW ). Select highlights from the internally released reports are being made available to the general public (included below), with access to the entirety of the research available to new members. Today, membership is open to readers on a complementary basis at the following URL: http://www.aciassociation.com/reports?keyword=AVNW Highlights from our AVNW Report include: Leading the Ranking - On August 04, 2015 , Aviat Networks, Inc., announced that IHS Infonetics recently named Aviat the No. 1 microwave-only specialist of radio solutions in the wireless networking infrastructure space based on its survey of incumbent, competitive and mobile operators. Infonetics' 2015 \"Microwave Strategies and Vendor Leadership\" survey ranked Aviat No. 1 among all microwave specialists in seven of 10 categories and second in an eighth. Aviat informed that telecommunications service providers use the IHS Infonetics survey results as a part of their microwave vendor selection process. DoD Certification for Eclipse Platform - On June 10, 2015 , Aviat announced that its Eclipse platform achieved Unified Capabilities Approved Product List (UC APL) certification after it cleared a set of rigorous security, performance, availability and interoperability tests required for deployment by U.S. Department of Defense (DoD) agencies. The Company stated that the Defense Information Systems Agency (DISA) maintains this list of communications equipment authorized for deployment on DoD networks. A Brief on the Eclipse Microwave Platform - Aviat stated that this platform is purpose-built to exceed the advanced Information Assurance (IA) needs of the U.S. federal government. Additionally, it is designed, built and supported in the United States and supplied to the federal government for operation in NTIA, FCC and ITU-R frequency bands used by government agencies throughout the world. Further, the Eclipse is compliant with National Telecommunications and Information Administration (NTIA) regulations in all the common fixed point-to-point microwave bands: 4, 5.8, 7, 8, 15, 23 and 26 GHz, the Company said. To find out how this influences our rating on Aviat Networks, Inc. read the full report in its entirety here: http://www.aciassociation.com/reports?keyword=AVNW -- About ACI Association: Active Charter Investors Association (\"ACI Association\") produces regular sponsored and non-sponsored reports, articles, stock market blogs, and popular investment newsletters covering equities listed on NYSE and NASDAQ and micro-cap stocks. ACI Association has two distinct and independent departments. One department produces non-sponsored analyst certified content generally in the form of press releases, articles and reports covering equities listed on NYSE and NASDAQ and the other produces sponsored content (in most cases not reviewed by a registered analyst), which typically consists of compensated investment newsletters, articles and reports covering listed stocks and micro-caps. Such sponsored content is outside the scope of procedures detailed below. ACI Association has not been compensated; directly or indirectly; for producing or publishing this document. PRESS RELEASE PROCEDURES: The non-sponsored content contained herein has been prepared by a writer (the \"Author\") and is fact checked and reviewed by a third party research service company (the \"Reviewer\"). Rohit Tuli , a CFA® charter holder (the \"Sponsor\"), provides necessary guidance in preparing the document templates. The Reviewer has reviewed and revised the content, as necessary, based on sound investment judgment and publicly available information which is believed to be reliable. The Reviewer and the Sponsor have not performed any independent investigations or forensic audits to validate the information herein. Unless otherwise noted, any content outside of this document has no association with the Author, the Reviewer, or the Sponsor (collectively referred to as the \"Production Team\") in any way. The Production Team is compensated on a fixed monthly basis and do not hold any positions of interest in any of the securities mentioned herein. NO WARRANTY ACI Association, the Author, the Reviewer and the Sponsor (collectively referred to as the \"Publishers\") are not responsible for any error which may be occasioned at the time of printing of this document or any error, mistake or shortcoming. No liability is accepted by the Publishers whatsoever for any direct, indirect or consequential loss arising from the use of this document. The Publishers expressly disclaim any fiduciary responsibility or liability for any consequences, financial or otherwise arising from any reliance placed on the information in this document. Additionally, the Publishers do not (1) guarantee the accuracy, timeliness, completeness or correct sequencing of the information, or (2) warrant any results from use of the information. The included information is subject to change without notice. NOT AN OFFERING This document is not intended as an offering, recommendation, or a solicitation of an offer to buy or sell the securities mentioned or discussed, and is to be used for informational purposes only. Please read all associated disclosures and disclaimers in full before investing. Neither ACI Association nor any party affiliated with us is a registered investment adviser or broker-dealer with any agency or in any jurisdiction whatsoever. To download our report(s), read our disclosures, or for more information, visit http://www.aciassociation.com/ . RESTRICTIONS ACI Association is not available to residents of Belarus , Cuba , Canada , Iran , North Korea , Sudan , Syria or Somalia . Do not send email to robottrap (at) aciassociation.com. CFA® and Chartered Financial Analyst® are registered trademarks owned by CFA Institute.", "external_links": [], "published": "2015-09-16T17:33:00.000+03:00", "crawled": "2015-09-16T17:20:35.365+03:00", "highlightTitle": ""}