{"organizations": ["Siliconware", "Siliconware Precision Industries Co. Ltd", "RSI", "Chartered Financial Analyst", "Rambus Inc.", "About Equity Research Institute", "Enphase Energy Inc.", "Rambus Technology Sector Stocks Technical Coverage", "Siliconware Precision Industries", "ASML", "S&P", "Micron Technology", "Micron Technology Inc.", "CFA Institute", "Siliconware Precision Industries Company Ltd", "ASML Holding N.V.", "Equity Research Institute"], "uuid": "79015b6d270ae01d2bfb9ad1c8f9d3240dfc5c33", "thread": {"social": {"gplus": {"shares": 0}, "pinterest": {"shares": 0}, "vk": {"shares": 0}, "linkedin": {"shares": 0}, "facebook": {"likes": 0, "shares": 0, "comments": 0}, "stumbledupon": {"shares": 0}}, "site_full": "science-technology.news-articles.net", "main_image": "", "site_section": "http://science-technology.news-articles.net/content/rss.php", "section_title": "Science and Technology @ News Articles Network", "url": "http://science-technology.news-articles.net/content/technology-sector-stocks-technical-coverage-micron-asml-holding-siliconware-precision-industries-enphase-energy-rambus.xhtml", "country": "US", "title": "Technology Sector Stocks Technical Coverage - Micron Technology, ASML Holding, Siliconware Precision Industries, Enphase Energy, and Rambus", "performance_score": 0, "site": "news-articles.net", "participants_count": 0, "title_full": "Technology Sector Stocks Technical Coverage - Micron Technology, ASML Holding, Siliconware Precision Industries, Enphase Energy, and Rambus", "spam_score": 0.0, "site_type": "news", "published": "2015-09-16T17:33:00.000+03:00", "replies_count": 0, "uuid": "79015b6d270ae01d2bfb9ad1c8f9d3240dfc5c33"}, "author": "", "url": "http://science-technology.news-articles.net/content/technology-sector-stocks-technical-coverage-micron-asml-holding-siliconware-precision-industries-enphase-energy-rambus.xhtml", "ord_in_thread": 0, "title": "Technology Sector Stocks Technical Coverage - Micron Technology, ASML Holding, Siliconware Precision Industries, Enphase Energy, and Rambus", "locations": ["Belarus", "Iran", "Cuba", "Canada", "Syria", "North Korea", "NEW YORK", "Sudan", "Somalia"], "entities": {"persons": [], "locations": [], "organizations": []}, "highlightText": "", "language": "english", "persons": ["ERI", "Rohit Tuli"], "text": "Technology Sector Stocks Technical Coverage - Micron Technology, ASML Holding, Siliconware Precision Industries, Enphase Energy, and Rambus   Published on 2015-09-16 06:17:46 Technology Sector Stocks Technical Coverage - Micron Technology, ASML Holding, Siliconware Precision... -- NEW YORK, September   <-   NEW YORK , September   Equity Research Institute has initiated coverage on the following equities: Micron Technology Inc. (NASDAQ: MU ), ASML Holding N.V. (NASDAQ: ASML ), Siliconware Precision Industries Company Ltd (NASDAQ: SPIL ), Enphase Energy Inc. (NASDAQ: ENPH ), and Rambus Inc. (NASDAQ: RMBS ). Free research report on Micron Technology can be accessed at https://www.erionline.net/reports?keyword=MU On Tuesday, September 15, 2015 , the NASDAQ Composite ended at 4,860.52, up 1.14%, the Dow Jones Industrial Average advanced 1.40%, to finish the day at 16,599.85, and the S&P 500 closed at 1,978.09, up 1.28%. The gains were broad based as all the sectors ended the session in positive. Register for your complimentary reports at the links given below. Micron Technology Inc.'s stock finished Tuesday's session 1.08% lower at $16.52 . A total of 20.63 million shares were traded, which was below its three months average volume of 34.95 million shares. Over the last one month and the previous three months, Micron Technology Inc.'s shares have declined 2.54% and 31.85%, respectively. Additionally, the stock has plummeted 52.81% since the beginning of 2015. The company's shares are trading below their 50-day and 200-day moving averages by 5.92% and 37.18%, respectively. Micron Technology Inc.'s stock traded at a PE ratio of 5.51 and has a Relative Strength Index (RSI) of 46.29. Sign up and read the free notes on MU at: https://www.erionline.net/reports?keyword=MU On Tuesday, shares in ASML Holding N.V. ended the session 2.64% higher at $93.33 . The stock reported a trading volume of 0.81 million shares, below its three months average volume of 1.30 million shares. Shares of the company traded at a PE ratio of 27.05. Although, ASML Holding N.V.'s shares have gained 0.69% in the last one month, it has lost 14.54% in the previous three months and 12.80% on YTD basis. The company is trading 2.64% below its 50-day moving average and 9.57% below its 200-day moving average. Moreover, shares of ASML Holding N.V. have an RSI of 51.56. The complimentary notes on ASML can be downloaded in PDF format at: https://www.erionline.net/reports?keyword=ASML Siliconware Precision Industries Co. Ltd's stock gained 1.99%, to close the day at $6.67 . The stock recorded a trading volume of 2.06 million shares, above its three months average volume of 1.22 million shares. Over the previous three months and since the start of this year, Siliconware Precision Industries Co. Ltd's shares have declined 1.77% and 4.63%, respectively. However, the stock has surged 20.83% in the last one month. The company's shares are trading 10.96% above their 50-day moving average. Additionally, Siliconware Precision Industries Co. Ltd traded at a PE ratio of 11.50 and has an RSI of 63.09. Register for free on Equity Research Institute and access the latest research on SPIL at: https://www.erionline.net/reports?keyword=SPIL On Tuesday, shares in Enphase Energy Inc. recorded a trading volume of 0.66 million shares, lower than their three months average volume of 0.90 million shares. The stock ended the day 1.36% higher at $4.48 . Enphase Energy Inc.'s stock has plummeted 18.55% in the last one month, 50.61% in the previous three months and 68.65% on YTD basis. The company is trading below its 50-day and 200-day moving averages by 18.74% and 56.83%, respectively. Furthermore, shares of Enphase Energy Inc. have an RSI of 39.49. The complete research on ENPH is available for free at: https://www.erionline.net/reports?keyword=ENPH Rambus Inc.'s stock lost 3.37%, to close Tuesday's session at $13.19 . The stock recorded a trading volume of 1.10 million shares, below its three months average volume of 0.77 million shares. Over the last one month and over the previous three months, Rambus Inc.'s shares have lost 1.93% and 13.11%, respectively. However, the stock has gained 18.94% since the beginning of 2015. The company is trading 1.87% above its 200-day moving average. Furthermore, Rambus Inc.'s stock traded at a PE ratio of 52.76 and has an RSI of 46.92. Free in-depth research on RMBS is available at: -- About Equity Research Institute: Equity Research Institute (\"ERI\") produces regular sponsored and non-sponsored reports, articles, stock market blogs, and popular investment newsletters covering equities listed on NYSE and NASDAQ and micro-cap stocks. ERI has two distinct and independent departments. One department produces non-sponsored analyst certified content generally in the form of press releases, articles and reports covering equities listed on NYSE and NASDAQ and the other produces sponsored content (in most cases not reviewed by a registered analyst), which typically consists of compensated investment newsletters, articles and reports covering listed stocks and micro-caps. Such sponsored content is outside the scope of procedures detailed below. ERI has not been compensated; directly or indirectly; for producing or publishing this document. PRESS RELEASE PROCEDURES: The non-sponsored content contained herein has been prepared by a writer (the \"Author\") and is fact checked and reviewed by a third party research service company (the \"Reviewer\"). Rohit Tuli , a CFAÂ® charter holder (the \"Sponsor\"), provides necessary guidance in preparing the document templates. The Reviewer has reviewed and revised the content, as necessary, based on sound investment judgment and publicly available information which is believed to be reliable. The Reviewer and the Sponsor have not performed any independent investigations or forensic audits to validate the information herein. Unless otherwise noted, any content outside of this document has no association with the Author, the Reviewer, or the Sponsor (collectively referred to as the \"Production Team\") in any way. The Production Team is compensated on a fixed monthly basis and do not hold any positions of interest in any of the securities mentioned herein. NO WARRANTY ERI, the Author, the Reviewer and the Sponsor (collectively referred to as the \"Publishers\") are not responsible for any error which may be occasioned at the time of printing of this document or any error, mistake or shortcoming. No liability is accepted by the Publishers whatsoever for any direct, indirect or consequential loss arising from the use of this document. The Publishers expressly disclaim any fiduciary responsibility or liability for any consequences, financial or otherwise arising from any reliance placed on the information in this document. Additionally, the Publishers do not (1) guarantee the accuracy, timeliness, completeness or correct sequencing of the information, or (2) warrant any results from use of the information. The included information is subject to change without notice. NOT AN OFFERING This document is not intended as an offering, recommendation, or a solicitation of an offer to buy or sell the securities mentioned or discussed, and is to be used for informational purposes only. Please read all associated disclosures and disclaimers in full before investing. Neither ERI nor any party affiliated with us is a registered investment adviser or broker-dealer with any agency or in any jurisdiction whatsoever. To download our report(s), read our disclosures, or for more information, visit http://www.erionline.net . RESTRICTIONS ERI is not available to residents of Belarus , Cuba , Canada , Iran , North Korea , Sudan , Syria or Somalia . Do not send email to robottrap (at) erionline.net. CFAÂ® and Chartered Financial AnalystÂ® are registered trademarks owned by CFA Institute.", "external_links": [], "published": "2015-09-16T17:33:00.000+03:00", "crawled": "2015-09-16T17:19:51.675+03:00", "highlightTitle": ""}