{"organizations": ["EMEA", "NGOs", "Communications Technology", "Vizocom", "Eutelsat", "Vizocom Exhibited in Oil & Gas Tanzania 2015 Vizocom Exhibited in Oil & Gas", "VSAT", "IPP Media Group", "Oil & Gas"], "uuid": "967c2cc5b1bfd3646d6d526968959ffab320e002", "thread": {"social": {"gplus": {"shares": 0}, "pinterest": {"shares": 0}, "vk": {"shares": 0}, "linkedin": {"shares": 0}, "facebook": {"likes": 0, "shares": 0, "comments": 0}, "stumbledupon": {"shares": 0}}, "site_full": "news.scoopasia.com", "main_image": "", "site_section": "http://scoopasia.com/index.php/syndication/news/C12/", "section_title": "Press Releases - Enterprise Technology", "url": "http://news.scoopasia.com/index.php/news/vizocom_exhibited_in_oil_gas_tanzania_2015/", "country": "US", "title": "Vizocom Exhibited in Oil & Gas Tanzania 2015", "performance_score": 0, "site": "scoopasia.com", "participants_count": 0, "title_full": "Vizocom Exhibited in Oil & Gas Tanzania 2015", "spam_score": 0.0, "site_type": "news", "published": "2015-09-16T02:42:00.000+03:00", "replies_count": 0, "uuid": "967c2cc5b1bfd3646d6d526968959ffab320e002"}, "author": "", "url": "http://news.scoopasia.com/index.php/news/vizocom_exhibited_in_oil_gas_tanzania_2015/", "ord_in_thread": 0, "title": "Vizocom Exhibited in Oil & Gas Tanzania 2015", "locations": ["UAE", "Tanzania", "Vizocom", "Africa", "Asia", "Newtec"], "entities": {"persons": [], "locations": [], "organizations": []}, "highlightText": "", "language": "english", "persons": ["Philippe Massoubre", "Vizocom", "Mengi", "Mukundan Paravasthu", "Pieter-Paul Mooijman", "Reginald Mengi", "Newtec"], "text": "Vizocom Exhibited in Oil & Gas Tanzania 2015 , 16 September 2015 -- Vizocom was an exhibitor in the Oil & Gas Tanzania 2015 Expo which took place during 27th thru 29th of August.Dubai, UAE, September 16, 2015 -- Vizocom was an exhibitor in the Oil & Gas Tanzania 2015 Expo which took place during 27th thru 29th of August. This was an opportunity for Vizocom and its partners Eutelsat and Newtec to debut their new IP Easy Service with low cost hardware solution from Newtec for Africa while taking advantage of this event to introduce its ICT and telecommunications services to international firms and Oil & Gas companies as well as visitors participating in this important regional event. The event helped facilitate the entry of international support services into the growing oil and gas industry in Tanzania, and hosted a number of international companies looking to introduce and expand operations and services in Africa. Many local and international oil and gas companies and professionals participated in this event. Most notably, Mr. Reginald Mengi, who heads IPP Media Group – one of the largest media conglomerates in Africa, participated in this event inauguration and met Vizocom’ Regional Sales Manager Mr. Mukundan Paravasthu, Eutelsat’s Head of Sales EMEA, Mr. Philippe Massoubre and Newtec’s Regional Sales Manager, Mr. Pieter-Paul Mooijman at our booth. Mr. Mengi was extremely happy to learn Vizocom was part of the event. He expressed interest in Vizocom and inquired extensively on Vizocom’s services and presence in Africa. Mr. Mengi encouraged Vizocom to expand its operation in Africa and create employment opportunities to the local economy either directly or through Vizocom’s African partners. Vizocom and it’s partners, Eutelsat and Newtec introduced their satellite communication services to Mr. Reginald Mengi, owner of IPP Media Group. About Vizocom: Vizocom is a leading Information and Communications Technology company with special focus and expertise on providing internet and VSAT services, IT infrastructure solutions and integration in remote regions throughout the world. Vizocom caters to Fortune 1000 companies with a focus on the O&G, mining and construction markets as well as governments, NGOs, and security companies. While Vizocom’s Satellite Services are global, it focuses on the emerging markets in Africa and Asia. For more information, visit http://www.vizocom.com | http://www.vizocomsat.com Mukundan Paravasthu, Regional Sales Manager - EMEA, Email: , Phone:+ 971 50 70 89379 Contact:", "external_links": [], "published": "2015-09-16T02:42:00.000+03:00", "crawled": "2015-09-16T14:32:27.124+03:00", "highlightTitle": ""}