{"organizations": ["GroupM Digital", "MediaCom", "GroupM", "WPP", "GroupM GroupM", "MEC", "China Data Giants Youku", "Tencent", "GroupM Digital Momentum Forging Your Competitive Edge Conference Partnership", "UnionPay Smart Co.", "Maxus", "Xiaomi Tech", "General Manager of Channel Department", "Youku Tudou Inc.", "Ltd.", "GroupM Asia-Pacific", "Online Media Group of Tencent"], "uuid": "cff07596a04ce34f3960a2c6c2198cc4f3316679", "thread": {"social": {"gplus": {"shares": 0}, "pinterest": {"shares": 0}, "vk": {"shares": 0}, "linkedin": {"shares": 0}, "facebook": {"likes": 0, "shares": 0, "comments": 0}, "stumbledupon": {"shares": 0}}, "site_full": "businesswireindia.com", "main_image": "", "site_section": "http://businesswireindia.com/RSSFeeds/subcat-technology.xml", "section_title": "BusinessWire India.com - Technology", "url": "http://businesswireindia.com/news/news-details/xaxis-announces-partnership-with-china-data-giants-youku-iqiyi-tencent/45399", "country": "US", "title": "Xaxis Announces Partnership with China Data Giants Youku, iQiyi, Tencent, Sina Weibo and UnionPay at the 2015 GroupM Digital Momentum Forging Your Competitive Edge Conference", "performance_score": 0, "site": "businesswireindia.com", "participants_count": 0, "title_full": "Xaxis Announces Partnership with China Data Giants Youku, iQiyi, Tencent, Sina Weibo and UnionPay at the 2015 GroupM Digital Momentum Forging Your Competitive Edge Conference", "spam_score": 0.0, "site_type": "news", "published": "2015-09-24T12:35:00.000+03:00", "replies_count": 0, "uuid": "cff07596a04ce34f3960a2c6c2198cc4f3316679"}, "author": "", "url": "http://businesswireindia.com/news/news-details/xaxis-announces-partnership-with-china-data-giants-youku-iqiyi-tencent/45399", "ord_in_thread": 0, "title": "Xaxis Announces Partnership with China Data Giants Youku, iQiyi, Tencent, Sina Weibo and UnionPay at the 2015 GroupM Digital Momentum Forging Your Competitive Edge Conference", "locations": ["North America", "Shanghai", "Latin America", "Europe", "Asia Pacific", "Middle East", "China", "Xaxis China"], "entities": {"persons": [], "locations": [], "organizations": []}, "highlightText": "", "language": "english", "persons": ["John Dao", "Patrick Xu", "Kelvin Long", "Youku Tudou", "Dawei Gu", "Sina Weibo", "Frankie Fu", "Mark Patterson", "Mickey Zhang"], "text": "Thursday, September 24, 2015 3:05PM IST (9:35AM GMT) (BW)(XAXIS) Xaxis Announces Partnership with China Data Giants Youku, iQiyi, Tencent, Sina Weibo and UnionPay at the 2015 GroupM Digital Momentum Forging Your Competitive Edge Conference Partnership will enable access to more premium inventory via programmatic buying, improve advertising precision and bring stronger standards to China digital ad market Shanghai, China Xaxis, the world’s largest programmatic media and technology platform, announced today a strategic partnership with China’s digital and data giants, Youku Tudou, iQiyi, Tencent, Sina Weibo, UnionPay Smart and Xiaomi at the 2015 GroupM Digital Momentum Forging Your Competitive Edge Conference. The partnership will increase the supply of premium digital inventory accessible via programmatic buying while enhancing the ability of advertisers to accurately target the right audiences. As part of the deal, Xaxis will incorporate audience data from the Chinese partners directly into Turbine, its revolutionary data management platform (DMP). With this unique data from the biggest players in the China digital landscape, Xaxis will be able to offer more accuracy in reaching the most relevant consumers with the right message at the right time. The companies will also work together to develop more accountable industry standards for effectively measuring digital media campaigns in China. The GroupM China conference attracted and inspired representatives from China’s top brands, media owners and agencies with keynote speeches and panel discussions covering major digital marketing topics. Programmatic buying was the key focus of this event, providing actionable takeaways for attendees to plan smarter and more effective digital campaigns. Patrick Xu, CEO of GroupM China said, “The huge opportunities lie in predicting your target audiences’ next moves based on similar users’ past history, and which content consumption pattern will trigger action from your consumer. The partnership will help us better understand users and reach out to them better. More importantly, these parties will come together to develop an industry standard to ensure its rapid and healthy development. We are eager to further develop our partnerships with more media and data sources within China.” Xaxis is the world’s largest programmatic media and technology platform. Turbine, a milestone in the evolution of data management platforms, is designed to provide advanced real-time audience segmentation capabilities and look-alike modeling, to complement Xaxis’ product offerings. Turbine enables Xaxis to create more accurate and unique audience portraits to better connect advertisers with their target audiences across its roster of premium publishers. By creating better connections for advertisers with their audiences on these publishers, Xaxis creates and sustains demand for the inventory. Mickey Zhang, Managing Director of Xaxis China, said, “Xaxis is proud to partner with these big digital companies in China. Programmatic buying provides sought-after premium inventory, especially premium online video inventory, in a more efficient way through greater audience intelligence. This partnership strengthens that intelligence, enabling us to provide enhanced campaign performance and efficiency. With that, we can empower our advertisers to make increasingly well-informed data-driven programmatic buying decisions in real time. ” Xaxis is eager to further develop its partnerships with more media and data sources within China. Mark Patterson, CEO of GroupM Asia-Pacific, said, “Our next phase is about partnerships, both outside and inside of WPP’s network. For example, GroupM is working increasingly closely with WPP's research, data and insights companies in Kantar in a number of areas to amplify each other's strengths and create new opportunities , products and services for our clients in China (and around the region and world) around our common DNA of data, insights and the consumer.” John Dao, General Manager of Channel Department, Online Media Group of Tencent, said at the conference, “Providing brands diversified marketing solutions to deliver the right message to right people is the core of Tencent and Xaxis’ marketing products. The partnership will further improve our data ecosystem and benefit marketers and the whole industry.” Kelvin Long, Co-founder and Chief Technology Officer of UnionPay Smart Co., Ltd. commented, “In the era of big data, protecting users' personal information and privacy is a precondition. We pay great importance to user behavior analysis and cross-channel data integration: aligning with Xaxis’ data and programmatic buying technology, to provide our users better personalized experience.” Frankie Fu, Vice President of Innovation Marketing, Youku Tudou Inc. said, “Programmatic buying is developing very fast, but there is still a lot of work to do. All publishers aim to enable brands to invest smarter and we are glad to work with GroupM to further explore new ad models and accelerate the standard setting progress.” Dawei Gu, Head of Data and Ads Group at Xiaomi Tech said, “Xiaomi is not only a mobile device manufacturer, but also a cross-screen media owner. We are excited to work with Xaxis to better identify users on different devices, synchronize channels and improve marketing effectiveness.” About Xaxis Xaxis is a global digital media platform that programmatically connects advertisers to audiences across all addressable channels. Through the expert use of proprietary data and advertising technology along with unparalleled media relationships, Xaxis delivers results for over 2,800 clients in 42 markets across North America, Europe, Asia Pacific, Latin America and the Middle East. Advertisers working with Xaxis achieve exceptionally high return on advertising spend through the company’s proprietary media products, as well as through its wholly-owned specialist companies, Light Reaction, Bannerconnect and ActionX. About GroupM GroupM is WPP’s consolidated media investment management operation, serving as the parent company to agencies including Maxus, MEC, MediaCom, Mindshare and Xaxis. GroupM is the global leading media investment management group. GroupM invests in more than 560 markets across China, with an overall activity volume of USD 9.87 billion (RECMA 2013). As China’s leading media communications group, GroupM is one of the industry’s biggest investors in syndicated and proprietary media research and optimization tool development.", "external_links": [], "published": "2015-09-24T12:35:00.000+03:00", "crawled": "2015-09-24T14:46:24.334+03:00", "highlightTitle": ""}