{"organizations": ["Reliance Communications", "Times of India News", "Reliance Jio", "Reliance Retail", "Reliance Industries", "Reliance"], "uuid": "ffe03eb6ff36244e475c948dabd92f08cb4da6c6", "thread": {"social": {"gplus": {"shares": 0}, "pinterest": {"shares": 0}, "vk": {"shares": 0}, "linkedin": {"shares": 0}, "facebook": {"likes": 0, "shares": 0, "comments": 0}, "stumbledupon": {"shares": 0}}, "site_full": "timesofindia.indiatimes.com", "main_image": "http://timesofindia.indiatimes.com/photo/48898926.cms", "site_section": "http://timesofindia.indiatimes.com/rssfeeds/5880659.cms", "section_title": "Technology News, Latest Gadget Reviews, Gaming & Tech Videos | Times of India", "url": "http://timesofindia.indiatimes.com/tech/tech-news/Reliance-Jio-to-offer-4G-handsets-starting-at-Rs-2000/articleshow/48898913.cms", "country": "IL", "title": "Reliance Jio to offer 4G handsets starting at Rs 2,000", "performance_score": 0, "site": "indiatimes.com", "participants_count": 0, "title_full": "Reliance Jio to offer 4G handsets starting at Rs 2,000", "spam_score": 0.0, "site_type": "news", "published": "2015-09-10T12:41:00.000+03:00", "replies_count": 0, "uuid": "ffe03eb6ff36244e475c948dabd92f08cb4da6c6"}, "author": "", "url": "http://timesofindia.indiatimes.com/tech/tech-news/Reliance-Jio-to-offer-4G-handsets-starting-at-Rs-2000/articleshow/48898913.cms", "ord_in_thread": 0, "title": "Reliance Jio to offer 4G handsets starting at Rs 2,000", "locations": ["MUMBAI"], "entities": {"persons": [], "locations": [], "organizations": []}, "highlightText": "", "language": "english", "persons": ["Mukesh Ambani", "Anil Ambani", "Reliance Jio", "Mukesh", "Piyush Pandey Piyush Pandey"], "text": "Reliance Jio to offer 4G handsets starting at Rs 2,000 Piyush Pandey Piyush Pandey ,TNN | Sep 10, 2015, 03.11 PM IST Reliance Jio, the telecommunications arm of RIL, targets to corner 10 crore of the 90 crore consumers in the world's fastest growing mobile market. RELATED MUMBAI: Mukesh Ambani-led energy-to-retail conglomerate Reliance Industries (RIL) is planning to launch fourth generation or 4G-enabled entry-level smartphones for as less as Rs 2,000, bettering the promise of launching such devices for less than Rs 4,000 during RIL's AGM in May. These entry-level smartphones with inbuilt Jio apps will be sold under the in-house brand 'ReConnect' and will be sold through the network of Reliance Retail, the retailing arm of RIL. The idea is replicate the success of 'Monsoon Hungama,' when Reliance Communications (now owned by Anil Ambani) gave away mobile connections along with mobile handsets for just Rs 501 during 2003-2004 to capture the mass market. Reliance Jio, the telecommunications arm of RIL, targets to corner 10 crore of the 90 crore consumers in the world's fastest growing mobile market. \"We want the entire range of smartphones to be available for the consumers to choose from. Starting from entry-level smartphones for Rs 2,000 to iPhones for Rs 20,000. There will be various price points to meet the needs of all the consumers,\" a Reliance Jio official told TOI on the condition of anonymity. Reliance Jio is working with 24 handsets makers and five chipmakers to launch the entire range of devices at all price points. A mail sent to RIL remained unanswered till the time of going to print. http://timesofindia.indiatimes.com/followceleb.cms?alias=Reliance Industries,Reliance communications,Mukesh Ambani,Anil Ambani,4G Stay updated on the go with Times of India News App. Click here to download it for your device.", "external_links": [], "published": "2015-09-10T12:41:00.000+03:00", "crawled": "2015-09-10T13:21:37.562+03:00", "highlightTitle": ""}