{"organizations": ["HBO", "Apple Stay", "Apple", "Times of India News"], "uuid": "f8c0bb096df77a759e4d395f7fcc0187f91b212a", "thread": {"social": {"gplus": {"shares": 0}, "pinterest": {"shares": 0}, "vk": {"shares": 0}, "linkedin": {"shares": 0}, "facebook": {"likes": 0, "shares": 0, "comments": 0}, "stumbledupon": {"shares": 0}}, "site_full": "timesofindia.indiatimes.com", "main_image": "http://timesofindia.indiatimes.com/photo/48891408.cms", "site_section": "http://timesofindia.indiatimes.com/rssfeeds/5880659.cms", "section_title": "Technology News, Latest Gadget Reviews, Gaming & Tech Videos | Times of India", "url": "http://timesofindia.indiatimes.com/tech/more-gadgets/New-version-of-Apple-TV-with-Siri-unveiled/articleshow/48891357.cms", "country": "IL", "title": "New version of Apple TV with Siri unveiled", "performance_score": 0, "site": "indiatimes.com", "participants_count": 0, "title_full": "New version of Apple TV with Siri unveiled", "spam_score": 0.0, "site_type": "news", "published": "2015-09-09T21:16:00.000+03:00", "replies_count": 0, "uuid": "f8c0bb096df77a759e4d395f7fcc0187f91b212a"}, "author": "", "url": "http://timesofindia.indiatimes.com/tech/more-gadgets/New-version-of-Apple-TV-with-Siri-unveiled/articleshow/48891357.cms", "ord_in_thread": 0, "title": "New version of Apple TV with Siri unveiled", "locations": ["Hulu"], "entities": {"persons": [], "locations": [], "organizations": []}, "highlightText": "", "language": "english", "persons": ["Jason Bateman", "Cook", "Tim Cook", "Siri"], "text": "New version of Apple TV with Siri unveiled RELATED Apple investors hope for stock boost NEW DELHI: Apple has taken a step towards making the TV the next big category for the company with a major revamp of its set-top box. The new Apple TV not only gets Siri integration and dedicated app store and more powerful hardware, the device will get an operating system of its own, named tvOS. CEO Tim Cook emphasized the importance of Apple TV and native apps, saying, \"Our vision for TV is simple and perhaps a little provocative. We believe the future of television is apps.\" Users will be able to interact with the new Apple TV using Siri as well as the remote control. Cook showed a video where Siri can pull up relevant movies in iTunes when asked questions like \"Show me family movies,\" \"Comedies with Jason Bateman,\" etc. Apple TV with come integrated iTunes, HBO, Hulu, Showtime integration. Siri will be able perform tasks like skipping back a few seconds if you miss a scene while watching a video, Apple said at the event. You will be able to watch two videos at the same time as the device supports split-screen view. Siri on Apple TV will also be able to deliver sports scores, weather etc. The device will also come with gaming apps like Galaxy on Fire and Guitar Hero, and Shadowmatic. For connectivity, the new Apple TV will have Ethernet, HDMI and Bluetooth 4.0. Apple said that the basic 32GB Apple TV m0del will cost $149, whereas the 64GB variant will cost $199, and will start shipping in 80 countries starting October. The company will continue to sell the existing Apple TV at $99. http://timesofindia.indiatimes.com/followceleb.cms?alias=Siri,Apple TV,Apple Stay updated on the go with Times of India News App. Click here to download it for your device.", "external_links": [], "published": "2015-09-09T21:16:00.000+03:00", "crawled": "2015-09-09T21:48:43.275+03:00", "highlightTitle": ""}