{"organizations": ["New Hampshire", "Facebook & Twitter", "First New Hampshire Operations Center", "people of New Hampshire", "CITY", "Granite State", "Securities and Exchange Commission"], "uuid": "fab301d1c0850eb4a61026d52381248f3daeab6a", "thread": {"social": {"gplus": {"shares": 0}, "pinterest": {"shares": 0}, "vk": {"shares": 0}, "linkedin": {"shares": 0}, "facebook": {"likes": 0, "shares": 0, "comments": 0}, "stumbledupon": {"shares": 0}}, "site_full": "science-technology.news-articles.net", "main_image": "", "site_section": "http://science-technology.news-articles.net/content/rss.php", "section_title": "Science and Technology @ News Articles Network", "url": "http://science-technology.news-articles.net/content/governor-hassan-hand-celebrate-solarcitys-first-new-hampshire-operations-center.xhtml", "country": "US", "title": "Governor Hassan on Hand to Celebrate SolarCity's First New Hampshire Operations Center", "performance_score": 0, "site": "news-articles.net", "participants_count": 0, "title_full": "Governor Hassan on Hand to Celebrate SolarCity's First New Hampshire Operations Center", "spam_score": 0.0, "site_type": "news", "published": "2015-09-10T02:22:00.000+03:00", "replies_count": 0, "uuid": "fab301d1c0850eb4a61026d52381248f3daeab6a"}, "author": "", "url": "http://science-technology.news-articles.net/content/governor-hassan-hand-celebrate-solarcitys-first-new-hampshire-operations-center.xhtml", "ord_in_thread": 0, "title": "Governor Hassan on Hand to Celebrate SolarCity's First New Hampshire Operations Center", "locations": ["Nashua", "Rhode Island", "Portsmouth", "Laconia", "Connecticut", "Vermont", "New Hampshire", "Concord", "America", "Massachusetts", "MANCHESTER", "New England", "N.H.", "Manchester"], "entities": {"persons": [], "locations": [], "organizations": []}, "highlightText": "", "language": "english", "persons": ["Chris Pappas", "Lee Keshishian", "Keene", "Hassan", "Maggie Hassan", "Ted Gatsas"], "text": "Governor Hassan on Hand to Celebrate SolarCity's First New Hampshire Operations Center   10:47:45 Governor Hassan on Hand to Celebrate SolarCity's First New Hampshire Operations Center -- MANCHESTER, N.H., Sept. 9,   (L-R) Councilor Chris Pappas, Governor Maggie Hassan, Manchester Mayor Ted Gatsas and other state and local officials joined SolarCity's Regional Vice President Lee Keshishian to cut the ribbon at SolarCity's new operations center in ... × <- stripped tags -> (L-R) Councilor Chris Pappas, Governor Maggie Hassan, Manchester Mayor Ted Gatsas and other state and local officials joined SolarCity's Regional Vice President Lee Keshishian to cut the ribbon at SolarCity's new operations center in Manchester today. <-  <- stripped tags -> MANCHESTER, N.H. , Sept. 9,   SolarCity® (NASDAQ: [[UEdFZ2NtVnNQVndpYm05bWIyeHNiM2RjSWlCb2NtVm1QU2RvZEhSd09pOHZjM1IxWkdsdkxUVXVabWx1WVc1amFXRnNZMjl1ZEdWdWRDNWpiMjB2Y0hKdVpYZHpQMUJoWjJVOVVYVnZkR1VtVkdsamEyVnlQVk5EVkZrbklISmxiRDBuYm05bWIyeHNiM2NuSUhSaGNtZGxkRDBuWDJKc1lXNXJKeUIwYVhSc1pUMG5VME5VV1NjZ2IyNWpiR2xqYXowbmJHbHVhMDl1UTJ4cFkyc29kR2hwY3lrbklISmxiRDBuYm05bWIyeHNiM2NuUGxORFZGazhMMkUrfA==]]), America's #1 solar power provider, is expanding its New Hampshire presence with a new, 26,000 square foot operations center in Manchester . Governor Maggie Hassan , Mayor Ted Gatsas , Councilor Chris Pappas , and other state and local officials joined SolarCity staff to cut the ribbon at the new facility today. The Manchester operations center is SolarCity's first in the state, and the company expects more than 75 jobs there when fully staffed. \"On behalf of the people of New Hampshire , I am proud to welcome SolarCity to the Granite State ,\" Governor Hassan said. \"SolarCity's decision to open this facility in New Hampshire reinforces that our tax-friendly environment, small and responsive state government, highly skilled workforce and high quality of life make the Granite State attractive for growing businesses. SolarCity will help encourage energy efficiency and diversification in our growing clean energy sector, which will help reduce costs for ratepayers, create jobs and decrease harmful emissions that lead to climate change.\" SolarCity, [[UEdFZ2NtVnNQVndpYm05bWIyeHNiM2RjSWlCdmJtTnNhV05yUFNkc2FXNXJUMjVEYkdsamF5aDBhR2x6S1NjZ2FISmxaajFjSW1oMGRIQTZMeTkzZDNjdWMyOXNZWEpqYVhSNUxtTnZiUzl1WlhkemNtOXZiUzl3Y21WemN5OXpiMnhoY21OcGRIa3RaWGh3WVc1a2N5MXVaWGN0YUdGdGNITm9hWEpsWENJZ2NtVnNQVndpYm05bWIyeHNiM2RjSWlCMFlYSm5aWFE5WENKZllteGhibXRjSWo1M2FHbGphQ0JzWVhWdVkyaGxaQ0JPWlhjZ1NHRnRjSE5vYVhKbElITmxjblpwWTJVZ2FXNGdkR2hsSUhOd2NtbHVaeXc4TDJFK3w=]] makes it possible for many New Hampshire homeowners to install solar with no upfront cost and pay as much as 20 percent less by going solar than they pay for utility power, with installation, production guarantee and monitoring included. SolarCity also offers customers the option to purchase upfront. The new SolarCity operations center creates new solar jobs for the state. With more than 40 staff already in place, the company is actively hiring for open positions in sales, installation and related roles. SolarCity already employs over 1,000 employees in New England who serve Connecticut , Massachusetts , New Hampshire , Rhode Island and Vermont . The company will service residential and commercial customers as far north as Concord and Laconia , as far west as Keene and the entire Southeastern part of the state including Portsmouth and Nashua from the location. Candidates interested in employment opportunities in New Hampshire can review available positions and contact SolarCity directly via its online jobs form at [[UEdFZ2NtVnNQVndpYm05bWIyeHNiM2RjSWlCdmJtTnNhV05yUFNkc2FXNXJUMjVEYkdsamF5aDBhR2x6S1NjZ2FISmxaajFjSW1oMGRIQTZMeTkzZDNjdWMyOXNZWEpqYVhSNUxtTnZiUzlxYjJKelhDSWdjbVZzUFZ3aWJtOW1iMnhzYjNkY0lpQjBZWEpuWlhROVhDSmZZbXhoYm10Y0lqNTNkM2N1YzI5c1lYSmphWFI1TG1OdmJTOXFiMkp6UEM5aFBnPT18]]. New Hampshire homeowners interested in SolarCity's services may visit SolarCity online at [[UEdFZ2NtVnNQVndpYm05bWIyeHNiM2RjSWlCdmJtTnNhV05yUFNkc2FXNXJUMjVEYkdsamF5aDBhR2x6S1NjZ2FISmxaajFjSW1oMGRIQTZMeTkzZDNjdWMyOXNZWEpqYVhSNUxtTnZiUzl5WlhOcFpHVnVkR2xoYkM5emRHRjBaWE12Ym1WM0xXaGhiWEJ6YUdseVpTMXpiMnhoY2x3aUlISmxiRDFjSW01dlptOXNiRzkzWENJZ2RHRnlaMlYwUFZ3aVgySnNZVzVyWENJK2FIUjBjRG92TDNkM2R5NXpiMnhoY21OcGRIa3VZMjl0TDNKbGMybGtaVzUwYVdGc0wzTjBZWFJsY3k5dVpYY3RhR0Z0Y0hOb2FYSmxMWE52YkdGeVBDOWhQZz09fA==]] or contact the company directly at 1-888-SOL -CITY (1-888-765-2489) for a free, no-obligation solar consultation. About SolarCity SolarCity® (NASDAQ: SCTY ) provides clean energy. The company has disrupted the century-old energy industry by providing renewable electricity directly to homeowners, businesses and government organizations for less than they spend on utility bills. SolarCity gives customers control of their energy costs to protect them from rising rates. The company makes solar energy easy by taking care of everything from design and permitting to monitoring and maintenance. SolarCity currently serves 19 states. Visit the company online at www.solarcity.com and follow the company on Facebook & Twitter . SolarCity is an Equal Opportunity / Affirmative Action employer committed to diversity in the workplace. All qualified applicants will receive consideration for employment without regard to race, color, religion, sex, sexual orientation, national origin, disability, protected veteran status, gender identity or any other factor protected by applicable federal, state or local laws. This release contains forward-looking statements including, but not limited to, statements regarding future hiring and company expansion, and customer cost savings. Forward-looking statements should not be read as a guarantee of future performance or results, and will not necessarily be accurate indications of the times at, or by, which such performance or results will be achieved, if at all. Forward-looking statements are subject to risks and uncertainties that could cause actual performance or results to differ materially from those expressed in or suggested by the forward looking statements. You should read the section entitled \"Risk Factors\" in SolarCity's most recent quarterly report on Form 10-Q, which has been filed with the Securities and Exchange Commission and identifies certain of these and additional risks and uncertainties. We do not undertake any obligation to publicly update or revise any forward-looking statement, whether as a result of new information, future developments or otherwise.", "external_links": [], "published": "2015-09-10T02:22:00.000+03:00", "crawled": "2015-09-10T02:10:11.216+03:00", "highlightTitle": ""}