{"organizations": ["KFDA", "Amtrak", "Legislature", "Nevada Supreme Court", "Amarillo News", "British Airways", "Telenor", "TeliaSonera", "Freddie Gray"], "uuid": "1802e71d545b903f1ef3c0a11a30737ad8960949", "thread": {"social": {"gplus": {"shares": 0}, "pinterest": {"shares": 0}, "vk": {"shares": 0}, "linkedin": {"shares": 0}, "facebook": {"likes": 0, "shares": 0, "comments": 0}, "stumbledupon": {"shares": 0}}, "site_full": "www.newschannel10.com", "main_image": "", "site_section": "http://www.newschannel10.com/category/58532/technology?clienttype=rss", "section_title": "KFDA - Technology", "url": "http://www.newschannel10.com/story/30007718/teliasonera-telenor-scrap-merger-of-danish-units", "country": "US", "title": "TeliaSonera, Telenor scrap merger of Danish units", "performance_score": 0, "site": "newschannel10.com", "participants_count": 0, "title_full": "TeliaSonera, Telenor scrap merger of Danish units", "spam_score": 0.0, "site_type": "news", "published": "2015-09-11T12:53:00.000+03:00", "replies_count": 0, "uuid": "1802e71d545b903f1ef3c0a11a30737ad8960949"}, "author": "", "url": "http://www.newschannel10.com/story/30007718/teliasonera-telenor-scrap-merger-of-danish-units", "ord_in_thread": 0, "title": "TeliaSonera, Telenor scrap merger of Danish units", "locations": ["Las Vegas", "Baltimore", "Minnesota", "Sacramento", "Seattle", "South Carolina", "Europe", "Michigan", "Minneapolis"], "entities": {"persons": [], "locations": [], "organizations": []}, "highlightText": "", "language": "english", "persons": ["O.J. Simpson", "Simpson"], "text": "TeliaSonera, Telenor scrap merger of Danish units - KFDA - NewsChannel 10 / Amarillo News, Weather, Sports Member Center: Police: 5 family members found dead in Minnesota home Five family members, including three children, were found dead in their lakeside home in an upscale western Minneapolis suburb in what police said appeared to be a murder-suicide. Five family members, including three children, were found dead in their lakeside home in an upscale western Minneapolis suburb in what police said appeared to be a murder-suicide. 1 lawmaker expelled, another resigns after affair cover-up One of two socially conservative Michigan lawmakers embroiled in scandal over their extramarital affair and a cover-up attempt resigned early Friday morning rather than be expelled by his colleagues. One socially conservative Michigan lawmaker was expelled from office and another resigned early Friday after they rocked the Legislature with an extramarital affair and a botched attempt to conceal it with a fictional,... Officer who fatally shot man after traffic stop seeking bond A lawyer for a South Carolina police officer charged with murder after he was captured on video shooting a fleeing man in the back is trying to change the public's perception of what happened. A lawyer for a South Carolina police officer charged with murder after he was captured on video shooting a fleeing man in the back is trying to change the public's perception of what happened. Jet engine parts on Las Vegas runway indicate major failure Jet engine parts found on the Las Vegas runway where a British Airways flight aborted takeoff as the engine burst into flames indicate a rare catastrophic failure, experts said as investigators released preliminary... Jet engine parts found on the Las Vegas runway where a British Airways flight aborted takeoff as the engine burst into flames indicate a rare catastrophic failure, experts said as investigators released preliminary... Sacramento throws parade for heroes from French train attack Sacramento is set to celebrate three hometown heroes who foiled an attack on a train in Europe. Sacramento on Friday is set to celebrate three hometown heroes who foiled an attack on a European train with a parade down the Capitol Mall. Truck owner: Site of Amtrak crash known to be dangerous The owner of the company whose tractor-trailer was hit by an Amtrak train, splitting the trailer in two, said the intersection where the crash happened was a dangerous one on a route the driver took several times a... The owner of the company whose tractor-trailer was hit by an Amtrak train, splitting the trailer in two, said the intersection where the crash happened was a dangerous one on a route the driver took several times a day. Seattle teachers to stay off picket line on 9/11 anniversary Seattle teachers striking over wages planned to put down their picket signs Friday and instead work on community service projects like food drives in commemoration of the 9/11 terror attacks. Seattle teachers striking over wages planned to put down their picket signs Friday and instead work on community service projects like food drives in commemoration of the 9/11 terror attacks. Judge leaves door open to reconsider Freddie Gray trials A judge ruled that six police officers charged in the death of Freddie Gray will be tried in Baltimore, but this could be just the beginning of defense attorneys' efforts to move their trials out of town. A judge ruled that six police officers charged in the death of Freddie Gray will be tried in Baltimore, but this could be just the beginning of defense attorneys' efforts to move their trials out of town. Police body cameras may solve one problem but create others The use of police body cameras is spreading to keep officers honest about using force against citizens. But how and when the public gets to see the footage is up for debate. The use of police body cameras is spreading to keep officers honest about using force against citizens. But how and when the public gets to see the footage is up for debate. OJ Simpson appeal rejected by Nevada Supreme Court Imprisoned former football star O.J. Simpson has lost his latest appeal of his 2008 kidnapping and armed robbery conviction in Las Vegas. Imprisoned former football star O.J. Simpson lost his latest appeal of his 2008 kidnapping and armed robbery conviction in Las Vegas.", "external_links": [], "published": "2015-09-11T12:53:00.000+03:00", "crawled": "2015-09-11T14:52:26.386+03:00", "highlightTitle": ""}