{"organizations": ["Lincoln Counties", "James Canada, President of Alliance Technologies", "Alliance Technologies LLC", "About Alliance Technologies Alliance Technologies", "St. Louis Acquires Metro IT Solutions Metro", "Alliance Technologies", "Alliance", "St. Louis Acquires Metro IT Solutions Alliance Technologies LLC", "Metro IT Solutions"], "uuid": "593621e6ff1d7343c9434cc5a02f40697bd3ad97", "thread": {"social": {"gplus": {"shares": 0}, "pinterest": {"shares": 0}, "vk": {"shares": 0}, "linkedin": {"shares": 0}, "facebook": {"likes": 0, "shares": 0, "comments": 0}, "stumbledupon": {"shares": 0}}, "site_full": "www.24-7pressrelease.com", "main_image": "http://www.24-7pressrelease.com/images/icon-247pressrelease.jpg", "site_section": "http://rss.24-7pressrelease.com/rss/technology_information.xml", "section_title": "Press Release and Top Technology   Information News From 24-7 Press Release Newswire", "url": "http://www.24-7pressrelease.com/press-release/alliance-technologies-llc-in-st-louis-acquires-metro-it-solutions-412923.php", "country": "US", "title": "Alliance Technologies LLC in St. Louis Acquires Metro IT Solutions", "performance_score": 0, "site": "24-7pressrelease.com", "participants_count": 0, "title_full": "Alliance Technologies LLC in St. Louis Acquires Metro IT Solutions", "spam_score": 0.0, "site_type": "news", "published": "2015-09-19T10:00:00.000+03:00", "replies_count": 0, "uuid": "593621e6ff1d7343c9434cc5a02f40697bd3ad97"}, "author": "", "url": "http://www.24-7pressrelease.com/press-release/alliance-technologies-llc-in-st-louis-acquires-metro-it-solutions-412923.php", "ord_in_thread": 0, "title": "Alliance Technologies LLC in St. Louis Acquires Metro IT Solutions", "locations": ["St. Charles County", "Lake St. Louis", "Canada", "St. Charles", "Lincoln County", "St. Louis Region", "St. Louis", "MO", "ST. LOUIS", "Eastern Missouri"], "entities": {"persons": [], "locations": [], "organizations": []}, "highlightText": "", "language": "english", "persons": ["Christopher DeLaquil", "MO", "Chris", "DeLaquil"], "text": "Alliance Technologies LLC in St. Louis Acquires Metro IT Solutions Metro IT acquisition will increase Alliance's footprint in St. Charles County, Lincoln County and Eastern Missouri. ST. LOUIS, MO, September 19,   Alliance Technologies, LLC. announces they have acquired Metro IT Solutions, an IT firm based in Lake St. Louis, MO. The acquisition adds dozens of clients to Alliance's customer base as the firm continues its expansion throughout the St. Louis Region and Eastern Missouri. Christopher DeLaquil, former owner of Metro IT Solutions, will join Alliance Technologies and serve as the firm's new Director of Client Services. DeLaquil will assist clients with IT management and support the client's core business strategy. \"Metro IT Solutions and Chris have an outstanding reputation working with businesses throughout the St. Louis area, especially in the western suburbs,\" said James Canada, President of Alliance Technologies, LLC. \"They have provided IT services for over 11 years to a large number of clients. This acquisition enables Alliance to continue our growth in St. Charles and Lincoln Counties, providing a variety of IT and Managed Services with a high level of expertise to local companies.\" Canada added that he is excited DeLaquil has joined the Alliance team. DeLaquil brings some 30 years of experience as a consultant, computer programmer and IT expert to the firm. About Alliance Technologies Alliance Technologies is an IT firm committed to providing world-class managed services, network solutions, staff augmentation and consulting solutions. They stand committed to providing quality processes, delivering high caliber customized solutions, presenting consultants with extensive professional experience, and empowering their consultants to provide the best service possible. With their Managed Services approach there are no complex formulas; instead they use a simple pay per use formula to keep the cost to your business predictable. Alliance Technologies understands their clients need to maintain a predictable IT cost structure. Their managed services approach allows your business to focus on driving revenue rather than managing technology. Alliance Technologies works to develop strong individual relationships with key decision makers in an effort to foster long-term partnerships and build continued confidence. The goal is to provide a solid return on investment for their clients and to deliver value at every turn. For additional information visit http://www.alliancetechnologiesllc.com or call 314-219-7887. # # # Read more Press Releases from Steve Turner:", "external_links": [], "published": "2015-09-19T10:00:00.000+03:00", "crawled": "2015-09-20T02:10:41.700+03:00", "highlightTitle": ""}