{"organizations": ["Accelerate Economic Value of Hadoop Attunity Introduces Unique Big Data Management Solution", "Attunity Ltd.", "SEC", "Federal Securities", "Microsoft", "CMO", "Facebook", "Hortonworks Data Platform", "VAR", "IBM", "Attunity Inc", "Accelerate Economic Value of Hadoop", "Attunity Google Cardboard", "Attunity See Attunity", "Javitz Convention Center", "Securities and Exchange Commission"], "uuid": "9275e3e014d24bda1f08c9ba2c92b74e4f82c148", "thread": {"social": {"gplus": {"shares": 0}, "pinterest": {"shares": 0}, "vk": {"shares": 0}, "linkedin": {"shares": 0}, "facebook": {"likes": 0, "shares": 0, "comments": 0}, "stumbledupon": {"shares": 0}}, "site_full": "science-technology.news-articles.net", "main_image": "", "site_section": "http://science-technology.news-articles.net/content/rss.php", "section_title": "Science and Technology @ News Articles Network", "url": "http://science-technology.news-articles.net/content/attunity-introduces-unique-big-data-management-solution-accelerate-economic-value-hadoop.xhtml", "country": "US", "title": "Attunity Introduces Unique Big Data Management Solution to Accelerate Economic Value of Hadoop", "performance_score": 0, "site": "news-articles.net", "participants_count": 0, "title_full": "Attunity Introduces Unique Big Data Management Solution to Accelerate Economic Value of Hadoop", "spam_score": 0.0, "site_type": "news", "published": "2015-09-29T15:06:00.000+03:00", "replies_count": 0, "uuid": "9275e3e014d24bda1f08c9ba2c92b74e4f82c148"}, "author": "", "url": "http://science-technology.news-articles.net/content/attunity-introduces-unique-big-data-management-solution-accelerate-economic-value-hadoop.xhtml", "ord_in_thread": 0, "title": "Attunity Introduces Unique Big Data Management Solution to Accelerate Economic Value of Hadoop", "locations": ["North America", "New York", "NY", "Massachusetts", "BURLINGTON", "Hortonworks", "ATTU", "Europe", "Boston", "Asia Pacific"], "entities": {"persons": [], "locations": [], "organizations": []}, "highlightText": "", "language": "english", "persons": ["Matt Morgan", "Hadoop", "Lawrence Schwartz", "Javitz", "Rodan Zadeh"], "text": "Attunity Introduces Unique Big Data Management Solution to Accelerate Economic Value of Hadoop  29 04:46:20 Attunity Introduces Unique Big Data Management Solution to Accelerate Economic Value of... -- BURLINGTON, Massachusetts, September 29, 2015 /PRNewswire/ -- <-   BURLINGTON, Massachusetts , September 29, 2015 /PRNewswire/ -- Attunity Ltd. (NASDAQ: ATTU ), a leading provider of data management software solutions, announced today the release of Attunity Visibility 7.0 , the software's latest edition and the only Big Data Management solution to provide intelligence for scaling Hadoop deployments and aligning them with business needs. Designed to help enterprises accelerate the economic value of Hadoop, Attunity Visibility 7.0 offers a broad range of enterprise data usage analytics and monitoring across enterprise data warehouses and Hadoop. The new Attunity solution will be demonstrated live at Strata + Hadoop World, in Booth 246 and in the Cloudera Partner Pavilion, from September 29 - October 1 at the Javitz Convention Center in New York, NY . Due to the complexity of the IT environment and growing demands from business users, data management is often difficult for IT teams to deliver with performance improvements in a timely manner at a reasonable cost. With this release, Attunity Visibility 7.0 is the only solution to provide consolidated insight into business activity, data usage and workloads across both Hadoop and all the leading Enterprise Data Warehouse (EDW) platforms, via a single console. Enabling enterprises to adopt and scale out Hadoop securely, intelligently and strategically in a cross-platform Big Data environment, Attunity Visibility 7.0 also optimizes, monitors and enables the modernization of an EDW and Hadoop environment by showing where data and workloads should optimally reside. \"We are pleased to see such a rapid adoption of the Hortonworks Data Platform by enterprises worldwide,\" said Matt Morgan , vice president, product and alliance marketing at Hortonworks . \"A growing part of that success is attributable to our valued partner, Attunity, who will continue to work with us to that end as we empower enterprises to gain faster value and ROI from Hadoop. We look forward to helping many more customers via our joint solutions to meet their Big Data analytics goals.\" \"The release of Attunity Visibility 7.0 is exciting because it empowers enterprises to provide detailed data usage analytics and monitoring across Hadoop and various platforms, to support charge-back/show back capabilities and increase enterprise optimization,\" explained Lawrence Schwartz , CMO at Attunity . \"Moreover, Attunity Visibility helps organizations worldwide by helping them to prioritize investments and make more informed decisions right from the start.\" Learn more: Visit Attunity booth #246 or in the Cloudera Partner Pavilion #K19 at Strata + Hadoop 2015 View a demo of Visibility 7.0 Earn a chance to win an Attunity Google Cardboard - and other fun prizes Attend Attunity's Session in the Vendor Showcase on Wednesday, September 30 th - 5:30pm 5 Tips for Enhancing Your Data Architecture with Hadoop Presented by: Rodan Zadeh , Director of Product Management, Attunity See Attunity's CMO, Lawrence Schwartz , live on Wikibon's TheCube video on Wednesday, September 30 at 10:30am ET at Pillar 37, 517 W 37th St in NY (near the Javitz) Visit http://www.attunity.com/stratany15 About Attunity Attunity is a leading provider of data management software solutions that enable access, management, sharing and distribution of data, including Big Data, across heterogeneous enterprise platforms, organizations, and the cloud . Our software solutions include data replication , data flow management , test data management , change data capture (CDC), data connectivity , enterprise file replication (EFR), managed file transfer (MFT), data warehouse automation , data usage analytics , and cloud data delivery . Attunity has supplied innovative software solutions to its enterprise-class customers for over 20 years and has successful deployments at thousands of organizations worldwide. Attunity provides software directly and indirectly through a number of partners such as Microsoft, Oracle, IBM and HP. Headquartered in Boston, Attunity serves its customers via offices in North America, Europe, and Asia Pacific and through a network of local partners. For more information, visit http://www.attunity.com or our In Tune blog and join our community on Twitter , Facebook , LinkedIn and YouTube . Safe Harbor Statement This press release contains forward-looking statements, including statements regarding the anticipated features and benefits of Replicate Solutions, within the meaning of the \"safe harbor\" provisions of the Private Securities Litigation Reform Act of 1995 and other Federal Securities laws. Statements preceded by , followed by, or that otherwise include the words \"believes\", \"expects\", \"anticipates\", \"intends\", \"estimates\", \"plans\", and similar expressions or future or conditional verbs such as \"will\", \"should\", \"would\", \"may\" and \"could\" are generally forward-looking in nature and not historical facts. Because such statements deal with future events, they are subject to various risks and uncertainties and actual results, expressed or implied by such forward-looking statements, could differ materially from Attunity's current expectations. Factors that could cause or contribute to such differences include, but are not limited to: our reliance on strategic relationships with our distributors, OEM and VAR partners, and on our other significant customers; risks and uncertainties relating to acquisitions, including costs and difficulties related to integration of acquired businesses; timely availability and customer acceptance of Attunity's new and existing products, including Attunity Maestro; changes in the competitive landscape, including new competitors or the impact of competitive pricing and products; a shift in demand for products such as Attunity's products; the impact on revenues of economic and political uncertainties and weaknesses in various regions of the world, including the commencement or escalation of hostilities or acts of terrorism; and other factors and risks on which Attunity may have little or no control. This list is intended to identify only certain of the principal factors that could cause actual results to differ. For a more detailed description of the risks and uncertainties affecting Attunity, reference is made to Attunity's latest Annual Report on Form 20-F which is on file with the Securities and Exchange Commission (SEC) and the other risk factors discussed from time to time by Attunity in reports filed with, or furnished to, the SEC. Except as otherwise required by law, Attunity undertakes no obligation to publicly release any revisions to these forward-looking statements to reflect events or circumstances after the date hereof or to reflect the occurrence of unanticipated events. Â© Attunity 2015. All Rights Reserved. Attunity is a registered trademark of Attunity Inc. All other product and company names herein may be trademarks of their respective owners. Press contact:", "external_links": [], "published": "2015-09-29T15:06:00.000+03:00", "crawled": "2015-09-29T14:52:32.929+03:00", "highlightTitle": ""}