{"organizations": ["Marine", "National Marine Fisheries Service Permit", "Southwest Fisheries Science Center", "Deutsche Post", "Merseyside Police", "FAA", "Erwin Wilder Wildlife Management Area", "Wallops Flight Facility", "Box Elder County Sheriff's Office", "University of California", "NASA", "NMFS", "NOAA", "Next New Homes Group", "Amazon", "Federal Aviation Administration", "National Oceanic and Atmospheric Administration"], "uuid": "7228cb3405a982829ca31c238f09141d474d5949", "thread": {"social": {"gplus": {"shares": 0}, "pinterest": {"shares": 0}, "vk": {"shares": 0}, "linkedin": {"shares": 0}, "facebook": {"likes": 0, "shares": 0, "comments": 0}, "stumbledupon": {"shares": 0}}, "site_full": "edition.cnn.com", "main_image": "http://i2.cdn.turner.com/cnnnext/dam/assets/140610175818-12-drones-t3-entertainment.jpg", "site_section": "http://rss.cnn.com/rss/cnn_tech.rss", "section_title": "CNN.com - Technology", "url": "http://edition.cnn.com/2015/09/09/opinions/schneier-shoot-down-drones/index.html?eref=rss_tech", "country": "US", "title": "Is it OK to shoot down a drone over your backyard?", "performance_score": 0, "site": "cnn.com", "participants_count": 0, "title_full": "Is it OK to shoot down a drone over your backyard?", "spam_score": 0.0, "site_type": "news", "published": "2015-09-09T20:45:00.000+03:00", "replies_count": 0, "uuid": "7228cb3405a982829ca31c238f09141d474d5949"}, "author": "", "url": "http://edition.cnn.com/2015/09/09/opinions/schneier-shoot-down-drones/index.html?eref=rss_tech", "ord_in_thread": 0, "title": "Is it OK to shoot down a drone over your backyard?", "locations": ["United States", "Brigham City", "England", "Prudhoe Bay", "Afghanistan", "Norton", "Arbuckle", "India", "California", "Sacramento", "Massachusetts", "Baqwa", "New England", "Liverpool", "Peru", "San Jose de Moro", "Virginia", "Krasnaya Polyana", "Nuernberg", "U.S.", "Jaipur", "Wallops Island", "Bonn", "Alaska", "Utah", "Russia", "Norway", "Germany"], "entities": {"persons": [], "locations": [], "organizations": []}, "highlightText": "", "language": "english", "persons": ["John Durban", "Michael Moore", "Davis", "Gary Hebert", "Nicholas Bender", "Aleksander Aurdal", "Christopher Brown", "Bruce Schneier", "Derek Charlton", "Luis Jaime Castillo"], "text": "  Is it OK to shoot down a drone over your backyard? By Bruce Schneier Updated 1717 GMT (0017 HKT) September 9, 2015 15 photos: The many uses of drones An MQ-9 Reaper, armed with laser-guided munitions and Hellfire missiles, flies a combat mission over southern Afghanistan. The Reaper has been in use since 2007. Hide Caption 1 of 15 15 photos: The many uses of drones Researchers from the Woods Hole Oceanographic Institution and the National Oceanic and Atmospheric Administration use a hexacopter -- a six-winged camera-loaded drone -- to monitor whales off the coast of New England in July. Acquired under National Marine Fisheries Service Permit 17355-01 and NOAA Class G flight authorization 2015-ESA-4-NOAA; Photo by John Durban, Southwest Fisheries Science Center, NMFS, NOAA; and Michael Moore, Woods Hole Oceanographic Institution. Hide Caption 2 of 15 15 photos: The many uses of drones An AeroVironment Puma drone undergoes pre-flight tests in Prudhoe Bay, Alaska, on June 7, 2014. The drone will be used to survey roads, pipelines and other equipment at the largest oil field in the United States. The Federal Aviation Administration authorized BP to conduct the first-ever commercial drone flights over land. Hide Caption 3 of 15 15 photos: The many uses of drones A drone camera follows Norway's Aleksander Aurdal during the men's slopestyle finals at the 2014 Winter Olympics in Krasnaya Polyana, Russia. Hide Caption 4 of 15 15 photos: The many uses of drones Members of the Box Elder County Sheriff's Office fly their search-and-rescue drone during a demonstration in Brigham City, Utah, on February 13, 2014. Gov. Gary Hebert has approved the state's first drone restrictions, setting new limits on law enforcement's use of the technology. Hide Caption 5 of 15 15 photos: The many uses of drones Christopher Brown of the Next New Homes Group uses a drone to take aerial video of a home in Sacramento, California, on February 25, 2014. Drones are increasingly being used by small companies to shoot promotional videos. Hide Caption 6 of 15 15 photos: The many uses of drones A researcher at the University of California, Davis, removes sprayer containers from a drone after a crop dusting test flight in Arbuckle, California, on February 5, 2014. UC Davis is testing the use of unmanned helicopters for agriculture. The FAA does not currently allow pesticide spraying from drones in the United States. Hide Caption 7 of 15 15 photos: The many uses of drones A drone delivers medicine from a nearby pharmacy to the Deutsche Post headquarters in Bonn, Germany, on December 9, 2013. The company was testing the viability of using drones to deliver small packages over short distances. Online retailer Amazon has also announced plans to start using unmanned flying vehicles. Hide Caption 8 of 15 15 photos: The many uses of drones A drone designed to capture footage of illegal hunting activities lands after taking footage at Erwin Wilder Wildlife Management Area in Norton, Massachusetts, on October 21, 2013. Hide Caption 9 of 15 15 photos: The many uses of drones A NASA Global Hawk drone sits in an airplane hangar during a Hurricane and Severe Storm Sentinel, or HS3, mission at NASA's Wallops Flight Facility in Wallops Island, Virginia, on September 10, 2013. The HS3 mission uses two of the unmanned aircraft to fly over tropical storms and hurricanes to monitor weather conditions. Hide Caption 10 of 15 15 photos: The many uses of drones Luis Jaime Castillo, a Peruvian archaeologist, uses a drone to take pictures of the archaeological site of San Jose de Moro in Trujillo on July 18, 2013. In Peru, home to Machu Picchu and thousands of ancient ruins, archaeologists are turning to drones to speed up sluggish survey work and protect sites from squatters, builders and miners. Hide Caption 11 of 15 15 photos: The many uses of drones A drone fitted with a film camera shoots aerial footage during the production of the film \"The Girl with the Indian Emerald\" in Jaipur, India, on November 7, 2012. While it's already being done in other countries, the U.S. government is considering a request from movie and TV producers to let them use unmanned aircraft to shoot aerial video. Hide Caption 12 of 15 15 photos: The many uses of drones A man controls an Parrot AR Drone with an iPad during the press preview day of the International Toy Fair in Nuernberg, Germany, on February 2, 2011. Hide Caption 13 of 15 15 photos: The many uses of drones Derek Charlton of the Merseyside Police operates the department's new aerial surveillance drone in Liverpool, England, on May 21, 2007. Hide Caption 14 of 15 15 photos: The many uses of drones U.S. Marine Sgt. Nicholas Bender launches a Raven surveillance drone from Marine base near the remote village of Baqwa, Afghanistan, on March 21, 2009. Marines use the unmanned aerial vehicles to get real-time intelligence on Taliban movements. Hide Caption", "external_links": [], "published": "2015-09-09T20:45:00.000+03:00", "crawled": "2015-09-09T21:32:17.497+03:00", "highlightTitle": ""}