{"organizations": ["RAM", "Bill Graham Civic Auditorium", "Apple", "Computer Industry Apple", "Macworld", "Google", "Technology Apple"], "uuid": "fd3449090907daab381549c8597994148eef7a86", "thread": {"social": {"gplus": {"shares": 0}, "pinterest": {"shares": 0}, "vk": {"shares": 0}, "linkedin": {"shares": 0}, "facebook": {"likes": 0, "shares": 0, "comments": 0}, "stumbledupon": {"shares": 0}}, "site_full": "www.onenewspage.com", "main_image": "http://cdn.newsserve.net/ONPglobe256.jpg", "site_section": "http://www.onenewspage.com/rss/latest/Technology.rss", "section_title": "Latest Technology News on One News Page", "url": "http://www.onenewspage.com/n/Technology/755899mgt/Apple-new-iPhone-6s-has-GB.htm", "country": "US", "title": "Apple's new iPhone 6s has 2 GB of RAM, iPad Pro gets 4 GB", "performance_score": 0, "site": "onenewspage.com", "participants_count": 0, "title_full": "Apple's new iPhone 6s has 2 GB of RAM, iPad Pro gets 4 GB", "spam_score": 0.0, "site_type": "news", "published": "2015-09-14T12:55:00.000+03:00", "replies_count": 0, "uuid": "fd3449090907daab381549c8597994148eef7a86"}, "author": "", "url": "http://www.onenewspage.com/n/Technology/755899mgt/Apple-new-iPhone-6s-has-GB.htm", "ord_in_thread": 0, "title": "Apple's new iPhone 6s has 2 GB of RAM, iPad Pro gets 4 GB", "locations": ["California", "San Francisco"], "entities": {"persons": [], "locations": [], "organizations": []}, "highlightText": "", "language": "english", "persons": ["Mikey", "Glenn", "Susie", "John Moltz", "Tim Cook", "Neil"], "text": "Apple's new iPhone 6s has 2 GB of RAM, iPad Pro gets 4 GB Monday, 14 September 2015 (15 minutes ago) Apple does not like to dive much into the technical side of things when it talks about how its new products perform. So, when it unveiled the new iPhone 6s, iPhone 6s Plus last week, Apple focused on how its processor stacks up against the previous generation instead of detailing its clock speed, number of cores, manufacturing process or even how much RAM is inside. The new iPad Pro was no exception. Those things are important, of course, but they do not mean much to the average consumer, who likely has no idea what RAM actually is or whether a 1.3 GHz dual-core… [Continue Reading] Apple just dropped a slew of new gadgets: Two new iPhones, a voice-controlled Apple TV, the biggest iPad ever — and a pencil. Recent related news It was a huge week in the Apple-verse, with Wednesday’s special event packing in the new iPhones, the powerful iPad Pro, and the brand-new Apple TV. There was... Macworld 2 days ago - Computer Industry “Stole” is a too strong word, but that’s what fans have been saying: Apple stole these features from Google, and vice-versa. That’s especially true in... Boy Genius Report 3 days ago - Technology Apple's biggest week of the year gets analyzed on the latest AppleInsider podcast, as Mikey and Neil share their thoughts on the newly announced iPhone 6s with... AppleInsider 3 days ago - Computer Industry Another day of California heat is met by some red hot new items from the folks at Apple. Tim Cook's September 9th presentation came like Christmas, giving the... Asylum 4 days ago - Lifestyle There are two things that Apple will never tell you when it comes to its iOS devices, and that’s how much memory an iPhone or iPad has, and what size the... Boy Genius Report 4 days ago - Technology Apple announced a passel of new products and updates today, and while Susie is busy editing, Glenn tapped John Moltz, a Macworld senior contributor and... Macworld 4 days ago - Computer Industry Apple was on stage at the Bill Graham Civic Auditorium in San Francisco today to announce several new products, including the iPhone 6s and iPhone 6s Plus, iPad... MacRumours.com 4 days ago - Computer Industry Apple unveiled its new, very large iPad Pro at its big event on Wednesday and the device pretty much stole the show. The new iPad basically has the same... Business Insider 4 days ago - Business You Might Like", "external_links": [], "published": "2015-09-14T12:55:00.000+03:00", "crawled": "2015-09-14T13:06:48.158+03:00", "highlightTitle": ""}