{"organizations": ["Best", "Guildwood Junior Public School", "Best Buy Canada Ian Evans"], "uuid": "7c5aa06f86d0198d040706eb0daa257f8d847802", "thread": {"social": {"gplus": {"shares": 0}, "pinterest": {"shares": 0}, "vk": {"shares": 0}, "linkedin": {"shares": 0}, "facebook": {"likes": 0, "shares": 0, "comments": 0}, "stumbledupon": {"shares": 0}}, "site_full": "www.newswire.ca", "main_image": "http://photos.newswire.ca/images/20150916_C6995_PHOTO_EN_498704.jpg", "site_section": "http://www.newswire.ca/rss/business-technology/all-business-technology-news.rss", "section_title": "CNW :  Business Technology", "url": "http://www.newswire.ca/news-releases/best-buy-canada-together-with-actor-and-comedian-gerry-dee-surprise-and-dee-light-guildwood-junior-public-school-with-brand-new-technology-as-part-of-their-ongoing-school-tech-grants-program-527891251.html", "country": "US", "title": "Best Buy Canada, together with actor and comedian Gerry Dee, surprise and \"Dee-light\" Guildwood Junior Public School with brand new technology as part of their ongoing School Tech Grants program", "performance_score": 0, "site": "newswire.ca", "participants_count": 0, "title_full": "Best Buy Canada, together with actor and comedian Gerry Dee, surprise and \"Dee-light\" Guildwood Junior Public School with brand new technology as part of their ongoing School Tech Grants program", "spam_score": 0.0, "site_type": "news", "published": "2015-09-16T20:03:00.000+03:00", "replies_count": 0, "uuid": "7c5aa06f86d0198d040706eb0daa257f8d847802"}, "author": "", "url": "http://www.newswire.ca/news-releases/best-buy-canada-together-with-actor-and-comedian-gerry-dee-surprise-and-dee-light-guildwood-junior-public-school-with-brand-new-technology-as-part-of-their-ongoing-school-tech-grants-program-527891251.html", "ord_in_thread": 0, "title": "Best Buy Canada, together with actor and comedian Gerry Dee, surprise and \"Dee-light\" Guildwood Junior Public School with brand new technology as part of their ongoing School Tech Grants program", "locations": ["Canada", "TORONTO"], "entities": {"persons": [], "locations": [], "organizations": []}, "highlightText": "", "language": "english", "persons": ["ComedianEckleton Richards", "Elliott Chun", "Sanjeev Chandna", "Ian Evans", "Eckleton Richards", "Guildwood", "Gerry Dee"], "text": "Pinterest Ã— Best Buy Canada together with actor and comedian Gerry Dee surprise 'Dee-light' Guildwood Junior Public School with all brand new technology, as part of their ongoing School Tech Grants program. This is one example of Best Buy Canada's commitment to supporting youth and education. Pictured with Guildwood students, from left to right are: Elliott Chun, Communications Manager, Best Buy; Ian Evans, Operations Manager, Best Buy Scarborough; Gerry Dee, Actor and Comedian; Eckleton Richards, Principal, Guildwood Junior Public School; ... TORONTO , Sept. 16, 2015 /CNW/ - Best Buy Canada, together with actor and comedian Gerry Dee , surprise and \"Dee-light\" Guildwood Junior Public School with brand new technology as part of their ongoing School Tech Grants program. This is one example of Best Buy Canada's commitment to supporting youth and education. Pictured with Guildwood students, from left to right are: Elliott Chun , Communications Manager, Best Buy Canada Ian Evans , Operations Manager, Best Buy Scarborough Gerry Dee , Actor and ComedianEckleton Richards, Principal, Guildwood Junior Public School Sanjeev Chandna , General Manager, Best Buy Scarborough SOURCE Best Buy Canada \nImage with caption: \"Best Buy Canada together with actor and comedian Gerry Dee surprise 'Dee-light' Guildwood Junior Public School with all brand new technology, as part of their ongoing School Tech Grants program. This is one example of Best Buy Canada's commitment to supporting youth and education. Pictured with Guildwood students, from left to right are: Elliott Chun, Communications Manager, Best Buy; Ian Evans, Operations Manager, Best Buy Scarborough; Gerry Dee, Actor and Comedian; Eckleton Richards, Principal, Guildwood Junior Public School; Sanjeev Chandna, General Manager, Best Buy Scarborough (Photographer: Shan Qiao) (CNW Group/Best Buy Canada)\". Image available at: http://photos.newswire.ca/images/download/20150916_C6995_PHOTO_EN_498704.jpg Release contains wide tables.", "external_links": [], "published": "2015-09-16T20:03:00.000+03:00", "crawled": "2015-09-16T20:07:23.697+03:00", "highlightTitle": ""}