{"organizations": ["Telecom Analytics", "Ezwim B.V.", "The Wireless Association", "MDSL", "TEMIA Thought Leaders Discuss Telecommunications Analytics", "CTIA", "Telecommunications Management and Solutions Providers", "Telecom Expense Management", "Telecommunications Management", "GM Mobility", "Telecom", "Business Analytics", "The Telecom Expense Management Industry Association", "TEMIA Panel Discusses New Ways Enterprises Use Data Analytics", "Best Put Telecom Analytics", "GM", "TEMIA", "Convention Center", "TEMIA TEMIA"], "uuid": "e0e90b67d4cc062e8f8354a9f2a4d8f39bbe94b8", "thread": {"social": {"gplus": {"shares": 0}, "pinterest": {"shares": 0}, "vk": {"shares": 0}, "linkedin": {"shares": 0}, "facebook": {"likes": 0, "shares": 0, "comments": 0}, "stumbledupon": {"shares": 0}}, "site_full": "www.24-7pressrelease.com", "main_image": "http://www.24-7pressrelease.com/attachments/041/press_release_distribution_0412209_93876_1.jpg", "site_section": "http://rss.24-7pressrelease.com/rss/technology_wireless_and_wi-fi.xml", "section_title": "Press Release and Top Technology   Wireless and Wi-Fi News From 24-7 Press Release Newswire", "url": "http://www.24-7pressrelease.com/press-release/temia-thought-leaders-discuss-telecommunications-analytics-at-ctia-super-mobility-2015-412209.php", "country": "US", "title": "TEMIA Thought Leaders Discuss Telecommunications Analytics at CTIA Super Mobility 2015", "performance_score": 0, "site": "24-7pressrelease.com", "participants_count": 0, "title_full": "TEMIA Thought Leaders Discuss Telecommunications Analytics at CTIA Super Mobility 2015", "spam_score": 0.0, "site_type": "news", "published": "2015-09-08T10:00:00.000+03:00", "replies_count": 0, "uuid": "e0e90b67d4cc062e8f8354a9f2a4d8f39bbe94b8"}, "author": "", "url": "http://www.24-7pressrelease.com/press-release/temia-thought-leaders-discuss-telecommunications-analytics-at-ctia-super-mobility-2015-412209.php", "ord_in_thread": 0, "title": "TEMIA Thought Leaders Discuss Telecommunications Analytics at CTIA Super Mobility 2015", "locations": ["North America", "Washington", "Lido", "CA", "WESTLAKE VILLAGE", "D.C."], "entities": {"persons": [], "locations": [], "organizations": []}, "highlightText": "", "language": "english", "persons": ["James Price", "David Sonenstein", "Felix Lau", "Will Nankivell", "Calero", "Ezwim"], "text": "Email This Story Printer Friendly PDF Version RSS Feed TEMIA Thought Leaders Discuss Telecommunications Analytics at CTIA Super Mobility 2015 TEMIA Panel Discusses New Ways Enterprises Use Data Analytics from Telecom to Improve Business Performance, Its Growing Importance, Challenges Collecting Data and Privacy Issues WESTLAKE VILLAGE, CA, September 08,   The Telecom Expense Management Industry Association ( TEMIA ), the authoritative voice for Telecommunications Management and Solutions Providers in related areas will moderate a Thought Leadership Panel at Super Mobility, which is powered by CTIA. TEMIA is inviting all managers and executives at Super Mobility 2015 to attend this session which will examine the question of how to \"Put Telecom Analytics to Work for Your Enterprise\": How Enterprises Can Best Put Telecom Analytics to Work. The panel will begin on September 10 at 11 AM at the Las Vegas Sands Expo and Convention Center on Stage 1 for Security, Privacy, Business Operations. Communications are more critical than ever for all organizations. With mobile devices providing greater processing power and greater adoption of enterprise apps, analytics from telecommunications can be used in new ways to help drive enterprise performance. This panel will provide examples of how analytics from communications usage and other data points are creating opportunities to improve business performance. TEMIA's panel for this session are: - James Price, Chief Operating Officer for ICOMM ( http://icomm.co ) - Will Nankivell, VP, GM Mobility for Calero ( http://www.calero.com ) - Felix Lau, Director of Global Services for MDSL ( http://www.mdsl.com ) - David Sonenstein, Sales Director - North America for Ezwim B.V. ( http://www.ezwim.com ) Will Nankivell, VP, GM Mobility, for Calero said, \"Analytics is one of the more critical issues in communications management especially when optimizing vendors and planning for the future. The answers are changing fast and now the questions even faster. Businesses demand actionable intelligence. Our panel will explore some of the critical conversations around Business Analytics and I look forward to the discussion.\" James Price, Chief Operating Officer for ICOMM said, \"As enterprise adoption of mobile technologies and converged communications systems grows, understanding how your users are using these technologies, what those technologies cost, what their value proposition is, how you are doing regarding supporting those technologies, and understanding the best practices behind all those items is vital. TEM Business Intelligence provides the necessary data points, allowing IT executives to proactively respond to business needs in a fully connected world.\" David Sonenstein, North America Director of Sales, for Ezwim said, \"While viewing aggregated analytics can make a telecom analyst feel like Nemo reading The Matrix , today's technology is proving that you do not need to be a superhero to find real patterns in the chaos of telecom usage and spend to deliver superhuman results to enterprise bottom lines.\" Felix Lau, Director of Global Services for MDSL said, \"Communications are more critical than ever for all organizations. With mobile devices providing greater processing power and greater adoption of enterprise apps analytics from telecommunications is more important. This panel will explore how analytics from communications usage and other data points are creating opportunities to improve business performance.\" TEMIA's thought leader panel and its members are positioned well to address best practices, performance metrics, open industry standards, and Key Performance Indicators (KPIs), drawing on experiences from managing over $61 billion in telecom expenses on behalf of clients. TEMIA will host 80 + members and invited guests on September 8, at the Las Vegas Sands Expo and Convention Center in Lido room 3101-3102, a dinner and moderate two Thought Leader panels at CTIA Super Mobility 2015. For more information about TEMIA, visit http://www.temia.org . CTIA Super Mobility 2015, is one of the Western Hemisphere's largest and most influential forums focused on mobile innovation. It will bring 35,000 + professionals across the new mobile landscape to discuss and learn what is driving and enabling the connected life. TEMIA members will meet on September 8, at the Las Vegas Sands Expo and Convention Center in Lido room 3101-3102, host a dinner for its members and moderate two Thought Leader panels. About TEMIA TEMIA's ongoing mission is to raise awareness, to improve the quality and value of solutions and to cultivate shared industry knowledge for Telecommunications Management, Telecom Expense Management, TEM, Wireless Expense Management WEM, Mobile Device Management MDM MMS and EMM solutions. TEMIA seeks to do this through the development and promotion of open industry standards, and industry knowledge among solutions providers, business partners, telecom service providers, and enterprise clients. Further, TEMIA members subscribe to a Code of Ethics, which clearly differentiates their level of commitment to their clients. For more information about TEMIA, visit http://www.temia.org . About CTIA Super Mobility 2015 CTIA Super Mobility 2015, on September 9, 10 and 11 is one of the Western Hemisphere's largest and most influential forums focused on mobile innovation. Powered by CTIA--The Wireless Association, this springboard event brings together 35,000+ professionals from across the new mobile landscape to experience the bleeding-edge technology that's driving and enabling the connected life. It will feature a comprehensive presentation of what's new--and what's next--in the fast-moving world of mobile. MobileCON-- a premier feature of CTIA Super Mobility 2015 features IT specific exhibits, programming, networking activities and Q&A opportunities--all designed to address the challenges and opportunities that arise on IT's cutting edge. About CTIA CTIA-The Wireless Association ( www.ctia.org ) is an international organization representing the wireless communications industry. Membership in the association includes wireless carriers and their suppliers, as well as providers and manufacturers of wireless data services and products. CTIA advocates on behalf of its members at all levels of government. The association also coordinates the industry's voluntary best practices and initiatives, and sponsors the industry's leading wireless tradeshows. CTIA was founded in 1984 and is based in Washington, D.C.", "external_links": [], "published": "2015-09-08T10:00:00.000+03:00", "crawled": "2015-09-08T10:07:44.453+03:00", "highlightTitle": ""}