{"organizations": ["KFDA", "Legislature", "Chevrolet Tahoe", "Amarillo News", "Seattle Public Schools", "Temple University"], "uuid": "6d3c1ea0ad25af69b72b6b05f7bd91ad50c94042", "thread": {"social": {"gplus": {"shares": 0}, "pinterest": {"shares": 0}, "vk": {"shares": 0}, "linkedin": {"shares": 0}, "facebook": {"likes": 0, "shares": 0, "comments": 0}, "stumbledupon": {"shares": 0}}, "site_full": "www.newschannel10.com", "main_image": "", "site_section": "http://www.newschannel10.com/category/58532/technology?clienttype=rss", "section_title": "KFDA - Technology", "url": "http://www.newschannel10.com/story/30014126/ecuadorean-sentenced-to-6-months-in-prison-for-jaguar-kill", "country": "US", "title": "Ecuadorean sentenced to 6 months in prison for jaguar kill", "performance_score": 0, "site": "newschannel10.com", "participants_count": 0, "title_full": "Ecuadorean sentenced to 6 months in prison for jaguar kill", "spam_score": 0.0, "site_type": "news", "published": "2015-09-12T05:43:00.000+03:00", "replies_count": 0, "uuid": "6d3c1ea0ad25af69b72b6b05f7bd91ad50c94042"}, "author": "", "url": "http://www.newschannel10.com/story/30014126/ecuadorean-sentenced-to-6-months-in-prison-for-jaguar-kill", "ord_in_thread": 0, "title": "Ecuadorean sentenced to 6 months in prison for jaguar kill", "locations": ["California", "Sacramento", "US", "Washington", "U.S.", "Seattle", "Arizona", "Europe", "Utah", "Michigan", "Phoenix", "China"], "entities": {"persons": [], "locations": [], "organizations": []}, "highlightText": "", "language": "english", "persons": ["MARC LEVY", "PETER JACKSON"], "text": "Ecuadorean sentenced to 6 months in prison for jaguar kill - KFDA - NewsChannel 10 / Amarillo News, Weather, Sports Member Center: Arizona police question man in freeway shootings Authorities on Friday were questioning two people in a string of freeway shootings over the past two weeks that have rattled Phoenix and led to a massive search for suspects. Police swarmed a convenience store near Interstate 10, detained a man and seized his white Chevrolet Tahoe on Friday, raising hopes of a resolution to the freeway shootings rattling Phoenix. Disgraced lawmakers, out of office, now face criminal probe One of two socially conservative Michigan lawmakers embroiled in scandal over their extramarital affair and a cover-up attempt resigned early Friday morning rather than be expelled by his colleagues. Two disgraced tea party Republicans are gone from Michigan's Legislature, but their troubles may not be over as attention turns to a criminal investigation of misconduct including a plot to conceal their extramarital... The latest developments on a series of freeway shootings in the Phoenix area. All times local: The latest developments on a series of freeway shootings in the Phoenix area. All times are local. California lawmakers approve right-to-die legislation California lawmakers gave final approval Friday to a bill that would allow terminally ill patients to legally end their lives. California lawmakers gave final approval Friday to a bill that would allow terminally ill patients to legally end their lives. US dropping sale-of-secrets-to-China case against professor Federal prosecutors are seeking to dismiss charges against a Temple University professor who was accused of scheming to provide secret U.S. technology to China. By MARC LEVY and PETER JACKSON Associated Press Federal prosecutors sought to dismiss charges Friday against a Temple University physics professor who was accused of scheming to provide secret U.S.... Automakers commit to put automatic brakes in all cars The government has received commitments from ten automakers to include automatic emergency braking in all new cars. It's a step safety advocates say could significantly reduce traffic deaths and injuries. Ten automakers have committed to the government and a private safety group that they will include automatic emergency braking in all new cars, a step transportation officials say could significantly reduce traffic deaths... Seattle teachers, school officials to resume talks Saturday Seattle teachers striking over wages planned to put down their picket signs Friday and instead work on community service projects like food drives in commemoration of the 9/11 terror attacks. Seattle teachers and officials from Seattle Public Schools say they will resume contract negotiations Saturday after three days of a teacher strike that has delayed the start of the school year for about 53,000 students. Police: Man shot by guard at Union Station dies Law enforcement officials are warning people in the nation's capital to stay clear of Union Station because of police activity. A man stabbed a woman and then was shot by a security guard at Washington's Union Station on Friday, sending people fleeing outside as trains were briefly stopped and officers converged on the massive transit hub. Couple finds injured Utah driver trapped in car for 2 days Authorities say a couple looking for a scenic spot to take a photo found an injured Utah woman who was trapped inside her wrecked vehicle for two days in a secluded part of a canyon. A young couple who stopped to take pictures at a scenic overlook in the Utah mountains at first thought the screams sounded like children playing in the distance. French train heroes: Foiling attack gives new view on 9/11 Sacramento is set to celebrate three hometown heroes who foiled an attack on a train in Europe. Three Americans who stopped a gunman on a Paris-bound passenger train talked about the significance of 9/11 on Friday at a festive parade hosted by their California hometown and in an interview to air on national television.", "external_links": [], "published": "2015-09-12T05:43:00.000+03:00", "crawled": "2015-09-12T05:50:17.260+03:00", "highlightTitle": ""}