{"organizations": ["UCLA", "Nuware Technologies", "Stanford", "Independent Angels", "Accel Partners", "CureJoy", "Accel", "Flycast", "Accel Partners CureJoy"], "uuid": "b46f48fed9c990666a34f492a244fcaac93da547", "thread": {"social": {"gplus": {"shares": 0}, "pinterest": {"shares": 0}, "vk": {"shares": 0}, "linkedin": {"shares": 0}, "facebook": {"likes": 0, "shares": 0, "comments": 0}, "stumbledupon": {"shares": 0}}, "site_full": "timesofindia.indiatimes.com", "main_image": "http://timesofindia.indiatimes.com/photo/49012209.cms", "site_section": "http://timesofindia.indiatimes.com/rssfeeds/5880666.cms", "section_title": "Technology News, Latest Tech News & Reviews | Times of India", "url": "http://timesofindia.indiatimes.com/tech/tech-news/CureJoy-raises-1-15-million-from-Accel-Partners/articleshow/49012151.cms", "country": "IL", "title": "CureJoy raises $1.15 million from Accel Partners", "performance_score": 0, "site": "indiatimes.com", "participants_count": 0, "title_full": "CureJoy raises $1.15 million from Accel Partners", "spam_score": 0.0, "site_type": "news", "published": "2015-09-18T12:47:00.000+03:00", "replies_count": 0, "uuid": "b46f48fed9c990666a34f492a244fcaac93da547"}, "author": "", "url": "http://timesofindia.indiatimes.com/tech/tech-news/CureJoy-raises-1-15-million-from-Accel-Partners/articleshow/49012151.cms", "ord_in_thread": 0, "title": "CureJoy raises $1.15 million from Accel Partners", "locations": ["California", "US", "USA", "Bangalore", "India"], "entities": {"persons": [], "locations": [], "organizations": []}, "highlightText": "", "language": "english", "persons": ["Shrinivasa Sharma", "Shalina Pillai Shalina Pillai", "Dave", "Larry Braitman", "Venk Krishnan"], "text": "CureJoy raises $1.15 million from Accel Partners Shalina Pillai Shalina Pillai ,TNN | Sep 18, 2015, 03.17 PM IST Bengaluru-based CureJoy, a content publishing and aggregation platform, will use the $1.15 million to expand its services globally. RELATED BENGALURU: Bengaluru-based healthcare startup, CureJoy has raised $1.15 million in Pre-Series A round, led by Accel Partners, India. Other investors include Venk Krishnan, founder of Nuware Technologies, and Larry Braitman, the founder of Flycast and Adify. The fund will be used by CureJoy to expand its services globally. The brainchild of Dikshant Dave and Shrinivasa Sharma, CureJoy, a content publishing and aggregation platform, was started in October 2013 to address the common concerns of people in the existing healthcare system. The platform provides curated content through its backend algorithms and technology on natural health and wellness by experts usually associated with large universities like Stanford or UCLA and merges it with the global trends and patterns. CureJoy is headquartered in California, USA and manages the entire operations and development from Bangalore. CureJoy has, so far, received two rounds of investments by Accel Partners, India and Independent Angels based out of US and India. The other players in the healthcare segment include HealthifyMe, Truweight, and Flexipass.  ", "external_links": [], "published": "2015-09-18T12:47:00.000+03:00", "crawled": "2015-09-18T13:06:57.592+03:00", "highlightTitle": ""}