{"organizations": ["The Wireless Association", "Super Mobility Conference Telecommunications Strategic Importance for Enterprises", "Super Mobility Conference Panel", "CTIA", "Telecommunications Management and Solutions Providers", "Telecom Expense Management", "Telecommunications Strategic Importance for Enterprises", "Telecommunications Management", "The Telecom Expense Management Industry Association", "TEMIA", "Network Control", "TEMIA Thought Leader Panel", "Convention Center", "TEMIA TEMIA"], "uuid": "0ca7455afcfd88b01f6512cde0ea91690f2bd878", "thread": {"social": {"gplus": {"shares": 0}, "pinterest": {"shares": 0}, "vk": {"shares": 0}, "linkedin": {"shares": 0}, "facebook": {"likes": 0, "shares": 0, "comments": 0}, "stumbledupon": {"shares": 0}}, "site_full": "www.24-7pressrelease.com", "main_image": "http://www.24-7pressrelease.com/attachments/041/press_release_distribution_0412202_93870_1.jpg", "site_section": "http://rss.24-7pressrelease.com/rss/technology_telecommunications.xml", "section_title": "Press Release and Top Technology   Telecommunications News From 24-7 Press Release Newswire", "url": "http://www.24-7pressrelease.com/press-release/telecommunications-strategic-importance-for-enterprises-and-how-to-engage-with-executives-addressed-by-temia-thought-leader-panel-at-ctias-super-mobility-conference-412202.php", "country": "US", "title": "Telecommunications Strategic Importance for Enterprises and How to Engage with Executives Addressed by TEMIA Thought Leader Panel at CTIA's Super Mobility Conference", "performance_score": 0, "site": "24-7pressrelease.com", "participants_count": 0, "title_full": "Telecommunications Strategic Importance for Enterprises and How to Engage with Executives Addressed by TEMIA Thought Leader Panel at CTIA's Super Mobility Conference", "spam_score": 0.0, "site_type": "news", "published": "2015-09-02T10:00:00.000+03:00", "replies_count": 0, "uuid": "0ca7455afcfd88b01f6512cde0ea91690f2bd878"}, "author": "", "url": "http://www.24-7pressrelease.com/press-release/telecommunications-strategic-importance-for-enterprises-and-how-to-engage-with-executives-addressed-by-temia-thought-leader-panel-at-ctias-super-mobility-conference-412202.php", "ord_in_thread": 0, "title": "Telecommunications Strategic Importance for Enterprises and How to Engage with Executives Addressed by TEMIA Thought Leader Panel at CTIA's Super Mobility Conference", "locations": ["Washington", "CA", "WESTLAKE VILLAGE", "Etelesolv", "D.C."], "entities": {"persons": [], "locations": [], "organizations": []}, "highlightText": "", "language": "english", "persons": ["Mark Hearn", "Anatole", "Steve Haddock", "Nitin Khatri", "Nicolas Peltier"], "text": "Telecommunications Strategic Importance for Enterprises and How to Engage with Executives Addressed by TEMIA Thought Leader Panel at CTIA's Super Mobility Conference Panel Reveals Secrets on How to Best Engage with Enterprise Executives WESTLAKE VILLAGE, CA, September 02,   The Telecom Expense Management Industry Association (TEMIA), the authoritative voice for Telecommunications Management and Solutions Providers in related areas will moderate a Thought Leadership Panel at Super Mobility Week. The Thought Leadership session, which is powered by CTIA, is titled \"Telecommunications Is Strategic: How Can We Best Engage with Executives?\" It will begin on Wednesday, September 9 at 1 PM in the Las Vegas Sands Expo and Convention Center on Stage 1 for Security, Privacy, Business Operations. Today, telecommunications impacts every industry providing opportunities to gain competitive advantage. TEMIA will moderate the session which will discuss strategic deployments of new telecom applications including cloud computing, mobility, Machine to Machine (M2M), the Internet of Things (IoT) and unified communications. It will also explore roles for executives and the value they bring to telecommunications management programs. TEMIA's panellists for this session are: - Nicolas Peltier, CEO for Anatole ( http://www.anatole.net ) - Nitin Khatri, Vice President, Sales and Marketing, for Etelesolv ( http://etelesolv.com ) - Steve Haddock, Vice President, Sales for MOBI ( http://www.mobiwm.com ) - Mark Hearn, President and CEO, for Network Control ( http://www.network-control.net ) Nicolas Peltier, CEO for Anatole said, \"There has been a real shift in executives' involvement over the past 18 months in the field of telecom management. They can now measure how mobility improves the way they conduct business.\" Steve Haddock, Vice President of Sales at MOBI , commented: \"Now, more than ever, mobility is changing how businesses get work done. This panel discussion will reveal the strategic importance of enterprise mobility and highlight critical considerations that must be addressed before enterprises are able to unlock mobility's full potential.\" Nitin Khatri, Vice President of Marketing and Sales at Etelesolv said, \"Executive buy-in is key to successful deployments of technology expense management. It ensures TEM adoption is a company-wide activity and not limited to the IT department. All users should be considered stakeholders. I am honored to share as a panelist how ROI and business value can be tracked in the age of Internet-of-Things, M2M, and cloud computing.\" Mark Hearn, President and CEO, for Network Control said, \"As Telecommunications remains the third highest expense in organizations and we become a more global economy, it is paramount for enterprise executives to understand their IT infrastructure, services and spend. By achieving this, they are be able to reduce operational costs, provide better reporting analytics and assure they are meeting all investment compliance requirements.\" TEMIA member companies are well positioned to address best practices, performance metrics, open industry standards, and Key Performance Indicators (KPIs), with member companies that are able to draw on experiences from managing over $61 billion in telecom expenses on behalf of clients. For more information about TEMIA, visit http://www.temia.org . CTIA Super Mobility 2015, is one of the Western Hemisphere's largest and most influential forums focused on mobile innovation. It will bring 35,000 + professionals across the new mobile landscape to discuss and learn what is driving and enabling the connected life. TEMIA members will meet on September 8, and host two Thought Leader panels on September 9 and 10.About TEMIA TEMIA's ongoing mission is to raise awareness, to improve the quality and value of solutions and to cultivate shared industry knowledge for Telecommunications Management, Telecom Expense Management, TEM, Wireless Expense Management WEM, Mobile Device Management MDM MMS and EMM solutions. TEMIA seeks to do this through the development and promotion of open industry standards, and industry knowledge among solutions providers, business partners, telecom service providers, and enterprise clients. Further, TEMIA members subscribe to a Code of Ethics, which clearly differentiates their level of commitment to their clients. For more information about TEMIA, visit http://www.temia.org . About CTIA Super Mobility 2015 CTIA Super Mobility 2015, on September 9, 10 and 11 is one of the Western Hemisphere's largest and most influential forums focused on mobile innovation. Powered by CTIA--The Wireless Association, this springboard event brings together 35,000+ professionals from across the new mobile landscape to experience the bleeding-edge technology that's driving and enabling the connected life. It will feature a comprehensive presentation of what's new--and what's next--in the fast-moving world of mobile. MobileCON-- a premier feature of CTIA Super Mobility 2015 features IT specific exhibits, programming, networking activities and Q&A opportunities--all designed to address the challenges and opportunities that arise on IT's cutting edge. About CTIA CTIA-The Wireless Association ( www.ctia.org ) is an international organization representing the wireless communications industry. Membership in the association includes wireless carriers and their suppliers, as well as providers and manufacturers of wireless data services and products. CTIA advocates on behalf of its members at all levels of government. The association also coordinates the industry's voluntary best practices and initiatives, and sponsors the industry's leading wireless tradeshows. CTIA was founded in 1984 and is based in Washington, D.C.", "external_links": [], "published": "2015-09-02T10:00:00.000+03:00", "crawled": "2015-09-02T21:47:30.101+03:00", "highlightTitle": ""}