{"organizations": ["Verizon Enterprise Solutions News & Insights", "S&P", "Verizon", "Verizon Verizon Communications Inc.", "Verizon Enterprise Solutions", "Global Channels for Verizon Enterprise Solutions", "Verizon Wireless", "Innovate Verizon", "Salesforce.com Dreamforce"], "uuid": "986e930db3fd3eb16cf19bef70e7a2fe710bbf27", "thread": {"social": {"gplus": {"shares": 0}, "pinterest": {"shares": 0}, "vk": {"shares": 0}, "linkedin": {"shares": 0}, "facebook": {"likes": 0, "shares": 0, "comments": 0}, "stumbledupon": {"shares": 0}}, "site_full": "science-technology.news-articles.net", "main_image": "", "site_section": "http://science-technology.news-articles.net/content/rss.php", "section_title": "Science and Technology @ News Articles Network", "url": "http://science-technology.news-articles.net/content/verizon-cognizant-join-forces-help-clients-digitally-transform-innovate.xhtml", "country": "US", "title": "Verizon and Cognizant Join Forces to Help Clients Digitally Transform and Innovate", "performance_score": 0, "site": "news-articles.net", "participants_count": 0, "title_full": "Verizon and Cognizant Join Forces to Help Clients Digitally Transform and Innovate", "spam_score": 0.0, "site_type": "news", "published": "2015-09-14T13:53:00.000+03:00", "replies_count": 0, "uuid": "986e930db3fd3eb16cf19bef70e7a2fe710bbf27"}, "author": "", "url": "http://science-technology.news-articles.net/content/verizon-cognizant-join-forces-help-clients-digitally-transform-innovate.xhtml", "ord_in_thread": 0, "title": "Verizon and Cognizant Join Forces to Help Clients Digitally Transform and Innovate", "locations": ["San Francisco", "America", "New York", "Waltham", "U.S.", "Teaneck", "Mass.", "TEANECK", "New Jersey", "N.J."], "entities": {"persons": [], "locations": [], "organizations": []}, "highlightText": "", "language": "english", "persons": ["Rob Calloway", "Adam Famularo"], "text": "Verizon and Cognizant Join Forces to Help Clients Digitally Transform and Innovate Â» Science & Technology Published on 2015-09-14 03:32:53 Verizon and Cognizant Join Forces to Help Clients... -- BASKING RIDGE, N.J. and TEANECK, N.J., Sept. 14,   Cognizant and Verizon logos Cognizant and Verizon logos  ><- stripped tags -> BASKING RIDGE, N.J. and TEANECK, N.J. , Sept. 14,   Verizon and Cognizant (NASDAQ: [[UEdFZ2NtVnNQVndpYm05bWIyeHNiM2RjSWlCb2NtVm1QU2RvZEhSd09pOHZjM1IxWkdsdkxUVXVabWx1WVc1amFXRnNZMjl1ZEdWdWRDNWpiMjB2Y0hKdVpYZHpQMUJoWjJVOVVYVnZkR1VtVkdsamEyVnlQVU5VVTBnbklISmxiRDBuYm05bWIyeHNiM2NuSUhSaGNtZGxkRDBuWDJKc1lXNXJKeUIwYVhSc1pUMG5RMVJUU0NjZ2IyNWpiR2xqYXowbmJHbHVhMDl1UTJ4cFkyc29kR2hwY3lrbklISmxiRDBuYm05bWIyeHNiM2NuUGtOVVUwZzhMMkUrfA==]]) today announced they are joining forces to accelerate the delivery of leading-edge, technology-based solutions to enterprise clients. Together the companies will work with organizations to define, design, deploy and manage new technology solutions that advance the digital business models of their customers. Cognizant and Verizon will provide enterprise clients with a set of high performance, reliable solutions focused on digital transformation, integration and business process support, technical expertise, networking and other solutions. As part of this alliance, joint customers will be able to experience large-scale technology demonstrations at Verizon's Innovation Centers in San Francisco and Waltham, Mass. that will be powered by a new test-bed lab the companies are building. The lab and its technology will enable clients to visualize enterprise-scale projects versus simply viewing and testing point technology offerings. The companies will leverage their extensive experience in helping clients build the digital infrastructure that integrates social, mobile, analytics, cloud and sensor technologies used to power the Internet of Things. \"Together with Verizon, we are showcasing the art of the possible and can offer integrated business and technology solutions that improve user experiences,\" said Rob Calloway , vice president, customer relationship management solutions leader at Cognizant. \"Seeing your business through your customer's eyes requires in-depth understanding of how and where data is generated and how to make meaning from that data to understand customers' behaviors, interests and desires.\" The organizations will put their expertise to work in serving clients in the retail, manufacturing and logistics, insurance, banking and financial services, and healthcare industries. \"Verizon is focused on delivering excellence in technology to our clients underpinned by our world-class networks,\" said Adam Famularo , vice president of Global Channels for Verizon Enterprise Solutions. \"Our relationship with Cognizant is one more example of how we are enabling our clients in today's digital economy to take advantage of leading advancements in technology.\" Look for Verizon and Cognizant at the Salesforce.com Dreamforce conference from September 15 through 18 in San Francisco . Verizon will be co-located in Cognizant's booth #W400. Visitors can see and experience the capabilities that the two companies are bringing to clients. Verizon Enterprise Solutions helps clients improve customer experience, drive growth and business performance and manage risk. With industry-specific solutions provided over the company's secure mobility, cloud, strategic networking, Internet of Things and advanced communications platforms, Verizon Enterprise Solutions helps open new opportunities around the world for innovation, investment and business transformation. Visit [[UEdFZ2NtVnNQVndpYm05bWIyeHNiM2RjSWlCdmJtTnNhV05yUFNkc2FXNXJUMjVEYkdsamF5aDBhR2x6S1NjZ2FISmxaajFjSW1oMGRIQTZMeTkzZDNjdWRtVnlhWHB2Ym1WdWRHVnljSEpwYzJVdVkyOXRMMXdpSUhKbGJEMWNJbTV2Wm05c2JHOTNYQ0lnZEdGeVoyVjBQVndpWDJKc1lXNXJYQ0krZDNkM0xuWmxjbWw2YjI1bGJuUmxjbkJ5YVhObExtTnZiVHd2WVQ0PXw=]] to learn more. About Verizon Verizon Communications Inc. (NYSE, NASDAQ: VZ ), headquartered in New York , employs a diverse workforce of 178,500 and generated more than $127 billion in 2014 revenues. Verizon Wireless operates America's most reliable wireless network, with 109.5 million retail connections nationwide. Verizon also provides converged communications, information and entertainment services over America's most advanced fiber-optic network, and delivers integrated business solutions to customers worldwide. For more information, visit www.verizon.com/news/ . About Cognizant Cognizant (NASDAQ: CTSH ) is a leading provider of information technology, consulting, and business process outsourcing services, dedicated to helping the world's leading companies build stronger businesses. Headquartered in Teaneck, New Jersey (U.S.), Cognizant combines a passion for client satisfaction, technology innovation, deep industry and business process expertise, and a global, collaborative workforce that embodies the future of work. With over 100 development and delivery centers worldwide and approximately 218,000 employees as of June 30, 2015, Cognizant is a member of the NASDAQ-100, the S&P 500, the Forbes Global 2000, and the Fortune 500 and is ranked among the top performing and fastest growing companies in the world. Visit us online at www.cognizant.com or follow us on Twitter: Cognizant . Verizon Enterprise Online News Room: News releases, blog posts, media contacts and other information are available at Verizon Enterprise Solutions News & Insights (news.verizonenterprise.com) . News from Verizon Enterprise Solutions is also available through an RSS feed at http://www.verizonenterprise.com/rss-options/ .", "external_links": [], "published": "2015-09-14T13:53:00.000+03:00", "crawled": "2015-09-14T13:40:27.040+03:00", "highlightTitle": ""}