{"organizations": ["Communication Technology", "Berkman Center for Internet and Society", "ITAC", "GTEC", "U.S. District of Columbia", "Information Technology Association of Canada", "Enterprise Communications and Technical Services", "Harvard University", "Shorenstein Center", "Black Hat", "InformationWeek", "ICT", "Shaw Centre", "Commerce", "CTO", "GTEC Helping Canada's Public Sector Harness the Power of the Cloud OTTAWA", "U.S. Commonwealth", "Network Computing"], "uuid": "ff293659270ef0e4f108eee0230defa7da84ce0a", "thread": {"social": {"gplus": {"shares": 0}, "pinterest": {"shares": 0}, "vk": {"shares": 0}, "linkedin": {"shares": 0}, "facebook": {"likes": 0, "shares": 0, "comments": 0}, "stumbledupon": {"shares": 0}}, "site_full": "www.newswire.ca", "main_image": "", "site_section": "http://www.newswire.ca/rss/business-technology/all-business-technology-news.rss", "section_title": "CNW :  Business Technology", "url": "http://www.newswire.ca/news-releases/vivek-kundra-salesforce-executive-and-former-us-cio-to-speak-at-gtec-529105851.html", "country": "US", "title": "Vivek Kundra, Salesforce Executive and Former U.S. CIO, to Speak at GTEC", "performance_score": 0, "site": "newswire.ca", "participants_count": 0, "title_full": "Vivek Kundra, Salesforce Executive and Former U.S. CIO, to Speak at GTEC", "spam_score": 0.0, "site_type": "news", "published": "2015-09-24T15:30:00.000+03:00", "replies_count": 0, "uuid": "ff293659270ef0e4f108eee0230defa7da84ce0a"}, "author": "", "url": "http://www.newswire.ca/news-releases/vivek-kundra-salesforce-executive-and-former-us-cio-to-speak-at-gtec-529105851.html", "ord_in_thread": 0, "title": "Vivek Kundra, Salesforce Executive and Former U.S. CIO, to Speak at GTEC", "locations": ["United States", "U.S.", "Virginia", "Canada", "Ottawa", "Ontario"], "entities": {"persons": [], "locations": [], "organizations": []}, "highlightText": "", "language": "english", "persons": ["Vivek Kundra", "Michael Larson", "Stephen Gordon", "Karna Gupta", "Bob Osborn", "Michele Lajeunesse", "Kundra", "Obama"], "text": "Vivek Kundra, Salesforce Executive and Former U.S. CIO, to Speak at GTEC Helping Canada's Public Sector Harness the Power of the Cloud OTTAWA, Ontario , Sept. 24, 2015 /CNW/ -- GTEC, Canada's internationally recognized forum for enabling and celebrating information and communication technology leadership, innovation and impact in Canada's public sector, today announced that Vivek Kundra , Executive Vice President, Salesforce, and former United States Chief Information Officer, will take the GTEC Main Stage to discuss The Rise of the Connected Government . This accomplished visionary will bring decades of technology leadership, experience and success to GTEC. As the first CIO of the United States , Kundra is credited with adopting game-changing technologies, strengthening the cybersecurity posture of the nation, and launching an open government movement which has been replicated around the world. Prior to joining the Obama administration, Kundra served as the CTO for the U.S. District of Columbia and as the Assistant Secretary of Commerce and Technology for the U.S. Commonwealth of Virginia . Kundra also served as a fellow at Harvard University at the Berkman Center for Internet and Society and the Shorenstein Center on the Press, Politics and Public Policy. The World Economic Forum selected Kundra as a 2011 Young Global Leader, representing a group of exceptional young leaders who share a commitment to shaping the global future. \"We are delighted to welcome Mr. Kundra to the GTEC Main Stage,\" said Michele Lajeunesse , Executive Director of GTEC. \"Among his many achievements, this former CIO led the U.S. Government to the cloud. His visit to Ottawa is truly timely as federal, provincial and municipal governments across the country assess cloud readiness, and explore the development and implementation of cloud computing strategies. Mr. Kundra will provide GTEC participants with the insight required to capitalize on this opportunity.\" Following his keynote address, Mr. Kundra will share his perspective on the provocative panel, The Journey to the Cloud – How Ready Are We? This session will explore key considerations for the implementation of cloud computing in the public sector, and why a 'cloud-first strategy' is imperative for driving a more efficient, innovative and transparent government. Mr. Kundra joins the following panelists: Karna Gupta , President and CEO, Information Technology Association of Canada (ITAC) Stephen Gordon , Executive Director, Hosting Delivery Services, Government of BC Michael Larson , Chief Operating Officer, CloudBC Bob Osborn , Chief Technology Officer, Federal at ServiceNow Vivek Kundra's keynote on The Rise of the Connected Government will take place on the GTEC 2015 Main Stage, on Wednesday, October 21, 2015 at 9:05AM , followed by the panel Journey to the Cloud – How Ready Are We ? at 9:25AM , at the Shaw Centre. For more information, visit : gtec.ca Register for GTEC: gtec.ca/ottawa/registration-and-pricing Apply for a GTEC media pass: gtec.ca/ottawa/press-centre-overview About GTEC GTEC is Canada's internationally recognized forum for enabling and celebrating Information and Communication Technology (ICT) leadership, innovation and impact in Canada's public sector. Since 1992, GTEC has brought together more than 100,000 public and private sector innovators, leaders and enterprises to explore and drive leading-edge ICT initiatives, application and service delivery. Building on targeted webinars, summits, and roundtables that stimulate dialogue throughout the year, GTEC's annual flagship Conference and Exhibition attracts more than 4,500 participants, and delivers: Education and training opportunities that develop top ICT talent A robust conference program with compelling keynote presentations and panels on current strategies, opportunities and trends An extensive exhibition showcasing emerging technologies, innovations, and solutions that enhance productivity and performance A wealth of collaboration, business development and networking opportunities Distinction Awards that celebrate ICT excellence in Canada's public sector For additional information on GTEC, please visit: www.gtec.ca . About UBM Tech UBM Tech engages technology professionals live and online through its world-class brands, including Black Hat, InformationWeek, Enterprise Connect, Game Developers Conference (GDC), Dark Reading, HDI, GTEC, Network Computing and Interop. We're dedicated to fostering real engagement by creating environments where the technology industry can make connections, share insights, and network effectively. UBM Tech is the only media company that delivers large-scale industry events, leading online brands and content marketing services serving the Enterprise IT, Information Security, Game Development, Enterprise Communications and Technical Services and Support communities. UBM Tech is a part of UBM (UBM.L), a global provider of media and information services with a market capitalization of more than $2.5 billion. For more information, go to http://tech.ubm.com .", "external_links": [], "published": "2015-09-24T15:30:00.000+03:00", "crawled": "2015-09-24T16:09:03.898+03:00", "highlightTitle": ""}