{"organizations": ["Head of Network Development", "ARRIS Group Inc", "DELTA N.V.", "DELTA", "Comcast", "GCI", "DELTA DELTA", "EMEA & Asia Pacific", "ARRIS Enterprises, Inc", "Liberty Global", "ARRIS"], "uuid": "9c501741c6edf12ff2daa686df696b757a96bbbf", "thread": {"social": {"gplus": {"shares": 0}, "pinterest": {"shares": 0}, "vk": {"shares": 0}, "linkedin": {"shares": 0}, "facebook": {"likes": 0, "shares": 0, "comments": 0}, "stumbledupon": {"shares": 0}}, "site_full": "science-technology.news-articles.net", "main_image": "", "site_section": "http://science-technology.news-articles.net/content/rss.php", "section_title": "Science and Technology @ News Articles Network", "url": "http://science-technology.news-articles.net/content/delta-selects-arris-cer-boost-broadband-speeds.xhtml", "country": "US", "title": "DELTA Selects ARRIS E6000a\" CER to Boost Broadband Speeds", "performance_score": 0, "site": "news-articles.net", "participants_count": 0, "title_full": "DELTA Selects ARRIS E6000a\" CER to Boost Broadband Speeds", "spam_score": 0.0, "site_type": "news", "published": "2015-09-11T22:33:00.000+03:00", "replies_count": 0, "uuid": "9c501741c6edf12ff2daa686df696b757a96bbbf"}, "author": "", "url": "http://science-technology.news-articles.net/content/delta-selects-arris-cer-boost-broadband-speeds.xhtml", "ord_in_thread": 0, "title": "DELTA Selects ARRIS E6000a\" CER to Boost Broadband Speeds", "locations": ["AMSTERDAM", "Zeeland", "Netherlands"], "entities": {"persons": [], "locations": [], "organizations": []}, "highlightText": "", "language": "english", "persons": ["Steve McCaffery", "Andre Meulmeester"], "text": "DELTA Selects ARRIS E6000a\" CER to Boost Broadband Speeds   DELTA Selects ARRIS E6000a\" CER to Boost Broadband Speeds -- AMSTERDAM, Sept.   <-   AMSTERDAM , Sept.   ARRIS Group Inc . (NASDAQ: ARRS ) today announced that Dutch operator DELTA N.V. selected the ARRIS E6000™ Converged Edge Router (CER) to enhance its broadband services and prepare for tomorrow's IP video delivery. DELTA will deploy the ARRIS E6000 CER to enhance broadband services for its 100K customers in the Zeeland province of the Netherlands . With the E6000 CER, DELTA has future plans to deliver speeds of up to 400Mbps—double the bandwidth its customers enjoy today. The new CCAP solution will also enable DELTA to lower the cost per MB delivered to customers. \"The E6000 CER is an investment in delivering tomorrow's services that delivers tangible service and CAPEX benefits today,\" says Steve McCaffery , Senior Vice President, EMEA & Asia Pacific at ARRIS. \"DELTA is realizing those advantages in its installation and configuration process, operational efficiencies, and service capacity. And its customers soon will see them materialize in the form of faster broadband speeds and exciting new entertainment and communications services.\" \"The E6000 CER enables DELTA to stay ahead of our subscribers' demands for faster speeds and new services and building a foundation for tomorrow's network,\" said Andre Meulmeester , Head of Network Development at DELTA. \"Our collaboration with ARRIS is at a high standard and let us keep a grip on operational expenditure in times of fast growing network services and data traffic.\" Powering Smarter Networks: The ARRIS E6000 CER Global momentum for the E6000 CER continues to showcase its value to the world's leading service providers. This announcement extends its streak of recent global wins including Liberty Global, Comcast, SK Broadband, GCI, and WOW! The E6000 CER is based on the Converged Cable Access Platform (CCAP) specification that enables operators to optimize IP content delivery and to cost-effectively deploy services. The E6000 CER is the industry's leading CCAP solution, providing service to millions of subscribers worldwide through a high-availability, high-performance solution that supports a redundant design. About DELTA DELTA is a Dutch independent supplier of energy. The company supplies energy, infrastructure and digital services. DELTA wants to make life as easy as possible for its customers and is constantly looking for ways of offering added value. The shares are owed by the municipalities of Zeeland, Noord-Brabant, Zuid-Holland and the provinces of Zeeland and Noord-Brabant. DELTA supplies gas, electricity and digital services to private and business clients in Zeeland and beyond. About ARRIS ARRIS is a global innovator in IP, video and broadband technology. We have continually worked with our customers to transform the experience of entertainment and communications for millions of people around the world. The people of ARRIS are dedicated to the success of our customers, bringing a passion for invention that has fueled our history: We created digital TV, delivered the first wireless broadband gateway and are pioneering the standards and pathways for tomorrow's personalized, Ultra HD, multiscreen, and cloud services. We are dedicated to meeting today's challenges and preparing for the tasks the future holds. Collaborating with our customers, ARRIS will continue to solve the most pressing challenges of 21st century communications. Together, we are inventing the future. For more information: www.arris.com . For the latest ARRIS news: Check out our Blog: ARRIS EVERYWHERE Follow us on Twitter @ARRIS ARRIS and the ARRIS Logo are trademarks or registered trademarks of ARRIS Enterprises, Inc. All other trademarks are the property of their respective owners. © ARRIS Enterprises, Inc. 2015. All rights reserved. \nSOURCE ARRIS Group Inc.", "external_links": [], "published": "2015-09-11T22:33:00.000+03:00", "crawled": "2015-09-11T22:21:01.124+03:00", "highlightTitle": ""}