{"organizations": ["TBI", "BMC Neuroscience", "SeraCare Life Sciences", "SeraCare Life Sciences Announces Launch of NGS Validated", "Women   Payright Health Solutions", "Carnegie Mellon University", "United Nations Foundation", "Priority Payment Systems Partner to Improve Patient Education and Financial Management Services for Health", "Cambridge Technology", "National Prescription Drug Take-Back Events"], "uuid": "af664015d72eb2e6d6e0dcdfd6c0145f88095277", "thread": {"social": {"gplus": {"shares": 0}, "pinterest": {"shares": 0}, "vk": {"shares": 0}, "linkedin": {"shares": 0}, "facebook": {"likes": 0, "shares": 0, "comments": 0}, "stumbledupon": {"shares": 0}}, "site_full": "www.bio-medicine.org", "main_image": "", "site_section": "http://feeds.bio-medicine.org/latest-medical-technology", "section_title": "Latest Medical Technology from Bio-Medicine.Org", "url": "http://www.bio-medicine.org/medicine-technology-1/Cambridge-Technology-opens-new-Development-Center-in-China-48297-1/", "country": "US", "title": "Cambridge Technology opens new Development Center in China", "performance_score": 0, "site": "bio-medicine.org", "participants_count": 0, "title_full": "Cambridge Technology opens new Development Center in China", "spam_score": 0.0, "site_type": "news", "published": "2015-09-23T19:26:00.000+03:00", "replies_count": 0, "uuid": "af664015d72eb2e6d6e0dcdfd6c0145f88095277"}, "author": "", "url": "http://www.bio-medicine.org/medicine-technology-1/Cambridge-Technology-opens-new-Development-Center-in-China-48297-1/", "ord_in_thread": 0, "title": "Cambridge Technology opens new Development Center in China", "locations": ["United States", "Hong Kong", "Calif.", "SOUTH SAN FRANCISCO", "U.S.", "Suzhou", "New England", "Hovaizi", "China"], "entities": {"persons": [], "locations": [], "organizations": []}, "highlightText": "", "language": "english", "persons": ["David Rivett", "Rivett", "Yazdi", "Tim Byers", "Lopez", "Jennifer Lopez", "Syneron Candela"], "text": "* Comment: * Email: (Date:9/23/2015)... , Sept 23, 2015 SeraCare Life Sciences, ... manufacturers, announced today that the company,s new precision ... Materials; a portfolio consisting of 12 individual high-titer ... next-generation sequencing (NGS). These products are intended for use ... identify drug resistance mutations or assign viral tropism. ... (Date:9/23/2015)... Sept. 23, 2015 This Saturday, September 26, ... states, marking the reintroduction of the U.S. Drug ... remove old prescription drugs from their medicine cabinets ... be safely disposed. For residents who cannot participate ... the Deterra Drug Deactivation System , a ... (Date:9/23/2015)... Sept. 23, 2015 Cambridge Technology (CTI) announces the grand ... China. The company,s Suzhou development center focuses on continued ... leading OEM partners in advanced industrial and medical applications. ... decades, the opening of the development center marks a ... renewed support for the China ... [ 0 ] SeraCare Life Sciences Announces Launch of NGS Validated HIV-1 Reference Materials [ 0 ] Verde Technologies Announces In-Home Alternative to Sept. 26 National Prescription Drug Take-Back Events [ 0 ] Cambridge Technology opens new Development Center in China ... , SOUTH SAN FRANCISCO, Calif. , ... PARD ), a biopharmaceutical company focused on innovative ... controlled Phase 2 trial of picoplatin in metastatic colorectal ... as picoplatin in combination with 5-fluorouracil and leucovorin (FOLPI ... ... , ... THOR ), a world leader in device-based mechanical circulatory support therapies ... report its operating results for the 2009 fiscal year on Thursday, ... discuss its financial results and operating activities open to all interested parties ... Poniard Pharmaceuticals Announces Phase 2 Trial of Picoplatin in Metastatic Colorectal Cancer Meets Primary Endpoint and Study Objectives Thoratec Schedules Fiscal 2009 Year-End Conference Call, Webcast (Date:9/23/2015)... ... September 23, 2015 , ... Motor insurance specialists Kwiksure have ... The first concern raised was the issue of Betterment, and how Hong Kong customers ... is also apparently a reliance on using too many resources and time, for these   Drs. Yazdi and Hovaizi, ... Spa are among the first in New England to offer the UltraShape, a ... developed by medical device leader Syneron Candela is the first and only non   Today, the United Nations Foundation announced Jennifer Lopez ... this new role, Lopez will help to amplify the call for action to address ... thrilled to work with Jennifer Lopez, who will lend her powerful voice to one ... (Date:9/23/2015)... ,   President   roundtables   committed   a partnership to help improve patient payment education and financial management. Under ... MX Medical and MX Home Care solutions, providing comprehensive tools for identifying ... [ 0 ] Kwiksure Announces Suggestions to Improve Motor Insurance Claims in Hong Kong [ 0 ] Lumiere Laser And Med Spa Offers The Hottest Fat Reduction Technology For Better Abs In Two Weeks [ 0 ] United Nations Foundation Announces Jennifer Lopez as Global Advocate for Girls and Women   Payright Health Solutions and Priority Payment Systems Partner to Improve Patient Education and Financial Management Services for Health and Home Care Market ... memory to take place, certain genes must be activated ... normal gene expression within these neurons can lead to ... and cataloging all the genes involved in learning is ... BMC Neuroscience, Carnegie Mellon University scientists show how an ... ... million people in the United States incur a traumatic brain ... these injuries//. TBI is the ultimate cause of death in ... from a direct blow to the brain or from the ... oxygen, or increased pressure on the brain. Intracranial hemorrhage (ICH) ... ... the most malignant diseases which are responsible for number of ... on this subject. A new study suggests that true biological ... have been confounded by Dr. Tim Byers, of the University ... ,It is not due to the disparity in the access ... ... (AMARRG), Dr David Rivett, today congratulated the Government on ... as part of the Rural and Remote Procedural GPs ... ,Dr Rivett said the Government had ... the program, but had placed onerous restrictions on an ... ... Organization (WHO) says that though treatment coverage for HIV/AIDS has ... 2010, is yet to be achieved. , Stating ... by last year-end, 2 million people in low- and middle-income ... infection. ,This equals an increase of 54 percent ... ... A vaccine for treating a recurrent cancer of the ... has shown promise in preliminary data from a clinical ... ,Known as a glioma, this cancerous tumor is ... patients showed that vitespen vaccination (trademarked as Oncophage) was ...", "external_links": [], "published": "2015-09-23T19:26:00.000+03:00", "crawled": "2015-09-23T20:43:07.138+03:00", "highlightTitle": ""}