{"organizations": ["Land Rover Jaguar Land Rover", "LAS VEGAS  AT&T Inc", "Jaguar Land Rover North America", "CTIA", "AT&T Intellectual Property", "Jaguar Land Rover North America, LLC", "AT&T Inc", "Jaguar Land Rover", "Jaguar", "USA About AT&T AT&T Inc.", "AT&T", "Jaguar Land Rover North America Enter Multi-Year Agreement AT&T", "Jaguar Land Rover North America Enter Multi-Year Agreement   Published", "Jaguar Land Rover North America The", "Jaguar Land Rover North America Enter Multi-Year Agreement", "AT&T Inc."], "uuid": "0084e8a61147abc9c3d594ebd478ac7ed0f29617", "thread": {"social": {"gplus": {"shares": 0}, "pinterest": {"shares": 0}, "vk": {"shares": 0}, "linkedin": {"shares": 0}, "facebook": {"likes": 0, "shares": 0, "comments": 0}, "stumbledupon": {"shares": 0}}, "site_full": "science-technology.news-articles.net", "main_image": "", "site_section": "http://science-technology.news-articles.net/content/rss.php", "section_title": "Science and Technology @ News Articles Network", "url": "http://science-technology.news-articles.net/content/jaguar-land-rover-north-america-enter-multi-year-agreement.xhtml", "country": "US", "title": "AT&T And Jaguar Land Rover North America Enter Multi-Year Agreement", "performance_score": 0, "site": "news-articles.net", "participants_count": 0, "title_full": "AT&T And Jaguar Land Rover North America Enter Multi-Year Agreement", "spam_score": 0.0, "site_type": "news", "published": "2015-09-10T21:26:00.000+03:00", "replies_count": 0, "uuid": "0084e8a61147abc9c3d594ebd478ac7ed0f29617"}, "author": "", "url": "http://science-technology.news-articles.net/content/jaguar-land-rover-north-america-enter-multi-year-agreement.xhtml", "ord_in_thread": 0, "title": "AT&T And Jaguar Land Rover North America Enter Multi-Year Agreement", "locations": ["United States", "USA", "U.S.", "Canada", "Atlanta", "UK", "New Jersey", "Mahwah"], "entities": {"persons": [], "locations": [], "organizations": []}, "highlightText": "", "language": "english", "persons": ["Chris Penrose"], "text": "AT&T And Jaguar Land Rover North America Enter Multi-Year Agreement   Published on 2015-09-10 08:32:48 AT&T And Jaguar Land Rover North America Enter Multi-Year Agreement -- LAS VEGAS  AT&T Inc. AT&T Inc.  ><- stripped tags -> LAS VEGAS   [[UEdFZ2NtVnNQVndpYm05bWIyeHNiM2RjSWlCdmJtTnNhV05yUFNkc2FXNXJUMjVEYkdsamF5aDBhR2x6S1NjZ2FISmxaajFjSW1oMGRIQTZMeTkzZDNjdVlYUjBMbU52YlM5blpXNHZiR0Z1WkdsdVp5MXdZV2RsY3o5d2FXUTlNek13T1Z3aUlISmxiRDFjSW01dlptOXNiRzkzWENJZ2RHRnlaMlYwUFZ3aVgySnNZVzVyWENJK1FWUW1WRHd2WVQ0PXw=]]* and Jaguar Land Rover North America are bringing high speed internet to Jaguar Land Rover vehicles in the United States and Canada as a part of a new multi-year agreement. AT&T connectivity will power Jaguar Land Rover's \"infotainment\" features like a Wi-Fi hot spot, connected navigation and a suite of apps. [[UEdFZ2NtVnNQVndpYm05bWIyeHNiM2RjSWlCdmJtTnNhV05yUFNkc2FXNXJUMjVEYkdsamF5aDBhR2x6S1NjZ2FISmxaajFjSW1oMGRIQTZMeTloWW05MWRDNWhkSFF1WTI5dEwyTmhkR1ZuYjNKNUwyRnNiRjl1WlhkekxtaDBiV3hjSWlCeVpXdzlYQ0p1YjJadmJHeHZkMXdpSUhSaGNtZGxkRDFjSWw5aWJHRnVhMXdpUGtGVUpsUThMMkUrfA==]] began offering wireless connectivity in the Range Rover and Range Rover Sport models this month, and will follow with more Jaguar and Land Rover models later this year. Jaguar Land Rover customers can easily share data among phones, tablets and now their vehicles with [[UEdFZ2NtVnNQVndpYm05bWIyeHNiM2RjSWlCdmJtTnNhV05yUFNkc2FXNXJUMjVEYkdsamF5aDBhR2x6S1NjZ2FISmxaajFjSW1oMGRIQTZMeTkzZDNjdVlYUjBMbU52YlM5dGIySnBiR1Z6YUdGeVpWd2lJSEpsYkQxY0ltNXZabTlzYkc5M1hDSWdkR0Z5WjJWMFBWd2lYMkpzWVc1clhDSStRVlFtVkNCTmIySnBiR1VnVTJoaGNtVThMMkUrfA==]] Value. The cost for adding vehicles to a Mobile Share Value plan is $10 for the access charge per month. 1 AT&T customers get ultimate flexibility – they can choose a stand-alone data plan or choose the Mobile Share option. For more information, go to [[UEdFZ2NtVnNQVndpYm05bWIyeHNiM2RjSWlCdmJtTnNhV05yUFNkc2FXNXJUMjVEYkdsamF5aDBhR2x6S1NjZ2FISmxaajFjSW1oMGRIQTZMeTl0ZVdOdmJtNWxZM1JsWkdOaGNpNWhkSFF1WTI5dEwxd2lJSEpsYkQxY0ltNXZabTlzYkc5M1hDSWdkR0Z5WjJWMFBWd2lYMkpzWVc1clhDSSthSFIwY0RvdkwyMTVZMjl1Ym1WamRHVmtZMkZ5TG1GMGRDNWpiMjA4TDJFK3w=]]. \"We're thrilled to work with Jaguar Land Rover to deliver a connected experience in cars for drivers and passengers,\" said Chris Penrose , senior vice president, [[UEdFZ2NtVnNQVndpYm05bWIyeHNiM2RjSWlCdmJtTnNhV05yUFNkc2FXNXJUMjVEYkdsamF5aDBhR2x6S1NjZ2FISmxaajFjSW1oMGRIQTZMeTloWW05MWRDNWhkSFF1WTI5dEwyMWxaR2xoYTJsMEwybHZkRndpSUhKbGJEMWNJbTV2Wm05c2JHOTNYQ0lnZEdGeVoyVjBQVndpWDJKc1lXNXJYQ0krU1c1MFpYSnVaWFFnYjJZZ1ZHaHBibWR6UEM5aFBnPT18]], [[UEdFZ2NtVnNQVndpYm05bWIyeHNiM2RjSWlCdmJtTnNhV05yUFNkc2FXNXJUMjVEYkdsamF5aDBhR2x6S1NjZ2FISmxaajFjSW1oMGRIQTZMeTloWW05MWRDNWhkSFF1WTI5dEwyMWxaR2xoYTJsMEwyMXZZbWxzYVhSNWMyOXNkWFJwYjI1elhDSWdjbVZzUFZ3aWJtOW1iMnhzYjNkY0lpQjBZWEpuWlhROVhDSmZZbXhoYm10Y0lqNUJWQ1pVSUUxdlltbHNhWFI1UEM5aFBnPT18]]. \"Our Mobile Share Value and other data plans give Jaguar Land Rover customers flexible options to stay connected while on the road.\" AT&T's Connected Car Leadership In 2014, AT&T launched two major initiatives to lead innovation in the connected car space. The first was a pioneering connected car innovation center in Atlanta , called the AT&T Drive Studio. It also launched a new global automotive solution and development platform, AT&T Drive . AT&T Drive Studio features a working lab and showroom to build and exhibit the latest innovations. It is a hub where AT&T works directly with companies and responds to automakers' opportunities. AT&T Drive is the company's connected car platform. This modular and flexible global solution helps car makers build unique solutions for the marketplace. Auto makers can choose the services and capabilities that are important to them. They can add features for connectivity, billing, data analytics and infotainment. AT&T is a telematics leader and connects vehicles around the globe. In the second quarter of 2015, AT&T added 1.4 million connected devices. Of those devices, nearly 1 million were connected cars. AT&T was the first major wireless carrier to launch a global SIM platform for cars. The platform lets automotive, consumer and M2M equipment makers use a single carrier to wirelessly connect products across the globe. For the complete array of AT&T offerings, visit www.att.com . Follow the conversation on Twitter: #SuperMobility, #ATTVegas *AT&T products and services are provided or offered by subsidiaries and affiliates of AT&T Inc. under the AT&T brand and not by AT&T Inc. About Jaguar Land Rover North America The United States is one of the leading global markets for both Jaguar and Land Rover Jaguar Land Rover employs 32,000 people and sells vehicles in 170 countries around the world Jaguar Land Rover has two state of the art engineering and design facilities and four advanced manufacturing plants in the UK Headquartered in Mahwah, New Jersey , in the United States , Jaguar Land Rover North America, LLC has offices across the USA Jaguar Land Rover is represented by more than 330 independently operated retail outlets in the USA About AT&T AT&T Inc. (NYSE: T ) helps millions around the globe connect with leading entertainment, mobile, high speed Internet and voice services. We're the world's largest provider of pay TV. We have TV customers in the U.S. and 11 Latin American countries. In the U.S., our wireless network offers the nation's strongest LTE signal and the most reliable 4G LTE network . We offer the best global wireless coverage*. And we help businesses worldwide serve their customers better with our mobility and secure cloud solutions. Additional information about AT&T products and services is available at http://about.att.com . Follow our news on Twitter at @ATT, on Facebook at http://www.facebook.com/att and YouTube at http://www.youtube.com/att . © 2015 AT&T Intellectual Property. All rights reserved. AT&T, the Globe logo and other marks are trademarks and service marks of AT&T Intellectual Property and/or AT&T affiliated companies. All other marks contained herein are the property of their respective owners. Reliability and signal strength claims based on nationwide carriers' LTE. Signal strength claim based ONLY on avg. LTE signal strength. LTE not available everywhere. *Global coverage claim based on offering discounted voice and data roaming; LTE roaming; voice roaming; and world-capable smartphone and tablets in more countries than any other U.S. based carrier. Coverage not available in all areas. Coverage may vary per country and be limited/restricted in some countries. CTIA 2015 AT&T BOOTH #3724 1 Add a vehicle to Mobile Share Value: Eligible vehicles only. Req's min. Mobile Share Value plan (starts at $20 /mo.) or Mobile Share Data plan (starts at $30 /mo.) plus $10 /mo. access charge per vehicle. Monthly, overage & other charges, fees & restr's apply. See att.com/mobilesharevalue for plan details", "external_links": [], "published": "2015-09-10T21:26:00.000+03:00", "crawled": "2015-09-10T21:14:10.448+03:00", "highlightTitle": ""}