{"organizations": ["Cisco Systems", "Micron Technology, Inc.", "ACI Association", "Oracle Corporation", "Chartered Financial Analyst", "Cisco Systems Inc", "AT&T Inc", "Active Charter Investors Association", "ORCL", "Cisco Systems Inc.", "AT&T", "Hewlett-Packard", "Cisco Systems, Inc.", "Micron Technology Inc", "Hewlett-Packard Company", "S&P", "Micron Technology", "Micron Technology Inc.", "CFA Institute", "Hewlett-Packard Co", "Oracle Corp", "CSCO", "AT&T Inc."], "uuid": "a2f9703a7467e742c71d4d8e5c7ee9b0464f3552", "thread": {"social": {"gplus": {"shares": 0}, "pinterest": {"shares": 0}, "vk": {"shares": 0}, "linkedin": {"shares": 0}, "facebook": {"likes": 0, "shares": 0, "comments": 0}, "stumbledupon": {"shares": 0}}, "site_full": "science-technology.news-articles.net", "main_image": "", "site_section": "http://science-technology.news-articles.net/content/rss.php", "section_title": "Science and Technology @ News Articles Network", "url": "http://science-technology.news-articles.net/content/tracking-technology-sector-cisco-systems-micron-oracle-hewlett-packard.xhtml", "country": "US", "title": "Tracking the Technology Sector - AT&T, Cisco Systems, Micron Technology, Oracle and Hewlett-Packard", "performance_score": 0, "site": "news-articles.net", "participants_count": 0, "title_full": "Tracking the Technology Sector - AT&T, Cisco Systems, Micron Technology, Oracle and Hewlett-Packard", "spam_score": 0.0, "site_type": "news", "published": "2015-09-21T17:26:00.000+03:00", "replies_count": 0, "uuid": "a2f9703a7467e742c71d4d8e5c7ee9b0464f3552"}, "author": "", "url": "http://science-technology.news-articles.net/content/tracking-technology-sector-cisco-systems-micron-oracle-hewlett-packard.xhtml", "ord_in_thread": 0, "title": "Tracking the Technology Sector - AT&T, Cisco Systems, Micron Technology, Oracle and Hewlett-Packard", "locations": ["Belarus", "Iran", "Cuba", "MU", "Canada", "Syria", "North Korea", "NEW YORK", "Sudan", "Somalia"], "entities": {"persons": [], "locations": [], "organizations": []}, "highlightText": "", "language": "english", "persons": ["Rohit Tuli"], "text": "Tracking the Technology Sector - AT&T, Cisco Systems, Micron Technology, Oracle and Hewlett-Packard  46:50 Tracking the Technology Sector - AT&T, Cisco Systems, Micron Technology, Oracle and... -- NEW YORK, September   <-   NEW YORK , September   ACI Association has initiated research coverage on the following equities: AT&T Inc. (NYSE: T ), Cisco Systems, Inc. (NASDAQ: CSCO ), Micron Technology, Inc. (NASDAQ: MU ), Oracle Corporation (NASDAQ: ORCL ), Hewlett-Packard Company (NYSE: HPQ ). On Friday, September 18, 2015 , Nasdaq ended at 4,827.23, down 1.36%, DOW declined 1.74% to finish the day at 16,384.58 and the S&P closed at 1,958.03, down 1.62%. Register for your complimentary reports at the links given below. -- AT&T Inc . -- AT&T Inc.'s stock edged lower by 0.70% to close Friday's session at USD 32.55 . The stock recorded a trading volume of 44.63 million shares, which was above its 50-day daily average volume of 33.06 million shares and above its 52-week average volume of 28.24 million shares. Over the last three days, AT&T Inc.'s shares have declined by 0.94% and in the past one week the stock has moved down 0.52%. Over the last three months the stock has lost 6.97% and in the past six months the shares have shed 2.05%. Further, AT&T Inc. has a current dividend yield of 5.78%. The company is trading at a price to earnings ratio of 32.55 and at a price to book ratio of 1.95. This compares to a historical PE ratio of 28.12. The historical PB ratio is near to 2.02. Additionally, the stock is trading at a price to cash flow ratio of 5.37. Sign up and read the free notes on T at: http://www.aciassociation.com/T.pdf -- Cisco Systems Inc . -- The stock of Cisco Systems Inc. lost 1.31% to close Friday's session at USD 25.54 . The shares of the company moved in the range of USD 25.25 and USD 25.74 and a trading volume of 40.02 million shares was recorded, which was greater than its 150-day daily average volume of 26.09 million shares. Over the last five days Cisco Systems Inc.'s shares have declined by 1.84% and in the past one month the stock has lost 9.59%. Moreover, over the last three months the stock has declined 12.02% and in the past six months the shares have registered a loss of 10.20%. Further, the company is trading at a price to earnings ratio of 14.76 and at a price to book ratio of 2.18. This compares to a historical PE and PB ratio of 16.27 and 2.42, respectively. Besides, the stock is trading at a price to cash flow ratio of 10.27 and at a price to sales ratio of 2.63. Register for free on ACI Association and access the latest research on CSCO at: http://www.aciassociation.com/CSCO.pdf -- Micron Technology Inc . -- Micron Technology Inc.'s stock declined 5.55% to end Friday's session at USD 15.50 . The company's shares fluctuated in the range of USD 15.36 and USD 16.19 . A total of 36.70 million shares exchanged hands, which surpassed its 52-week average volume of 26.83 million shares. Over the last three days Micron Technology Inc.'s shares have declined by 6.17% and in the past one week the stock has moved down 7.74%. Further, the company is trading at a price to earnings ratio of 5.17, compared to the historical PE ratio of 12.91. The price to book ratio stood at 1.43. The historical PB ratio is near to 3.27. Additionally, the stock is trading at a price to cash flow ratio of 3.23 and at a price to sales ratio of 1.06. The complete research on MU is available for free at: http://www.aciassociation.com/MU.pdf -- Oracle Corp oration -- Oracle Corp's stock lost 0.98% to finish the session at USD 36.38 . The stock recorded a trading volume of 34.92 million shares, which was above its 50-day daily average volume of 15.33 million shares. Over the last five days Oracle Corp's shares have declined by 4.06% and in the past one month the stock has lost 8.66%. In addition, over the last three months the stock has lost 12.53% and year to date the shares have shed 18.17%. Oracle Corp has a current dividend yield of 1.65% and is trading at a price to earnings ratio of 17.00. The price to book ratio was 3.25. This compares to a historical PE and PB ratio of 19.71 and 3.88, respectively. Additionally, the stock is trading at a price to cash flow ratio of 11.50 and at a price to sales ratio of 4.13. Free in-depth research on ORCL is available at: http://www.aciassociation.com/ORCL.pdf -- Hewlett-Packard C ompany -- Hewlett-Packard Co's stock declined 3.74% to close at USD 26.54 . The stock recorded a trading volume of 29.48 million shares, which surpassed its 52-week average volume of 12.72 million shares. Over the last three days Hewlett-Packard Co's shares have declined by 2.10% and in the past one week the stock has moved down 2.25%. Moreover, in the last six months the stock has lost 20.25% and year to date the shares have shed 32.59%. Further, Hewlett-Packard Co has a current dividend yield of 2.65%. The company is trading at a price to earnings ratio of 10.83, compared to the historical PE ratio of 13.68. Additionally, the stock is trading at a price to sales ratio of 0.45. The complimentary notes on HPQ can be downloaded in PDF format at: http://www.aciassociation.com/HPQ.pdf -- About ACI Association: Active Charter Investors Association (\"ACI Association\") produces regular sponsored and non-sponsored reports, articles, stock market blogs, and popular investment newsletters covering equities listed on NYSE and NASDAQ and micro-cap stocks. ACI Association has two distinct and independent departments. One department produces non-sponsored analyst certified content generally in the form of press releases, articles and reports covering equities listed on NYSE and NASDAQ and the other produces sponsored content (in most cases not reviewed by a registered analyst), which typically consists of compensated investment newsletters, articles and reports covering listed stocks and micro-caps. Such sponsored content is outside the scope of procedures detailed below. ACI Association has not been compensated; directly or indirectly; for producing or publishing this document. PRESS RELEASE PROCEDURES: The non-sponsored content contained herein has been prepared by a writer (the \"Author\") and is fact checked and reviewed by a third party research service company (the \"Reviewer\"). Rohit Tuli , a CFAÂ® charter holder (the \"Sponsor\"), provides necessary guidance in preparing the document templates. The Reviewer has reviewed and revised the content, as necessary, based on sound investment judgment and publicly available information which is believed to be reliable. The Reviewer and the Sponsor have not performed any independent investigations or forensic audits to validate the information herein. Unless otherwise noted, any content outside of this document has no association with the Author, the Reviewer, or the Sponsor (collectively referred to as the \"Production Team\") in any way. The Production Team is compensated on a fixed monthly basis and do not hold any positions of interest in any of the securities mentioned herein. NO WARRANTY ACI Association, the Author, the Reviewer and the Sponsor (collectively referred to as the \"Publishers\") are not responsible for any error which may be occasioned at the time of printing of this document or any error, mistake or shortcoming. No liability is accepted by the Publishers whatsoever for any direct, indirect or consequential loss arising from the use of this document. The Publishers expressly disclaim any fiduciary responsibility or liability for any consequences, financial or otherwise arising from any reliance placed on the information in this document. Additionally, the Publishers do not (1) guarantee the accuracy, timeliness, completeness or correct sequencing of the information, or (2) warrant any results from use of the information. The included information is subject to change without notice. NOT AN OFFERING This document is not intended as an offering, recommendation, or a solicitation of an offer to buy or sell the securities mentioned or discussed, and is to be used for informational purposes only. Please read all associated disclosures and disclaimers in full before investing. Neither ACI Association nor any party affiliated with us is a registered investment adviser or broker-dealer with any agency or in any jurisdiction whatsoever. To download our report(s), read our disclosures, or for more information, visit http://www.aciassociation.com/ . RESTRICTIONS ACI Association is not available to residents of Belarus , Cuba , Canada , Iran , North Korea , Sudan , Syria or Somalia . CFAÂ® and Chartered Financial AnalystÂ® are registered trademarks owned by CFA Institute.", "external_links": [], "published": "2015-09-21T17:26:00.000+03:00", "crawled": "2015-09-21T17:13:31.787+03:00", "highlightTitle": ""}