{"organizations": ["Electronic Arts Inc.", "Wedbush", "Madden NFL", "SVP of Technology for Pixar Animation Studios", "Take-Two Interactive Software, Inc.", "FN Media Group LLC", "Citi 2015 Global Technology Conference", "FNMG", "Zynga Inc.", "Gearbox Software", "SPYR APPS", "Company", "New Strategies and Product Launches Mobile & Digital Gaming App Industry Seeing Significant Growth as Developers Capitalize", "Zynga", "Microsoft", "Activision Publishing, Inc.", "Business Intelligence", "Glu Mobile Inc.", "Activision Blizzard Inc.", "Board of Directors", "LLC", "Glu", "Canaccord Genuity", "CTO of Walt Disney Animation Studios", "Canaccord Genuity 2015 Global Online Gaming Conference", "Securities and Exchange Commission", "SPYR"], "uuid": "d14c9348c88acb527f17af29066a0ea4a998e4d2", "thread": {"social": {"gplus": {"shares": 0}, "pinterest": {"shares": 0}, "vk": {"shares": 0}, "linkedin": {"shares": 0}, "facebook": {"likes": 0, "shares": 0, "comments": 0}, "stumbledupon": {"shares": 0}}, "site_full": "science-technology.news-articles.net", "main_image": "", "site_section": "http://science-technology.news-articles.net/content/rss.php", "section_title": "Science and Technology @ News Articles Network", "url": "http://science-technology.news-articles.net/content/mobile-digital-gaming-app-industry-seeing-significant-growth-developers-capitalize-new-strategies-product-launches.xhtml", "country": "US", "title": "Mobile & Digital Gaming App Industry Seeing Significant Growth as Developers Capitalize on New Strategies and Product Launches", "performance_score": 0, "site": "news-articles.net", "participants_count": 0, "title_full": "Mobile & Digital Gaming App Industry Seeing Significant Growth as Developers Capitalize on New Strategies and Product Launches", "spam_score": 0.0, "site_type": "news", "published": "2015-09-09T19:39:00.000+03:00", "replies_count": 0, "uuid": "d14c9348c88acb527f17af29066a0ea4a998e4d2"}, "author": "", "url": "http://science-technology.news-articles.net/content/mobile-digital-gaming-app-industry-seeing-significant-growth-developers-capitalize-new-strategies-product-launches.xhtml", "ord_in_thread": 0, "title": "Mobile & Digital Gaming App Industry Seeing Significant Growth as Developers Capitalize on New Strategies and Product Launches", "locations": ["New York", "EA", "Nuketown", "CORAL SPRINGS", "Florida"], "entities": {"persons": [], "locations": [], "organizations": []}, "highlightText": "", "language": "english", "persons": ["Michael Pactcher", "Lee", "Thind", "Greg", "Ari Arad", "Avi", "Niccolo de Masi", "Lincoln Brown", "Brandeau", "Greg Brandeau", "David Lee", "Brown", "Paul Thind"], "text": "Mobile & Digital Gaming App Industry Seeing Significant Growth as Developers Capitalize on New Strategies and Product Launches   Published on 2015-09-09 08:47:47 Mobile & Digital Gaming App Industry Seeing Significant Growth as Developers... -- CORAL SPRINGS, Florida, September 9,   <-   CORAL SPRINGS, Florida , September 9,   The mobile gaming and digital app industry is a battle of smash hits and a single winning game or app can drive years of profitability for developers. Mobile Gaming and App Developers in focus with recent developments are SPYR, INC. (OTC: SPYR), Zynga Inc. (NASDAQ: ZNGA ), Glu Mobile Inc. (NASDAQ: GLUU ), Electronic Arts Inc. (NASDAQ: EA ) and Activision Blizzard Inc. (NASDAQ: ATVI ) SPYR, INC. (OTCQB: SPYR), a holding company with wholly owned subsidiaries in the digital publishing and advertising industry, mobile game and app development industry, and the food service industry, today followed up its recent announcement of the appointment of Paul Thind as Managing Director of the Company's wholly owned subsidiary, SPYR APPS, LLC, which focuses on the development of digital games and applications, by revealing some of the strategic goals and actions Mr. Thind expects to implement early in his tenure with the Company. More specifically, Mr. Thind has already taken steps to: - Establish a core team of mobile games industry professionals in Marketing, Business Intelligence, Studio and Production; - Establish a team of industry expert advisors to assist with strategic direction of the Games Publishing Division; - Source the first round of third party Mobile Games that will be published under the SPYR APPS label; and - Initiate a \"soft launch\" of SPYR APPS' third original IP mobile title in core test markets. Read the full SPYR Press Release at http://www.financialnewsmedia.com/profiles/spyr.html Mr. Thind from SPYR concluded, \"Through dramatic expansion, procurement of co-development deals, acquisitions and games publishing, we intend to position SPYR APPS for continued success. Our company culture will be based on the Key Performance Indicators and strong analytics-based thinking that I've found to be incredibly successful in the free to play mobile games business. This, along with the creativity of our game designers, producers and developer partners should position SPYR APPS as a major player in the global games and apps market. Of course it all starts with the user, and we will be committed to creating fun experiences for our users to keep them engaged and satisfied.\" According to NewZoo, a games market researcher (newzoo.com), the mobile games market will rise to an impressive $35.4 Billion USD by 2017. SPYR APPS, LLC believes that it is poised to be a part of this growth by beefing up its team and its games portfolio under the leadership of Mr. Thind. In other gaming news and recent developments: Zynga Inc. (NASDAQ: ZNGA ), a leading social game developer, announced that it will speak at the Canaccord Genuity 2015 Global Online Gaming Conference in New York on Today, September 9, 2015, and the Citi 2015 Global Technology Conference in New York on September 10, 2015. Zynga's Chief Financial Officer, David Lee , and Senior Vice President of Games, Lincoln Brown , will attend the Canaccord Genuity 2015 Global Online Gaming Conference in New York on Today, September 9. Brown will participate in a panel discussion on social casino games that is scheduled to begin at 8:00 a.m. Eastern Daylight Time (EDT). Lee will also participate in a fireside chat at the Citi 2015 Global Technology Conference in New York on Thursday, September 10, at 11:00 a.m. EDT. Glu Mobile Inc. (NASDAQ: GLUU ), a leading global developer and publisher of free-to-play games for smartphone and tablet devices, recently announced that Greg Brandeau has joined the company's Board of Directors. Brandeau brings to Glu a strong background in technology management experience. As the former CTO of Walt Disney Animation Studios and former SVP of Technology for Pixar Animation Studios, he is uniquely positioned to offer world-class engineering leadership expertise as Glu continues to expand its digital entertainment portfolio. \"Greg has a proven track record as a leader in the entertainment technology space,\" said Niccolo de Masi , Glu Chairman and CEO. \"We expect that his experience and commitment to innovation will provide tremendous value to Glu's Board of Directors. We look forward to his contributions.\" According to analyst Michael Pactcher of Wedbush, a leading authority on gaming space, Electronic Arts Inc. (NASDAQ: EA )'s Madden NFL 16 will lead all sales \"by a wide margin\" with 1.33 million units sold, including 100,000 bundle units. The analyst added that the game benefited from the strongest review in five years and was also aided by the continued expansion of next-gen console sales. Activision Blizzard (NASDAQ: ATVI ) News: A re-imagined version of the fan-favorite multiplayer map Nuketown, is coming to Call of Duty®: Black Ops III. Set in the year 2065 and refreshed for a new generation of gameplay, Nuk3town integrates Black Ops III's new momentum-based chained-movement system, taking players into intense close-quarters action that they've come to expect. Fans that pre-order the game will receive the Nuk3town downloadable bonus map as an in-box download code, available with launch units of Call of Duty: Black Ops III for PlayStation®4 computer entertainment system, Xbox One, the all-in-one games and entertainment system from Microsoft and PC. Published by Activision Publishing, Inc., a wholly owned subsidiary of Activision Blizzard (Nasdaq: ATVI ), and developed by award-winning developer Treyarch, Call of Duty: Black Ops III will arrive in stores Friday, November 6. Lionsgate (NYSE: LGF ), a premier next generation global content leader, is teaming with the publisher and creators of Borderlands®, and renowned producers Avi and Ari Arad to adapt Gearbox Software's critically-acclaimed blockbuster video game Borderlands into a tent-pole feature film, the parties announced late last month. Borderlands is an action role-playing first-person shooter video game created and developed by Gearbox Software and published by 2K, a wholly owned label of Take-Two Interactive Software, Inc. (NASDAQ: TTWO ). FinancialNewsMedia.com is leading provider of third party publishing & news dissemination services. If you would like more information regarding our news coverage solutions, please visit http://www.financialnewsmedia.com for more details. Get an edge on the market with our Premium News Alerts that are FREE for a limited time at http://www.financialnewsmedia.com/ . Follow us on Facebook: http://www.facebook.com/financialnewsmedia and Twitter: http://twitter.com/FNMgroup . DISCLAIMER: FN Media Group LLC (FNMG) is a third party publisher and news dissemination service provider, which disseminates electronic information through multiple online media channels. FNMG is NOT affiliated in any manner with any company mentioned herein. FNMG and its affiliated companies are a news dissemination solutions provider and are NOT a registered broker/dealer/analyst/adviser, holds no investment licenses and may NOT sell, offer to sell or offer to buy any security. FNMG's market updates, news alerts and corporate profiles are NOT a solicitation or recommendation to buy, sell or hold securities. The material in this release is intended to be strictly informational and is NEVER to be construed or interpreted as research material. All readers are strongly urged to perform research and due diligence on their own and consult a licensed financial professional before considering any level of investing in stocks. All material included herein is republished content and details which were previously disseminated by the companies mentioned in this release. FNMG is not liable for any investment decisions by its readers or subscribers. Investors are cautioned that they may lose all or a portion of their investment when investing in stocks. For current services performed FNMG has been compensated three thousand five hundred dollars for news coverage of the current press release issued by SPYR, INC. by a non-affiliated. FNMG HOLDS NO SHARES OF ANY COMPANY NAMED IN THIS RELEASE. This release contains \"forward-looking statements\" within the meaning of Section 27A of the Securities Act of 1933, as amended, and Section 21E the Securities Exchange Act of 1934, as amended and such forward-looking statements are made pursuant to the safe harbor provisions of the Private Securities Litigation Reform Act of 1995. \"Forward-looking statements\" describe future expectations, plans, results, or strategies and are generally preceded by words such as \"may\", \"future\", \"plan\" or \"planned\", \"will\" or \"should\", \"expected,\" \"anticipates\", \"draft\", \"eventually\" or \"projected\". You are cautioned that such statements are subject to a multitude of risks and uncertainties that could cause future circumstances, events, or results to differ materially from those projected in the forward-looking statements, including the risks that actual results may differ materially from those projected in the forward-looking statements as a result of various factors, and other risks identified in a company's annual report on Form 10-K or 10-KSB and other filings made by such company with the Securities and Exchange Commission. You should consider these factors in evaluating the forward-looking statements included herein, and not place undue reliance on such statements. The forward-looking statements in this release are made as of the date hereof and FNMG undertakes no obligation to update such statements. Contact Information:", "external_links": [], "published": "2015-09-09T19:39:00.000+03:00", "crawled": "2015-09-09T19:27:22.142+03:00", "highlightTitle": ""}