{"organizations": ["NetSuite Today", "Big Data", "Retalon Inc", "Field Marketing SweetWater Brewing Company", "EMV"], "uuid": "6f5c6d0b7a98d3d0c7e7d694632c170889e59a2a", "thread": {"social": {"gplus": {"shares": 0}, "pinterest": {"shares": 0}, "vk": {"shares": 0}, "linkedin": {"shares": 0}, "facebook": {"likes": 0, "shares": 0, "comments": 0}, "stumbledupon": {"shares": 0}}, "site_full": "www.innovativeretailtechnologies.com", "main_image": "", "site_section": "http://www.retailsolutionsonline.com/rssfeeds/rssnews", "section_title": "Innovative Retail Technologies News", "url": "http://www.innovativeretailtechnologies.com/doc/inside-gilts-cloud-mpos-wins-0001?atc~c=771+s=773+r=001+l=a", "country": "US", "title": "09.28.15 -- Inside Gilt's Cloud, mPOS Wins", "performance_score": 0, "site": "innovativeretailtechnologies.com", "participants_count": 0, "title_full": "09.28.15 -- Inside Gilt's Cloud, mPOS Wins", "spam_score": 0.0, "site_type": "news", "published": "2015-09-25T03:16:00.000+03:00", "replies_count": 0, "uuid": "6f5c6d0b7a98d3d0c7e7d694632c170889e59a2a"}, "author": "", "url": "http://www.innovativeretailtechnologies.com/doc/inside-gilts-cloud-mpos-wins-0001?atc~c=771+s=773+r=001+l=a", "ord_in_thread": 0, "title": "09.28.15 -- Inside Gilt's Cloud, mPOS Wins", "locations": ["United States", "Overstock.com", "Atlanta", "Georgia", "SweetWater"], "entities": {"persons": [], "locations": [], "organizations": []}, "highlightText": "", "language": "english", "persons": ["Klarna", "Matt Pillar", "Christine Kern", "Matt Rhodus", "Marco La Vecchia", "Erin Harris", "Mark Krupnik"], "text": "09.28.15 -- Inside Gilt's Cloud, mPOS Wins Inside Gilt's Omni-Channel Success Story By Erin Harris, editor in chief An mPOS solution helped Gilt streamline operations in its pop-up shops and spark new ideas for a better customer experience. Guest Column Task Management Problems? What shoppers don’t see, but store managers know all too well, is the amount of planning that goes on behind the scenes in order to deliver a reliable customer experience. Whether it’s a local grocery store or a national hardware retailer, all of the products you see on the shelves were produced, packaged, and shipped to that location — then unboxed, displayed, and sold to customers by trained associates. Featured Content By Marco La Vecchia, VP channel sales, AVG Technologies Retailers say the proposal marks a “step back” for career-track workers. 5 Key Trends In Employee Recognition Continued employee engagement is one of the keys to human capital management for HR leaders at large corporations. When people work for big businesses, they sometimes find themselves too caught up in the rigmarole of their daily operations, and they lose sight of their employers’ vision and their own individual career goals. By Matt Pillar, senior executive editor Smarter fulfillment decisions help a regional specialty sporting goods store save 40 labor hours per week. Predictive Analytics: Transforming Omni-Channel Retail A Q&A with Mark Krupnik, PhD, president & CEO, Retalon Inc. Retalon is known for Smart Fulfillment. What does that mean for the retailer? We are known for having the only fully integrated predictive analytics solution available for retailers. Smart Fulfillment is a small, but important part of it, and I will address it in the next question. How Clienteling Improves The In-Store Experience By Matt Rhodus, NetSuite Today’s customers expect retailers to be able to provide them with a highly personalized omni-channel shopping experience based on who they are and their shopping and buying habits and history. By Christine Kern, contributing writer Klarna partners with Overstock.com to offer new payment options online. How Craft Brewery Streamlines Field Marketing SweetWater Brewing Company is a craft brewing company based out of Atlanta, Georgia. Famous for their colorful logo and delicious brews, SweetWater’s popularity in the United States over the last few years has skyrocketed. As expansion became more of a priority, the company added a field marketing department. To compliment their hard-working team, SweetWater needed a robust data collection tool that would increase efficiency and enable information sharing. Want Your Next Project Funded? The Green Light Is In The Data By Matt Pillar, senior executive editor Big Data isn’t all about consumer intelligence. There’s an equally important, albeit less flashy application for Big Data in retail, and it addresses a challenge virtually all technology and operations budget stakeholders face: getting signoff on capex initiatives. Editor's Notebook By Matt Pillar, senior executive editor October first is this Thursday. It’s D-day for the EMV liability shift, the big deadline that’s been all the hullabaloo in retail payment circles for the last, I don’t know, five or ten years. And despite estimates that some 8 in 10 small to midsized retailers hadn’t adopted EMV-ready systems as of mid-September (according to a Software Advice study), the sky has not begun to fall. Sponsor Luxury Interactive was created in 2007 in response to a tremendous growth opportunity in the luxury space and a widening gap of understanding how luxury companies can fully take advantage of opportunities in the digital marketplace. For the past nine years, we have built a loyal audience, where 300+ executives gather to network and share their insights to challenges and opportunities in digital and online.", "external_links": [], "published": "2015-09-25T03:16:00.000+03:00", "crawled": "2015-09-28T20:19:36.727+03:00", "highlightTitle": ""}