{"organizations": ["Bothell Call Center", "AT&T AT&T Inc.", "AT&T Intellectual Property", "AT&T Inc", "AT&T Customer Support Specialist Jobs AT&T", "AT&T Inc.", "AT&T"], "uuid": "734e8c761d8ce29f0f3c09146cd287d4949ff2c0", "thread": {"social": {"gplus": {"shares": 0}, "pinterest": {"shares": 0}, "vk": {"shares": 0}, "linkedin": {"shares": 0}, "facebook": {"likes": 0, "shares": 0, "comments": 0}, "stumbledupon": {"shares": 0}}, "site_full": "science-technology.news-articles.net", "main_image": "", "site_section": "http://science-technology.news-articles.net/content/rss.php", "section_title": "Science and Technology @ News Articles Network", "url": "http://science-technology.news-articles.net/content/now-hiring-washington-jobs-available.xhtml", "country": "US", "title": "AT&T Now Hiring In Washington With 165 Jobs Available", "performance_score": 0, "site": "news-articles.net", "participants_count": 0, "title_full": "AT&T Now Hiring In Washington With 165 Jobs Available", "spam_score": 0.0, "site_type": "news", "published": "2015-09-03T00:39:00.000+03:00", "replies_count": 0, "uuid": "734e8c761d8ce29f0f3c09146cd287d4949ff2c0"}, "author": "", "url": "http://science-technology.news-articles.net/content/now-hiring-washington-jobs-available.xhtml", "ord_in_thread": 0, "title": "AT&T Now Hiring In Washington With 165 Jobs Available", "locations": ["United States", "BOTHELL", "U.S.", "WA", "Washington", "Monte Villa Parkway", "Washington State", "Wash.", "Bothell", "Monte Villa Pkwy"], "entities": {"persons": [], "locations": [], "organizations": []}, "highlightText": "", "language": "english", "persons": ["Bob Bass"], "text": "AT&T Now Hiring In Washington With 165 Jobs Available   Published on 2015-09-02 10:03:05 AT&T Now Hiring In Washington With 165 Jobs Available -- BOTHELL, Wash., Sept. 2,   AT&T Inc. logo AT&T Inc. logo <-  <- stripped tags -> BOTHELL, Wash. , Sept. 2,   [[UEdFZ2NtVnNQVndpYm05bWIyeHNiM2RjSWlCdmJtTnNhV05yUFNkc2FXNXJUMjVEYkdsamF5aDBhR2x6S1NjZ2FISmxaajFjSW1oMGRIQTZMeTkzZDNjdVlYUjBMbU52YlM5blpXNHZiR0Z1WkdsdVp5MXdZV2RsY3o5d2FXUTlNek13T1Z3aUlISmxiRDFjSW01dlptOXNiRzkzWENJZ2RHRnlaMlYwUFZ3aVgySnNZVzVyWENJK1FWUW1WRHd2WVQ0PXw=]]* today announced the company is recruiting candidates for 165 positions available in Washington State. The company is seeking to fill 95 customer support specialist jobs in Bothell, Washington , and 70 retail sales associate positions at its 43 retail stores throughout the state. AT&T employee benefits include benefits include: medical/dental/vision, ability to earn up to 22 paid days off per year, discounts on AT&T products and services, tuition reimbursement, pre-taxed flexible spending accounts, life insurance and 401K with a company match. About AT&T Customer Support Specialist Jobs AT&T is seeking both Customer Support Specialists and Live Chat Customer Support Specialists at the company's Call Center located at 3755 Monte Villa Parkway in Bothell . Customer Support Specialists handle calls from internal and external customers related to troubleshooting, warranties, network coverage, handsets and devices, accessories, billing, rate plans, features and services, and repair. Live Chat Customer Support Specialists correspond with our customers via live chat. They handle inquiries from customers related to billing, rate plans, features, coverage, accessories, troubleshooting and more. AT&T's call center features workout facilities, and discounted childcare as well as walking trails and quiet rooms. AT&T Hiring Fair, September 11, 2015 AT&T is hosting a hiring fair for the Customer Support Specialist Positions on Friday, September 11, 2015 from 9:00 a.m. to 3:00 p.m. at the company's Bothell Call Center located at 3755 Monte Villa Pkwy, Bothell, WA 98021. Attendees will have the opportunity to learn about the Customer Support Specialist careers, meet with AT&T staffing and hiring Managers, apply for the Customer Support Specialist role, be tested and interviewed on the spot. Attendees will also learn about the benefits we offer and our career growth opportunities. Job seekers who are interested but unable to attend the hiring fair may apply online today at http://attlinks.com/bothellcallcenter About AT&T Retail Sales Associate Jobs AT&T's current full-time Retail Sales Consultants earn an average of $47,175.00 in total compensation in the first year when successfully meeting or exceeding sales goals. Retail Sales Consultant role and responsibilities include: developing and attaining customer experience and sales objectives for the store; selling products and services offered by the company; handling administrative aspects of the sale including completing customer contracts and warranties, pulling products from inventory, accepting customer payments and filing the completed orders; and more. \"AT&T is innovating and investing in Washington to make sure our customers continue to have the best retail experience, customer service, products and services available,\" said Bob Bass , Washington President, AT&T. \"Anyone who is interested in being part of a great company and making a positive difference for the people of Washington should check out AT&T.\" AT&T employs approximately 4,500 people in Washington . With highly competitive wages and benefits, AT&T jobs are among the best in the United States. Interested job seekers may apply online by visiting the AT&T online job center at http://att.jobs . Selected candidates will receive paid job training. *AT&T products and services are provided or offered by subsidiaries and affiliates of AT&T Inc. under the AT&T brand and not by AT&T Inc. About AT&T AT&T Inc. (NYSE: T ) helps millions around the globe connect with leading entertainment, mobile, high speed Internet and voice services. We're the world's largest provider of pay TV. We have TV customers in the U.S. and 11 Latin American countries. In the U.S., our wireless network offers the nation's strongest LTE signal and the most reliable 4G LTE network. We offer the best global wireless coverage*. And we help businesses worldwide serve their customers better with our mobility and secure cloud solutions. Additional information about AT&T products and services is available at http://about.att.com . Follow our news on Twitter at @ATT, on Facebook at http://www.facebook.com/att and YouTube at http://www.youtube.com/att . Â© 2015 AT&T Intellectual Property. All rights reserved. AT&T, the Globe logo and other marks are trademarks and service marks of AT&T Intellectual Property and/or AT&T affiliated companies. All other marks contained herein are the property of their respective owners.", "external_links": [], "published": "2015-09-03T00:39:00.000+03:00", "crawled": "2015-09-03T00:28:23.808+03:00", "highlightTitle": ""}