{"organizations": ["U.S. Securities and Exchange Commission", "Ltd", "Global Service", "Enphase Energy for Commercial Customers", "Enphase Energy, Inc.", "Inc", "Inc.", "JinkoSolar Holding Co.", "SHANGHAI   JinkoSolar Holding Co.", "Ltd."], "uuid": "694a279d906dd633d62a4ce188f865f00f8e00a5", "thread": {"social": {"gplus": {"shares": 0}, "pinterest": {"shares": 0}, "vk": {"shares": 0}, "linkedin": {"shares": 0}, "facebook": {"likes": 0, "shares": 0, "comments": 0}, "stumbledupon": {"shares": 0}}, "site_full": "science-technology.news-articles.net", "main_image": "", "site_section": "http://science-technology.news-articles.net/content/rss.php", "section_title": "Science and Technology @ News Articles Network", "url": "http://science-technology.news-articles.net/content/jinkosolar-offers-bundle-enphase-energy-commercial-customers.xhtml", "country": "US", "title": "JinkoSolar Offers Bundle with Enphase Energy for Commercial Customers", "performance_score": 0, "site": "news-articles.net", "participants_count": 0, "title_full": "JinkoSolar Offers Bundle with Enphase Energy for Commercial Customers", "spam_score": 0.0, "site_type": "news", "published": "2015-09-16T14:43:00.000+03:00", "replies_count": 0, "uuid": "694a279d906dd633d62a4ce188f865f00f8e00a5"}, "author": "", "url": "http://science-technology.news-articles.net/content/jinkosolar-offers-bundle-enphase-energy-commercial-customers.xhtml", "ord_in_thread": 0, "title": "JinkoSolar Offers Bundle with Enphase Energy for Commercial Customers", "locations": ["United States", "United Arab Emirates", "Portugal", "Saudi Arabia", "Morocco", "SHANGHAI", "Costa Rica", "Spain", "Chile", "Switzerland", "Italy", "India", "France", "Kenya", "Jordan", "Malaysia", "Australia", "South Africa", "Zhejiang Provinces", "China", "Ghana", "O&M", "United Kingdom", "Egypt", "Mexico", "U.S.", "Canada", "Brazil", "Belgium", "Singapore", "Germany", "Jiangxi", "Japan"], "entities": {"persons": [], "locations": [], "organizations": []}, "highlightText": "", "language": "english", "persons": ["JinkoSolar", "Martin Rogers", "Nigel Cockroft"], "text": "JinkoSolar Offers Bundle with Enphase Energy for Commercial Customers   JinkoSolar Offers Bundle with Enphase Energy for Commercial Customers -- SHANGHAI  <-   SHANGHAI   JinkoSolar Holding Co., Ltd. (\"JinkoSolar\"), a global leader in the photovoltaic (PV) industry, today announced that its wholly owned subsidiary, JinkoSolar (U.S.) Inc., has entered into an agreement with Enphase Energy, Inc. (NASDAQ: ENPH ), a global energy technology company, to create a new PV bundle for U.S. commercial & industrial customers. The bundle, which consists of a JinkoSolar module and an EnphaseÂ® Microinverter System, will give clients access to add on the Enphase 100% System Availability Guarantee O&M service program from Enphase Energy Services (EES). JinkoSolar is the first module manufacturer to receive 100% coverage through EES' comprehensive O&M solution: customers are compensated for covered downtime of module or microinverter. The JinkoSolar-Enphase Commercial PV Bundle with EES is expected to maximize project revenue and protect customers' investment through EES' O&M services by providing higher system availability, reduced installation time, and easier system design. \"Enphase is dedicated to establishing unprecedented standards for the solar industry,\" said Mr. Martin Rogers , Vice President, Global Service and Support at Enphase. \"JinkoSolar's proven record of product quality and reliability makes them an excellent partner for this O&M program, and we believe this solution will further validate solar as a solid financial investment.\" \"JinkoSolar and Enphase both share a similar commitment to quality and service. We are excited to offer this joint solution to commercial & industrial customers seeking not only the best module, but also the best performing solar systems and the peace-of-mind that systems will continue to perform as promised for 25 years or longer,\" said Mr. Nigel Cockroft , General Manager of JinkoSolar (U.S.) Inc. About JinkoSolar Holding Co., Ltd JinkoSolar (NYSE: JKS) is a global leader in the solar industry. JinkoSolar distributes its solar products and sells its solutions and services to a diversified international utility, commercial and residential customer base in China , the United States , Japan , Germany , the United Kingdom , Chile , South Africa , India , Mexico , Brazil , the United Arab Emirates , Italy , Spain , France , Belgium , and other countries and regions. JinkoSolar has built a vertically integrated solar product value chain, with an integrated annual capacity of 3 GW for silicon ingots and wafers, 2.5 GW for solar cells, and 4 GW for solar modules, as of June 30, 2015 . JinkoSolar also sells electricity in China , and has connected approximately 725 MW of solar power projects to the grid, as of June 30, 2015 . JinkoSolar has over 15,000 employees across its 5 productions facilities in Jiangxi and Zhejiang Provinces, China , Malaysia , Portugal and South Africa , 13 global sales offices in China , Spain , the United Kingdom , the United Arab Emirates , Jordan , Saudi Arabia , Egypt , Morocco , Kenya , Ghana , Brazil , Costa Rica and Mexico and 11 oversea subsidiaries in Germany , Italy , Switzerland , the United States , Canada , Australia , Singapore , Japan , India , South Africa and Chile . To find out more, please see: www.jinkosolar.com About Enphase Energy, Inc. Enphase Energy, a global energy technology company, is leading the charge to bring smart, connected solar energy to every home, business and community. The company delivers simple, innovative and reliable energy management solutions that advance the worldwide potential of renewable energy. Enphase has shipped approximately 9 million microinverters, and over 340,000 Enphase residential and commercial systems have been deployed in more than 95 countries. Join Enphase on LinkedIn and Twitter and visit www.enphase.com for more information. Safe Harbor Statement This press release contains forward-looking statements. These statements constitute \"forward-looking\" statements within the meaning of Section 27A of the Securities Act of 1933, as amended, and Section 21E of the Securities Exchange Act of 1934, as amended, and as defined in the U.S. Private Securities Litigation Reform Act of 1995. These forward-looking statements can be identified by terminology such as \"will,\" \"expects,\" \"anticipates,\" \"future,\" \"intends, \"plans,\" \"believes,\" \"estimates\" and similar statements. Among other things, the quotations from management in this press release and the Company's operations and business outlook, contain forward-looking statements. Such statements involve certain risks and uncertainties that could cause actual results to differ materially from those in the forward-looking statements. Further information regarding these and other risks is included in JinkoSolar's filings with the U.S. Securities and Exchange Commission, including its annual report on Form 20-F. Except as required by law, the Company does not undertake any obligation to update any forward-looking statements, whether as a result of new information, future events or otherwise. For investor and media inquiries, please contact: In China :", "external_links": [], "published": "2015-09-16T14:43:00.000+03:00", "crawled": "2015-09-16T14:31:21.737+03:00", "highlightTitle": ""}