{"organizations": ["Verisign", "CIRA", "Neustar", "Afilias", "CNW Telbec", "ICANN"], "uuid": "26f8c0d7434bd3e131deffe68263a0b178ecd734", "thread": {"social": {"gplus": {"shares": 0}, "pinterest": {"shares": 0}, "vk": {"shares": 0}, "linkedin": {"shares": 0}, "facebook": {"likes": 0, "shares": 0, "comments": 0}, "stumbledupon": {"shares": 0}}, "site_full": "www.newswire.ca", "main_image": "http://photos.newswire.ca/images/20150921_C4738_PHOTO_EN_497544.jpg", "site_section": "http://www.newswire.ca/rss/business-technology/all-business-technology-news.rss", "section_title": "CNW :  Business Technology", "url": "http://www.newswire.ca/news-releases/planethoster-receives-icann-accreditation-for-top-level-domain-tld-name-registration---planethoster-becomes-the-first-company-in-quebec-to-earn-this-certification-528471161.html", "country": "US", "title": "PlanetHoster receives ICANN accreditation for top-level domain (TLD) name registration - PlanetHoster becomes the first company in Quebec to earn this certification", "performance_score": 0, "site": "newswire.ca", "participants_count": 0, "title_full": "PlanetHoster receives ICANN accreditation for top-level domain (TLD) name registration - PlanetHoster becomes the first company in Quebec to earn this certification", "spam_score": 0.0, "site_type": "news", "published": "2015-09-21T13:00:00.000+03:00", "replies_count": 0, "uuid": "26f8c0d7434bd3e131deffe68263a0b178ecd734"}, "author": "", "url": "http://www.newswire.ca/news-releases/planethoster-receives-icann-accreditation-for-top-level-domain-tld-name-registration---planethoster-becomes-the-first-company-in-quebec-to-earn-this-certification-528471161.html", "ord_in_thread": 0, "title": "PlanetHoster receives ICANN accreditation for top-level domain (TLD) name registration - PlanetHoster becomes the first company in Quebec to earn this certification", "locations": ["France", "North America", "LAVAL", "Montreal", "Canada", "Quebec", "Paris", "Europe"], "entities": {"persons": [], "locations": [], "organizations": []}, "highlightText": "", "language": "english", "persons": ["Mina Shenouda", "PlanetHoster"], "text": "× PlanetHoster® (CNW Group/PlanetHoster) LAVAL, QC , Sept. 21, 2015 /CNW Telbec/ - PlanetHoster®, a company providing web hosting and other related services, announces today that it has successfully achieved ICANN certification. This certification enables the company to register top-level domain names such as .com, .net, .org, etc. PlanetHoster is the first company in Quebec to become ICANN accredited. PlanetHoster will offer very competitive rates and better protection for high value domain names, as well as direct contact with authorities in the event of dispute. Over the past months, the company has developed a state-of-the-art system in order to provide individuals, businesses and governmental institutions with top-quality web services. \"PlanetHoster is a web hosting leader in the Canadian and European market, and we take great pleasure in supporting Quebecers with our expertise,\" stated Mina Shenouda , COO of PlanetHoster. About PlanetHoster Inc. PlanetHoster provides web hosting, domain name registration, SSL certificate sale and other web-related services. The company has its own redundant computer network and serves more than 40,000 customers using its hybrid cloud infrastructure distributed over its facilities in Montreal, Canada and Paris, France . PlanetHoster's Anycast DNS and anti-DDOS serve more than 100,000 websites throughout North America and Europe . The ICANN accreditation is in addition to those already granted by CIRA, Afnic, DNSbe, DNSlu, EURid and SWITCH. The company specializes in turn-key solutions and rely on an experienced team of web hosting professionals dedicated to providing top-quality services to their customers. About ICANN An international non-profit organization responsible for the management of assigned domain names and numbers. It acts as one of internet's regulatory authorities. ICANN is responsible for issuing certification authorizing registrars to submit applications for top-level registries (e.g.: Afilias, Neustar, Verisign, etc.). \nImage with caption: \"PlanetHoster® (CNW Group/PlanetHoster)\". Image available at: http://photos.newswire.ca/images/download/20150921_C4738_PHOTO_EN_497544.jpg \nFor further information: Media Contact: PlanetHoster - Guillaume Renault, Office: 514-360-1802, guillaume@planethoster.info RELATED LINKS", "external_links": [], "published": "2015-09-21T13:00:00.000+03:00", "crawled": "2015-09-21T13:27:21.641+03:00", "highlightTitle": ""}