{"organizations": ["Super Micro Computer, Inc.", "SMCI", "Super Micro Computer", "Kessler Topaz Meltzer & Check", "SMCI Shareholder Class Action Filed Against Super Micro Computer, Inc.", "Company"], "uuid": "492d41af3732a7733746b6f4840b5edc618aee1a", "thread": {"social": {"gplus": {"shares": 0}, "pinterest": {"shares": 0}, "vk": {"shares": 0}, "linkedin": {"shares": 0}, "facebook": {"likes": 0, "shares": 0, "comments": 0}, "stumbledupon": {"shares": 0}}, "site_full": "science-technology.news-articles.net", "main_image": "", "site_section": "http://science-technology.news-articles.net/content/rss.php", "section_title": "Science and Technology @ News Articles Network", "url": "http://science-technology.news-articles.net/content/shareholder-class-action-filed-against-super-micro-computer-smci.xhtml", "country": "US", "title": "Shareholder Class Action Filed Against Super Micro Computer, Inc. - SMCI", "performance_score": 0, "site": "news-articles.net", "participants_count": 0, "title_full": "Shareholder Class Action Filed Against Super Micro Computer, Inc. - SMCI", "spam_score": 0.0, "site_type": "news", "published": "2015-09-09T19:39:00.000+03:00", "replies_count": 0, "uuid": "492d41af3732a7733746b6f4840b5edc618aee1a"}, "author": "", "url": "http://science-technology.news-articles.net/content/shareholder-class-action-filed-against-super-micro-computer-smci.xhtml", "ord_in_thread": 0, "title": "Shareholder Class Action Filed Against Super Micro Computer, Inc. - SMCI", "locations": ["United States", "RADNOR", "Esq", "Esq.", "Pa."], "entities": {"persons": [], "locations": [], "organizations": []}, "highlightText": "", "language": "english", "persons": ["D. Seamus Kaskela", "Darren J. Check", "Adrienne O. Bell"], "text": "Shareholder Class Action Filed Against Super Micro Computer, Inc. - SMCI   Published on 2015-09-09 09:02:47 Shareholder Class Action Filed Against Super Micro Computer, Inc. - SMCI -- RADNOR, Pa., Sept. 9,   <-   RADNOR, Pa. , Sept. 9,   The law firm of Kessler Topaz Meltzer & Check, LLP announces that a shareholder class action lawsuit has been filed against Super Micro Computer, Inc. (Nasdaq: SMCI ) (\"Super Micro Computer\" or the \"Company\") on behalf of purchasers of the Company's securities between September 15, 2014 and August 31, 2015 , inclusive (the \"Class Period\"). Super Micro Computer shareholders who wish to discuss this action and their legal options are encouraged to contact Kessler Topaz Meltzer & Check, LLP ( Darren J. Check, Esq. , D. Seamus Kaskela, Esq. or Adrienne O. Bell, Esq. ) at (888) 299-7706 or at info@ktmc.com . For additional information about this lawsuit, or to request information about this action online, please visit http://www.ktmc.com/new-cases/super-micro-computer-inc . Super Micro Computer develops and provides high-performance server solutions based on modular and open-standard architecture. The Complaint alleges that Super Micro Computer and certain of its executive officers made a series of false and misleading statements, and failed to disclose material adverse facts, about the Company's business, operations, and prospects. Specifically, the defendants are alleged to have made false and misleading statements and/or failed to disclose that: (i) the Company improperly recorded expenses in its financial reports; (ii) as a result, the Company's reported net income was misstated; (iii) the Company lacked adequate internal financial controls; and (iv) as a result of the above, the Company's financial statements were materially false and misleading at all relevant times. On August 31, 2015 , the Company disclosed that it had \"determined that it is unable to file its Annual Report on Form 10-K for the fiscal year ended June 30, 2015 within the prescribed time period without unreasonable effort or expense,\" and that it had \"recently discovered certain irregularities regarding certain marketing expenses and additional time is required for [the Company] to complete its investigation of the matter.\" On this news, shares of Super Micro Computer's stock declined $2.58 per share, or 9.4%, to close on September 1, 2015 at $24.77 per share, on heavy trading volume. If you wish to discuss this action or have any questions concerning this notice or your rights or interests with respect to these matters, please contact Kessler Topaz Meltzer & Check ( Darren J. Check, Esq. , D. Seamus Kaskela, Esq. or Adrienne O. Bell, Esq. ) at (888) 299 – 7706 or (610) 667 – 7706, or via e-mail at info@ktmc.com Super Micro Computer shareholders who are members of the class may, no later than November 3, 2015 , petition the Court for to be appointed as a lead plaintiff of the class. A lead plaintiff is a representative party who acts on behalf of other class members in directing the litigation. In order to be appointed as a lead plaintiff, the Court must determine that the class member's claim is typical of the claims of other class members, and that the class member will adequately represent the class in the action. Your ability to share in any recovery is not affected by the decision of whether or not to serve as a lead plaintiff. Any member of the purported class may move the court to serve as lead plaintiff through counsel of their choice, or may choose to do nothing and remain an absent class member. Kessler Topaz Meltzer & Check prosecutes class actions in state and federal courts throughout the country. Kessler Topaz Meltzer & Check is a driving force behind corporate governance reform, and has recovered billions of dollars on behalf of institutional and individual investors from the United States and around the world. The firm represents investors, consumers and whistleblowers (private citizens who report fraudulent practices against the government and share in the recovery of government dollars). The complaint in this action was not filed by Kessler Topaz Meltzer & Check. For more information about Kessler Topaz Meltzer & Check, or for additional information about participating in this action, please visit www.ktmc.com . CONTACT: Kessler Topaz Meltzer & Check, LLP Darren J. Check, Esq.", "external_links": [], "published": "2015-09-09T19:39:00.000+03:00", "crawled": "2015-09-09T19:27:21.752+03:00", "highlightTitle": ""}