{"organizations": ["Trai", "Airtel", "TRAI", "Telecom Regulatory Authority of India", "PTI", "Times of India News"], "uuid": "19a756d09181af98fdf748f133e63ce2569954c4", "thread": {"social": {"gplus": {"shares": 0}, "pinterest": {"shares": 0}, "vk": {"shares": 0}, "linkedin": {"shares": 0}, "facebook": {"likes": 0, "shares": 0, "comments": 0}, "stumbledupon": {"shares": 0}}, "site_full": "timesofindia.indiatimes.com", "main_image": "http://timesofindia.indiatimes.com/photo/45317755.cms", "site_section": "http://timesofindia.indiatimes.com/rssfeeds/5880659.cms", "section_title": "Technology News, Latest Gadget Reviews, Gaming & Tech Videos | Times of India", "url": "http://timesofindia.indiatimes.com/tech/tech-news/PM-Modi-concerned-government-scrambles-to-fix-call-drops/articleshow/48760803.cms", "country": "IL", "title": "PM Modi concerned, government scrambles to fix call drops", "performance_score": 1, "site": "indiatimes.com", "participants_count": 0, "title_full": "PM Modi concerned, government scrambles to fix call drops", "spam_score": 0.0, "site_type": "news", "published": "2015-09-01T16:23:00.000+03:00", "replies_count": 0, "uuid": "19a756d09181af98fdf748f133e63ce2569954c4"}, "author": "", "url": "http://timesofindia.indiatimes.com/tech/tech-news/PM-Modi-concerned-government-scrambles-to-fix-call-drops/articleshow/48760803.cms", "ord_in_thread": 0, "title": "PM Modi concerned, government scrambles to fix call drops", "locations": ["Mumbai", "Delhi", "India"], "entities": {"persons": [], "locations": [], "organizations": []}, "highlightText": "", "language": "english", "persons": ["Rakesh Garg", "Prasad", "Sharma", "Modi", "Narendra Modi"], "text": "PM Modi concerned, government scrambles to fix call drops PTI | Sep 1, 2015, 06.53 PM IST TRAI will soon ask telecom companies to disclose information related to their services, which would be publicized so that customers are aware of capacity of their operator. RELATED NEW DELHI: Amid Prime Minister Narendra Modi's concerns over call drops, the government has initiated steps to address the problem, with regulator TRAI being asked to seek information from telecom operators about their infrastructure and capacity for providing effective services. TRAI will soon ask telecom companies to disclose information related to their services, which would be publicized so that customers are aware of capacity of their operator and enable them to choose their service provider. READ ALSO: Facing call drops? Prime Minister Narendra Modi wants it to be fixed urgently \"First of all they have to disclose this information to us. TRAI has the authority to call for information relating to service, they will provide the information, which we will publish so ultimately public will get the information,\" Telecom Regulatory Authority of India (TRAI) chairman RS Sharma told PTI. -- He said TRAI is preparing a status or information paper which gives a detailed analysis of the extent of call drops especially in two cities of Delhi and Mumbai on the basis of data available and the regulator will publish it. READ ALSO: Government tells Trai to examine telcos' tariff plans to check call drops \"So essentially that will bring out not only the extent of call drops, it will also bring out the potential causes of call drops and therefore the operators what the operators should do will come out of that,\" Sharma added. The move is part of DoT's efforts to curb the menace of call drops and also let people to make a concerted decision while choosing a operator. READ ALSO: Telcos: Can't be blamed alone for call drops PM Modi had last week voiced serious concern over the menace of call drops and asked officials concerned to take urgent steps to address it as it affects the common people. The Prime Minister is believed to have told telecom secretary Rakesh Garg personally that people get irritated due to call drops and \"curse the government\" and this needs to be addressed on war-footing, the sources said. READ ALSO: Airtel subscribers suffer maximum call drops: TRAI PM Modi is worried that the problem may even affect data services in the future. The problem of call drops has become rather serious in the last 3-4 months and DoT has asked the telecom operators last week fix it speedily. The operators have sought 30-45 days to address it. DoT has already warned that if the operators fail to address the problem, the government has the option of levying penalty under the licence conditions. READ ALSO: According to the sources, Prasad, in a recent internal DoT meeting, said that there was lack of investment by operators to enhance their networks which was the main reason for call drops. Understanding call drops and how to reduce them... of 8 One of the most irritating things in todayâ€™s connected world are call drops. Carrying out an uninterrupted conversation through a cellphone is practically impossible.We explore major the major reasons for call drops and what consumers can do in short term to resolve this issue. Only 4.25 lakh mobile phone towers in India vs at least 6.25 lakh towers needed. Radiation concerns have led to people not renewing their leases to provide space for installing towers. Surging growth in data traffic and voice usage not met by adequate spectrum supply. Operators in India hold on an average 12-15MHz of airwaves vs 40-45MHz globally. Moreover, carriers cut capital expenditure due to financial limitations through years of competition. http://timesofindia.indiatimes.com/followceleb.cms?alias=Telecom operators,TRAI,Narendra Modi,call drops Stay updated on the go with Times of India News App. Click here to download it for your device.", "external_links": [], "published": "2015-09-01T16:23:00.000+03:00", "crawled": "2015-09-01T17:52:50.069+03:00", "highlightTitle": ""}