{"organizations": ["MXIM", "RSI", "Maxim Integrated Products", "NTELOS Holdings Technology Sector Equities", "AU Optronics", "Chartered Financial Analyst", "About Equity Research Institute", "Qorvo Inc.", "Freescale Semiconductor Ltd", "Technology Sector Equities", "Freescale Semiconductor", "NTELOS Holdings Corporation", "S&P", "NTELOS Holdings Corp.", "AU Optronics Corp.", "CFA Institute", "Maxim Integrated Products Inc.", "Equity Research Institute", "AU Optronics Corporation"], "uuid": "015467be6a2a13165eb46e9340a5f7ccb10f13d0", "thread": {"social": {"gplus": {"shares": 0}, "pinterest": {"shares": 0}, "vk": {"shares": 0}, "linkedin": {"shares": 0}, "facebook": {"likes": 0, "shares": 0, "comments": 0}, "stumbledupon": {"shares": 0}}, "site_full": "science-technology.news-articles.net", "main_image": "", "site_section": "http://science-technology.news-articles.net/content/rss.php", "section_title": "Science and Technology @ News Articles Network", "url": "http://science-technology.news-articles.net/content/technology-sector-equities-motion-qorvo-maxim-integrated-products-optronics-freescale-semiconductor-ntelos-holdings.xhtml", "country": "US", "title": "Technology Sector Equities in Motion -- Qorvo, Maxim Integrated Products, AU Optronics, Freescale Semiconductor, and NTELOS Holdings", "performance_score": 0, "site": "news-articles.net", "participants_count": 0, "title_full": "Technology Sector Equities in Motion -- Qorvo, Maxim Integrated Products, AU Optronics, Freescale Semiconductor, and NTELOS Holdings", "spam_score": 0.0, "site_type": "news", "published": "2015-09-16T18:47:00.000+03:00", "replies_count": 0, "uuid": "015467be6a2a13165eb46e9340a5f7ccb10f13d0"}, "author": "", "url": "http://science-technology.news-articles.net/content/technology-sector-equities-motion-qorvo-maxim-integrated-products-optronics-freescale-semiconductor-ntelos-holdings.xhtml", "ord_in_thread": 0, "title": "Technology Sector Equities in Motion -- Qorvo, Maxim Integrated Products, AU Optronics, Freescale Semiconductor, and NTELOS Holdings", "locations": ["Belarus", "Iran", "Cuba", "Canada", "Syria", "North Korea", "NEW YORK", "Sudan", "Somalia"], "entities": {"persons": [], "locations": [], "organizations": []}, "highlightText": "", "language": "english", "persons": ["ERI", "Rohit Tuli"], "text": "Technology Sector Equities in Motion -- Qorvo, Maxim Integrated Products, AU Optronics, Freescale Semiconductor, and NTELOS Holdings »   Published on 2015-09-16 07:47:45 Technology Sector Equities in Motion -- Qorvo, Maxim Integrated Products, AU Optronics,... -- NEW YORK, September  - <-   NEW YORK , September  - Equity Research Institute has initiated coverage on the following equities: Qorvo Inc. (NASDAQ: QRVO ), Maxim Integrated Products Inc. (NASDAQ: MXIM ), AU Optronics Corporation (NYSE: AUO ), Freescale Semiconductor Ltd (NYSE: FSL ), and NTELOS Holdings Corporation (NASDAQ: NTLS ). Free research report on Qorvo can be accessed at https://www.erionline.net/reports?keyword=QRVO On Tuesday, September 15, 2015 , the NASDAQ Composite ended at 4,860.52, up 1.14%, the Dow Jones Industrial Average advanced 1.40%, to finish the day at 16,599.85, and the S&P 500 closed at 1,978.09, up 1.28%. The gains were broad based as all the sectors ended the session in positive. Register for your complimentary reports at the links given below. Qorvo Inc.'s stock lost 1.42%, to close Tuesday's session at $52.73 . The stock recorded a trading volume of 1.83 million shares, below its three months average volume of 2.65 million shares. Over the last one month and the previous three months, Qorvo Inc.'s shares have lost 9.46% and 37.78%, respectively. Additionally, the stock has declined 25.10% since the start of this year. The company is trading 15.53% and 25.82% below its 50-day and 200-day moving averages, respectively. Furthermore, Qorvo Inc.'s stock traded at a PE ratio of 25.23 and has a Relative Strength Index (RSI) of 37.76. Sign up and read the free notes on QRVO at: https://www.erionline.net/reports?keyword=QRVO Maxim Integrated Products Inc.'s stock finished Tuesday's session 0.32% lower at $34.24 . A total of 1.87 million shares were traded, which was below its three months average volume of 2.87 million shares. Over the last one month and the previous three months, Maxim Integrated Products Inc.'s shares have advanced 2.60% and 1.37%, respectively. Furthermore, the stock has gained 10.17% since the beginning of 2015. The company's shares are trading above their 50-day and 200-day moving averages by 4.14% and 3.74%, respectively. Maxim Integrated Products Inc.'s stock traded at a PE ratio of 48.23 and has an RSI of 58.63. The complimentary notes on MXIM can be downloaded in PDF format at: https://www.erionline.net/reports?keyword=MXIM On Tuesday, shares in AU Optronics Corp. ended the session 1.20% higher at $3.38 . The stock reported a trading volume of 1.30 million shares, below its three months average volume of 1.94 million shares. Shares of the company traded at a PE ratio of 4.90. Although, AU Optronics Corp.'s shares have gained 11.55% in the last one month, it has lost 27.00% in the previous three months and 33.60% on YTD basis. The company is trading 1.00% below its 50-day moving average and 27.64% below its 200-day moving average. Moreover, shares of AU Optronics Corp. have an RSI of 57.32. Register for free on Equity Research Institute and access the latest research on AUO at: https://www.erionline.net/reports?keyword=AUO Freescale Semiconductor Ltd's stock edged 0.16% higher, to close the day at $37.77 . The stock recorded a trading volume of 0.74 million shares, much below its three months average volume of 2.05 million shares. Over the last one month and over the past three months, Freescale Semiconductor Ltd's shares have lost 0.40% and 9.71%, respectively. However, the stock has gained 49.70% since the start of this year. The company's shares are trading 4.16% above their 200-day moving average. Additionally, Freescale Semiconductor Ltd traded at a PE ratio of 31.21 and has an RSI of 55.17. The complete research on FSL is available for free at: https://www.erionline.net/reports?keyword=FSL On Tuesday, shares in NTELOS Holdings Corp. recorded a trading volume of 0.32 million shares, lower than their three months average volume of 0.72 million shares. The stock ended the day 0.11% lower at $9.09 . Although, NTELOS Holdings Corp.'s stock has lost 1.52% in the last one month, it has surged 63.49% in the previous three months and 116.95% on YTD basis. The company is trading above its 50-day and 200-day moving averages by 24.70% and 54.18%, respectively. Furthermore, shares of NTELOS Holdings Corp. have an RSI of 69.66. Free in-depth research on NTLS is available at: -- About Equity Research Institute: Equity Research Institute (\"ERI\") produces regular sponsored and non-sponsored reports, articles, stock market blogs, and popular investment newsletters covering equities listed on NYSE and NASDAQ and micro-cap stocks. ERI has two distinct and independent departments. One department produces non-sponsored analyst certified content generally in the form of press releases, articles and reports covering equities listed on NYSE and NASDAQ and the other produces sponsored content (in most cases not reviewed by a registered analyst), which typically consists of compensated investment newsletters, articles and reports covering listed stocks and micro-caps. Such sponsored content is outside the scope of procedures detailed below. ERI has not been compensated; directly or indirectly; for producing or publishing this document. PRESS RELEASE PROCEDURES: The non-sponsored content contained herein has been prepared by a writer (the \"Author\") and is fact checked and reviewed by a third party research service company (the \"Reviewer\"). Rohit Tuli , a CFA® charter holder (the \"Sponsor\"), provides necessary guidance in preparing the document templates. The Reviewer has reviewed and revised the content, as necessary, based on sound investment judgment and publicly available information which is believed to be reliable. The Reviewer and the Sponsor have not performed any independent investigations or forensic audits to validate the information herein. Unless otherwise noted, any content outside of this document has no association with the Author, the Reviewer, or the Sponsor (collectively referred to as the \"Production Team\") in any way. The Production Team is compensated on a fixed monthly basis and do not hold any positions of interest in any of the securities mentioned herein. NO WARRANTY ERI, the Author, the Reviewer and the Sponsor (collectively referred to as the \"Publishers\") are not responsible for any error which may be occasioned at the time of printing of this document or any error, mistake or shortcoming. No liability is accepted by the Publishers whatsoever for any direct, indirect or consequential loss arising from the use of this document. The Publishers expressly disclaim any fiduciary responsibility or liability for any consequences, financial or otherwise arising from any reliance placed on the information in this document. Additionally, the Publishers do not (1) guarantee the accuracy, timeliness, completeness or correct sequencing of the information, or (2) warrant any results from use of the information. The included information is subject to change without notice. NOT AN OFFERING This document is not intended as an offering, recommendation, or a solicitation of an offer to buy or sell the securities mentioned or discussed, and is to be used for informational purposes only. Please read all associated disclosures and disclaimers in full before investing. Neither ERI nor any party affiliated with us is a registered investment adviser or broker-dealer with any agency or in any jurisdiction whatsoever. To download our report(s), read our disclosures, or for more information, visit http://www.erionline.net . RESTRICTIONS ERI is not available to residents of Belarus , Cuba , Canada , Iran , North Korea , Sudan , Syria or Somalia . Do not send email to robottrap (at) erionline.net. CFA® and Chartered Financial Analyst® are registered trademarks owned by CFA Institute.", "external_links": [], "published": "2015-09-16T18:47:00.000+03:00", "crawled": "2015-09-16T18:34:19.052+03:00", "highlightTitle": ""}