{"organizations": ["U.S. Securities and Exchange Commission", "Eosol Energy", "Eosol Energy de Mexico", "Ltd", "PV Modules for Mexico", "JinkoSolar Holding Co.", "Ltd."], "uuid": "bd95b408bfb8db004019d0daabae33263fcd4747", "thread": {"social": {"gplus": {"shares": 0}, "pinterest": {"shares": 0}, "vk": {"shares": 0}, "linkedin": {"shares": 0}, "facebook": {"likes": 0, "shares": 0, "comments": 0}, "stumbledupon": {"shares": 0}}, "site_full": "science-technology.news-articles.net", "main_image": "", "site_section": "http://science-technology.news-articles.net/content/rss.php", "section_title": "Science and Technology @ News Articles Network", "url": "http://science-technology.news-articles.net/content/jinkosolar-supplies-modules-mexicos-largest-plant.xhtml", "country": "US", "title": "JinkoSolar Supplies 49.8 MW of PV Modules for Mexico's Largest PV Plant", "performance_score": 0, "site": "news-articles.net", "participants_count": 0, "title_full": "JinkoSolar Supplies 49.8 MW of PV Modules for Mexico's Largest PV Plant", "spam_score": 0.0, "site_type": "news", "published": "2015-09-28T15:39:00.000+03:00", "replies_count": 0, "uuid": "bd95b408bfb8db004019d0daabae33263fcd4747"}, "author": "", "url": "http://science-technology.news-articles.net/content/jinkosolar-supplies-modules-mexicos-largest-plant.xhtml", "ord_in_thread": 0, "title": "JinkoSolar Supplies 49.8 MW of PV Modules for Mexico's Largest PV Plant", "locations": ["United States", "United Arab Emirates", "Portugal", "Saudi Arabia", "Morocco", "SHANGHAI", "Costa Rica", "Spain", "Chile", "Switzerland", "Italy", "India", "France", "Durgango", "Kenya", "Jordan", "Malaysia", "Australia", "Durango", "South Africa", "Zhejiang Provinces", "China", "Ghana", "United Kingdom", "Egypt", "U.S.", "Mexico", "Canada", "Brazil", "Belgium", "Singapore", "Germany", "Jiangxi", "Japan"], "entities": {"persons": [], "locations": [], "organizations": []}, "highlightText": "", "language": "english", "persons": ["JinkoSolar", "Durango TAI", "Eosol", "Xiande Li"], "text": "JinkoSolar Supplies 49.8 MW of PV Modules for Mexico's Largest PV Plant   04:16:22 JinkoSolar Supplies 49.8 MW of PV Modules for Mexico's Largest PV Plant -- SHANGHAI, China, Sept.   <-   SHANGHAI, China , Sept.   JinkoSolar Holding Co., Ltd. (\"JinkoSolar\"), a global leader in the solar PV industry, today announced that it will supply TSK ElectrÃ³nica y Electricidad, S.A. (\"TSK\") with 49.8MW of PV solar modules for the largest solar PV plant in Mexico . Located in the State of Durgango, the solar PV plant (\"Durango TAI\") is the first PV solar plant in Mexico to be connected to the National Power System. Durango TAI is currently in the second stage of construction of phase one. The total five phases of 49.8 MW is expected to be completed this year. Eosol Energy de Mexico , S.A.P.I. de C.V. (\"Eosol\") is Durango TAI's developer and TSK will be managing the project. \"We are glad to cooperate with Eosol and TSK on Mexico's largest solar PV plant,\" commented Mr. Xiande Li , Chairman of JinkoSolar, \"This milestone project was carried out thanks to the reliability, knowhow and the synergy among all partners involved. We look forward to collaborating with Eosol and TSK on future projects.\" About JinkoSolar Holding Co., Ltd JinkoSolar (NYSE: JKS ) is a global leader in the solar industry. JinkoSolar distributes its solar products and sells its solutions and services to a diversified international utility, commercial and residential customer base in China , the United States , Japan , Germany , the United Kingdom , Chile , South Africa , India , Mexico , Brazil , the United Arab Emirates , Italy , Spain , France , Belgium , and other countries and regions. JinkoSolar has built a vertically integrated solar product value chain, with an integrated annual capacity of 3 GW for silicon ingots and wafers, 2.5 GW for solar cells, and 4 GW for solar modules, as of June 30, 2015 . JinkoSolar also sells electricity in China , and has connected approximately 725 MW of solar power projects to the grid, as of June 30, 2015 . JinkoSolar has over 15,000 employees across its 5 productions facilities in Jiangxi and Zhejiang Provinces, China , Malaysia , Portugal and South Africa , 13 global sales offices in China , Spain , the United Kingdom , the United Arab Emirates , Jordan , Saudi Arabia , Egypt , Morocco , Kenya , Ghana , Brazil , Costa Rica and Mexico and 11 oversea subsidiaries in Germany , Italy , Switzerland , the United States , Canada , Australia , Singapore , Japan , India , South Africa and Chile To find out more, please see: www.jinkosolar.com About TSK TSK is a global company specializing in the execution of turnkey projects spanning multiple sectors such as electricity infrastructure, industrial plants, power generation (conventional and renewable) energy, water treatment plants or storage facilities and materials management premiums. About Eosol Energy de Mexico , S.A.P.I. de C.V. Locally experienced with 5 turnkey solar projects in operation and more than 10 under development, Eosol Energy is a leading global developer of wind, photovoltaic, thermo solar and biomass renewable energy technologies with more than 2,600MW installed in more than 14 countries. Safe Harbor Statement This press release contains forward-looking statements. These statements constitute \"forward-looking\" statements within the meaning of Section 27A of the Securities Act of 1933, as amended, and Section 21E of the Securities Exchange Act of 1934, as amended, and as defined in the U.S. Private Securities Litigation Reform Act of 1995. These forward-looking statements can be identified by terminology such as \"will,\" \"expects,\" \"anticipates,\" \"future,\" \"intends, \"plans,\" \"believes,\" \"estimates\" and similar statements. Among other things, the quotations from management in this press release and the Company's operations and business outlook, contain forward-looking statements. Such statements involve certain risks and uncertainties that could cause actual results to differ materially from those in the forward-looking statements. Further information regarding these and other risks is included in JinkoSolar's filings with the U.S. Securities and Exchange Commission, including its annual report on Form 20-F. Except as required by law, the Company does not undertake any obligation to update any forward-looking statements, whether as a result of new information, future events or otherwise. For investor and media inquiries, please contact:In China :", "external_links": [], "published": "2015-09-28T15:39:00.000+03:00", "crawled": "2015-09-28T15:25:24.157+03:00", "highlightTitle": ""}