{"organizations": ["AT&T AT&T Inc.", "The Dan Patrick Show", "AT&T Inc", "AT&T Intellectual Property", "MMA", "Audience Network Now Available On AT&T", "AT&T", "Audience Network", "DIRECTV", "Calista Flockhart", "NBC", "Audience Network Now Available On AT&T U-verse DIRECTV", "AT&T Original Content", "AT&T Inc.", "Adding Audience Network"], "uuid": "9f3497eb95bc447e1cdba8472530632c1da47504", "thread": {"social": {"gplus": {"shares": 0}, "pinterest": {"shares": 0}, "vk": {"shares": 0}, "linkedin": {"shares": 0}, "facebook": {"likes": 0, "shares": 0, "comments": 0}, "stumbledupon": {"shares": 0}}, "site_full": "science-technology.news-articles.net", "main_image": "", "site_section": "http://science-technology.news-articles.net/content/rss.php", "section_title": "Science and Technology @ News Articles Network", "url": "http://science-technology.news-articles.net/content/directvs-audience-network-now-available-verse.xhtml", "country": "US", "title": "DIRECTV's Audience Network Now Available On AT&T U-verse", "performance_score": 0, "site": "news-articles.net", "participants_count": 0, "title_full": "DIRECTV's Audience Network Now Available On AT&T U-verse", "spam_score": 0.0, "site_type": "news", "published": "2015-09-30T23:49:00.000+03:00", "replies_count": 0, "uuid": "9f3497eb95bc447e1cdba8472530632c1da47504"}, "author": "", "url": "http://science-technology.news-articles.net/content/directvs-audience-network-now-available-verse.xhtml", "ord_in_thread": 0, "title": "DIRECTV's Audience Network Now Available On AT&T U-verse", "locations": ["Calif.", "U.S.", "Chicago", "El SEGUNDO"], "entities": {"persons": [], "locations": [], "organizations": []}, "highlightText": "", "language": "english", "persons": ["Dan Patrick Show", "Chris Long", "Neil LaBute", "Nick Jonas", "Rita Wilson", "Jessica Chastain", "Terry O'Quinn", "Lisa Joyce", "Thandie Newton", "Cole Hauser", "Billy & Billie", "Rose Byrne", "Keith Huff", "Matt Damon", "Eric McCormack", "Sam Jones", "Dan York", "Joe Buck", "Ricky Schroder", "Adam Brody", "Glenn Close", "Frank Grillo"], "text": "DIRECTV's Audience Network Now Available On AT&T U-verse   Published on 2015-09-30 10:46:31 DIRECTV's Audience Network Now Available On AT&T U-verse -- El SEGUNDO, Calif., Sept.   AT&T Inc. AT&T Inc.  ><- stripped tags -> El SEGUNDO, Calif. , Sept.   The fall TV season is now even more exciting for [[UEdFZ2NtVnNQVndpYm05bWIyeHNiM2RjSWlCdmJtTnNhV05yUFNkc2FXNXJUMjVEYkdsamF5aDBhR2x6S1NjZ2FISmxaajFjSW1oMGRIQTZMeTkxZG1WeWMyVXVZMjl0TDF3aUlISmxiRDFjSW01dlptOXNiRzkzWENJZ2RHRnlaMlYwUFZ3aVgySnNZVzVyWENJK1FWUW1WQ0JWTFhabGNuTmxQQzloUGc9PXw=]]® customers. Today, we're launching [[UEdFZ2NtVnNQVndpYm05bWIyeHNiM2RjSWlCdmJtTnNhV05yUFNkc2FXNXJUMjVEYkdsamF5aDBhR2x6S1NjZ2FISmxaajFjSW1oMGRIQnpPaTh2ZDNkM0xtUnBjbVZqZEhZdVkyOXRMMjVsZEhkdmNtdHpMMkYxWkdsbGJtTmxYQ0lnY21Wc1BWd2libTltYjJ4c2IzZGNJaUIwWVhKblpYUTlYQ0pmWW14aGJtdGNJajVCZFdScFpXNWpaU0JPWlhSM2IzSnJQQzloUGc9PXw=]] on the U-verse platform. U-verse customers can now watch Audience Network, previously only available on DIRECTV. Shows, like the highly acclaimed series Kingdom starring Nick Jonas , will air on channel 1114. U-verse customers can watch Audience Network's highly anticipated fall season line-up via live TV streaming on the U-verse App for smartphones and tablets and on Uverse.com. It boasts the second season premiere of Kingdom , the premiere of Undeniable with Joe Buck and new episodes of Off Camera with Sam Jones and Guitar Center Sessions. They can also catch up on the first season of Kingdom when it becomes available on U-verse On Demand and the U-verse App on Oct. 1 . \"We're always looking for new ways to give our customers the most value for their programming dollar. Adding Audience Network is a perfect way to do that,\" said Dan York , chief content officer, AT&T. \"There is no better time to experience Audience Network's compelling programming. Whether you're a movie buff, a sports fan or a music enthusiast, Audience Network's fall lineup has something for you.\" \"Since 2011, Audience Network has always had one goal— to create the most compelling original content for our customers and provide them with an entertainment experience that cannot be found anywhere else,\" said Chris Long , senior vice president, AT&T Original Content and Production. \"We're excited to share our wide variety of programming, like Kingdom , Guitar Center Sessions and Off Camera with Sam Jones , with U-verse's subscribers. We believe this helps set AT&T apart.\" Audience Network has been a premium exclusive for DIRECTV customers since 2011. It is the exclusive home for the smartest, most daring entertainment on television, from critically-acclaimed originals like ROGUE and The Fighting Season , to sports news programs including The Dan Patrick Show and The Rich Eisen Show, to concerts by today's hottest artists. Geographic and service restrictions apply to AT&T U-verse services. For more information on AT&T U-verse — or to find out if it's available in your area — visit [[UEdFZ2NtVnNQVndpYm05bWIyeHNiM2RjSWlCdmJtTnNhV05yUFNkc2FXNXJUMjVEYkdsamF5aDBhR2x6S1NjZ2FISmxaajFjSW1oMGRIQTZMeTkzZDNjdVlYUjBMbU52YlM5MUxYWmxjbk5sWENJZ2NtVnNQVndpYm05bWIyeHNiM2RjSWlCMFlYSm5aWFE5WENKZllteGhibXRjSWo1M2QzY3VZWFIwTG1OdmJTOTFMWFpsY25ObFBDOWhQZz09fA==]]. *AT&T products and services are provided or offered by subsidiaries and affiliates of AT&T Inc. under the AT&T brand and not by AT&T Inc. About AT&T AT&T Inc. (NYSE: T ) helps millions around the globe connect with leading entertainment, mobile, high speed Internet and voice services. We're the world's largest provider of pay TV. We have TV customers in the U.S. and 11 Latin American countries. In the U.S., our wireless network offers the nation's strongest LTE signal and the most reliable 4G LTE network . We offer the best global wireless coverage*. And we help businesses worldwide serve their customers better with our mobility and secure cloud solutions. Additional information about AT&T products and services is available at http://about.att.com . Follow our news on Twitter at @ATT, on Facebook at http://www.facebook.com/att and YouTube at http://www.youtube.com/att . © 2015 AT&T Intellectual Property. All rights reserved. AT&T, the Globe logo and other marks are trademarks and service marks of AT&T Intellectual Property and/or AT&T affiliated companies. All other marks contained herein are the property of their respective owners. Reliability and signal strength claims based on nationwide carriers' LTE. Signal strength claim based ONLY on avg. LTE signal strength. LTE not available everywhere. *Global coverage claim based on offering discounted voice and data roaming; LTE roaming; voice roaming; and world-capable smartphone and tablets in more countries than any other U.S. based carrier. Coverage not available in all areas. Coverage may vary per country and be limited/restricted in some countries. About Audience Network Always Original. Always Smart. Always Bold. Never Ordinary. Audience is a unique and exclusive television experience available only to DIRECTV and AT&T U-verse subscribers. The channel first made its mark by partnering with NBC to produce and air three additional seasons of the Emmy Award-winning series Friday Night Lights and then became the exclusive home of the Emmy Award-winning drama Damages, starring Glenn Close and Rose Byrne . DIRECTV continues its commitment to original, provocative content with a growing slate of critically acclaimed original series including the MMA drama Kingdom , starring Frank Grillo and Nick Jonas ; the suspense-drama ROGUE , starring Thandie Newton and Cole Hauser ; Full Circle: Chicago Payback, written by Keith Huff and starring Calista Flockhart , Eric McCormack , Rita Wilson , and Terry O'Quinn ; and Neil LaBute's second project with the network, Billy & Billie , starring Adam Brody and Lisa Joyce . Audience is also home to acclaimed original documentaries including The Fighting Season , a first hand account at the deadliest year in our nation's longest war, Executive Produced by Ricky Schroder . Sports fans will find live, daily sports and entertainment news from two renowned sports journalists with The Dan Patrick Show and The Rich Eisen Show . Plus, viewers can enjoy exclusive concerts by today's hottest artists on Guitar Center Sessions and intimate interviews with top talent like Matt Damon and Jessica Chastain on Off Camera with Sam Jones . It's original entertainment you won't see anywhere else. For more info, please visit directv.com/audience", "external_links": [], "published": "2015-09-30T23:49:00.000+03:00", "crawled": "2015-09-30T23:35:16.642+03:00", "highlightTitle": ""}