{"organizations": ["Cisco Advance AT&T", "AT&T AT&T Inc.", "Cisco", "AT&T Intellectual Property", "AT&T Inc", "AT&T Mobile", "Securities and Exchange Commission", "AT&T Inc.", "AT&T Network", "AT&T"], "uuid": "edc0c3edfe513e117ee867e87c9953f141afc92f", "thread": {"social": {"gplus": {"shares": 0}, "pinterest": {"shares": 0}, "vk": {"shares": 0}, "linkedin": {"shares": 0}, "facebook": {"likes": 0, "shares": 0, "comments": 0}, "stumbledupon": {"shares": 0}}, "site_full": "science-technology.news-articles.net", "main_image": "", "site_section": "http://science-technology.news-articles.net/content/rss.php", "section_title": "Science and Technology @ News Articles Network", "url": "http://science-technology.news-articles.net/content/cisco-advance-network-demand-platform.xhtml", "country": "US", "title": "AT&T And Cisco Advance AT&T's Network On Demand Platform", "performance_score": 0, "site": "news-articles.net", "participants_count": 0, "title_full": "AT&T And Cisco Advance AT&T's Network On Demand Platform", "spam_score": 0.0, "site_type": "news", "published": "2015-09-30T19:26:00.000+03:00", "replies_count": 0, "uuid": "edc0c3edfe513e117ee867e87c9953f141afc92f"}, "author": "", "url": "http://science-technology.news-articles.net/content/cisco-advance-network-demand-platform.xhtml", "ord_in_thread": 0, "title": "AT&T And Cisco Advance AT&T's Network On Demand Platform", "locations": ["U.S.", "Calif", "SAN JOSE", "DALLAS"], "entities": {"persons": [], "locations": [], "organizations": []}, "highlightText": "", "language": "english", "persons": ["Ralph de la Vega", "Pankaj Patel"], "text": "AT&T And Cisco Advance AT&T's Network On Demand Platform   Published on 2015-09-30 07:01:33 AT&T And Cisco Advance AT&T's Network On Demand... -- DALLAS and SAN JOSE, Calif.  AT&T Inc. AT&T Inc.  ><- stripped tags -> DALLAS and SAN JOSE, Calif.   [[UEdFZ2NtVnNQVndpYm05bWIyeHNiM2RjSWlCdmJtTnNhV05yUFNkc2FXNXJUMjVEYkdsamF5aDBhR2x6S1NjZ2FISmxaajFjSW1oMGRIQTZMeTloWW05MWRDNWhkSFF1WTI5dEwyTmhkR1ZuYjNKNUwyRnNiRjl1WlhkekxtaDBiV3hjSWlCeVpXdzlYQ0p1YjJadmJHeHZkMXdpSUhSaGNtZGxkRDFjSWw5aWJHRnVhMXdpUGtGVUpsUThMMkUrfA==]]* and Cisco are collaborating to enhance the AT&T Network on Demand platform by developing and deploying advanced virtualized technologies, including software-based customer premise equipment (CPE) that will deliver expanded benefits to business customers. AT&T is utilizing Software Defined Networking (SDN) and Network Function Virtualization (NFV) technologies to create dynamic, on-demand services. Together with Cisco, AT&T is leading the shift to next-generation networking by providing customers more flexible and scalable services and experiences. \"AT&T and Cisco are longstanding technology and business collaborators with a proven track record of success,\" said Pankaj Patel , executive vice president and chief development officer, Cisco. \"By combining Cisco's industry-leading portfolio of over 100 virtualized network functions with AT&T's vision and industry leadership, together we are working to capture new business opportunities that deliver on the promise of virtualization.\" \"We're working with Cisco to bring the next-generation network technology benefits to our customers. Cisco is an industry leader in networking. Their extensive SDN and NFV capabilities will broaden and enhance our Network on Demand platform,\" Ralph de la Vega , president and CEO, AT&T Mobile and Business Solutions. We're continuing to make our network dynamic and adaptive with these new Network on Demand capabilities. This will enable the agility, speed and efficiency customers need. *AT&T products and services are provided or offered by subsidiaries and affiliates of AT&T Inc. under the AT&T brand and not by AT&T Inc. About Cisco Cisco (NASDAQ: CSCO ) is the worldwide leader in IT that helps companies seize the opportunities of tomorrow by proving that amazing things can happen when you connect the previously unconnected. For ongoing news, please go to http://newsroom.cisco.com . About AT&T AT&T Inc. (NYSE: T ) helps millions around the globe connect with leading entertainment, mobile, high speed Internet and voice services. We're the world's largest provider of pay TV. We have TV customers in the U.S. and 11 Latin American countries. In the U.S., our wireless network offers the nation's strongest LTE signal and the most reliable 4G LTE network . We offer the best global wireless coverage*. And we help businesses worldwide serve their customers better with our mobility and secure cloud solutions. Additional information about AT&T products and services is available at http://about.att.com . Follow our news on Twitter at @ATT, on Facebook at http://www.facebook.com/att and YouTube at http://www.youtube.com/att . Â© 2015 AT&T Intellectual Property. All rights reserved. AT&T, the Globe logo and other marks are trademarks and service marks of AT&T Intellectual Property and/or AT&T affiliated companies. All other marks contained herein are the property of their respective owners. Reliability and signal strength claims based on nationwide carriers' LTE. Signal strength claim based ONLY on avg. LTE signal strength. LTE not available everywhere. *Global coverage claim based on offering discounted voice and data roaming; LTE roaming; voice roaming; and world-capable smartphone and tablets in more countries than any other U.S. based carrier. Coverage not available in all areas. Coverage may vary per country and be limited/restricted in some countries. Cautionary Language Concerning Forward-Looking Statements Information set forth in this news release contains financial estimates and other forward-looking statements that are subject to risks and uncertainties, and actual results may differ materially. A discussion of factors that may affect future results is contained in AT&T's filings with the Securities and Exchange Commission. AT&T disclaims any obligation to update or revise statements contained in this news release based on new information or otherwise.", "external_links": [], "published": "2015-09-30T19:26:00.000+03:00", "crawled": "2015-09-30T19:12:46.162+03:00", "highlightTitle": ""}