{"organizations": ["Multimodal Research", "Chairs of TRB", "Multimodal Research and Practice TRB", "National Academies", "Congress", "Metro", "Florida Board of Professional Engineers", "Future Directions for Multimodal Research", "American Institute of Certified Planners Certification Maintenance", "University of Utah Webinar Outline Driverless", "TRB Standing Committee on Transportation Issues", "San Francisco Municipal Transportation Agency John Gordon", "Center for Urban Transportation Research at University of San Francisco Darby Watson", "American Institute of Certified Planners", "TRB Sponsors"], "uuid": "16c0fb0a240741fb67656cc2e0655fcea4c8de20", "thread": {"social": {"gplus": {"shares": 0}, "pinterest": {"shares": 0}, "vk": {"shares": 0}, "linkedin": {"shares": 0}, "facebook": {"likes": 0, "shares": 0, "comments": 0}, "stumbledupon": {"shares": 0}}, "site_full": "www.trb.org", "main_image": "", "site_section": "http://www.trb.org/Rss.aspx?sn=DataandInformationTechnologyRSSFeed", "section_title": "Data and Information Technology RSS Feed", "url": "http://www.trb.org/Main/Blurbs/173239.aspx", "country": "US", "title": "TRB Webinar: Future Directions for Multimodal Research and Practice", "performance_score": 0, "site": "trb.org", "participants_count": 0, "title_full": "TRB Webinar: Future Directions for Multimodal Research and Practice", "spam_score": 0.0, "site_type": "news", "published": "2015-09-21T20:56:00.000+03:00", "replies_count": 0, "uuid": "16c0fb0a240741fb67656cc2e0655fcea4c8de20"}, "author": "", "url": "http://www.trb.org/Main/Blurbs/173239.aspx", "ord_in_thread": 0, "title": "TRB Webinar: Future Directions for Multimodal Research and Practice", "locations": ["Washington", "NW", "DC", "Florida"], "entities": {"persons": [], "locations": [], "organizations": []}, "highlightText": "", "language": "english", "persons": ["Kristine Williams", "Reggie Gillum", "Ivana Tasic"], "text": "  TRB Webinar: Future Directions for Multimodal Research and Practice Text Size: TRB Webinar: Future Directions for Multimodal Research and Practice 173239 TRB Webinar: Future Directions for Multimodal Research and Practice TRB will conduct a webinar on Wednesday, December 9, 2015, from 2:00-3:30PM ET that will focus on the most recent technological developments that facilitate multimodal transportation. The webinar will provide knowledge on current research advancements in urban multimodal transportation, and the challenges of overcoming the gap between research and practice. This webinar was organized by the TRB Standing Committee on Transportation Issues in Major Cities. Participants must register in advance of the webinar, and there is a fee for non-TRB Sponsor or non-TRB Sustaining Affiliate employees. A certificate for 1.5 Professional Development Hours (PDHs) will be provided to attendees who register and attend the webinar as an individual. This webinar is pending approval by the American Institute of Certified Planners for 1.5 Certification Maintenance Credits. Webinar Presenters Kristine Williams, Center for Urban Transportation Research at University of San Francisco Darby Watson, San Francisco Municipal Transportation Agency John Gordon, Metro Moderator: Ivana Tasic, University of Utah Webinar Outline Driverless vehicles in a multimodal world The role of social media in large-scale multimodal systems Innovative tools for transit planning Question and answer session The first 60 minutes of the webinar will be for presentations and the final 30 minutes will be reserved for audience questions. The Registered Continuing Education Program (RCEP) categorizes this webinar activity as relating to health, safety, and welfare including core technical. Learning Objectives At the end of this webinar, participants will be able to: Understand the gaps that currently exist between research on multimodal transportation and practice List innovative tools that may help improve multimodality in urban contexts Understand the role of social media in large-scale multimodal systems List best practices for advancing multimodal transportation in urban environments Registration Information There is no fee for employees of TRB Sponsors or TRB Sustaining Affiliates who register using their work email address. In addition to employees of TRB sponsor organizations, the following are eligible to receive complimentary webinar registration: TRB and National Academies employees; Chairs of TRB standing committees, sections, or groups; Members of the media; Employees of tribal governments; and Members of Congress or their staff. Other sites must pay $49 per site. View our pricing page for details. After registering you will receive a confirmation email containing information about joining the webinar. Professional Development Hour Information A certificate for 1.5 Professional Development Hours (PDHs) will be provided to Professional Engineers (PEs) who register and attend the webinar as an individual. For groups, only the person that registers and attends the session will receive a PDH certificate. Individuals registered as Florida PEs are no longer required to email TRB with your license number to report your attendance. Instead, please use your certificate that TRB provides through RCEP.net as verification of your attendance to the Florida Board of Professional Engineers. Please check with your licensing board to ensure that TRB webinar PDHs are approved by your board. This webinar was developed in March 2015. TRB has met the standards and requirements of the Registered Continuing Education Program (RCEP). Credit earned on completion of this program will be reported to RCEP by TRB. Certificates of Completion will be issued to individuals who register for and attend the entire webinar session. Complaints about registered providers may be sent to RCEP, 1015 15th Street, NW, 8th Floor, Washington, DC 20005. Website: www.RCEP.net . American Institute of Certified Planners Certification Maintenance Credits This webinar is pending approval by the American Institute of Certified Planners for 1.5 Certification Maintenance Credits. Please make sure that you register for this session and log-in using the link that TRB provides to your email account. We use this as your record that you attended this session. TRB only maintains the records of attendees who use their email address to log into the webinar, and cannot verify attendance of individuals who view the webinar without personally logging into the session. To report your CM credits, visit www.planning.org/cm 1. Login using your ID# and password 2. Select My CM log 3. Select Add Credits 4. Under Browse you have the option of searching by Date, Provider, or Distance Education and using the search box to type in the name of the event or activity and clicking go 5. A pop-up box will appear. If this is a multi-part event you will have the option to select from a list of activities 6. Please rate, add a comment (optional), and click on the Ethics statement and answer 7. Click submit and the CM credits should appear in your CM log If you have problems reporting your CM credits or have general questions about the CM program, please contact AICPCM@planning.org . Registration questions? Contact Reggie Gillum at RGillum@nas.edu .   9/24/2015  ", "external_links": [], "published": "2015-09-21T20:56:00.000+03:00", "crawled": "2015-09-25T09:57:30.206+03:00", "highlightTitle": ""}