{"organizations": ["InterMune", "Rodman & Renshaw Annual Global Investment Conference", "Host", "World Patent Marketing's Hand Free Pocket Cop Invention", "Cardiac Science Corporation", "Cardiac Science Appoints Healthcare", "Chaos Cantel Medical Corp", "Brain Aneurysm Awareness Month", "Forest Laboratories, Inc", "CANTEL MEDICAL CORP.", "Wyle Business Development Staff", "H.C. Wainwright & Co", "Migraine Research Foundation", "Prostate Cancer Awareness Month ... Inc.", "MDD", "Medicine and Food & Environmental Technologies", "Creighton University of Omaha"], "uuid": "42e6daacf5760c35bc2507576d1d5251fa2fc693", "thread": {"social": {"gplus": {"shares": 0}, "pinterest": {"shares": 0}, "vk": {"shares": 0}, "linkedin": {"shares": 0}, "facebook": {"likes": 0, "shares": 0, "comments": 0}, "stumbledupon": {"shares": 0}}, "site_full": "www.bio-medicine.org", "main_image": "", "site_section": "http://www.bio-medicine.org/inc/biomed/medicine-technology.asp", "section_title": "Latest Medical Technology from Bio-Medicine.Org", "url": "http://www.bio-medicine.org/medicine-technology-1/Crossing-the-threshold-3A-More-than-half-of-physicians-restrict-access-to-sales-reps-47922-1/", "country": "US", "title": "Crossing the threshold: More than half of physicians restrict access to sales reps", "performance_score": 0, "site": "bio-medicine.org", "participants_count": 0, "title_full": "Crossing the threshold: More than half of physicians restrict access to sales reps", "spam_score": 0.0, "site_type": "news", "published": "2015-09-02T15:28:00.000+03:00", "replies_count": 0, "uuid": "42e6daacf5760c35bc2507576d1d5251fa2fc693"}, "author": "", "url": "http://www.bio-medicine.org/medicine-technology-1/Crossing-the-threshold-3A-More-than-half-of-physicians-restrict-access-to-sales-reps-47922-1/", "ord_in_thread": 0, "title": "Crossing the threshold: More than half of physicians restrict access to sales reps", "locations": ["United States", "Calif.", "America", "New York", "Houston", "Massachusetts", "Utah", "SEGUNDO", "Portoroz"], "entities": {"persons": [], "locations": [], "organizations": []}, "highlightText": "", "language": "english", "persons": ["Wyle", "Andrew Krakauer", "Parazynski", "Andrews", "Phillip Chan", "Christine Buckley", "Krakauer", "Ronald A. Andrews", "Jue-Hsien Chern", "Seth R. Segel", "David Stirling"], "text": " 9/2/2015)... Tumultuous market conditions – including changes in ... activity – have led more than half of today,s ... reps. This marks the first time that the number ... point, according to the spring 2015 AccessMonitor™ report ... . AccessMonitor™ aggregates sales-call records   2015 CytoSorbents Corporation (NASDAQ: CTSO ), ... blood purification technology to reduce deadly uncontrolled inflammation ... Dr. Phillip Chan , MD, PhD, will present ... (sponsored by H.C. Wainwright & Co) taking ... City. Currently, the management team will   , Sept. 2, 2015 OncoSec Medical Incorporated ... intratumoral cancer immunotherapies, announced today that members of its ... events in September, including: , First ... Biology, Medicine and Food & Environmental Technologies; Portoroz, ... 17th Annual Global Investment Conference; New York, ... [ 0 ] Crossing the threshold: More than half of physicians restrict access to sales reps [ 0 ] CytoSorbents to Present at the 2015 Rodman & Renshaw Annual Global Investment Conference [ 0 ] OncoSec to Present at Scientific and Investment Conferences in September ... Cardiac Science Corporation (Nasdaq: CSCX ), a ... ) and diagnostic cardiac monitoring devices, announced today it appointed ... of directors. Andrews replaces long-time board member Jue-Hsien Chern, Ph.D., ... The total number of directors remains at six. , ... ... (Nasdaq: ITMN ) today announced results from operations for the ... InterMune reported a net loss for the third quarter of ... net loss of $14.0 million, or $0.36 per share, in the ... and President of InterMune, said, \"The third quarter and recent weeks ... Cardiac Science Appoints Healthcare Executive Ronald A. Andrews, Jr. to Board of Directors InterMune Reports Third Quarter 2009 Financial Results and Business Highlights (Date:9/2/2015)... ... 2015 , ... World Patent Marketing, a vertically integrated manufacturer ... that protects people from crime and other hostile situations. , \"The Security Services ... Creative Director of World Patent Marketing. \"The industry is growing at a healthy   ...   On September 9, 2015, ... doTERRA’s annual convention, the largest single-company convention to date for the state of Utah. ... forward to a tremendous event,” states David Stirling, doTERRA CEO. “One of the most   ...   Please join the world renowned ... which was established by the Foundation in 2007 with the help of Massachusetts ... more research remains our top priority,” commented Christine Buckley, Executive Director of the   ...   Mobile working is increasingly more important, ... seems that everywhere new mobile apps are being launched, and mobile device usage as ... regular part of their work and personal lives. What's more people are expecting mobile   September 01, 2015 , ... September is National Prostate Cancer ... affects more than 233,000 men each year in the United States. , Prostate cancer ... non-skin cancer in America, affecting 1 in 7 men. One new case occurs every ... [ 0 ] What Should You Be Watching As You Walk Alone At Night - World Patent Marketing's Hand Free Pocket Cop Invention [ 0 ] doTERRA to Host the Largest Single-Company Convention in the State of Utah [ 0 ] September Celebrated as Brain Aneurysm Awareness Month [ 0 ] New Mobility Experience From Winscribe [ 0 ] September is Prostate Cancer Awareness Month ... Inc. (NYSE: FRX ) today announced that ... the Company,s supplemental New Drug Application (sNDA) for Lexapro ... Major Depressive Disorder (MDD) in adolescents, 12 - 17 ... to be approved for the treatment of MDD in ... ... Finding could lead to new treatments for cognitive ... News) -- The human brain functions on \"the ... order and randomness, according to U.K.-based researchers who ... cognitive performance and psychiatric disorders. , The ... ... 20 CANTEL MEDICAL CORP. (NYSE: ... of the Company, to President and Chief Executive Officer. ... of Directors. Since joining Cantel in September 2004, Mr. Krakauer ... 2008 as President. The Board concurrently appointed Seth R. Segel, ... ... the Migraine Research Foundation (MRF) announced a new initiative ... migraine called FOR OUR CHILDREN. The new program ... understanding of migraine and its causes and treatments in ... , Migraine is very common in children - ... ... SEGUNDO, Calif., March 20 A former astronaut and ... a director of business development for Wyle,s Integrated Science ... Parazynski joins Wyle to assist in the company,s continued ... health and performance services to the Federal Government. He ... ... obscure clinical manifestation of severe vomiting sickness due to ... his colleagues at the Creighton University of Omaha, NE, ... of Gastroenterology . , Recent research into the neurobiology ... receptor types including two specific types that mediate neuropsychiatric ... Forest Laboratories, Inc. Announces FDA Approval of Lexapro(R) for the Treatment of Major Depressive Disorder in Adolescents Human Brain Works Between Order and Chaos Cantel Medical Corp. Names Andrew Krakauer as CEO and Announces Other Corporate Appointments New initiative to support pediatric migraine research is announced Veteran Astronaut Joins Wyle Business Development Staff in Houston A severe vomiting sickness with chronic cannabis abuse ... the first commercially available real-time detection ... use. , ,The kit can detect ... genotypes of HPV providing the sensitivity ... simplifying the process by using a ... ACMI COAG Bipolar Laparoscopy Probes provide 360 of hemostatis, bipolar safety, blunt dissection, irrigation, and suction in one instrument.... ... An in vitro Nucleic ... Amplification using Microplate Chemiluminescence for ... Papillomavirus (HPV) Types 6,11,16,18,31,33,35,39,42,43,44,45,51,52,56,58,59 and ... DNA Lowand High-Risk Groups in ... An In Vitro Nucleic Acid Hybridization Assay with Signal Amplification using Microplate Chemiluminescence for the Qualitative Detection of Human Papillomavirus (HPV) Types 16, 18, 31, 33, 35, 39, 45,...", "external_links": [], "published": "2015-09-02T15:28:00.000+03:00", "crawled": "2015-09-02T15:53:13.531+03:00", "highlightTitle": ""}