{"organizations": ["NRSRO", "Morningstar", "Morningstar, Inc.", "LLC", "Morningstar, Inc", "Treasury", "Morningstar Credit Ratings Assigns Preliminary Ratings", "Morningstar Credit Ratings", "Morningstar Credit Ratings, LLC"], "uuid": "bc8468945f1a9f8f3f77a4b9b701685c6bb9d42e", "thread": {"social": {"gplus": {"shares": 0}, "pinterest": {"shares": 0}, "vk": {"shares": 0}, "linkedin": {"shares": 0}, "facebook": {"likes": 0, "shares": 0, "comments": 0}, "stumbledupon": {"shares": 0}}, "site_full": "science-technology.news-articles.net", "main_image": "", "site_section": "http://science-technology.news-articles.net/content/rss.php", "section_title": "Science and Technology @ News Articles Network", "url": "http://science-technology.news-articles.net/content/morningstar-credit-ratings-assigns-preliminary-mad-mortgage-trust-commercial-pass-through-certificates.xhtml", "country": "US", "title": "Morningstar Credit Ratings Assigns Preliminary Ratings to MAD 2015-11MD Mortgage Trust, Commercial Mortgage Pass-Through Certificates (MAD 2015-11MD)", "performance_score": 0, "site": "news-articles.net", "participants_count": 0, "title_full": "Morningstar Credit Ratings Assigns Preliminary Ratings to MAD 2015-11MD Mortgage Trust, Commercial Mortgage Pass-Through Certificates (MAD 2015-11MD)", "spam_score": 0.0, "site_type": "news", "published": "2015-09-10T02:22:00.000+03:00", "replies_count": 0, "uuid": "bc8468945f1a9f8f3f77a4b9b701685c6bb9d42e"}, "author": "", "url": "http://science-technology.news-articles.net/content/morningstar-credit-ratings-assigns-preliminary-mad-mortgage-trust-commercial-pass-through-certificates.xhtml", "ord_in_thread": 0, "title": "Morningstar Credit Ratings Assigns Preliminary Ratings to MAD 2015-11MD Mortgage Trust, Commercial Mortgage Pass-Through Certificates (MAD 2015-11MD)", "locations": ["North America", "New York City", "Australia", "Europe", "NEW YORK", "Asia"], "entities": {"persons": [], "locations": [], "organizations": []}, "highlightText": "", "language": "english", "persons": ["Morningstar", "Michelle Weiss"], "text": "Morningstar Credit Ratings Assigns Preliminary Ratings to MAD 2015-11MD Mortgage Trust, Commercial Mortgage Pass-Through Certificates (MAD 2015-11MD)   11:02:44 Morningstar Credit Ratings Assigns Preliminary Ratings to MAD 2015-11MD Mortgage Trust, Commercial... -- NEW YORK, Sept. 9,   <-   NEW YORK , Sept. 9,   Morningstar Credit Ratings, LLC today assigned preliminary ratings to the commercial mortgage-backed securities (CMBS) transaction MAD 2015-11MD Mortgage Trust, Commercial Mortgage Pass-Through Certificates (MAD 2015-11MD). The collateral supporting MAD 2015-11MD consists of a single fixed-rate, interest-only mortgage loan secured by the borrower's fee simple and leasehold interest in 11 Madison Avenue, a 2.3 million-square-foot Class A office building located in New York City . The preliminary ratings are based on information known to Morningstar as of Sept. 8, 2015 . Preliminary Ratings (as of Sept. 8, 2015) Class BBB- 0.00 Morningstar's Presale Analysis Package, including the Presale Report; Rule 17g-7 Disclosures and Certification; and the Representations, Warranties, and Enforcement Mechanisms, is available under the Ratings Reports tab at https://ratingagency.morningstar.com . Morningstar could receive subsequent information that may result in final ratings that differ from the preliminary ratings. About Morningstar Credit Ratings, LLC and Morningstar, Inc. Morningstar Credit Ratings, LLC is a Nationally Recognized Statistical Rating Organization (NRSRO) offering a wide array of services including new-issue ratings and analysis, operational risk assessments, surveillance services, data, and technology solutions. Morningstar Credit Ratings, LLC is a subsidiary of Morningstar, Inc. (NASDAQ: MORN ), a leading provider of independent investment research in North America , Europe , Australia , and Asia . Morningstar, Inc. offers an extensive line of products and services for individual investors, financial advisors, asset managers, and retirement plan providers and sponsors. Morningstar provides data on more than 500,000 investment offerings, including stocks, mutual funds, and similar vehicles, along with real-time global market data on more than 16 million equities, indexes, futures, options, commodities, and precious metals, in addition to foreign exchange and Treasury markets. Morningstar also offers investment management services through its investment advisory subsidiaries, with more than $180 billion in assets under advisement and management as of June 30, 2015 . The company has operations in 27 countries. Morningstar, Inc. is not an NRSRO and does not issue NRSRO credit ratings. Â©2015 Morningstar, Inc. All Rights Reserved. MORN-R Michelle Weiss , +1 267-960-6014 or michelle.weiss@morningstar.com", "external_links": [], "published": "2015-09-10T02:22:00.000+03:00", "crawled": "2015-09-10T02:10:10.691+03:00", "highlightTitle": ""}