{"organizations": ["Hale Groves and Pittman & Davis", "Tata Consultancy Services’ Digital Software & Solutions Group Being", "Southern Fulfillment", "Hosted Contact Center Helps Citrus Gift Company", "Walmart", "Lucas Systems", "Tyco Retail Solutions", "GameStop Technology Institute"], "uuid": "bbeb3467af6ca44d27fc2ac38eb3032530e46cf8", "thread": {"social": {"gplus": {"shares": 0}, "pinterest": {"shares": 0}, "vk": {"shares": 0}, "linkedin": {"shares": 0}, "facebook": {"likes": 0, "shares": 0, "comments": 0}, "stumbledupon": {"shares": 0}}, "site_full": "www.innovativeretailtechnologies.com", "main_image": "", "site_section": "http://www.retailsolutionsonline.com/rssfeeds/rssnews", "section_title": "Innovative Retail Technologies News", "url": "http://www.innovativeretailtechnologies.com/doc/adapting-dcs-to-support-omni-channel-fulfillment-0002?atc~c=771+s=773+r=001+l=a", "country": "US", "title": "09.21.15 -- Adapting DCs To Support Omni-Channel Fulfillment", "performance_score": 0, "site": "innovativeretailtechnologies.com", "participants_count": 0, "title_full": "09.21.15 -- Adapting DCs To Support Omni-Channel Fulfillment", "spam_score": 0.0, "site_type": "news", "published": "2015-09-18T04:58:00.000+03:00", "replies_count": 0, "uuid": "bbeb3467af6ca44d27fc2ac38eb3032530e46cf8"}, "author": "", "url": "http://www.innovativeretailtechnologies.com/doc/adapting-dcs-to-support-omni-channel-fulfillment-0002?atc~c=771+s=773+r=001+l=a", "ord_in_thread": 0, "title": "09.21.15 -- Adapting DCs To Support Omni-Channel Fulfillment", "locations": ["Mexico", "U.S.", "Singapore", "Dubai", "Vero Beach", "Florida"], "entities": {"persons": [], "locations": [], "organizations": []}, "highlightText": "", "language": "english", "persons": ["Virginia Fraser", "Seeta Hariharan", "Matt Pillar", "Jeff Slevin", "Christine Kern", "Stephen Gorman", "Erin Harris"], "text": "09.21.15 -- Adapting DCs To Support Omni-Channel Fulfillment GameStop Breaks New Ground With Beacons By Matt Pillar, senior executive editor An innovative deployment of beacons in nearly 150 test-market stores delivers an education in best practices at the GameStop Technology Institute. Guest Column By Jeff Slevin, chief operating officer, Lucas Systems This is the second in a three-part series of articles describing how retailers can adapt their fulfillment and returns processes to address omni-channel needs using Mobile Work Execution software, which complements existing information systems. This article focuses on DC-based processes while the third and final article will discuss in-store processes. Featured Content comScore U.S. Study: 2015 Pulse Of The Online Shopper In a world of constant connectivity, amidst the frantic pace of technological change for both consumers and retailers, today’s “flex shopper” has been born. This flex shopper is ruthlessly efficient, switching channels and devices to best suit personal convenience when evaluating and purchasing products. By Christine Kern, contributing writer While physical stores still win out, online marketing is still imperative. Owning The New Customer Journey In The Digital Era By Seeta Hariharan, general manager and group head, Tata Consultancy Services’ Digital Software & Solutions Group Being a retailer in today’s digital marketplace has become an extreme sport. Challenges abound with digital technologies continuing to transform the consumer’s shopping experience and driving retailers to relentlessly rethink and reshape their businesses. Hosted Contact Center Helps Citrus Gift Company Squeeze Out More Productivity And Cost Year-round, Southern Fulfillment fulfills orders for Hale Groves and Pittman & Davis — two of the nation’s largest citrus gift brands. Its Vero Beach, Florida, contact center constantly adapts staffing levels to support an average of 260,000 calls per year, ensuring the ultimate experience, during the peak holiday period or off-season. By Christine Kern, contributing writer Retail executive pay will come under scrutiny. Technology Changes The Game, But Not The Players By Stephen Gorman, business development director, and Virginia Fraser, senior communications editor, Insights Learning and Development Cash registers used to only do what their namesake denotes — register cash. Now, you’d be hard-pressed to find a cash register in a leading retail environment that only operates as a money till. In its place you’ll find sophisticated POS systems that not only process sales transactions, but also manage inventory, recognize customer loyalty programs and incentives, and other important business line and back-office functions. Best Practices Of Using Real-Time Traffic Reporting At Crate And Barrel Crate and Barrel is an industry-leading multichannel home furnishings specialty retailer, known for its exclusive housewares and furniture designs. In addition to a thriving direct marketing division that services more than 90 countries, the company operates stores in most major North American markets as well as international franchise locations in Dubai, Singapore, and Mexico. By Christine Kern, contributing writer Tyco Retail Solutions and Walmart enter a leading-edge partnership to drive greater business value. Editor's Notebook By Erin Harris, editor in chief Retailers came to the realization long ago that accommodating the mobile-savvy consumer isn’t innovative retailing, it’s business as usual. Cut to a few years later, and the retail industry is in the throes of a full-fledged digital transformation. Here we are with another behemoth term, and depending on whom you ask, the definition of digital transformation differs slightly, but most will agree that the digital transformation occurring in retail means embracing technologies such as cloud, mobile, predictive analytics, as well as social networks to improve the business. Most Popular News", "external_links": [], "published": "2015-09-18T04:58:00.000+03:00", "crawled": "2015-09-21T17:56:53.425+03:00", "highlightTitle": ""}