{"organizations": ["Solar Inc.", "Canadian Solar on Facebook", "Minas Gerais"], "uuid": "6ddc4518c52575f9b925c4dd497d6347d129fc24", "thread": {"social": {"gplus": {"shares": 0}, "pinterest": {"shares": 0}, "vk": {"shares": 0}, "linkedin": {"shares": 0}, "facebook": {"likes": 0, "shares": 0, "comments": 0}, "stumbledupon": {"shares": 0}}, "site_full": "science-technology.news-articles.net", "main_image": "", "site_section": "http://science-technology.news-articles.net/content/rss.php", "section_title": "Science and Technology @ News Articles Network", "url": "http://science-technology.news-articles.net/content/canadian-solar-wins-five-power-projects-totaling-brazil.xhtml", "country": "US", "title": "Canadian Solar Wins Five Solar Power Projects Totaling 185 MW in Brazil", "performance_score": 0, "site": "news-articles.net", "participants_count": 0, "title_full": "Canadian Solar Wins Five Solar Power Projects Totaling 185 MW in Brazil", "spam_score": 0.0, "site_type": "news", "published": "2015-09-03T12:59:00.000+03:00", "replies_count": 0, "uuid": "6ddc4518c52575f9b925c4dd497d6347d129fc24"}, "author": "", "url": "http://science-technology.news-articles.net/content/canadian-solar-wins-five-power-projects-totaling-brazil.xhtml", "ord_in_thread": 0, "title": "Canadian Solar Wins Five Solar Power Projects Totaling 185 MW in Brazil", "locations": ["U.S.", "Canada", "Brazil", "Europe", "Pirapora", "China", "Japan", "India", "Ontario", "GUELPH"], "entities": {"persons": [], "locations": [], "organizations": []}, "highlightText": "", "language": "english", "persons": ["Shawn Qu"], "text": "Canadian Solar Wins Five Solar Power Projects Totaling 185 MW in Brazil   Published on 2015-09-03 02:17:52 Canadian Solar Wins Five Solar Power Projects Totaling 185 MW in Brazil -- GUELPH, Ontario, Sept. 3,   <-   GUELPH, Ontario , Sept. 3,   Canadian Solar Inc. (the \"Company\", or \"Canadian Solar\") (NASDAQ: CSIQ ), one of the world's largest solar power companies, today announced that it has won five solar photovoltaic (PV) projects totaling 185 megawatts (MW) In Pirapora, in the state in Minas Gerais, Brazil . Canadian Solar will develop and build the solar power plants which, once connected to the grid will sell the electricity generated to a Brazilian government entity, under a 20-year Power Purchase Agreement at R$298.58 /MWh (approximately $84.0 USD /MWh). \"This win in Brazil demonstrates the strength of our global project development capabilities, and positions us well to become a solar energy leader in this important emerging market,\" commented Dr. Shawn Qu , Chairman and Chief Executive Officer of Canadian Solar. \" Brazil has significant solar resources and a large energy market, which provides us with an opportunity to stablish our brand, take market share and deliver good results for our shareholders.\" The five projects are targeted to reach commercial operation in mid-2017. The Company will short list potential equity partners for these projects and believes that it can make adequate developer margins should it decide to sell them. About Canadian Solar Founded in 2001 in Canada , Canadian Solar (NASDAQ: CSIQ ) is one of the world's largest and foremost solar power companies. As a leading manufacturer of solar photovoltaic modules and a provider of solar energy solutions, Canadian Solar has a geographically diversified pipeline of utility-scale power projects. In the past 14 years, Canadian Solar has successfully deployed over 10 GW of premium quality modules in over 70 countries around the world. Furthermore, Canadian Solar is one of the most bankable companies in the world, having been publically listed on NASDAQ since 2006. For additional information about the company, follow Canadian Solar on Facebook , Twitter , LinkedIn , or on the website . Safe Harbor/Forward-Looking Statements Certain statements in this press release are forward-looking statements that involve a number of risks and uncertainties that could cause actual results to differ materially. These statements are made under the \"Safe Harbor\" provisions of the U.S. Private Securities Litigation Reform Act of 1995. In some cases, you can identify forward-looking statements by such terms as \"believes,\" \"expects,\" \"anticipates,\" \"intends,\" \"estimates,\" the negative of these terms, or other comparable terminology. Factors that could cause actual results to differ include the risks regarding general business and economic conditions and the state of the solar industry; governmental support for the deployment of solar power; future available supplies of solar grade silicon; demand for solar products by consumers and inventory levels of such products in the supply chain; changes in demand from significant customers; changes in demand in our project markets, including Canada, the U.S., Japan and China; changes in customer order patterns; capacity utilization; level of competition; pricing pressure and declines in average selling price; delays in new product introduction; continued success in technological innovations and delivery of products with the features customers demand; utility-scale project approval process delays; utility-scale project construction delays; utility-scale project cancelation due to failure to obtain all the necessary permits; shortage in supply of materials or capacity requirements; availability of financing; exchange rate fluctuations; trade protectionism in Europe, the U.S. and India; litigation and other risks as described in the Company's SEC filings, including its annual report on Form 20-F filed on April 28, 2014. Although the Company believes that the expectations reflected in its forward looking statements are reasonable, it cannot guarantee future results, level of activity, performance, or achievements. Investors should not place undue reliance on these forward-looking statements. All information provided in this press release is as of today's date, unless otherwise stated, and Canadian Solar undertakes no duty to update such information, except as required under applicable law. \nSOURCE Canadian Solar Inc.", "external_links": [], "published": "2015-09-03T12:59:00.000+03:00", "crawled": "2015-09-03T12:46:50.977+03:00", "highlightTitle": ""}