{"organizations": ["CSC Computer Sciences Corporation", "CSC", "AT&T AT&T Inc.", "AT&T Mobile & Business Solutions", "AT&T Intellectual Property", "AT&T Inc", "AT&T Inc.", "AT&T"], "uuid": "56c382866088adfdf3f50044a077e7de98a9e70d", "thread": {"social": {"gplus": {"shares": 0}, "pinterest": {"shares": 0}, "vk": {"shares": 0}, "linkedin": {"shares": 0}, "facebook": {"likes": 0, "shares": 0, "comments": 0}, "stumbledupon": {"shares": 0}}, "site_full": "science-technology.news-articles.net", "main_image": "", "site_section": "http://science-technology.news-articles.net/content/rss.php", "section_title": "Science and Technology @ News Articles Network", "url": "http://science-technology.news-articles.net/content/csc-revolutionize-hybrid-cloud-management.xhtml", "country": "US", "title": "AT&T and CSC Revolutionize Hybrid Cloud Management", "performance_score": 0, "site": "news-articles.net", "participants_count": 0, "title_full": "AT&T and CSC Revolutionize Hybrid Cloud Management", "spam_score": 0.0, "site_type": "news", "published": "2015-09-24T03:42:00.000+03:00", "replies_count": 0, "uuid": "56c382866088adfdf3f50044a077e7de98a9e70d"}, "author": "", "url": "http://science-technology.news-articles.net/content/csc-revolutionize-hybrid-cloud-management.xhtml", "ord_in_thread": 0, "title": "AT&T and CSC Revolutionize Hybrid Cloud Management", "locations": ["Va", "U.S.", "DALLAS"], "entities": {"persons": [], "locations": [], "organizations": []}, "highlightText": "", "language": "english", "persons": ["Dan Hushon", "Jon Summers"], "text": "AT&T and CSC Revolutionize Hybrid Cloud Management   Published on 2015-09-23 16:46:50 AT&T and CSC Revolutionize Hybrid Cloud Management -- DALLAS and FALLS CHURCH, Va.  AT&T Inc. CSC Logo.  ><- stripped tags -> DALLAS and FALLS CHURCH, Va.   CSC (NYSE: CSC ) and AT&T (NYSE: T ) today unveiled AT&T NetBond ® with CSC Agility Platform TM to help manage workloads across hybrid cloud networks. CSC Agility Platform and AT&T NetBond help businesses become more flexible and lower costs by moving key apps to the cloud. The joint solution allows the developer to rapidly and consistently provision apps onto cloud and network services using automation. Enterprises can now safely transform to a highly secure hybrid cloud environment. \"We're combining our strengths to provide a complete hybrid cloud management solution,\" said Jon Summers , senior vice president, AT&T Mobile & Business Solutions. \"The CSC Agility Platform can manage multiple clouds from one dashboard and AT&T NetBond provides on-demand, dynamic network management.\" Moving apps to hybrid clouds can cause enterprise security challenges. The CSC Agility Platform quickly applies policies to all cloud resources. This improves both security and resource management while reducing audit burdens. Here's how it works: A business struggling to keep up with demand can use the solution to boost computing power, storage and network capacity. They can access multiple cloud providers from a CSC Agility Platform single control plane over AT&T's virtual private network. \"We're creating a more consistent blueprint for hybrid cloud apps. This makes the user experience easier and more complete, while improving conformance with enterprise guidelines. The joint solution does just that,\" said Dan Hushon , CSC chief technology officer. \"This is a step forward for enterprise cloud service -- end-to-end control helps the most complex environments work better.\" The new solution is available now. For more information on the solution, visit www.att.com/netbond or www.csc.com/harnessthecloud . For more on the AT&T and CSC alliance, visit: http://www.csc.com/global_alliances/alliances/112505-at_t *AT&T products and services are provided or offered by subsidiaries and affiliates of AT&T Inc. under the AT&T brand and not by AT&T Inc. About AT&T AT&T Inc. (NYSE: T ) helps millions around the globe connect with leading entertainment, mobile, high speed Internet and voice services. We're the world's largest provider of pay TV. We have TV customers in the U.S. and 11 Latin American countries. In the U.S., our wireless network offers the nation's strongest LTE signal and the most reliable 4G LTE network . We offer the best global wireless coverage*. And we help businesses worldwide serve their customers better with our mobility and secure cloud solutions. Additional information about AT&T products and services is available at http://about.att.com . Follow our news on Twitter at @ATT, on Facebook at http://www.facebook.com/att and YouTube at http://www.youtube.com/att . © 2015 AT&T Intellectual Property. All rights reserved. AT&T, the Globe logo and other marks are trademarks and service marks of AT&T Intellectual Property and/or AT&T affiliated companies. All other marks contained herein are the property of their respective owners. Reliability and signal strength claims based on nationwide carriers' LTE. Signal strength claim based ONLY on avg. LTE signal strength. LTE not available everywhere. *Global coverage claim based on offering discounted voice and data roaming; LTE roaming; voice roaming; and world-capable smartphone and tablets in more countries than any other U.S. based carrier. Coverage not available in all areas. Coverage may vary per country and be limited/restricted in some countries. About CSC Computer Sciences Corporation (CSC) is a global leader of next generation information technology (IT) services and solutions. The Company's mission is to enable superior returns on our clients' technology investments through best-in-class industry solutions, domain expertise and global scale. CSC has approximately 70,000 employees and reported revenue of $11.7 billion for the 12 months ended July 3, 2015 . For more information, visit the company's website at www.csc.com .", "external_links": [], "published": "2015-09-24T03:42:00.000+03:00", "crawled": "2015-09-24T03:28:33.484+03:00", "highlightTitle": ""}