{"organizations": ["MTS", "Robotics", "National Institute for Aviation Research", "MTS Systems Corporation MTS Systems Corporation", "Computational Mechanics", "Wichita State University", "National Center for Aviation Training", "Advanced Coatings", "NIAR", "Research Machine Shop", "About National Institute for Aviation Research", "Worldwide Aerospace Users' Group"], "uuid": "fe60c284533c4419a2691c9b577a23c2e2a8ae35", "thread": {"social": {"gplus": {"shares": 0}, "pinterest": {"shares": 0}, "vk": {"shares": 0}, "linkedin": {"shares": 0}, "facebook": {"likes": 0, "shares": 0, "comments": 0}, "stumbledupon": {"shares": 0}}, "site_full": "science-technology.news-articles.net", "main_image": "", "site_section": "http://science-technology.news-articles.net/content/rss.php", "section_title": "Science and Technology @ News Articles Network", "url": "http://science-technology.news-articles.net/content/mts-brings-prominent-aerospace-scientists-together-meeting-future-structural-material-testing.xhtml", "country": "US", "title": "MTS Brings Prominent Aerospace Scientists Together For Meeting On Future Of Structural And Material Testing", "performance_score": 0, "site": "news-articles.net", "participants_count": 0, "title_full": "MTS Brings Prominent Aerospace Scientists Together For Meeting On Future Of Structural And Material Testing", "spam_score": 0.0, "site_type": "news", "published": "2015-09-11T01:17:00.000+03:00", "replies_count": 0, "uuid": "fe60c284533c4419a2691c9b577a23c2e2a8ae35"}, "author": "", "url": "http://science-technology.news-articles.net/content/mts-brings-prominent-aerospace-scientists-together-meeting-future-structural-material-testing.xhtml", "ord_in_thread": 0, "title": "MTS Brings Prominent Aerospace Scientists Together For Meeting On Future Of Structural And Material Testing", "locations": ["Minn", "Indonesia", "Turkey", "Wichita", "KS", "Colombia", "Korea", "Italy", "USA", "U.S.", "Mexico", "Canada", "Brazil", "Russia", "Germany", "China", "Japan", "Kan."], "entities": {"persons": [], "locations": [], "organizations": []}, "highlightText": "", "language": "english", "persons": ["Jeffrey Graves", "John Tomblin", "Walter H. Beech"], "text": "MTS Brings Prominent Aerospace Scientists Together For Meeting On Future Of Structural And Material Testing   14:47:46 MTS Brings Prominent Aerospace Scientists Together For Meeting On Future Of... -- EDEN PRAIRIE, Minn.  MTS Systems Corporation. MTS Systems Corporation.   EDEN PRAIRIE, Minn.   MTS Systems Corporation (NASDAQ: [[UEdFZ2NtVnNQVndpYm05bWIyeHNiM2RjSWlCb2NtVm1QU2RvZEhSd09pOHZjM1IxWkdsdkxUVXVabWx1WVc1amFXRnNZMjl1ZEdWdWRDNWpiMjB2Y0hKdVpYZHpQMUJoWjJVOVVYVnZkR1VtVkdsamEyVnlQVTFVVTBNbklISmxiRDBuYm05bWIyeHNiM2NuSUhSaGNtZGxkRDBuWDJKc1lXNXJKeUIwYVhSc1pUMG5UVlJUUXljZ2IyNWpiR2xqYXowbmJHbHVhMDl1UTJ4cFkyc29kR2hwY3lrbklISmxiRDBuYm05bWIyeHNiM2NuUGsxVVUwTThMMkUrfA==]]), a leading global supplier of high-performance test systems and position sensors, brought together members of the aerospace testing community last week at the Worldwide Aerospace Users' Group meeting in Wichita, KS. Held at the prestigious National Center for Aviation Training (NCAT), the two-day event provided a forum for attendees to learn about the latest techniques and technologies for aerospace structural and materials testing, as well as exchange ideas with industry peers. Attendees also had the opportunity to share their knowledge with the engineers that influence the development of MTS hardware and software, and to take a tour of the extensive structural and materials research facilities of the National Institute for Aviation Research (NIAR) at Wichita State University . \"We highly value our relationship with MTS and the opportunity to collaborate on this significant event,\" said NIAR executive director John Tomblin . \"It provided an optimal setting for us to meet with engineers working on similar projects and we were able to identify multiple opportunities for future collaboration with attendees.\" The MTS Worldwide Aerospace Users' Group Meeting is held every three years. The 2015 event, which included presentations from both industry-leading manufacturers and MTS testing experts, took place early in September and attracted aerospace engineering professionals from Brazil , Canada , China , Colombia , Germany , Indonesia , Italy , Japan , Korea, Mexico , Russia , Turkey and the USA . \"Advances in aircraft manufacturing continues to evolve with new structures and composite materials being employed, as well as greater emphasis on improving fuel efficiency and increasing safety levels. These advancements set numerous challenges for aerospace testing,\" says Dr. Jeffrey Graves , Chief Executive Officer and President of MTS. \"The MTS Worldwide Aerospace Users' Group Meeting is an exciting and engaging forum for collaborative interaction among industry experts to discuss their challenges and accomplishments, and to learn of industry advances from their colleagues.\" About MTS Systems Corporation MTS Systems Corporation's testing hardware, software and services solutions help customers accelerate and improve their design, development, and manufacturing processes and are used for determining the mechanical behavior of materials, products, and structures. MTS' high-performance position sensors provide controls for a variety of industrial and vehicular applications. MTS had 2,180 employees at September 27, 2014 and revenue of $564 million for the fiscal year ended September 27, 2014. Additional information on MTS can be found at http://www.mts.com About National Institute for Aviation Research (NIAR) Wichita State University's National Institute for Aviation Research (NIAR) supports the aviation industry by providing research, development, testing, certification and training. Laboratories include Advanced Coatings, Aging Aircraft, CAD/CAM, Composites & Advanced Materials, Computational Mechanics, Crash Dynamics, Environmental Test, Full-Scale Structural Test, Mechanical Test, Metrology, Nondestructive Test, Research Machine Shop, Robotics and Automation, Virtual Reality and the Walter H. Beech Wind Tunnel. NIAR operates on a nonprofit budget and is the largest university aviation R&D institution in the U.S., located in Wichita, Kan. , the \"Air Capital of the World.\" www.niar.wichita.edu", "external_links": [], "published": "2015-09-11T01:17:00.000+03:00", "crawled": "2015-09-11T01:05:26.206+03:00", "highlightTitle": ""}