{"organizations": ["U.S. Securities and Exchange Commission", "Yingli Green Energy", "Yingli Green Energy Holding Company Limited", "Qingdao New Energy Solutions Inc.", "Corporate Communications Yingli Green Energy Holding Company", "NESI", "Yingli Green Energy Yingli Green Energy Holding Company Limited", "NESI Qingdao New Energy Solutions Inc.", "Facebook"], "uuid": "9e34b2939d4260d829f6d4a3058d66dfab7639f3", "thread": {"social": {"gplus": {"shares": 0}, "pinterest": {"shares": 0}, "vk": {"shares": 0}, "linkedin": {"shares": 0}, "facebook": {"likes": 0, "shares": 0, "comments": 0}, "stumbledupon": {"shares": 0}}, "site_full": "science-technology.news-articles.net", "main_image": "", "site_section": "http://science-technology.news-articles.net/content/rss.php", "section_title": "Science and Technology @ News Articles Network", "url": "http://science-technology.news-articles.net/content/yingli-supplies-solar-panels-projects-china.xhtml", "country": "US", "title": "Yingli Supplies 130 MW of Solar Panels for Projects in China", "performance_score": 0, "site": "news-articles.net", "participants_count": 0, "title_full": "Yingli Supplies 130 MW of Solar Panels for Projects in China", "spam_score": 0.0, "site_type": "news", "published": "2015-09-24T15:43:00.000+03:00", "replies_count": 0, "uuid": "9e34b2939d4260d829f6d4a3058d66dfab7639f3"}, "author": "", "url": "http://science-technology.news-articles.net/content/yingli-supplies-solar-panels-projects-china.xhtml", "ord_in_thread": 0, "title": "Yingli Supplies 130 MW of Solar Panels for Projects in China", "locations": ["Shanxi", "Tianjin", "Qingdao", "U.S.", "Baoding", "Shandong", "Mongolia", "Zhejiang", "BAODING", "Yunnan", "Shandong Province", "Hebei", "China"], "entities": {"persons": [], "locations": [], "organizations": []}, "highlightText": "", "language": "english", "persons": ["Gang Wang", "Yingli", "Weibo", "Shen Jianfei"], "text": "Yingli Supplies 130 MW of Solar Panels for Projects in China   Published on 2015-09-24 03:46:50 Yingli Supplies 130 MW of Solar Panels for Projects in China -- BAODING, China, Sept.   <-   BAODING, China , Sept.   Yingli Green Energy Holding Company Limited (\"Yingli\" or \" Yingli Solar \") (NYSE: YGE ), one of the world's leading solar panel manufacturers, today announced that it recently signed several agreements with Qingdao New Energy Solutions Inc. (NESI), a leading provider of agricultural and industrial building-integrated photovoltaic (BIPV) and utility-scale solar solutions, for the supply of 130 megawatts (MW) of high quality solar panels. Yingli has begun to deliver the first 30 MW and expects to complete the delivery by the end of September 2015 . According to the terms of the companies' supply agreements, Yingli will supply the remaining 100 MW of solar panels by the end of the second quarter of 2016. These panels will be used in utility-scale projects, industrial rooftop systems as well as BIPV agricultural solutions, in Zhejiang , Inner Mongolia, Shandong and other provinces in China . In total, Yingli will provide NESI with more than 500,000 multicrystalline YGE 60 Cell Series solar panels that are expected to generate approximately 150,000 megawatt-hours (MWh) of clean energy per year once operational. The clean energy they produce will offset about 120,000 tons of carbon emissions annually. \"As a leading supplier of agricultural and BIPV solutions in China , we are excited to begin our partnership with Yingli and expect the company to become one of our preferred suppliers,\" commented Mr. Shen Jianfei, Chief Operations Officer of NESI. \"In August, NESI announced our collaboration with several state-owned banks and other entities to establish China's first agricultural PV project fund. As such, we intend to gradually increase our exposure to solar PV assets and hope to continue partnering with Yingli as we do so.\" \"We are pleased to begin collaborating with NESI, a comprehensive solar developer, and believe that together our companies will drive the adoption of BIPV and agricultural solar applications in China ,\" commented Mr. Gang Wang, Vice President of Sales of Yingli Green Energy. \"Our new partnership with NESI exemplifies Yingli's strategic effort to expand relationships with China's leading private enterprises, which has resulted in 350 MW of supply agreements with cash before delivery in 2015. With demand expected to grow in China through the second half of 2015, Yingli is focused on expanding our domestic footprint by strengthening our customer relationships and continuing to supply our high-quality products to this key market.\" About Yingli Green Energy Yingli Green Energy Holding Company Limited (NYSE: YGE ), known as \" Yingli Solar ,\" is one of the world's leading solar panel manufacturers. Yingli Green Energy's manufacturing covers the photovoltaic value chain from ingot casting and wafering through solar cell production and solar panel assembly. Headquartered in Baoding, China , Yingli Green Energy has more than 30 regional subsidiaries and branch offices and has distributed more than 14 GW solar panels to customers worldwide. For more information, please visit www.yinglisolar.com and join the conversation on Facebook , Twitter and Weibo . About NESI Qingdao New Energy Solutions Inc. (NESI), headquartered in Qingdao , Shandong Province , is a leading provider of BIPV and agricultural integrated PV solutions in China . By the end of 2014, it completed 230 MW of distributed rooftop PV projects and began started the construction of approximately 400 MW agricultural PV greenhouse projects, throughout 18 provinces in China , including Shandong , Tianjin , Hebei , Shanxi , Inner Mongolia, Zhejiang , Yunnan , etc. In 2015, NESI plans to build 500 MW of agricultural PV greenhouse projects. Safe Harbor Statement This press release contains forward-looking statements. These statements constitute \"forward-looking\" statements within the meaning of Section 21E of the Securities Exchange Act of 1934, as amended, and as defined in the U.S. Private Securities Litigation Reform Act of 1995. These forward-looking statements can be identified by terminology such as \"will,\" \"expects,\" \"anticipates,\" \"future,\" \"intends,\" \"plans,\" \"believes,\" \"estimates,\" \"target\" and similar statements. Such statements are based upon management's current expectations and current market and operating conditions, and relate to events that involve known or unknown risks, uncertainties and other factors, all of which are difficult to predict and many of which are beyond Yingli Green Energy's control, which may cause Yingli Green Energy's actual results, performance or achievements to differ materially from those in the forward-looking statements. Further information regarding these and other risks, uncertainties or factors is included in Yingli Green Energy's filings with the U.S. Securities and Exchange Commission. Yingli Green Energy does not undertake any obligation to update any forward-looking statement as a result of new information, future events or otherwise, except as required under applicable law. For further information, please contact: In China : Vice President of Corporate Communications Yingli Green Energy Holding Company Limited Tel: +86 312 8929787", "external_links": [], "published": "2015-09-24T15:43:00.000+03:00", "crawled": "2015-09-24T15:30:10.437+03:00", "highlightTitle": ""}