{"organizations": ["Hospitality Solutions Product", "Hospitality Solutions Product Development Sabre", "Sabre Corporation Sabre Corporation", "Sabre Corporation", "Pratt & Whitney", "Sabre Hospitality Solutions", "Sabre", "Hospitality Solutions Product Development", "Sabre Airline Solutions", "Texas  Sabre", "Air Canada", "Concordia University", "McGill University", "Texas   Sabre Corporation"], "uuid": "43911e9aae79e1c21d30edc57dfb10732c8e14b1", "thread": {"social": {"gplus": {"shares": 0}, "pinterest": {"shares": 0}, "vk": {"shares": 0}, "linkedin": {"shares": 0}, "facebook": {"likes": 0, "shares": 0, "comments": 0}, "stumbledupon": {"shares": 0}}, "site_full": "science-technology.news-articles.net", "main_image": "", "site_section": "http://science-technology.news-articles.net/content/rss.php", "section_title": "Science and Technology @ News Articles Network", "url": "http://science-technology.news-articles.net/content/sabre-appoints-hani-joakim-senior-vice-president-hospitality-solutions-product-development.xhtml", "country": "US", "title": "Sabre appoints Hani Joakim as senior vice president of Hospitality Solutions Product Development", "performance_score": 0, "site": "news-articles.net", "participants_count": 0, "title_full": "Sabre appoints Hani Joakim as senior vice president of Hospitality Solutions Product Development", "spam_score": 0.0, "site_type": "news", "published": "2015-09-03T18:10:00.000+03:00", "replies_count": 0, "uuid": "43911e9aae79e1c21d30edc57dfb10732c8e14b1"}, "author": "", "url": "http://science-technology.news-articles.net/content/sabre-appoints-hani-joakim-senior-vice-president-hospitality-solutions-product-development.xhtml", "ord_in_thread": 0, "title": "Sabre appoints Hani Joakim as senior vice president of Hospitality Solutions Product Development", "locations": ["USA", "Texas", "Southlake", "SOUTHLAKE"], "entities": {"persons": [], "locations": [], "organizations": []}, "highlightText": "", "language": "english", "persons": ["Hani Joakim", "Deborah Kerr", "Hani", "Joakim"], "text": "Sabre appoints Hani Joakim as senior vice president of Hospitality Solutions Product Development   07:32:54 Sabre appoints Hani Joakim as senior vice president of Hospitality Solutions Product... -- SOUTHLAKE, Texas  Sabre logo. Sabre logo. <-  <- stripped tags -> SOUTHLAKE, Texas   Sabre Corporation (NASDAQ: [[UEdFZ2NtVnNQVndpYm05bWIyeHNiM2RjSWlCb2NtVm1QU2RvZEhSd09pOHZjM1IxWkdsdkxUVXVabWx1WVc1amFXRnNZMjl1ZEdWdWRDNWpiMjB2Y0hKdVpYZHpQMUJoWjJVOVVYVnZkR1VtVkdsamEyVnlQVk5CUWxJbklISmxiRDBuYm05bWIyeHNiM2NuSUhSaGNtZGxkRDBuWDJKc1lXNXJKeUIwYVhSc1pUMG5VMEZDVWljZ2IyNWpiR2xqYXowbmJHbHVhMDl1UTJ4cFkyc29kR2hwY3lrbklISmxiRDBuYm05bWIyeHNiM2NuUGxOQlFsSThMMkUrfA==]]) has named Hani Joakim as senior vice president of Hospitality Solutions Product Development. In this role, he will lead all aspects of software development and technology for Sabre Hospitality Solutions, a leading provider of distribution, operations, retailing, guest experience and business intelligence solutions for more than 23,000 hotels worldwide. Joakim has been with Sabre for 19 years, serving Sabre Airline Solutions in a senior technology leadership role for the last eight years. He was most recently vice president of eCommerce digital platform and technology services for Sabre Airline Solutions. \"Hani's experience leading large-scale implementations for Sabre Airline Solutions, along with his more than 30 years of software development and technology experience, will provide tremendous value and leadership to our hospitality business and help position us for future growth,\" said Deborah Kerr , chief product and technology officer for Sabre Corporation. In support of Sabre Hospitality Solutions, Joakim will serve as the technology lead for large-scale hotel migrations to the SynXis Enterprise Platform and ensure the rapid delivery of innovative new products and solutions that will help Sabre hotel customers grow their businesses. Prior to joining Sabre, Joakim was with Air Canada, where he led several large software development initiatives. He started his career as a software developer with Pratt & Whitney. Joakim holds a bachelor's degree in IT/Computer Data Processing from Concordia University and an MBA from McGill University . About Sabre Corporation Sabre Corporation is a leading technology provider to the global travel and tourism industry. Sabre's software, data, mobile and distribution solutions are used by hundreds of airlines and thousands of hotel properties to manage critical operations, including passenger and guest reservations, revenue management, flight, network and crew management. Sabre also operates a leading global travel marketplace, which processes more than $110 billion of estimated travel spend annually by connecting travel buyers and suppliers. Headquartered in Southlake, Texas , USA, Sabre serves customers in more than 160 countries around the world. Media Contact:", "external_links": [], "published": "2015-09-03T18:10:00.000+03:00", "crawled": "2015-09-03T17:57:40.112+03:00", "highlightTitle": ""}