{"organizations": ["Emerging Medical Devices Technology Trends", "Emerging Medical Devices Technology Trends ... Emerging Medical Devices Technology Trends", "GBI Research", "Spindial S.p.A.", "Spindial Announce Partnership", "NxStage Medical, Inc.", "Granda Hospital in Milan", "Antigen Express", "Generex Biotechnology Corporation ... Company", "CSL", "NxStage", "Ferring & SteadyMed"], "uuid": "97040d83b05f454100dea7584aae89162759e2b0", "thread": {"social": {"gplus": {"shares": 0}, "pinterest": {"shares": 0}, "vk": {"shares": 0}, "linkedin": {"shares": 0}, "facebook": {"likes": 0, "shares": 0, "comments": 0}, "stumbledupon": {"shares": 0}}, "site_full": "www.bio-medicine.org", "main_image": "", "site_section": "http://www.bio-medicine.org/inc/biomed/medicine-technology.asp", "section_title": "Latest Medical Technology from Bio-Medicine.Org", "url": "http://www.bio-medicine.org/medicine-technology-1/NxStage-and-Spindial-Announce-Partnership-with-Niguarda-Ca-Granda-Hospital-in-Milan-48250-1/", "country": "US", "title": "NxStage and Spindial Announce Partnership with Niguarda-Ca' Granda Hospital in Milan", "performance_score": 0, "site": "bio-medicine.org", "participants_count": 0, "title_full": "NxStage and Spindial Announce Partnership with Niguarda-Ca' Granda Hospital in Milan", "spam_score": 0.0, "site_type": "news", "published": "2015-09-11T14:26:00.000+03:00", "replies_count": 0, "uuid": "97040d83b05f454100dea7584aae89162759e2b0"}, "author": "", "url": "http://www.bio-medicine.org/medicine-technology-1/NxStage-and-Spindial-Announce-Partnership-with-Niguarda-Ca-Granda-Hospital-in-Milan-48250-1/", "ord_in_thread": 0, "title": "NxStage and Spindial Announce Partnership with Niguarda-Ca' Granda Hospital in Milan", "locations": ["Granda Hospital", "Milan", "Stockholm", "TORONTO", "Norway", "Sweden", "DUBLIN"], "entities": {"persons": [], "locations": [], "organizations": []}, "highlightText": "", "language": "english", "persons": ["Granda", "Roche", "Richard Godfrey"], "text": " 9/11/2015)... DUBLIN , Sept. 11, 2015 ... ) has announced the addition of the ... The increasing number of drugs that ... of drug delivery devices - devices that can ... mL and higher to ambulatory patients. Wearable subcutaneous ... (Date:9/11/2015)... , Sept. 11, 2015 NxStage Medical, Inc. (Nasdaq: ... products and Spindial S.p.A., a distributor of renal ... today their new partnership with the Niguarda-Ca, Granda hospital ... assist hemodialysis patients, including both current NxStage patients and ... Milan . Through this partnership and under the ... (Date:9/11/2015)... BERGEN, Norway , September 11, 2015 ... company, today announces that it has been awarded one of ... Days 2015 conference held in Stockholm, Sweden ... presented with this award in recognition of its market-leading innovation ... On news of this award, Richard Godfrey , ... [ 0 ] Global Wearable Infusion Systems Market Study Featuring Market Leaders, CSL Behring, Roche, scPharmaceuticals, Ferring & SteadyMed [ 0 ] NxStage and Spindial Announce Partnership with Niguarda-Ca' Granda Hospital in Milan [ 0 ] BerGenBio Awarded 2015 Nordic Stars Award ... 24, 2011 Reportlinker.com announces that a new ... Emerging Medical Devices Technology Trends ... Emerging Medical Devices Technology Trends - ... GBI Research,s new report, \"Emerging Medical Devices Technology ... ... and TORONTO, Oct. 24, 2011 Generex Biotechnology Corporation ... Company is planning an investor update conference call for ... provide investors with an update on (i) the status ... announced spinout of its wholly-owned immunotherapeutics subsidiary, Antigen Express, ... Emerging Medical Devices Technology Trends - 2011 Generex Announces Investor Update Conference Call Planned for Late November  ", "external_links": [], "published": "2015-09-11T14:26:00.000+03:00", "crawled": "2015-09-11T17:45:56.150+03:00", "highlightTitle": ""}