{"organizations": ["NRSRO", "Morningstar", "Morningstar, Inc.", "LLC", "Morningstar, Inc", "Treasury", "Morningstar Credit Ratings Assigns Preliminary Ratings", "Morningstar Credit Ratings", "RMBS", "Morningstar Credit Ratings, LLC"], "uuid": "89baa55fd37d461d59839cdac0013ebe8907c2bc", "thread": {"social": {"gplus": {"shares": 0}, "pinterest": {"shares": 0}, "vk": {"shares": 0}, "linkedin": {"shares": 0}, "facebook": {"likes": 0, "shares": 0, "comments": 0}, "stumbledupon": {"shares": 0}}, "site_full": "science-technology.news-articles.net", "main_image": "", "site_section": "http://science-technology.news-articles.net/content/rss.php", "section_title": "Science and Technology @ News Articles Network", "url": "http://science-technology.news-articles.net/content/morningstar-credit-ratings-assigns-preliminary-gsmsc-resecuritization-trust.xhtml", "country": "US", "title": "Morningstar Credit Ratings Assigns Preliminary Ratings to GSMSC Resecuritization Trust 2015-7R (GSMSC 2015-7R) and GSMSC Resecuritization Trust 2015-8R (GSMSC 2015-8R)", "performance_score": 0, "site": "news-articles.net", "participants_count": 0, "title_full": "Morningstar Credit Ratings Assigns Preliminary Ratings to GSMSC Resecuritization Trust 2015-7R (GSMSC 2015-7R) and GSMSC Resecuritization Trust 2015-8R (GSMSC 2015-8R)", "spam_score": 0.0, "site_type": "news", "published": "2015-09-30T00:01:00.000+03:00", "replies_count": 0, "uuid": "89baa55fd37d461d59839cdac0013ebe8907c2bc"}, "author": "", "url": "http://science-technology.news-articles.net/content/morningstar-credit-ratings-assigns-preliminary-gsmsc-resecuritization-trust.xhtml", "ord_in_thread": 0, "title": "Morningstar Credit Ratings Assigns Preliminary Ratings to GSMSC Resecuritization Trust 2015-7R (GSMSC 2015-7R) and GSMSC Resecuritization Trust 2015-8R (GSMSC 2015-8R)", "locations": ["North America", "Australia", "Europe", "NEW YORK", "Asia"], "entities": {"persons": [], "locations": [], "organizations": []}, "highlightText": "", "language": "english", "persons": ["Morningstar", "Michelle Weiss"], "text": "Morningstar Credit Ratings Assigns Preliminary Ratings to GSMSC Resecuritization Trust 2015-7R (GSMSC 2015-7R) and GSMSC Resecuritization Trust 2015-8R (GSMSC 2015-8R)   13:01:22 Morningstar Credit Ratings Assigns Preliminary Ratings to GSMSC Resecuritization Trust 2015-7R (GSMSC... -- NEW YORK  <-   NEW YORK   Morningstar Credit Ratings, LLC today assigned preliminary ratings to one class of residential notes from GSMSC Resecuritization Trust 2015-7R (GSMSC 2015-7R) and one class of residential notes from GSMSC Resecuritization Trust 2015-8R (GSMSC 2015-8R), resecuritizations of previously issued residential mortgage-backed securities (RMBS). The ratings are based on information known to Morningstar as of Sept. 29, 2015 . GSMSC 2015-7R Preliminary Ratings (as of Sept. 29, 2015) Class NR NR – Not Rated The collateral backing the GSMSC 2015-7R transaction consists of a previously issued RMBS backed by seasoned subprime and second lien residential mortgages. The rating of the Class A notes reflects the credit enhancement provided by the Class B certificates and the quality of the underlying assets. Morningstar did not rate the Class B certificates. The principal balance of the Class B certificates represents the amount of overcollateralization with respect to the Class A notes. The initial principal balance of the Class B certificates is approximately 51.20 percent of the aggregate principal balance of the underlying securities, as of their distribution dates in August 2015 . GSMSC 2015-8R Preliminary Ratings (as of Sept. 29, 2015) Class NR NR – Not Rated The collateral backing the GSMSC 2015-8R transaction consists of a previously issued RMBS backed by seasoned subprime and second lien residential mortgages. The rating of the Class A notes reflects the credit enhancement provided by the Class B certificates and the quality of the underlying assets. Morningstar did not rate the Class B certificates. The principal balance of the Class B certificates represents the amount of overcollateralization with respect to the Class A notes. The initial principal balance of the Class B certificates is approximately 65.30 percent of the aggregate principal balance of the underlying securities, as of their distribution dates in August 2015 . Morningstar's Preliminary Analysis Packages, including the Ratings Bulletin; Rule 17g-7 Disclosures and Certification; and the Representations, Warranties, and Enforcement Mechanisms, are available under the RMBS tab in the Ratings Reports section at https://ratingagency.morningstar.com . About Morningstar Credit Ratings, LLC and Morningstar, Inc. Morningstar Credit Ratings, LLC is a Nationally Recognized Statistical Rating Organization (NRSRO) offering a wide array of services including new-issue ratings and analysis, operational risk assessments, surveillance services, data, and technology solutions. Morningstar Credit Ratings, LLC is a subsidiary of Morningstar, Inc. (NASDAQ: MORN ), a leading provider of independent investment research in North America , Europe , Australia , and Asia . Morningstar, Inc. offers an extensive line of products and services for individual investors, financial advisors, asset managers, and retirement plan providers and sponsors. Morningstar provides data on more than 500,000 investment offerings, including stocks, mutual funds, and similar vehicles, along with real-time global market data on more than 16 million equities, indexes, futures, options, commodities, and precious metals, in addition to foreign exchange and Treasury markets. Morningstar also offers investment management services through its investment advisory subsidiaries, with more than $180 billion in assets under advisement and management as of June 30, 2015 . The company has operations in 27 countries. Morningstar, Inc. is not an NRSRO and does not issue NRSRO credit ratings. ©2015 Morningstar, Inc. All Rights Reserved. MORN-R Michelle Weiss , +1 267-960-6014 or michelle.weiss@morningstar.com", "external_links": [], "published": "2015-09-30T00:01:00.000+03:00", "crawled": "2015-09-29T23:48:23.083+03:00", "highlightTitle": ""}