{"organizations": ["Board of Directors", "Tieto Corporation", "Varma Mutual Pension Insurance Company", "Cevian Capital AB", "Nomination Board", "Ilmarinen Mutual Pension Insurance Company", "Head of Listed Securities", "EET Tieto’s Shareholders' Nomination Board", "OMX Helsinki NASDAQ OMX Stockholm Principal Media Tieto", "Tieto Tieto Corporation", "Nomination Board Composition of Tieto", "Nordics"], "uuid": "9f9b3a1dca38b0f8b84c4cc1c37a41bac79aee97", "thread": {"social": {"gplus": {"shares": 0}, "pinterest": {"shares": 0}, "vk": {"shares": 0}, "linkedin": {"shares": 0}, "facebook": {"likes": 0, "shares": 0, "comments": 0}, "stumbledupon": {"shares": 0}}, "site_full": "globenewswire.com", "main_image": "http://globenewswire.com/Attachment/LogoDisplay/256070?filename=256070.jpg&amp;size=1", "site_section": "http://globenewswire.com//Rss/industry/9000/Technology", "section_title": "GlobeNewswire: Industry News on Technology", "url": "http://globenewswire.com/news-release/2015/09/14/767959/0/en/Composition-of-Tieto-s-Shareholders-Nomination-Board.html?f=22&fvtc=3&fvtv=9000", "country": "US", "title": "Composition of Tieto’s Shareholders’ Nomination Board", "performance_score": 0, "site": "globenewswire.com", "participants_count": 0, "title_full": "Composition of Tieto’s Shareholders’ Nomination Board", "spam_score": 0.0, "site_type": "news", "published": "2015-09-14T14:00:00.000+03:00", "replies_count": 0, "uuid": "9f9b3a1dca38b0f8b84c4cc1c37a41bac79aee97"}, "author": "", "url": "http://globenewswire.com/news-release/2015/09/14/767959/0/en/Composition-of-Tieto-s-Shareholders-Nomination-Board.html?f=22&fvtc=3&fvtv=9000", "ord_in_thread": 0, "title": "Composition of Tieto’s Shareholders’ Nomination Board", "locations": ["Helsinki", "Stockholm", "Finland"], "entities": {"persons": [], "locations": [], "organizations": []}, "highlightText": "", "language": "english", "persons": ["Markku Pohjola", "Jouko Lonka", "Martin Oliw", "Kari Järvinen", "Timo Sallinen", "Timo Ritakallio"], "text": "Composition of Tieto’s Shareholders’ Nomination Board September 14, 2015 07:00 ET | Source: Tieto Tieto Corporation STOCK EXCHANGE RELEASE 14 September 2015, 2 pm EET Tieto’s Shareholders' Nomination Board comprises four members annually nominated by the largest shareholders and the Chairman of the Board of Directors of the company. The largest shareholders were determined on the basis of the shareholdings registered in the Finnish and Swedish book-entry systems on 31 August 2015. The shareholders who wished to participate in the work of the Shareholders’ Nomination Board have nominated the following members: Martin Oliw, Partner, Cevian Capital AB, Kari Järvinen, Managing Director, Solidium Oy, Timo Ritakallio, President and CEO, Ilmarinen Mutual Pension Insurance Company, Timo Sallinen, Head of Listed Securities, Varma Mutual Pension Insurance Company and Markku Pohjola, Chairman of the Board of Directors, Tieto Corporation. The representative of the largest shareholder shall act as Chairman unless otherwise decided by the Shareholders' Nomination Board. The Annual General Meeting 2010 of Tieto Corporation decided to establish a Shareholders’ Nomination Board for the time being. The Nomination Board prepares proposals for the election and remuneration of the chairman and members of the Board of Directors to the Annual General Meeting. The charter of the Nomination Board is available on the company’s website at http://www.tieto.com/investors/tietos-governance/shareholders-nomination-board. For further information, please contact: Jouko Lonka, General Counsel, tel. +358 20 727 8182, +358 400 424 451, firstname.lastname (at) tieto.com DISTRIBUTION NASDAQ OMX Helsinki NASDAQ OMX Stockholm Principal Media Tieto is the largest IT services company in the Nordics providing full lifecycle IT services. We also provide global product development services for companies in the communications and embedded technologies arena. Through industry insight, technology vision, and innovative thinking, Tieto proactively strives to inspire and engage our customers in finding new ways of accelerating their business. Building on a strong Nordic heritage, Tieto combines global capabilities with local presence. Headquartered in Helsinki, Finland, Tieto has over 13 000 experts in more than 20 countries. Turnover is approximately EUR 1.5 billion. Tieto’s shares are listed on NASDAQ in Helsinki and Stockholm. www.tieto.com Related Articles", "external_links": [], "published": "2015-09-14T14:00:00.000+03:00", "crawled": "2015-09-14T14:25:51.349+03:00", "highlightTitle": ""}