{"organizations": ["Cheetah Mobile", "Apus Group", "Times of India News", "TNN"], "uuid": "97a80ec24681a73ab5d874734361a71a86212432", "thread": {"social": {"gplus": {"shares": 0}, "pinterest": {"shares": 0}, "vk": {"shares": 0}, "linkedin": {"shares": 0}, "facebook": {"likes": 0, "shares": 0, "comments": 0}, "stumbledupon": {"shares": 0}}, "site_full": "timesofindia.indiatimes.com", "main_image": "http://timesofindia.indiatimes.com/photo/47529300.cms", "site_section": "http://timesofindia.indiatimes.com/rssfeeds/5880659.cms", "section_title": "Technology News, Latest Gadget Reviews, Gaming & Tech Videos | Times of India", "url": "http://timesofindia.indiatimes.com/tech/tech-news/Chinese-mobile-companies-expand-rapidly-into-India/articleshow/48907508.cms", "country": "IL", "title": "Chinese mobile companies expand rapidly into India", "performance_score": 0, "site": "indiatimes.com", "participants_count": 0, "title_full": "Chinese mobile companies expand rapidly into India", "spam_score": 0.0, "site_type": "news", "published": "2015-09-11T03:48:00.000+03:00", "replies_count": 0, "uuid": "97a80ec24681a73ab5d874734361a71a86212432"}, "author": "", "url": "http://timesofindia.indiatimes.com/tech/tech-news/Chinese-mobile-companies-expand-rapidly-into-India/articleshow/48907508.cms", "ord_in_thread": 0, "title": "Chinese mobile companies expand rapidly into India", "locations": ["US", "Asia-Pacific", "Brazil", "Baidu", "China", "India"], "entities": {"persons": [], "locations": [], "organizations": []}, "highlightText": "", "language": "english", "persons": ["Shalina Pillai Shalina Pillai", "Mobivista", "Joshua Fenn", "Tao Li", "Coolpad Dazen"], "text": "Chinese mobile companies expand rapidly into India Shalina Pillai Shalina Pillai ,TNN | Sep 11, 2015, 06.18 AM IST READ MORE Mobivista | mobile advertising platform | Chinese mobile companies RELATED BENGALURU: A number of Chinese mobile companies are expanding rapidly into India. Mobivista, a mobile advertising platform, has announced plans to invest $100 million in India by 2018.Chinese handset company Coolpad Dazen has set up more than 250 service centres across India, in just the past two months. On Thursday, at the Global Mobile Internet Conference (GMIC) Bengaluru, Chinese mobile market leaders like Baidu, Cheetah Mobile, and Apus Group announced plans to seek Indian partnerships and hire Indian developers. Some also announced big investment plans. Web service giant Baidu said the number of its users in India was one of the highest outside China. The other big markets for Baidu are Brazil and Indonesia.Called the \"Google of China\", Baidu has a 75% market share in China. \"We don't have the same standing in India now, but India is important to us, given its 1.25 billion people, 19% internet penetration, and government policies that are favourable to promoting internet penetration,\" said Joshua Fenn, Baidu's senior marketing manager. Mobile tools provider Cheetah Mobile said it planned to expand local partnerships, hire local talent, promote the Cheetah ad platform, and invest in startups in India. \"The mobile internet market in India is growing rapidly. It's the fastest growing market for smartphones in Asia-Pacific. India will soon become the most populous country.So we see India as one of the most important markets,\" said Sheng Fu, CEO of Cheetah Mobile. Apus Group, an Android application developer, said it would invest $1 billion in In dia over the next few years, in innovative startups and mobile developers. TOI had last week reported Apus' plan to set up an operations centre, R&D and, tech support branch in India. \"Indian developers have already learnt from the US and China markets. We need to speed up and look for more innovation in India. India's market is similar to China's in terms of user base and innovation,\" said Tao Li, CEO and founder, Apus Group. The company's looking to hire around 300 people for the India R&D centre. Stay updated on the go with Times of India News App. Click here to download it for your device.", "external_links": [], "published": "2015-09-11T03:48:00.000+03:00", "crawled": "2015-09-11T05:35:35.620+03:00", "highlightTitle": ""}