{"organizations": ["Epix", "Verizon", "Verizon Communications Inc.", "HBO", "Fios Voice", "Cinemax", "VERIZON", "Verizon Wireless", "Fios Digital Voice", "PC Magazine"], "uuid": "dcac2f33ed9660873b751dc40b327a779616b9b8", "thread": {"social": {"gplus": {"shares": 0}, "pinterest": {"shares": 0}, "vk": {"shares": 0}, "linkedin": {"shares": 0}, "facebook": {"likes": 0, "shares": 0, "comments": 0}, "stumbledupon": {"shares": 0}}, "site_full": "science-technology.news-articles.net", "main_image": "", "site_section": "http://science-technology.news-articles.net/content/rss.php", "section_title": "Science and Technology @ News Articles Network", "url": "http://science-technology.news-articles.net/content/tampa-bay-region-speeds-verizons-new-mbps-internet-option-latest-fios-bundles.xhtml", "country": "US", "title": "Tampa Bay region speeds up with Verizon's new 100/100 Mbps Internet option, latest Fios bundles", "performance_score": 0, "site": "news-articles.net", "participants_count": 0, "title_full": "Tampa Bay region speeds up with Verizon's new 100/100 Mbps Internet option, latest Fios bundles", "spam_score": 0.0, "site_type": "news", "published": "2015-09-21T17:48:00.000+03:00", "replies_count": 0, "uuid": "dcac2f33ed9660873b751dc40b327a779616b9b8"}, "author": "", "url": "http://science-technology.news-articles.net/content/tampa-bay-region-speeds-verizons-new-mbps-internet-option-latest-fios-bundles.xhtml", "ord_in_thread": 0, "title": "Tampa Bay region speeds up with Verizon's new 100/100 Mbps Internet option, latest Fios bundles", "locations": ["Sarasota", "Fla.", "America", "New York", "Polk", "Pinellas", "Hillsborough", "Pasco", "Tampa Bay", "TAMPA", "Florida"], "entities": {"persons": [], "locations": [], "organizations": []}, "highlightText": "", "language": "english", "persons": ["Melanie Williams"], "text": "Tampa Bay region speeds up with Verizon's new 100/100 Mbps Internet option, latest Fios bundles   07:17:06 Tampa Bay region speeds up with Verizon's new 100/100 Mbps Internet option,... -- TAMPA, Fla., Sept.   <-   TAMPA, Fla. , Sept.   Attention Tampa region customers who love Internet speed â€“ on your mark, get set, go! Verizon is introducing a new 100/100 Mbps tier into its already super-fast, super-reliable Fios Internet services. Additionally, the price for its 150/150 Mbps service has been greatly reduced. Both are part of new bundled offers being introduced today where Verizon offers its most advanced, 100 percent fiber optic network to nearly 1.3 million premises in Hillsborough , Pinellas , Pasco , Polk , Manatee and Sarasota counties. Verizon is the only communications provider to offer a symmetrical speed tier of 100/100 Mbps, or any Internet services offering the same fast download and upload speeds, in the Florida market Verizon's triple-play bundle offers of Internet, TV and voice services features Fios Custom TV , which enables customers to purchase a package of programming that includes a choice of channel packs from seven different genres. This gives customers more freedom and flexibility to choose and pay for the types of channels they want and not for the ones they don't. \"Speed and reliability are the two most important features customers want in their Internet service and that's exactly what Fios delivers,\" said Melanie Williams , Verizon's Florida region president. \"This new tier adds even more choices for Fios Internet services and further enables the best experience with multiple digital devices in the home, video streaming, social platforms and more, at some of the best prices and value we've ever offered.\" With the Fios bundles new residential customers in the Tampa Bay area: Can order triple-play services featuring 50/50 Mbps Internet, Custom TV and Fios Digital Voice for $79.99 per year; 100/100 Mbps, Custom TV and Fios Voice for $89.99 per year; or 150/150 Mbps, Custom TV and Fios Voice for $99.99 per year. These are available with a two-year contract or month-to-month. Customers opting for a two-year contract are guaranteed to receive these prices for the term. They also have the option of receiving either a $300 Visa Reward card or $15 per month off of the price for Verizon's recording and storage service for a two-year period. They also receive a fully-loaded entertainment pack for one year, featuring HBO, Showtime, STARZ, Cinemax and Epix for no additional cost. In addition to these bundle options, customers can choose plans featuring faster Internet speeds or more robust TV plans, depending on specific needs. And, with Verizon's Fios TV Mobile app, customers are able to watch Fios TV on compatible mobile devices. New 100/100 Fios Internet tier adds more versatility to Verizon's industry-leading service Verizon offers a wide variety of Internet, video and voice service bundles for homes or small businesses. Fios Internet is a PC Magazine Readers' Choice Award winner 10 years in a row and is consistently rated No. 1 by PC Magazine in speed, reliability and customer satisfaction. It has also been recognized for offering the fastest Internet and in-home Wi-Fi available. According to the 2015 American Customer Satisfaction Index , Fios Internet is rated No. 1 for overall quality and streaming video quality, while Fios TV is rated No. 1 in customer satisfaction, picture quality, signal reliability and customer loyalty. More consumer information and offers are available at www.verizon.com . Small businesses can visit www.verizon.com/smallbusiness for more information on Fios Internet, voice and TV plans, including Fios Custom TV for Small Business. Verizon Communications Inc. (NYSE, Nasdaq: VZ ), headquartered in New York , employs a diverse workforce of 178,500 and generated more than $127 billion in 2014 revenues. Verizon Wireless operates America's most reliable wireless network, with 109.5 million retail connections nationwide. Verizon also provides converged communications, information and entertainment services over America's most advanced fiber-optic network, and delivers integrated business solutions to customers worldwide. For more information, visit www.verizon.com/news/ . VERIZON'S ONLINE NEWS CENTER: Verizon news releases, executive speeches and biographies, media contacts and other information are available at Verizon's online News Center at www.verizon.com/news / . The news releases are available through an RSS feed. To subscribe, visit www.verizon.com/about/rss-feeds /. \nSOURCE Verizon", "external_links": [], "published": "2015-09-21T17:48:00.000+03:00", "crawled": "2015-09-21T17:34:39.643+03:00", "highlightTitle": ""}