{"organizations": ["Lemko Corporation LAS VEGAS", "Lemko Corporation", "Distributed Mobile Wireless Network", "CTIA", "Lemko Corporation Lemko Corporation", "FCC", "Private Enterprise Network", "Mobile Network for Internet Economics", "EPC"], "uuid": "7a624a7c5b92ec29feb85de2e53097a7980f5e0e", "thread": {"social": {"gplus": {"shares": 0}, "pinterest": {"shares": 0}, "vk": {"shares": 0}, "linkedin": {"shares": 0}, "facebook": {"likes": 0, "shares": 0, "comments": 0}, "stumbledupon": {"shares": 0}}, "site_full": "www.prnewswire.com", "main_image": "http://content.prnewswire.com/designimages/logo-prn-01_PRN.gif", "site_section": "http://rss.prnewswire.com/industry/technology/", "section_title": "PR Newswire: Business Technology", "url": "http://www.prnewswire.com/news-releases/lemko-announces-lte-off-the-shelf-300138174.html", "country": "IT", "title": "Lemko Announces LTE-Off-the-Shelf", "performance_score": 0, "site": "prnewswire.com", "participants_count": 0, "title_full": "Lemko Announces LTE-Off-the-Shelf", "spam_score": 0.0, "site_type": "news", "published": "2015-09-08T15:35:00.000+03:00", "replies_count": 0, "uuid": "7a624a7c5b92ec29feb85de2e53097a7980f5e0e"}, "author": "", "url": "http://www.prnewswire.com/news-releases/lemko-announces-lte-off-the-shelf-300138174.html", "ord_in_thread": 0, "title": "Lemko Announces LTE-Off-the-Shelf", "locations": ["USA", "U.S.", "LAS VEGAS", "Illinois", "Itasca"], "entities": {"persons": [], "locations": [], "organizations": []}, "highlightText": "", "language": "english", "persons": ["Lemko", "Bo Pyskir"], "text": "Lemko Announces LTE-Off-the-Shelf -- LAS VEGAS, Sept. 8,   Lemko Announces LTE-Off-the-Shelf 08:35 ET from Lemko Corporation LAS VEGAS , Sept. 8,   Lemko announces LTE-Off-the-Shelf. Private Enterprise Network using Citizen Band Spectrum for IoT. Lemko is pleased to announce the EZ LTE product line, an Off-the-Shelf smart eNodeB indoor/outdoor access point, specifically designed for Enterprise and Industry Vertical IoT Solutions. EZ LTE provides broadband carrier grade connectivity for private networks. Lemko's EZ LTE delivers a robust LTE solution with network scalability and drop-n-go economics normally associated with Wi-Fi solutions. Lemko's EZ LTE, an industry first, is an affordable solution for Industries and Enterprises that is simple to install, easy to provision, and inexpensive to operate and maintain. EZ LTE smart access points connect securely to any private IP network behind an Enterprise firewall, or Private/Public/Hybrid Clouds. The EZ LTE smart access point will make its public debut in the 5G Innovation Lab at CTIA Super Mobility 2015 from September 9 th to 11 th . Bo Pyskir , President and Founder of Lemko Corporation said, \"Our vision is to connect everything anywhere by driving the lowest connectivity cost to enable a fully networked world. Lemko's 5G network architecture delivers an affordable IoT. Lemko is showcasing how mobility can be purchased now and in the future by offering LTE-Off-the-shelf. A CIO can go to Lemko's website, use a PayPal account, and buy an EZ LTE network. It is that easy. The EZ LTE smart access point is powered by Lemko's 5G networking software featuring a virtualized, distributed EPC and IMS that is managed on the Cloud. EZ delivers LTE QoS and Security with Wi-Fi like economics. Customers in the U.S. can purchase EZ LTE directly via Lemko's website and deploy LTE based on the FCC Citizen Band Spectrum rules.\" About Lemko Corporation Lemko Corporation is a Distributed Mobile Wireless Network software company with ultra-low cost Internet based architectures that drive down the cost per GB MHz POP. Lemko is the industry leader in Re-Engineering the Mobile Network for Internet Economics and provides quick deployments of 2G, 3G and 4G LTE cellular systems powered by a virtualized and distributed EPC and IMS core. The company's market leading solutions are available in multiple form factors including macro network, small cell, enterprise access points, On-Demand Cellular (ODC), M2M, Cellular-on-Wheels (COWs), man-portable and are deployed with carriers, governments, military private network operators and enterprises. Lemko is headquartered in Itasca, Illinois , USA. For more information visit www.lemko.com . Media Contact:", "external_links": [], "published": "2015-09-08T15:35:00.000+03:00", "crawled": "2015-09-08T15:46:51.878+03:00", "highlightTitle": ""}