{"organizations": ["Boston Business Journal", "Inc.", "Google", "LinkedIn"], "uuid": "f7a8bc0d7da564fa9ef27d230344577d87baca10", "thread": {"social": {"gplus": {"shares": 0}, "pinterest": {"shares": 0}, "vk": {"shares": 0}, "linkedin": {"shares": 0}, "facebook": {"likes": 0, "shares": 0, "comments": 0}, "stumbledupon": {"shares": 0}}, "site_full": "www.prnewswire.com", "main_image": "http://photos.prnewswire.com/prnvar/20110817/NE53515LOGO", "site_section": "http://www.prnewswire.com/rss/business-technology/all-business-technology-news.rss", "section_title": "PR Newswire: Business Technology", "url": "http://www.prnewswire.com/news-releases/hubspot-expands-global-reach-and-impact-adds-five-languages-to-its-marketing-platform-300135418.html", "country": "US", "title": "HubSpot Expands Global Reach and Impact, Adds Five Languages to its Marketing Platform", "performance_score": 0, "site": "prnewswire.com", "participants_count": 0, "title_full": "HubSpot Expands Global Reach and Impact, Adds Five Languages to its Marketing Platform", "spam_score": 0.0, "site_type": "news", "published": "2015-09-01T15:15:00.000+03:00", "replies_count": 0, "uuid": "f7a8bc0d7da564fa9ef27d230344577d87baca10"}, "author": "", "url": "http://www.prnewswire.com/news-releases/hubspot-expands-global-reach-and-impact-adds-five-languages-to-its-marketing-platform-300135418.html", "ord_in_thread": 0, "title": "HubSpot Expands Global Reach and Impact, Adds Five Languages to its Marketing Platform", "locations": ["CAMBRIDGE", "Portsmouth", "Singapore", "Mass.", "Ireland", "Dublin", "Boston", "Australia", "Cambridge", "MA", "Japan", "Sydney"], "entities": {"persons": [], "locations": [], "organizations": []}, "highlightText": "", "language": "english", "persons": ["HubSpot", "JD Sherman", "Deloitte", "Forbes", "VentureBeat"], "text": "Ã— HubSpot, Inc. logo - www.hubspot.com. CAMBRIDGE, Mass. , Sept. 1, 2015 /PRNewswire/ -- HubSpot, a leading inbound marketing and sales software company, announced today that its Marketing Platform's user interface is now available in 6 of the world's most commonly used languages: French, German, Japanese, Portuguese, and Spanish, as well as English. HubSpot users can now offer a more tailored experience through in-language forms, localized content and URLs, and smart image resizing, among many other new features. In addition to now having full product functionality in six languages, HubSpot Marketing Platform users can create content and launch campaigns in nearly any of the world's written languages. For example, a marketer using the German version can launch a multilingual campaign in Spanish, French, and Swedish, while a regional marketing team in Japan can easily clone a corporate campaign in English and launch it in Japanese. HubSpot's marketing software is now used by people in more than 90 countries, signaling a growing demand from businesses eager to delight their customers. HubSpot's product enhancements give marketers the tools they need -- in their preferred languages -- while offering businesses the ability to standardize on a single product. With the latest updates to the Marketing Platform, HubSpot users can: Delight international customers and visitors with a customized, in-language, and localized user experience with forms in 15 languages Improve international SEO and keyword ranking performance across languages with keyword tracking data available for 25+ languages, as well as better SEO through localizable URLs Target content by language and country through customized local content and A/B testing Empower international marketing teams and agency partners to create more efficient, relevant, and native content with localized UI for dates, times and numbers in 19 global locales, as well as through cloned campaigns Provide an optimized local experience for international website visitors with smart image resizing that accounts for local load times and internet speeds Enable easier customer purchase by customizing the currency associated with the contact database Improve compliance with international data privacy laws through double opt-In functionality and customizable Privacy Policy and Cookie requirements Extend global social engagement across the world's most important social media platforms with support for Facebook, Twitter, LinkedIn, Google+, and Xing \"HubSpot's goal is to help millions of businesses around the globe use Inbound Marketing to transform their marketing and sales to match the way modern humans shop and buy,\" said JD Sherman, HubSpot's Chief Operating Officer. \"Today, we have 2,500 partner agencies and 15,000 customers around the world, and we want to help them deliver a more personalized, in-language experience to their customers. \" Headquartered in Cambridge, MA with offices in Dublin, Ireland ; Sydney, Australia ; Singapore (expected Q4 2015) and Portsmouth, NH , HubSpot has led the global inbound marketing movement since its inception nearly 10 years ago. On September 8-11, 2015 , HubSpot will host its annual INBOUND event in Boston, MA , where more than 12,000 marketing and sales professionals from around the world will convene to discuss inbound marketing and sales strategies, content, and innovative ideas. HubSpot's blogs, with total traffic surpassing 2 million visits per month, have become a go-to source for marketing and sales professionals around the globe seeking actionable advice, sharable content, insight, and ideas. HubSpot maintains blogs in English , Spanish , Portuguese , German and Japanese . For more information on HubSpot's global reach, visit: www.hubspot.com/global About HubSpot HubSpot (NYSE: HUBS ) is the world's leading inbound marketing and sales platform. Since 2006, HubSpot has been on a mission to make the world more inbound. Today, over 15,000 customers in more than 90 countries use HubSpot's software, services, and support to transform the way they attract, engage, and delight customers. HubSpot's inbound marketing software, ranked #1 in customer satisfaction by VentureBeat and G2Crowd, includes social media publishing and monitoring, blogging, SEO, website content management, email marketing, marketing automation, and reporting and analytics, all in one integrated platform. Sidekick, HubSpot's award-winning sales application, enables sales and service teams to have more effective conversations with leads, prospects, and customers. HubSpot has been recognized by Inc., Forbes, and Deloitte as one of the world's fastest-growing companies and the Boston Business Journal as the #1 best place to work. Learn more at www.hubspot.com .", "external_links": [], "published": "2015-09-01T15:15:00.000+03:00", "crawled": "2015-09-01T15:23:08.978+03:00", "highlightTitle": ""}