{"organizations": ["EMEA", "Splunk Inc.", "Splunk® Enterprise", "Splunk Enterprise", "ITSM", "IDC", "Jade Catalano | Splunk, Inc.", "Network Operations and Customer Care Centers", "LinkedIn | YouTube | Facebook About Resolve Systems Resolve Systems", "Splunk Inc"], "uuid": "7753e0c240607dfd29917870a15ff45cd74e3706", "thread": {"social": {"gplus": {"shares": 0}, "pinterest": {"shares": 0}, "vk": {"shares": 0}, "linkedin": {"shares": 0}, "facebook": {"likes": 0, "shares": 0, "comments": 0}, "stumbledupon": {"shares": 0}}, "site_full": "science-technology.news-articles.net", "main_image": "", "site_section": "http://science-technology.news-articles.net/content/rss.php", "section_title": "Science and Technology @ News Articles Network", "url": "http://science-technology.news-articles.net/content/resolve-systems-announces-integration-splunk-enterprise-accelerate-incident-resolution.xhtml", "country": "US", "title": "Resolve Systems Announces Integration with Splunk Enterprise to Accelerate Incident Resolution", "performance_score": 0, "site": "news-articles.net", "participants_count": 0, "title_full": "Resolve Systems Announces Integration with Splunk Enterprise to Accelerate Incident Resolution", "spam_score": 0.0, "site_type": "news", "published": "2015-09-21T17:26:00.000+03:00", "replies_count": 0, "uuid": "7753e0c240607dfd29917870a15ff45cd74e3706"}, "author": "", "url": "http://science-technology.news-articles.net/content/resolve-systems-announces-integration-splunk-enterprise-accelerate-incident-resolution.xhtml", "ord_in_thread": 0, "title": "Resolve Systems Announces Integration with Splunk Enterprise to Accelerate Incident Resolution", "locations": ["California", "Calif.", "IRVINE", "Splunk", "Irvine"], "entities": {"persons": [], "locations": [], "organizations": []}, "highlightText": "", "language": "english", "persons": ["Tanya Shuckhart", "Martin Savitt", "Robert Young", "Rick Fitz"], "text": "Resolve Systems Announces Integration with Splunk Enterprise to Accelerate Incident Resolution  32:05 Resolve Systems Announces Integration with Splunk Enterprise to Accelerate Incident Resolution -- IRVINE, Calif., Sept.   Resolve Systems | Accelerating Incident Resolution | www.resolvesystems.com Resolve Systems | Accelerating Incident Resolution | www.resolvesystems.com <-  <- stripped tags -> IRVINE, Calif. , Sept.   [[UEdFZ2NtVnNQVndpYm05bWIyeHNiM2RjSWlCdmJtTnNhV05yUFNkc2FXNXJUMjVEYkdsamF5aDBhR2x6S1NjZ2FISmxaajFjSW1oMGRIQTZMeTkzZDNjdWNtVnpiMngyWlhONWMzUmxiWE11WTI5dEwxd2lJSEpsYkQxY0ltNXZabTlzYkc5M1hDSWdkR0Z5WjJWMFBWd2lYMkpzWVc1clhDSStVbVZ6YjJ4MlpTQlRlWE4wWlcxelBDOWhQZz09fA==]], the global leader in accelerating incident resolution for IT Operations, Network Operations and Customer Care Centers today announced an integration with [[UEdFZ2NtVnNQVndpYm05bWIyeHNiM2RjSWlCdmJtTnNhV05yUFNkc2FXNXJUMjVEYkdsamF5aDBhR2x6S1NjZ2FISmxaajFjSW1oMGRIQTZMeTkzZDNjdWMzQnNkVzVyTG1OdmJTOWxibDkxY3k5d2NtOWtkV04wY3k5emNHeDFibXN0Wlc1MFpYSndjbWx6WlM1b2RHMXNYQ0lnY21Wc1BWd2libTltYjJ4c2IzZGNJaUIwWVhKblpYUTlYQ0pmWW14aGJtdGNJajVUY0d4MWJtc21JekUzTkRzZ1JXNTBaWEp3Y21selpUd3ZZVDQ9fA==]] to help its users accelerate IT incident resolution. Splunk Enterprise collects and indexes machine data identifying potential anomalies and incidents to be handled by Resolve. With the integration, Resolve processes the incident from Splunk solutions to execute full, closed-loop automation and immediately resolve the incident. The automation can also trigger Resolve's human-guided automation and process guidance to prescriptively lead agents to resolve the issues more quickly and effectively. The value this integration delivers to customers includes: The ability to apply focused resources on valid incidents instead of false ones increasing productivity Reduced swivel-chairing by combining information from multiple disparate systems and tests into a centralized incident resolution dashboard and diagnostic console Reduced incident escalations with easy to follow troubleshooting actions and decision trees \"Big data and analytics provided by Splunk Enterprise can bring insights into new problems and incidents often not found by traditional event and fault management systems. Resolve's incident resolution platform, working together with Splunk Enterprise, uniquely enables businesses to efficiently address these new problems by effectively diagnosing, troubleshooting, and resolving them,\" said Robert Young , research director, ITSM and Client Virtualization software, IDC. \"We are thrilled to enable Splunk Enterprise customers with automation, process guidance and procedures to accelerate the resolution of their incidents, thereby saving time and money,\" said Martin Savitt , chief executive officer, Resolve Systems. \"Resolve is an exciting new integration for users of Splunk Enterprise because it combines incident detection with automation and process guidance to accelerate the resolution of IT incidents,\" said Rick Fitz , senior vice president of IT markets Splunk. About Splunk Inc. Splunk Inc. (NASDAQ: SPLK ) provides the leading software platform for real-time Operational Intelligence. Splunk® software and cloud services enable organizations to search, monitor, analyze and visualize machine-generated big data coming from websites, applications, servers, networks, sensors and mobile devices. More than 10,000 enterprises, government agencies, universities and service providers in more than 100 countries use Splunk software to deepen business and customer understanding, mitigate cybersecurity risk, prevent fraud, improve service performance and reduce cost. Splunk products include Splunk® Enterprise, Splunk Cloud™, Hunk®, Splunk Light™, Splunk MINT and premium Splunk Apps. To learn more, please visit http://www.splunk.com/company . Social Media : Twitter | LinkedIn | YouTube | Facebook About Resolve Systems Resolve Systems is the global leader in accelerating incident resolutions for IT operations, network operations, and customer care centers. The Resolve Platform provides actionable dashboards and process guidance for end-to-end and human-guided automations. Headquartered in Irvine, California with Operations in EMEA, Resolve Systems has Fortune 500 customers around the world. For more information, please visit www.resolvesystems.com/splunk Media Contact Information: Tanya Shuckhart | Resolve Systems | 714.585.6663 | tanya.shuckhart@resolvesystems.com Jade Catalano | Splunk, Inc. | 415.848.8520 | jcatalano@splunk.com", "external_links": [], "published": "2015-09-21T17:26:00.000+03:00", "crawled": "2015-09-21T17:13:32.428+03:00", "highlightTitle": ""}