{"organizations": ["Associated Press", "House Select Committee on Benghazi"], "uuid": "d5fef1ea5a4b9c6774d45da9df8e3caf6ff4659a", "thread": {"social": {"gplus": {"shares": 0}, "pinterest": {"shares": 0}, "vk": {"shares": 0}, "linkedin": {"shares": 0}, "facebook": {"likes": 0, "shares": 0, "comments": 0}, "stumbledupon": {"shares": 0}}, "site_full": "mynorthwest.com", "main_image": "http://mynorthwest.com/emedia/apimage/ap_6a16adfd7fc44e598140e91f737261bb.jpg", "site_section": "http://www.mynorthwest.com/xml/23.xml", "section_title": "MyNorthwest.com - Technology", "url": "http://mynorthwest.com/23/2805654/Benghazi-panel-questions-Clinton-aide-amid-public-spat", "country": "US", "title": "Benghazi panel questions Clinton aide amid public spat", "performance_score": 0, "site": "mynorthwest.com", "participants_count": 0, "title_full": "Benghazi panel questions Clinton aide amid public spat", "spam_score": 0.0, "site_type": "news", "published": "2015-09-05T01:48:00.000+03:00", "replies_count": 0, "uuid": "d5fef1ea5a4b9c6774d45da9df8e3caf6ff4659a"}, "author": "", "url": "http://mynorthwest.com/23/2805654/Benghazi-panel-questions-Clinton-aide-amid-public-spat", "ord_in_thread": 0, "title": "Benghazi panel questions Clinton aide amid public spat", "locations": ["Benghazi", "U.S.", "Washington", "D-Md.", "Capitol Hill", "R-S.C."], "entities": {"persons": [], "locations": [], "organizations": []}, "highlightText": "", "language": "english", "persons": ["Clinton", "Hillary Rodham Clinton", "Elijah Cummings", "Walsh", "Cheryl Mills", "Trey Gowdy", "Obama"], "text": "Benghazi panel questions Clinton aide amid public spat By Associated Press | September 4, 2015 @ 2:48 pm Former Hillary Rodham Clinton aide Cheryl Mills, right, turns to look at House Select Committee on Benghazi Chairman Trey Gowdy, R-S.C., second from left, and ranking member Rep. Elijah Cummings, D-Md., left, as she speaks to reporters on Capitol Hill in Washington, Thursday, Sept. 3, 2015, following her deposition before the panel investigating Benghazi. The committee was launched last year to investigate the Obama administration's response to the Benghazi attacks that killed four Americans, including the U.S. ambassador. The investigation has widened in recent months to focus on Clinton's use of a private email account and server. (AP Photo/Susan Walsh)", "external_links": [], "published": "2015-09-05T01:48:00.000+03:00", "crawled": "2015-09-05T00:55:26.911+03:00", "highlightTitle": ""}