{"organizations": ["About Basic Energy Services Basic Energy Services", "MiX Telematics For Fleet Management and Driver Safety Basic Energy Services Signs Five-Year Renewal", "Johannesburg Stock Exchange", "New York Stock Exchange", "MiX Telematics For Fleet", "MiX Telematics For Fleet Management and Driver Safety   05:16:31 Basic Energy Services Signs Five-Year Renewal", "Basic Energy Services", "VP Manufacturing and Equipment"], "uuid": "a7fbe3a1304899b62bee0a32fad32409f8bd7a7b", "thread": {"social": {"gplus": {"shares": 0}, "pinterest": {"shares": 0}, "vk": {"shares": 0}, "linkedin": {"shares": 0}, "facebook": {"likes": 0, "shares": 0, "comments": 0}, "stumbledupon": {"shares": 0}}, "site_full": "science-technology.news-articles.net", "main_image": "", "site_section": "http://science-technology.news-articles.net/content/rss.php", "section_title": "Science and Technology @ News Articles Network", "url": "http://science-technology.news-articles.net/content/basic-energy-services-signs-five-year-renewal-mix-telematics-fleet-management-driver-safety.xhtml", "country": "US", "title": "Basic Energy Services Signs Five-Year Renewal with MiX Telematics For Fleet Management and Driver Safety", "performance_score": 0, "site": "news-articles.net", "participants_count": 0, "title_full": "Basic Energy Services Signs Five-Year Renewal with MiX Telematics For Fleet Management and Driver Safety", "spam_score": 0.0, "site_type": "news", "published": "2015-09-28T15:39:00.000+03:00", "replies_count": 0, "uuid": "a7fbe3a1304899b62bee0a32fad32409f8bd7a7b"}, "author": "", "url": "http://science-technology.news-articles.net/content/basic-energy-services-signs-five-year-renewal-mix-telematics-fleet-management-driver-safety.xhtml", "ord_in_thread": 0, "title": "Basic Energy Services Signs Five-Year Renewal with MiX Telematics For Fleet Management and Driver Safety", "locations": ["United Arab Emirates", "United States", "Uganda", "Texas", "Rocky Mountain", "New Mexico", "Florida", "United Kingdom", "Oklahoma", "Kansas", "U.S.", "Brazil", "Australia", "Louisiana", "South Africa", "Arkansas"], "entities": {"persons": [], "locations": [], "organizations": []}, "highlightText": "", "language": "english", "persons": ["Brett Taylor", "Skip Kinford"], "text": "Basic Energy Services Signs Five-Year Renewal with MiX Telematics For Fleet Management and Driver Safety   05:16:31 Basic Energy Services Signs Five-Year Renewal with MiX Telematics For Fleet... -- BOCA RATON, Florida, September   <-   BOCA RATON, Florida , September   MiX solutions used to manage 4,000 Basic Energy Services vehicles MiX Telematics (NYSE: MIXT ), a leading global provider of fleet and mobile asset management solutions, announced today that Basic Energy Services (NYSE: BAS ) has renewed its contract for fleet management and driver behavior solutions for the next five years. Basic Energy Services uses solutions from MiX Telematics to help improve driver safety and monitor performance of more than 4,000 vehicles. One of the key factors in the renewal decision was MiX's Service for Life commitment. MiX offers a comprehensive range of services, which go beyond sales, implementation and troubleshooting. It starts when a customer signs the contract and continues, holistically, until the day the contract ends. \"MiX plays a crucial role in helping us meet important compliance standards such as electronic HOS and is helping to keep our drivers safe,\" said Brett Taylor , VP Manufacturing and Equipment at Basic Energy Services. \"Its Service for Life program is delivering the type of results we expect. MiX has been an excellent, proactive partner to Basic Energy Services and we're pleased to continue that relationship.\" \"We're excited that Basic Energy Services has recommitted to the products and people here at MiX Telematics,\" said Skip Kinford , President and CEO at MiX Telematics Americas. \"It's a company that makes driver safety and compliance a priority, and we're happy that we can continue to contribute to Basic Energy Services on both fronts.\" About Basic Energy Services Basic Energy Services provides well site services essential to maintaining production from the oil and gas wells within its operating area. The company employs more than 4,400 employees in more than 100 service points throughout the major oil and gas producing regions in Texas , Louisiana , Oklahoma , New Mexico , Arkansas , Kansas , and the Rocky Mountain and Appalachian regions. Additional information on Basic Energy Services is available on the Company's website at http://www.basicenergyservices.com . About MiX Telematics MiX Telematics is a leading global provider of fleet and mobile asset management solutions delivered as SaaS to customers managing over 523,000 assets in more than 120 countries. In the U.S., MiX Telematics is known for providing the best customer support, including service for life on all solutions and dedicated account managers who proactively monitor customers' systems for optimal use. The company's products and services provide fleets of all sizes with solutions for efficiency, safety, compliance and security. MiX Telematics was founded in 1996 and has offices in the United States , South Africa , the United Kingdom , Uganda , Brazil , Australia and the United Arab Emirates as well as a network of more than 130 fleet partners worldwide. MiX Telematics shares are publicly traded on the New York Stock Exchange (NYSE: MIXT ) and the Johannesburg Stock Exchange (JSE: MIX). For more information, visit http://www.mixtelematics.com . Contact details :", "external_links": [], "published": "2015-09-28T15:39:00.000+03:00", "crawled": "2015-09-28T15:26:22.502+03:00", "highlightTitle": ""}