{"organizations": ["Softpedia", "Computer Industry Also", "Apple Pencil", "Apple", "Microsoft", "Dell", "Apple Inc.", "Fast Company"], "uuid": "e500b055fd05fb90c0a186bd3881207f2dd54256", "thread": {"social": {"gplus": {"shares": 0}, "pinterest": {"shares": 0}, "vk": {"shares": 0}, "linkedin": {"shares": 0}, "facebook": {"likes": 0, "shares": 0, "comments": 0}, "stumbledupon": {"shares": 0}}, "site_full": "www.onenewspage.com", "main_image": "http://cdn.newsserve.net/ONPglobe256.jpg", "site_section": "http://www.onenewspage.com/rss/latest/Technology.rss", "section_title": "Latest Technology News on One News Page", "url": "http://www.onenewspage.com/n/Technology/75589elxm/Why-the-iPad-Pro-could-be-good-for.htm", "country": "US", "title": "Why the iPad Pro could be good for Microsoft", "performance_score": 0, "site": "onenewspage.com", "participants_count": 0, "title_full": "Why the iPad Pro could be good for Microsoft", "spam_score": 0.0, "site_type": "news", "published": "2015-09-21T07:20:00.000+03:00", "replies_count": 0, "uuid": "e500b055fd05fb90c0a186bd3881207f2dd54256"}, "author": "", "url": "http://www.onenewspage.com/n/Technology/75589elxm/Why-the-iPad-Pro-could-be-good-for.htm", "ord_in_thread": 0, "title": "Why the iPad Pro could be good for Microsoft", "locations": ["Yogi Berra", "Forbes.com"], "entities": {"persons": [], "locations": [], "organizations": []}, "highlightText": "", "language": "english", "persons": ["Yasmeen Abutaleb", "Mark Wilson", "Mari Saito"], "text": "Why the iPad Pro could be good for Microsoft Monday, 21 September 2015 (8 minutes ago) Apple Inc.'s new iPad - though not expected to sell like crazy - could lift the entire market for large, touchscreen slates, boosting the fortunes of Microsoft, Dell and several other hardware makers. Apple's 12.9-inch and 1.5 lb (700 grams) iPad Pro has been announced on September 9, and it should be released in November, starting at $799 for the 32 GB Wi-Fi... Softpedia 22 hours ago - Technology Also reported by • Forbes.com • Mashable Apple’s latest announcements for its mobile ecosystem had plenty to do with the enterprise: It announced a dedicated for-work tablet in the form of the iPad... ITworld 3 days ago - Computer Industry Also reported by • 9to5Mac When Apple introduced the iPad Pro last week, it called up two of its oldest rivals to help sell the device: Adobe and Microsoft. For many, this was quite a... Boy Genius Report 3 days ago - Technology Also reported by • The Verge OneNote is becoming a lot more powerful for iPad users thanks to iOS 9. Microsoft today announced an update to OneNote for iOS, mainly adding support for... The Next Web 4 days ago - Internet iOS 9 is launching today, and Microsoft’s OneNote team is wasting no time. The company updated OneNote with support for iOS 9, iPad Pro, Apple Pencil, Handoff,... VentureBeat 5 days ago - Technology Also reported by • The Verge • Forbes.com By Mari Saito and Yasmeen Abutaleb The iPad Pro's biggest competitor is likely Microsoft's 12-inch Surface Pro 3, also geared towards the business market. While... WorldNews 5 days ago - Front Page The irony of being Apple is being criticized both for not providing enough choice and for making too many products. Writing for Fast Company, Mark Wilson... Macworld 6 days ago - Computer Industry When you come to a fork in the road, take it, Yogi Berra is alleged to have said. Microsoft chose this bon mot to guide its Windows 8 strategy, converging mobile... Macworld 6 days ago - Computer Industry Also reported by • Forbes.com You Might Like", "external_links": [], "published": "2015-09-21T07:20:00.000+03:00", "crawled": "2015-09-21T07:28:28.247+03:00", "highlightTitle": ""}