{"organizations": ["SAN FRANCISCO   Yelp Inc.", "Davidson Companies", "Coopers & Lybrand LLP", "Ticketmaster", "SAN FRANCISCO  Yelp", "XO Group Inc.", "Audit Committee", "Yelp Board of Directors Appoints Diane Irvine as Chairperson Yelp Board of Directors Appoints Diane Irvine as Chairperson   Yelp Board of Directors Appoints Diane Irvine", "Blue Nile, Inc.", "Golden Gate University", "Illinois State University", "Rightside Group, Ltd.", "Plum Creek Timber Company", "CafePress Inc", "Google Analytics", "Blue Nile", "Yelp Inc."], "uuid": "def48dffcf56051a6ac679defa9cf15457d239e7", "thread": {"social": {"gplus": {"shares": 0}, "pinterest": {"shares": 0}, "vk": {"shares": 0}, "linkedin": {"shares": 0}, "facebook": {"likes": 0, "shares": 0, "comments": 0}, "stumbledupon": {"shares": 0}}, "site_full": "science-technology.news-articles.net", "main_image": "", "site_section": "http://science-technology.news-articles.net/content/rss.php", "section_title": "Science and Technology @ News Articles Network", "url": "http://science-technology.news-articles.net/content/yelp-board-directors-appoints-diane-irvine-chairperson.xhtml", "country": "US", "title": "Yelp Board of Directors Appoints Diane Irvine as Chairperson", "performance_score": 0, "site": "news-articles.net", "participants_count": 0, "title_full": "Yelp Board of Directors Appoints Diane Irvine as Chairperson", "spam_score": 0.0, "site_type": "news", "published": "2015-09-28T20:48:00.000+03:00", "replies_count": 0, "uuid": "def48dffcf56051a6ac679defa9cf15457d239e7"}, "author": "", "url": "http://science-technology.news-articles.net/content/yelp-board-directors-appoints-diane-irvine-chairperson.xhtml", "ord_in_thread": 0, "title": "Yelp Board of Directors Appoints Diane Irvine as Chairperson", "locations": ["San Francisco"], "entities": {"persons": [], "locations": [], "organizations": []}, "highlightText": "", "language": "english", "persons": ["Jeremy Stoppelman", "Diane Irvine", "Diane", "Max Levchin"], "text": "Yelp Board of Directors Appoints Diane Irvine as Chairperson   Yelp Board of Directors Appoints Diane Irvine as Chairperson -- SAN FRANCISCO  Yelp logo Yelp logo <-  <- stripped tags -> SAN FRANCISCO   Yelp Inc. (NYSE: [[UEdFZ2NtVnNQVndpYm05bWIyeHNiM2RjSWlCb2NtVm1QU2RvZEhSd09pOHZjM1IxWkdsdkxUVXVabWx1WVc1amFXRnNZMjl1ZEdWdWRDNWpiMjB2Y0hKdVpYZHpQMUJoWjJVOVVYVnZkR1VtVkdsamEyVnlQVmxGVEZBbklISmxiRDBuYm05bWIyeHNiM2NuSUhSaGNtZGxkRDBuWDJKc1lXNXJKeUIwYVhSc1pUMG5XVVZNVUNjZ2IyNWpiR2xqYXowbmJHbHVhMDl1UTJ4cFkyc29kR2hwY3lrbklISmxiRDBuYm05bWIyeHNiM2NuUGxsRlRGQThMMkUrfA==]]), the company that connects consumers with great local businesses, today announced the election of current board member, Diane Irvine , to the position of non-executive board chairperson, effective immediately. Irvine takes over from Max Levchin , who recently stepped down from Yelp's and other boards to dedicate more time to the company he founded and leads. \"Diane has made significant contributions to Yelp since she joined the board in 2011,\" said Jeremy Stoppelman , co-founder and chief executive officer. \"She has played an important role as our Audit Committee chairperson, providing insight and leadership that is valuable to Yelp, our employees and shareholders,\" he continued. \"Diane brings an ideal blend of finance, technology and international business expertise – as well as a deep love of Yelp – to her new role.\" \"I am honored to be named chairperson of Yelp's board,\" said Diane Irvine . \"I'm proud to be part of a company that is building a great business and consumer experience through its best-in-class mobile platform. I am excited about the innovation and culture that powers Yelp, and look forward to continuing my work with the leadership team and the other members of the board.\" Diane is also a board member of XO Group Inc., a consumer internet and media company, and of Rightside Group, Ltd., a leading provider of domain name services. She previously served as an executive of Blue Nile, Inc., the leading online retailer of diamonds and fine jewelry, from 1999-2011, having joined Blue Nile as chief financial officer and later serving as chief executive officer, president and a director on the board. Diane has also served as chief financial officer of Plum Creek Timber Company, a timberland management and wood products company, and was a tax partner at international accounting firm, Coopers & Lybrand LLP. Diane previously served on the boards of directors of Davidson Companies, a leading regional financial services firm; Ticketmaster; and CafePress Inc. She holds a B.S. in Accounting from Illinois State University and a M.S. in Taxation from Golden Gate University . About Yelp Yelp Inc. ([[UEdFZ2NtVnNQVndpYm05bWIyeHNiM2RjSWlCdmJtTnNhV05yUFNkc2FXNXJUMjVEYkdsamF5aDBhR2x6S1NjZ2FISmxaajFjSW1oMGRIQTZMeTkzZDNjdWVXVnNjQzVqYjIwdlhDSWdjbVZzUFZ3aWJtOW1iMnhzYjNkY0lpQjBZWEpuWlhROVhDSmZZbXhoYm10Y0lqNW9kSFJ3T2k4dmQzZDNMbmxsYkhBdVkyOXRQQzloUGc9PXw=]]) connects people with great local businesses. Yelp was founded in San Francisco in July 2004 . Since then, Yelp communities have taken hold in major metros across 31 countries. Approximately 83 million unique visitors visited Yelp via their mobile device 1 , including approximately 18 million unique devices accessing the Yelp app 2 , and approximately 79 million unique visitors visited Yelp via a desktop computer 3 on a monthly average basis during the second quarter of 2015. By the end of the same quarter, Yelpers had written approximately 83 million rich, local reviews, making Yelp the leading local guide for real word-of-mouth on everything from boutiques and mechanics to restaurants and dentists. 1 Calculated as the number of \"users,\" as measured by Google Analytics, accessing Yelp via mobile web plus unique devices accessing the app, each on a monthly average basis over a given three-month period. 2 Calculated as the number of unique devices accessing the app on a monthly average basis over a given three-month period, according to internal Yelp logs. 3 Calculated as the number of \"users,\" as measured by Google Analytics, accessing Yelp via desktop computer on an average monthly basis over a given three-month period. Investor Relations Contact Information", "external_links": [], "published": "2015-09-28T20:48:00.000+03:00", "crawled": "2015-09-28T20:35:20.717+03:00", "highlightTitle": ""}