{"organizations": ["NTT Group", "Dimension Data", "NTT Com", "NTT", "NTT DOCOMO", "NTT Com Enterprise-Cloud-Rechenzentren", "NTT Communications", "NTT Communications Corporation", "NTT Europe Ltd.", "Welt"], "uuid": "36cf1761bca39abae53c84da2b04a327cd9ba392", "thread": {"social": {"gplus": {"shares": 0}, "pinterest": {"shares": 0}, "vk": {"shares": 0}, "linkedin": {"shares": 0}, "facebook": {"likes": 0, "shares": 0, "comments": 0}, "stumbledupon": {"shares": 0}}, "site_full": "science-technology.news-articles.net", "main_image": "", "site_section": "http://science-technology.news-articles.net/content/rss.php", "section_title": "Science and Technology @ News Articles Network", "url": "http://science-technology.news-articles.net/content/ntt-com-baut-sdn-basierte-enterprise-cloud-europa-aus.xhtml", "country": "US", "title": "NTT Com baut SDN-basierte Enterprise-Cloud in Europa aus", "performance_score": 0, "site": "news-articles.net", "participants_count": 0, "title_full": "NTT Com baut SDN-basierte Enterprise-Cloud in Europa aus", "spam_score": 0.0, "site_type": "news", "published": "2015-09-22T14:18:00.000+03:00", "replies_count": 0, "uuid": "36cf1761bca39abae53c84da2b04a327cd9ba392"}, "author": "", "url": "http://science-technology.news-articles.net/content/ntt-com-baut-sdn-basierte-enterprise-cloud-europa-aus.xhtml", "ord_in_thread": 0, "title": "NTT Com baut SDN-basierte Enterprise-Cloud in Europa aus", "locations": ["Architektur", "Netzwerke", "Löschungen", "Europe", "Germany", "Frankreich", "FRANKFURT"], "entities": {"persons": [], "locations": [], "organizations": []}, "highlightText": "", "language": "english", "persons": ["nach Datenhoheitsanforderungen", "Jens Leuchters", "Datenhoheit", "Juni", "Wahl", "Zahl", "Geschäftsbereich", "zur Verfügung", "Wunsch", "Rechenleistung", "sich Änderungen", "Ergänzungen", "Maschinen", "Hoch"], "text": "NTT Com baut SDN-basierte Enterprise-Cloud in Europa aus » Science & Technology NTT Com baut SDN-basierte Enterprise-Cloud in Europa aus -- FRANKFURT, Deutschland, September 22, 2015 /PRNewswire/ -- <- stripped tags -><- stripped tags -> FRANKFURT , Deutschland, September 22, 2015 /PRNewswire/ -- Kunden haben je nach Datenhoheitsanforderungen die Wahl, Cloud-Dienste an vier verschiedenen europäischen Standorten zu nutzen: NTT Communications (NTT Com), der Geschäftsbereich der NTT-Gruppe für ICT-Lösungen und internationale Kommunikation (NYSE: NTT ), stellt ihre Enterprise-Cloud neben Deutschland und Großbritannien nun auch in Frankreich und Spanien bereit. Aufgrund der strengen Datenschutzgesetze in Europa kommt dem Standort, an dem die Daten gehostet werden, eine ebenso große Bedeutung zu wie deren Sicherheit. Dank der Ausweitung der Enterprise-Cloud können NTT Coms bestehende und künftige Kunden ihre Daten an vier Standorten ihrer Wahl innerhalb Europas beherbergen. Damit steigt die Zahl der NTT Com Enterprise-Cloud-Rechenzentren auf 14 weltweit. Cloud-Dienste sind für Unternehmen in diesen Regionen, in denen die Nachfrage nach Cloud-Infrastruktur stetig wächst, einfacher zugänglich. NTT Com unterstützt seine Enterprise-Cloud-Services mit einer soliden Infrastrukturbasis in Form von 130 Rechenzentren in aller Welt und dem drittgrößten Rechenzentrumsbetreiber in Europa. \"NTT Com hebt sich durch die Bereitstellung echter Cloud-Dienste der Enterprise-Klasse ab. Deren erneute Ausweitung macht uns zum perfekten Partner für Organisationen, die in Frankreich und Spanien entweder Unterstützung bei der Migration in die Cloud benötigen oder Bedarf an Cloud-Diensten über den gesamten Lifecycle hinweg haben. Mit der verstärkten lokalen Präsenz adressieren wir die Bedenken rund um die Datenhoheit, die vor allem in Europa einen hohen Stellenwert hat\", erklärt Jens Leuchters, Regional General Manager Central & East Europe bei NTT Europe Ltd., Germany . Die Enterprise Cloud wurde im Juni 2015 in Gartners Magic Quadrant for Cloud-Enabled Managed Hosting, Europe mit dem \"Challenger\"-Status ausgezeichnet. Die Enterprise-Cloud auf einen Blick ( http://www.ntt.com/enterprise_cloud ): Kostenoptimiert: Die Kunden bezahlen auf Pay-per-Use-Basis nur die real genutzten Dienste. Flexibel und skalierbar: Garantierte schrittweise ausbaubare Rechenressourcen ab einer Rechenleistung von 1 GHz Hauptprozessor, 1 GB Speicherkapazität und 1 GB Arbeitsspeicher. Einfach: Ein SDN-gesteuertes Portal stellt den Kunden eine einheitliche Managementkonsole (Dashboard) zur Verfügung. Darüber können sie verzögerungsfrei Ressourcen nutzen und virtuelle Maschinen, Firewalls und Load-Balancer konfigurieren. Ebenso lassen sich Änderungen, Ergänzungen oder Löschungen in Echtzeit vornehmen. Kostenloser VPN Zugang : Nutzer des NTT Com Virtual-Private-Networks (VPN) \"Arcstar Universal One\" können auf Wunsch ohne Zusatzkosten direkt auf die Enterprise-Cloud zugreifen. Hoch verfügbar: Die Enterprise-Cloud umfasst Service-Level-Agreements (SLAs) mit 99,99-prozentiger Verfügbarkeit und bietet erweiterte Sicherheitseinstellungen z.B. für Netzwerke, Applikationen, E-Mail oder virtuelle Maschinen. Details zu den Services sind unter http://www.eu.ntt.com/en/services/cloud/enterprise-cloud.html verfügbar. Über NTT Communications Corporation: NTT Communications bietet Beratung, Architektur-, Sicherheits- und Cloud-Services zur Optimierung der Informations- und Kommunikationstechnologie (ICT) in Unternehmen. Diese Angebote stützen sich auf die weltweite Infrastruktur des Unternehmens. Hierzu zählt neben dem globalen IPv4/IPv6-konformen IP-Netzwerk der Tier-1-Klasse auch das VPN-Netzwerk Arcstar Universal One, über das weltweit 196 Länder und Regionen sowie über 140 sichere Rechenzentren erreicht werden. Mit seinen Lösungen kombiniert NTT Communications wirksam die globalen Ressourcen aller Unternehmen der NTT Group, darunter Dimension Data, NTT DOCOMO und NTT DATA. Weitere Informationen unter: http://www.eu.ntt.com , http://www.twitter.com/nttcom , http://www.facebook.com/nttcomtv Pressekontakte", "external_links": [], "published": "2015-09-22T14:18:00.000+03:00", "crawled": "2015-09-22T14:04:58.728+03:00", "highlightTitle": ""}