{"organizations": ["Verizon Enterprise Solutions News & Insights", "Verizon", "Skype for Business", "Verizon Enterprise Solutions", "Skype", "Microsoft Azure Government Verizon", "Verizon Enterprise Solution", "Microsoft", "Microsoft Corp.", "Secure Cloud Interconnect Service", "Verizon Verizon Communications Inc.", "Verizon Wireless", "Microsoft Azure ExpressRoute", "Secure Cloud Interconnect Service Now Available"], "uuid": "89e5103919c8564b5f8475ab451fbbb0fcd5dc75", "thread": {"social": {"gplus": {"shares": 0}, "pinterest": {"shares": 0}, "vk": {"shares": 0}, "linkedin": {"shares": 0}, "facebook": {"likes": 0, "shares": 0, "comments": 0}, "stumbledupon": {"shares": 0}}, "site_full": "science-technology.news-articles.net", "main_image": "", "site_section": "http://science-technology.news-articles.net/content/rss.php", "section_title": "Science and Technology @ News Articles Network", "url": "http://science-technology.news-articles.net/content/verizons-secure-cloud-interconnect-service-now-available-microsoft-azure-expressroute-office-skype-business-government.xhtml", "country": "US", "title": "Verizon's Secure Cloud Interconnect Service Now Available with Microsoft Azure ExpressRoute for Office 365, Skype for Business and Microsoft Azure Government", "performance_score": 0, "site": "news-articles.net", "participants_count": 0, "title_full": "Verizon's Secure Cloud Interconnect Service Now Available with Microsoft Azure ExpressRoute for Office 365, Skype for Business and Microsoft Azure Government", "spam_score": 0.0, "site_type": "news", "published": "2015-09-30T00:01:00.000+03:00", "replies_count": 0, "uuid": "89e5103919c8564b5f8475ab451fbbb0fcd5dc75"}, "author": "", "url": "http://science-technology.news-articles.net/content/verizons-secure-cloud-interconnect-service-now-available-microsoft-azure-expressroute-office-skype-business-government.xhtml", "ord_in_thread": 0, "title": "Verizon's Secure Cloud Interconnect Service Now Available with Microsoft Azure ExpressRoute for Office 365, Skype for Business and Microsoft Azure Government", "locations": ["America", "New York", "Hong Kong", "U.S.", "San Jose", "BASKING RIDGE", "Chicago", "Northern Virginia", "N.J.", "London"], "entities": {"persons": [], "locations": [], "organizations": []}, "highlightText": "", "language": "english", "persons": ["Shawn Hakl"], "text": "Verizon's Secure Cloud Interconnect Service Now Available with Microsoft Azure ExpressRoute for Office 365, Skype for Business and Microsoft Azure Government   12:31:24 Verizon's Secure Cloud Interconnect Service Now Available with Microsoft Azure ExpressRoute... -- BASKING RIDGE, N.J.  <-   BASKING RIDGE, N.J.   Verizon Enterprise Solution's Secure Cloud Interconnect service will now offer Microsoft ExpressRoute for Office 365, Skype for Business and Microsoft Azure Government Cloud as announced at Microsoft Corp.'s online conference AzureCon on Tuesday ( Sept. 29 ). Verizon's private networking option provides additional benefits and control to Azure, Office 365 and Skype for Business customers, including consumption-based bandwidth, pre-provisioned on-demand resources, controlled application performance and varying classes of service. \"Verizon's Secure Cloud Interconnect is fast becoming the premier choice for enterprises that are shifting workloads into the cloud,\" said Shawn Hakl , vice president of enterprise networking and innovation for Verizon. \"Microsoft cloud users will find this solution delivers an unbeatable combination of security, resiliency, application performance, simplicity and efficiency, while enabling a wide range of applications and use cases.\" With this platform, Verizon removes many of the barriers that often affect enterprise cloud adoption, including control, scalability and flexibility. Secure Cloud Interconnect with Microsoft ExpressRoute for Office 365, Skype for Business and Government Cloud Azure uses Verizon's Secure Cloud Interconnect to pre-provision wireless and IP data networking into the cloud service provider community to create a security-enhanced, high-performance environment. With this service, Azure users can maintain the security, consistency and reliability of their business cloud connections, without the need to expose data to the public Internet or to construct costly and time consuming custom network connections. In addition, Microsoft and Verizon's interconnect service are built with redundant links to further increase the reliability of the solution. Azure ExpressRoute for Office 365 and Skype for Business with SCI are now available in Microsoft's Verizon's Northern Virginia , San Jose , London and Hong Kong data centers. Microsoft Azure Government complies with FedRAMP and FISMA requirements. This option is now available to Azure customers in Microsoft's data center in Northern Virginia with an additional site in Chicago planned to come online this fall. Verizon Private IP Provides Secure, High-Performance Environment for Cloud Computing Secure Cloud Interconnect is built on Verizon's world-class Private IP network that offers any-to-any connectivity of IP, while providing the security and reliability associated with private wide area networking solutions. Using Verizon's Private IP wireless access feature, Secure Cloud Interconnect is further extended to U.S. users of its world-class 4G LTE service. Available in more than 170 markets around the globe, Private IP delivers scalability, varying classes of service, expansive reach and exceptional service including stringent service level agreements for latency and packet-loss. Verizon Enterprise Solutions helps clients improve customer experience, drive growth and business performance and manage risk. With industry-specific solutions provided over the company's secure mobility, cloud, strategic networking, Internet of Things and advanced communications platforms, Verizon Enterprise Solutions helps open new opportunities around the world for innovation, investment and business transformation. Visit www.verizonenterprise.com to learn more. About Verizon Verizon Communications Inc. (NYSE, Nasdaq: VZ ), headquartered in New York , employs a diverse workforce of 178,500 and generated more than $127 billion in 2014 revenues. Verizon Wireless operates America's most reliable wireless network, with 109.5 million retail connections nationwide. Verizon also provides converged communications, information and entertainment services over America's most advanced fiber-optic network, and delivers integrated business solutions to customers worldwide. For more information, visit www.verizon.com/news/ . Verizon Enterprise Online News Room: News releases, blog posts, media contacts and other information are available at Verizon Enterprise Solutions News & Insights (news.verizonenterprise.com) . News from Verizon Enterprise Solutions is also available through an RSS feed at http://www.verizonenterprise.com/rss-options/ . \nSOURCE Verizon", "external_links": [], "published": "2015-09-30T00:01:00.000+03:00", "crawled": "2015-09-29T23:48:23.155+03:00", "highlightTitle": ""}