{"organizations": ["Ohio County Economic Development Association", "AT&T AT&T Inc.", "Green River Regional Industrial Development Authority", "AT&T Intellectual Property", "Commonwealth", "Ohio County Economic Development Alliance", "AT&T Kentucky", "AT&T Inc.", "AT&T"], "uuid": "db0f15190e3920d76096f923b6a3d8ea3ffb61fb", "thread": {"social": {"gplus": {"shares": 0}, "pinterest": {"shares": 0}, "vk": {"shares": 0}, "linkedin": {"shares": 0}, "facebook": {"likes": 0, "shares": 0, "comments": 0}, "stumbledupon": {"shares": 0}}, "site_full": "science-technology.news-articles.net", "main_image": "", "site_section": "http://science-technology.news-articles.net/content/rss.php", "section_title": "Science and Technology @ News Articles Network", "url": "http://science-technology.news-articles.net/content/bluegrass-crossings-business-centre-designated-fiber-ready.xhtml", "country": "US", "title": "Bluegrass Crossings Business Centre Designated As AT&T Fiber Ready", "performance_score": 0, "site": "news-articles.net", "participants_count": 0, "title_full": "Bluegrass Crossings Business Centre Designated As AT&T Fiber Ready", "spam_score": 0.0, "site_type": "news", "published": "2015-09-30T19:58:00.000+03:00", "replies_count": 0, "uuid": "db0f15190e3920d76096f923b6a3d8ea3ffb61fb"}, "author": "", "url": "http://science-technology.news-articles.net/content/bluegrass-crossings-business-centre-designated-fiber-ready.xhtml", "ord_in_thread": 0, "title": "Bluegrass Crossings Business Centre Designated As AT&T Fiber Ready", "locations": ["Beaver Dam", "U.S.", "Ky.", "Frankfort", "Kentucky", "LOUISVILLE"], "entities": {"persons": [], "locations": [], "organizations": []}, "highlightText": "", "language": "english", "persons": ["Chase Vincent", "C.B. Embry", "Hood Harris", "Tommy Thompson"], "text": "Bluegrass Crossings Business Centre Designated As AT&T Fiber Ready   09:31:23 Bluegrass Crossings Business Centre Designated As AT&T Fiber Ready -- LOUISVILLE, Ky., Sept.   AT&T Inc. logo. AT&T Inc. logo. <-  <- stripped tags -> LOUISVILLE, Ky. , Sept.   As part of AT&T's continuing efforts to drive economic development and investment in Kentucky , AT&T and representatives from the Green River Regional Industrial Development Authority and the Ohio County Economic Development Association today announced that the Bluegrass Crossings Business Centre in Beaver Dam, Kentucky has been designated AT&T Fiber Ready. The AT&T Fiber Ready designation helps economic development leaders more effectively position their communities for site selection by emphasizing the availability of high-speed, fiber-based services. \"For years, AT&T has invested in Kentucky to deliver high-speed Internet in urban and rural areas all across the Commonwealth using the latest wired and wireless technologies, and this announcement offers an opportunity to highlight the Bluegrass Crossings Business Centre as one of many places across the Commonwealth where AT&T's fiber infrastructure is in place and ready to help local businesses drive job creation,\" said Hood Harris, president of AT&T Kentucky. \"I'm proud of the work our AT&T Kentucky employees are doing to deploy fiber-based infrastructure that delivers high-speed Internet access that Kentuckians want and need, and I am grateful that policymakers across the Commonwealth are increasingly embracing positive and pro-business policies that encourage businesses of all types to invest here.\" In today's world, connectivity is vital to new employers and businesses of every type. AT&T has been deploying high-speed, fiber-optic infrastructure across the Commonwealth for years, and the AT&T Fiber Ready designation is a tool for economic development leaders to highlight the assets available in their facilities. \"Fiber connectivity is essential for many businesses in today's economy, and as we work to attract new businesses to the community, this designation will help to make it clear that world-class communications networks are readily available for our tenants,\" said Chase Vincent , Executive Director of the Ohio County Economic Development Alliance. \"Our elected officials at the state and local levels have worked hard in recent years to improve the business environment in Kentucky , and the policies they pursue in Frankfort and here at home are vital to improving our chances of bringing new jobs to the community.\" \"All across the Commonwealth, there are hard workers, strong communities and people ready to do the work necessary to keep this economy growing and developing, and when we can highlight the presence of these vital communications resources, it serves to make our communities even more attractive to prospective employers,\" said State Representative Tommy Thompson . \"It truly has been remarkable to watch our economy grow and our communities succeed as we have worked with local leadership improve the business environment in Kentucky , and it is always encouraging when the business community comes along side and provides a resource like this designation to help emphasize what our community brings to the table when companies are making the important decisions on where they have the best chance to succeed,\" said State Senator C.B. Embry . About AT&T AT&T Inc. (NYSE: T ) helps millions around the globe connect with leading entertainment, mobile, high speed Internet and voice services. We're the world's largest provider of pay TV. We have TV customers in the U.S. and 11 Latin American countries. In the U.S., our wireless network offers the nation's strongest LTE signal and the most reliable 4G LTE network . We offer the best global wireless coverage*. And we help businesses worldwide serve their customers better with our mobility and secure cloud solutions. Additional information about AT&T products and services is available at http://about.att.com . Follow our news on Twitter at @ATT, on Facebook at http://www.facebook.com/att and YouTube at http://www.youtube.com/att . Â© 2015 AT&T Intellectual Property. All rights reserved. AT&T, the Globe logo and other marks are trademarks and service marks of AT&T Intellectual Property and/or AT&T affiliated companies. All other marks contained herein are the property of their respective owners. Reliability and signal strength claims based on nationwide carriers' LTE. Signal strength claim based ONLY on avg. LTE signal strength. LTE not available everywhere. *Global coverage claim based on offering discounted voice and data roaming; LTE roaming; voice roaming; and world-capable smartphone and tablets in more countries than any other U.S. based carrier. Coverage not available in all areas. Coverage may vary per country and be limited/restricted in some countries.", "external_links": [], "published": "2015-09-30T19:58:00.000+03:00", "crawled": "2015-09-30T19:44:33.825+03:00", "highlightTitle": ""}