{"organizations": ["Infosys", "Conselho e Presidente da ATP", "Parceira Global de Serviços de Tecnologia", "United States Securities and Exchange Commission", "O Centro de Resultados", "ATP", "Câmbio dos Estados Unidos", "Infosys ATP Scores & Stats Center", "Centro de Resultados", "Lei de Reforma de Litígios de Títulos Privados", "Comissão de Valores Mobiliários", "ATP World Tour"], "uuid": "3ac9bb267f14614ebc80dca8af891be949e15f61", "thread": {"social": {"gplus": {"shares": 0}, "pinterest": {"shares": 0}, "vk": {"shares": 0}, "linkedin": {"shares": 0}, "facebook": {"likes": 0, "shares": 0, "comments": 0}, "stumbledupon": {"shares": 0}}, "site_full": "science-technology.news-articles.net", "main_image": "", "site_section": "http://science-technology.news-articles.net/content/rss.php", "section_title": "Science and Technology @ News Articles Network", "url": "http://science-technology.news-articles.net/content/infosys-atp-anunciam-parceria-tecnolgica-estratgica.xhtml", "country": "US", "title": "A Infosys e a ATP anunciam parceria tecnolgica estratgica", "performance_score": 0, "site": "news-articles.net", "participants_count": 0, "title_full": "A Infosys e a ATP anunciam parceria tecnolgica estratgica", "spam_score": 0.0, "site_type": "news", "published": "2015-09-11T03:09:00.000+03:00", "replies_count": 0, "uuid": "3ac9bb267f14614ebc80dca8af891be949e15f61"}, "author": "", "url": "http://science-technology.news-articles.net/content/infosys-atp-anunciam-parceria-tecnolgica-estratgica.xhtml", "ord_in_thread": 0, "title": "A Infosys e a ATP anunciam parceria tecnolgica estratgica", "locations": ["BANGALORE", "Índia", "Londres"], "entities": {"persons": [], "locations": [], "organizations": []}, "highlightText": "", "language": "english", "persons": ["Chris Kermode", "Vishal Sikka", "Sarah Gideon"], "text": "A Infosys e a ATP anunciam parceria tecnolgica estratgica   16:47:51 A Infosys e a ATP anunciam parceria tecnolgica estratgica -- BANGALORE, Índia, 10 de setembro de   <- stripped tags -> <-   BANGALORE , Índia, 10 de setembro de   A Infosys (NYSE: [[UEdFZ2NtVnNQVndpYm05bWIyeHNiM2RjSWlCb2NtVm1QU2RvZEhSd09pOHZjM1IxWkdsdkxUVXVabWx1WVc1amFXRnNZMjl1ZEdWdWRDNWpiMjB2Y0hKdVpYZHpQMUJoWjJVOVVYVnZkR1VtVkdsamEyVnlQVWxPUmxrbklISmxiRDBuYm05bWIyeHNiM2NuSUhSaGNtZGxkRDBuWDJKc1lXNXJKeUIwYVhSc1pUMG5TVTVHV1NjZ2IyNWpiR2xqYXowbmJHbHVhMDl1UTJ4cFkyc29kR2hwY3lrbklISmxiRDBuYm05bWIyeHNiM2NuUGtsT1JsazhMMkUrfA==]]), uma líder global em consultoria, tecnologia, terceirização e serviços da próxima geração e a ATP, o órgão que dirige o tênis profissional masculino, anunciaram hoje uma parceria estratégica para impulsionar os mais recentes avanços tecnológicos em mobilidade, computação em nuvem e análises para transformar a experiência dos fãs e dos jogadores de tênis em todo o mundo. Logo - [[UEdFZ2NtVnNQVndpYm05bWIyeHNiM2RjSWlCdmJtTnNhV05yUFNkc2FXNXJUMjVEYkdsamF5aDBhR2x6S1NjZ2FISmxaajFjSW1oMGRIQTZMeTl3YUc5MGIzTXVjSEp1WlhkemQybHlaUzVqYjIwdmNISnVhQzh5TURFek1ERXlNaTgxT0RreE5qSmNJaUJ5Wld3OVhDSnViMlp2Ykd4dmQxd2lJSFJoY21kbGREMWNJbDlpYkdGdWExd2lQbWgwZEhBNkx5OXdhRzkwYjNNdWNISnVaWGR6ZDJseVpTNWpiMjB2Y0hKdWFDOHlNREV6TURFeU1pODFPRGt4TmpJOEwyRSt8]] Como parte desta parceria, a Infosys será a Parceira Global de Serviços de Tecnologia e Patrocinador Platinum do ATP World Tour bem como do torneio de final de temporada Barclays ATP World Tour Finals, durante os próximos três anos. Como acontece na maioria dos esportes populares, os fãs do tênis estão cada vez mais consumindo conteúdo sobre o esporte através de canais múltiplos. O compromisso ativo dos fãs da atualidade exige informações contextuais e em tempo real e percepções sobre o jogo através de uma variedade de canais. A Infosys, como Parceira Global de Serviços de Tecnologia do ATP World Tour, irá utilizar sua especialização em computação em nuvem, mobilidade e análises para gerenciar, analisar e interpretar grandes volumes de dados sobre tênis (tanto históricos quanto atuais) e apresentar percepções e previsões através de plataformas interativas para os fãs, jogadores e parceiros da ATP e para a mídia. De acordo com esta parceria, a Infosys trabalhará em várias iniciativas-chave para o ATP World Tour. Estas iniciativas incluem: A criação do exclusivo Infosys ATP Scores & Stats Center (Centro de Resultados e Estatísticas Infosys ATP) para revolucionar o envolvimento com os fãs do tênis através do fornecimento de percepções e previsões sem precedentes sobre cada torneio, cada jogo e cada ponto. O Centro de Resultados e Estatísticas será acionado pela Plataforma de Informações da Infosys (IIP), uma plataforma analítica de dados de fonte aberta para visualização e análise de dados. Uma nova versão da ATP Player Zone , uma plataforma e um aplicativo móvel da próxima geração para envolvimento dos jogadores e para elevar sua experiência e permitir que eles se inscrevam em torneios, revisem informações de viagens, se conectem com outros jogadores e fiquem atualizados sobre todas as notícias do ATP World Tour. O gerenciamento da infraestrutura, aplicações e dados do ATP World Tour utilizando a elasticidade e poder computacional do modelo baseado em nuvem. Citações Dr. Vishal Sikka , Executivo-Chefe, Infosys \"Sendo pessoalmente um fã do tênis, é realmente muito empolgante imaginar como podemos inventar incríveis experiências novas e envolventes para os fãs. Incríveis experiências para os fãs do tênis é o que a ATP sempre defendeu e agora podemos levar isso ainda mais adiante com nosso trabalho conjunto. Os fãs terão em breve a oportunidade de mergulharem completamente na ação e sentirem a paixão e a intensidade em cada partida e muito mais. Esta parceria nos permitirá trazer novas experiências de novas maneiras para os fãs de todo o mundo, e também servirá para informar vários novos tipos de envolvimento dos consumidores em outros estilos de vida\". Chris Kermode , Presidente Executivo do Conselho e Presidente da ATP \"Estamos muito satisfeitos com o lançamento desta nova parceria com a Infosys. As oportunidades que envolvem a tecnologia, as estatísticas e os dados do tênis profissional masculino são imensas. O anúncio feito hoje é uma notícia fantástica para a ATP quando damos as boas-vindas à Infosys, uma companhia líder da indústria, e damos um importante passo visando explorar novas oportunidades nesta área. Estamos ansiosos para desenvolvermos uma série de iniciativas empolgantes como parte desta parceria\". Sobre a ATP A ATP é o órgão que dirige os circuitos do tênis profissional masculino – ATP World Tour, ATP Challenger Tour e o ATP Champions Tour. Com 62 torneios em 31 países, o ATP World Tour apresenta os melhores atletas competindo nos locais mais empolgantes de todo o mundo. Desde a Austrália até a Europa e das Américas até a Ásia, os astros do ATP World Tour de 2015 lutam por títulos de prestígio e pontos na classificação Emirates ATP Rankings, nos eventos ATP World Tour Masters 1000, 500 e 250, bem como nos Grand Slams (eventos não ATP). No final da temporada, somente os oito melhores jogadores individuais e duplas qualificados em todo o mundo competem pelo último título da temporada no Barclays ATP World Tour Finals. Realizado no O2 em Londres, o evento irá oficialmente coroar o Número 1 do ATP World Tour de 2015, apresentado pela Emirates. Para mais informações, visite o endereço [[UEdFZ2NtVnNQVndpYm05bWIyeHNiM2RjSWlCdmJtTnNhV05yUFNkc2FXNXJUMjVEYkdsamF5aDBhR2x6S1NjZ2FISmxaajFjSW1oMGRIQTZMeTlzYVc1cmN5NXRhM1F4TURBekxtTnZiUzlqZEhRL2EyNDlNU1p0Y3oxT1JHdDZUMFJuZUU1RWExTXhKbkk5VFdwck5VNVVXVFJOYW1zMFRtZFRNaVppUFRBbWFqMU9lbEY2VG1wak5FOVVZM3BUTUNadGREMHhKbkowUFRCY0lpQnlaV3c5WENKdWIyWnZiR3h2ZDF3aUlIUmhjbWRsZEQxY0lsOWliR0Z1YTF3aVBtaDBkSEE2THk5M2QzY3VRVlJRVjI5eWJHUlViM1Z5TG1OdmJUd3ZZVDQ9fA==]]. Sobre a Infosys A Infosys é uma líder global em soluções de consultoria, tecnologia, de terceirização e serviços da próxima geração. Habilitamos clientes, em mais de 50 países, para ficarem à frente das emergentes tendências de negócios e superarem a concorrência. Ajudamos esses clientes a se transformar e prosperar em um mundo em mudanças, por meio da criação conjunta de soluções inovadoras que combinam visões estratégicas com excelência em execução. Visite o endereço [[UEdFZ2NtVnNQVndpYm05bWIyeHNiM2RjSWlCdmJtTnNhV05yUFNkc2FXNXJUMjVEYkdsamF5aDBhR2x6S1NjZ2FISmxaajFjSW1oMGRIQTZMeTkzZDNjdWFXNW1iM041Y3k1amIyMHZjR0ZuWlhNdmFXNWtaWGd1WVhOd2VGd2lJSEpsYkQxY0ltNXZabTlzYkc5M1hDSWdkR0Z5WjJWMFBWd2lYMkpzWVc1clhDSSthSFIwY0RvdkwzZDNkeTVwYm1admMzbHpMbU52YlR3dllUND18]] para ver como a Infosys (NYSE: [[UEdFZ2NtVnNQVndpYm05bWIyeHNiM2RjSWlCb2NtVm1QU2RvZEhSd09pOHZjM1IxWkdsdkxUVXVabWx1WVc1amFXRnNZMjl1ZEdWdWRDNWpiMjB2Y0hKdVpYZHpQMUJoWjJVOVVYVnZkR1VtVkdsamEyVnlQVWxPUmxrbklIUmhjbWRsZEQwblgySnNZVzVySnlCMGFYUnNaVDBuU1U1R1dTY2diMjVqYkdsamF6MG5iR2x1YTA5dVEyeHBZMnNvZEdocGN5a25JSEpsYkQwbmJtOW1iMnhzYjNjblBrbE9SbGs4TDJFK3w=]]), com sua receita anual de US$ 8,7 bilhões e mais de 179.000 funcionários está ajudando as empresas a se renovarem enquanto cria novos caminhos para a geração de valor. Porto Seguro Certas declarações contidas neste comunicado à imprensa relativas às nossas perspectivas de crescimento futuro são declarações prospectivas sobre nossas expectativas de negócios futuros que pretendemos que sejam qualificadas pela definição de 'porto seguro' na Lei de Reforma de Litígios de Títulos Privados (Private Securities Litigation Reform Act) de 1995 que envolvem diversos riscos e incertezas que podem fazer com que os resultados reais sejam substancialmente diferentes daqueles previstos em tais declarações prospectivas.Os riscos e incertezas relativos a essas declarações incluem, mas não estão limitados aos riscos e incertezas relacionados às flutuações das receitas, flutuações das taxas de câmbio de moedas estrangeiras, nossa capacidade de administrar o crescimento, concorrência intensa na área de serviços de TI, incluindo aqueles fatores que podem afetar nossa vantagem de custos, aumentos salariais na Índia, nossa capacidade de atrair e de reter profissionais altamente qualificados, ultrapassagem de prazos e de custos em contratos com estruturas de preços fixos e prazos fixos, concentração de clientes, restrições em imigração, concentração de segmentos do setor, nossa capacidade de administrar nossas operações internacionais, redução da demanda por tecnologia em nossas principais áreas de foco, interrupções nas redes de telecomunicações ou falhas do sistema, nossa capacidade de concluir e integrar com sucesso aquisições em potencial, responsabilidade por danos em nossos contratos de serviço, o sucesso de companhias nas quais a Infosys fez investimentos estratégicos, retirada ou expiração de incentivos fiscais governamentais, instabilidade política e conflitos regionais, restrições legais para levantar capital ou adquirir companhias fora da Índia e uso não autorizado de nossa propriedade intelectual e as condições econômicas em geral que possam afetar nosso setor. Riscos adicionais que podem afetar nossos resultados operacionais no futuro são descritos mais detalhadamente em nossos registros na Comissão de Valores Mobiliários e Câmbio dos Estados Unidos (United States Securities and Exchange Commission), incluindo nosso Relatório Anual no Formulário 20-F para o ano fiscal encerrado em 31 de março de 2015 e nos Formulários 6-K para os trimestres encerrados em 30 de junho de 2014, 30 de setembro de 2014 e 31 de dezembro de 2014. Esses registros estão disponíveis no endereço [[UEdFZ2NtVnNQVndpYm05bWIyeHNiM2RjSWlCdmJtTnNhV05yUFNkc2FXNXJUMjVEYkdsamF5aDBhR2x6S1NjZ2FISmxaajFjSW1oMGRIQTZMeTkzZDNjdWFXNW1iM041Y3k1amIyMHZiR2x1YTNNdmNtVmthWEpsWTNSc2FXNXJMbUZ6Y0hnL2FXUTljMlZqTFdkdmRpNWhjM0I0WENJZ2NtVnNQVndpYm05bWIyeHNiM2RjSWlCMFlYSm5aWFE5WENKZllteGhibXRjSWo1b2RIUndPaTh2ZDNkM0xuTmxZeTVuYjNZOEwyRSt8]]. A Infosys pode, periodicamente, fazer declarações prospectivas adicionais, por escrito ou verbalmente, incluindo declarações contidas nos registros da companhia na Comissão de Valores Mobiliários e Câmbio e em nossos relatórios para os acionistas. Quaisquer declarações prospectivas contidas neste documento são baseadas em pressupostos que consideramos razoáveis nesta data. A companhia não se compromete a atualizar quaisquer declarações prospectivas que possam ser feitas periodicamente pela companhia ou em seu nome, a menos que exigido por lei. Para informações adicionais, entre em contato com: Sarah Gideon", "external_links": [], "published": "2015-09-11T03:09:00.000+03:00", "crawled": "2015-09-11T02:56:54.371+03:00", "highlightTitle": ""}