{"organizations": ["Microsoft Research", "Microsoft", "MSN", "CTO", "Securities and Exchange Commission", "Quantum Corp.", "Quantum Corporation"], "uuid": "e3e96a17b9b008a33c5aca62e988a422ce698a62", "thread": {"social": {"gplus": {"shares": 0}, "pinterest": {"shares": 0}, "vk": {"shares": 0}, "linkedin": {"shares": 0}, "facebook": {"likes": 0, "shares": 0, "comments": 0}, "stumbledupon": {"shares": 0}}, "site_full": "science-technology.news-articles.net", "main_image": "", "site_section": "http://science-technology.news-articles.net/content/rss.php", "section_title": "Science and Technology @ News Articles Network", "url": "http://science-technology.news-articles.net/content/quantum-appoints-bassam-tabbara-chief-technology-officer.xhtml", "country": "US", "title": "Quantum Appoints Bassam Tabbara as Chief Technology Officer", "performance_score": 0, "site": "news-articles.net", "participants_count": 0, "title_full": "Quantum Appoints Bassam Tabbara as Chief Technology Officer", "spam_score": 0.0, "site_type": "news", "published": "2015-09-29T11:09:00.000+03:00", "replies_count": 0, "uuid": "e3e96a17b9b008a33c5aca62e988a422ce698a62"}, "author": "", "url": "http://science-technology.news-articles.net/content/quantum-appoints-bassam-tabbara-chief-technology-officer.xhtml", "ord_in_thread": 0, "title": "Quantum Appoints Bassam Tabbara as Chief Technology Officer", "locations": ["United States", "Calif", "SAN JOSE"], "entities": {"persons": [], "locations": [], "organizations": []}, "highlightText": "", "language": "english", "persons": ["Bassam", "Bassam Tabbara", "Jon Gacek", "Tabbara"], "text": "Quantum Appoints Bassam Tabbara as Chief Technology Officer   Quantum Appoints Bassam Tabbara as Chief Technology Officer -- SAN JOSE, Calif.  Quantum Logo Quantum Logo  ><- stripped tags -> SAN JOSE, Calif.   Quantum Corp. (NYSE: [[UEdFZ2NtVnNQVndpYm05bWIyeHNiM2RjSWlCb2NtVm1QU2RvZEhSd09pOHZjM1IxWkdsdkxUVXVabWx1WVc1amFXRnNZMjl1ZEdWdWRDNWpiMjB2Y0hKdVpYZHpQMUJoWjJVOVVYVnZkR1VtVkdsamEyVnlQVkZVVFNjZ2NtVnNQU2R1YjJadmJHeHZkeWNnZEdGeVoyVjBQU2RmWW14aGJtc25JSFJwZEd4bFBTZFJWRTBuSUc5dVkyeHBZMnM5SjJ4cGJtdFBia05zYVdOcktIUm9hWE1wSnlCeVpXdzlKMjV2Wm05c2JHOTNKejVSVkUwOEwyRSt8]]) today announced the appointment of Bassam Tabbara as chief technology officer, with responsibility for driving the company's long-term technology strategy as it builds on its leadership in [[UEdFZ2NtVnNQVndpYm05bWIyeHNiM2RjSWlCdmJtTnNhV05yUFNkc2FXNXJUMjVEYkdsamF5aDBhR2x6S1NjZ2FISmxaajFjSW1oMGRIQTZMeTkzZDNjdWNYVmhiblIxYlM1amIyMHZjSEp2WkhWamRITXZjMk5oYkdVdGIzVjBMWE4wYjNKaFoyVXZhVzVrWlhndVlYTndlRndpSUhKbGJEMWNJbTV2Wm05c2JHOTNYQ0lnZEdGeVoyVjBQVndpWDJKc1lXNXJYQ0krYzJOaGJHVXRiM1YwSUhOMGIzSmhaMlU4TDJFK3w=]], archive and [[UEdFZ2NtVnNQVndpYm05bWIyeHNiM2RjSWlCdmJtTnNhV05yUFNkc2FXNXJUMjVEYkdsamF5aDBhR2x6S1NjZ2FISmxaajFjSW1oMGRIQTZMeTkzZDNjdWNYVmhiblIxYlM1amIyMHZjSEp2WkhWamRITXZaR2x6YXkxaVlYTmxaR0poWTJ0MWNDOXBibVJsZUM1aGMzQjRYQ0lnY21Wc1BWd2libTltYjJ4c2IzZGNJaUIwWVhKblpYUTlYQ0pmWW14aGJtdGNJajVrWVhSaElIQnliM1JsWTNScGIyNDhMMkUrfA==]]. Tabbara has more than 20 years of experience in strategic product development -- identifying and delivering on new innovation opportunities. He joined Quantum in August 2014 as part of its acquisition of Symform's cloud platform, having served as the company's CTO and co-founder. \"As reflected in our 74 percent scale-out storage growth this past year, more and more customers are turning to Quantum to help maximize the business value of their data,\" said Jon Gacek , president and CEO of Quantum. \"Bassam has already advanced our thinking about how we can enable these customers to drive future success, leveraging his broad experience in developing new innovations to meet evolving storage demands. We look forward to drawing on Bassam's technology perspective and vision across the company.\" Since joining Quantum, Tabbara has played a key role in defining the company's cloud technology direction and in the development of its new [[UEdFZ2NtVnNQVndpYm05bWIyeHNiM2RjSWlCdmJtTnNhV05yUFNkc2FXNXJUMjVEYkdsamF5aDBhR2x6S1NjZ2FISmxaajFjSW1oMGRIQTZMeTkzZDNjdWNYVmhiblIxYlM1amIyMHZjSEp2WkhWamRITXZjMk5oYkdVdGIzVjBMWE4wYjNKaFoyVXZjM1J2Y201bGVIUXRjUzFqYkc5MVpDMWhjbU5vYVhabEwybHVaR1Y0TG1GemNIaGNJaUJ5Wld3OVhDSnViMlp2Ykd4dmQxd2lJSFJoY21kbGREMWNJbDlpYkdGdWExd2lQbEV0UTJ4dmRXUThMMkUrfA==]]™ service offerings. These offerings enable customers to integrate the public cloud seamlessly into a multitier storage architecture that provides a unique combination of high performance and low cost. At Symform, Tabbara built a revolutionary cloud storage platform from the ground up, ultimately storing billions of objects for users and small businesses across 170 countries. Before that, he spent 12 years at Microsoft in key leadership roles where he worked on a number of key initiatives, including Microsoft Research, MSN, Windows, Visual Studio and System Center. Tabbara also holds more than 30 patents. \"We are at a critical junction where cloud innovations are disrupting traditional enterprise infrastructure and approaches,\" said Tabbara. \"I'm excited about working with the rest of the Quantum executive team to deliver on solutions optimized for tomorrow's enterprise.\" Photo Link: [[UEdFZ2NtVnNQVndpYm05bWIyeHNiM2RjSWlCdmJtTnNhV05yUFNkc2FXNXJUMjVEYkdsamF5aDBhR2x6S1NjZ2FISmxaajFjSW1oMGRIQTZMeTkzZDNjdWNYVmhiblIxYlM1amIyMHZZMjF6YVcxaFoyVnpMMkpoYzNOaGJTMTBZV0ppWVhKaExtcHdaMXdpSUhKbGJEMWNJbTV2Wm05c2JHOTNYQ0lnZEdGeVoyVjBQVndpWDJKc1lXNXJYQ0krYUhSMGNEb3ZMM2QzZHk1eGRXRnVkSFZ0TG1OdmJTOWpiWE5wYldGblpYTXZZbUZ6YzJGdExYUmhZbUpoY21FdWFuQm5QQzloUGc9PXw=]] Photo Caption: Bassam Tabbara , Chief Technology Officer, Quantum About Quantum Quantum is a leading expert in scale-out storage, archive and data protection, providing solutions for capturing, sharing and preserving digital assets over the entire data lifecycle. From small businesses to major enterprises, more than 100,000 customers have trusted Quantum to address their most demanding data workflow challenges. With Quantum, customers can Be Certain™ they have the end-to-end storage foundation to maximize the value of their data by making it accessible whenever and wherever needed, retaining it indefinitely and reducing total cost and complexity. See how at www.quantum.com/customerstories . Quantum, the Quantum logo, Be Certain and Q-Cloud are either registered trademarks or trademarks of Quantum Corporation and its affiliates in the United States and/or other countries. All other trademarks are the property of their respective owners. \"Safe Harbor\" Statement: This press release contains \"forward-looking\" statements. All statements other than statements of historical fact are statements that could be deemed forward-looking statements. Specifically, but without limitation, statements relating to benefits from the appointment of Bassam Tabbara as chief technology officer, are forward-looking statements within the meaning of the Safe Harbor. All forward-looking statements in this press release are based on information available to Quantum on the date hereof. These statements involve known and unknown risks, uncertainties and other factors that may cause Quantum's actual results to differ materially from those implied by the forward-looking statements. More detailed information about these risk factors are set forth in Quantum's periodic filings with the Securities and Exchange Commission, including, but not limited to, those risks and uncertainties listed in the section entitled \"Risk Factors,\" in Quantum's Quarterly Report on Form 10-Q filed with the Securities and Exchange Commission on August 13, 2015 and in Quantum's Annual Report on Form 10-K filed with the Securities and Exchange Commission on June 12, 2015 . Quantum expressly disclaims any obligation to update or alter its forward-looking statements, whether as a result of new information, future events or otherwise, except as required by applicable law. Public Relations Contact:", "external_links": [], "published": "2015-09-29T11:09:00.000+03:00", "crawled": "2015-09-29T10:55:45.967+03:00", "highlightTitle": ""}