{"organizations": ["NTT Group", "Official Technology Partner of A.S.O.", "Dimension Data plc", "UCI", "Amaury Sport Organisation (A.S.O.", "ICT", "Continental", "Dimension Data’s Group", "Samsung", "United States Dimension Data"], "uuid": "853b58e66c1f6b2e77fd53e62fec0c1072ffeea6", "thread": {"social": {"gplus": {"shares": 0}, "pinterest": {"shares": 0}, "vk": {"shares": 0}, "linkedin": {"shares": 0}, "facebook": {"likes": 0, "shares": 0, "comments": 0}, "stumbledupon": {"shares": 0}}, "site_full": "businesswireindia.com", "main_image": "", "site_section": "http://businesswireindia.com/RSSFeeds/subcat-technology.xml", "section_title": "BusinessWire India.com - Technology", "url": "http://businesswireindia.com/news/news-details/dimension-data-becomes-title-partner-africas-cycling-team/45418", "country": "US", "title": "Dimension Data Becomes Title Partner of Africa’s Cycling Team", "performance_score": 0, "site": "businesswireindia.com", "participants_count": 0, "title_full": "Dimension Data Becomes Title Partner of Africa’s Cycling Team", "spam_score": 0.0, "site_type": "news", "published": "2015-09-25T16:11:00.000+03:00", "replies_count": 0, "uuid": "853b58e66c1f6b2e77fd53e62fec0c1072ffeea6"}, "author": "", "url": "http://businesswireindia.com/news/news-details/dimension-data-becomes-title-partner-africas-cycling-team/45418", "ord_in_thread": 0, "title": "Dimension Data Becomes Title Partner of Africa’s Cycling Team", "locations": ["Qhubeka", "Va.", "Africa", "Richmond", "South Africa", "Italy", "Johannesburg"], "entities": {"persons": [], "locations": [], "organizations": []}, "highlightText": "", "language": "english", "persons": ["Doug Ryder", "Stephen Cummings", "Brett Dawson", "Nguni", "Douglas Ryder", "Daniel Teklehaimanot"], "text": "Friday, September 25, 2015 6:41PM IST (1:11PM GMT) Dimension Data Becomes Title Partner of Africa’s Cycling Team Johannesburg, South Africa and Richmond, Va., United States Dimension Data , the global ICT solutions and services provider, today announced that it will become the new title partner of Ryder Cycling, which owns and manages Team MTN-Qhubeka p/b Samsung, Africa’s only UCI Professional Continental Cycling Team. Effective 1 January 2016, the team’s new name will be Team Dimension Data. This Smart News Release features multimedia. View the full release here: http://www.businesswire.com/news/home/20150925005235/en/ Dimension Data CEO Brett Dawson and Doug Ryder of Ryder Cycling - set to harness the power of technology to drive transformation in the world of cycling (Photo: Business Wire) The team made history this year as the first African team to compete in the Tour de France alongside five other wild-card teams. The team’s tremendous successes in the race included: Wearing the prestigious King of the Mountain jersey for four days on the shoulders of Eritrean rider, Daniel Teklehaimanot - the first African rider to do so Stephen Cummings winning the 14 th stage on Mandela Day Team finishing in fifth place overall in the Team competition out of a total of 22 teams Raising over 4,000 bicycles in their #BicyclesChangeLives campaign. Douglas Ryder, Team Principal said, “We are incredibly excited to have Dimension Data become our new title partner. It enables us to continue to support the development of African cycling and the Qhubeka charity at the highest levels in world cycling. Cycling is such a high tech sport, and we’ve leveraged technology and data through our high performance team to build the bridge from racing in Africa to competing successfully against the best in the world on the global race calendar. Partnering with Dimension Data supports us more in this area, and will also help us be more connected with our growing fan base around the world. This is the next step in our journey and we look forward to accelerating our collective ambitions through this partnership.” Brett Dawson, Dimension Data’s Group CEO said, “Dimension Data is proud to become the new title partner of this amazing African team. We’re a global technology organisation, and because the team leverages technology – both on and off the bike – our joint goal is to take the team and African cycling to new heights. In addition, we want to help develop African riders into professional cyclists who will compete in some of the greatest cycling events on the African continent and across the world.” Adam Foster Dimension Data’s Group Executive – Communications, who is responsible for the Amaury Sport Organisation (A.S.O.) which owns the Tour de France, as well as the relationship with Ryder Cycling said: “We will work closely with Doug Ryder, his team, and its other partners to provide world class infrastructure, services, and race opportunities for the team’s riders to be successful. Our partnership, combined with harnessing the power of our technologies to drive transformation within the world of cycling, will help the team accelerate their individual and collective ambitions.” Dimension Data also confirmed it will continue to support Qhubeka and World Bicycle Relief’s initiative to put more children across the African continent on bicycles, and raise funds to purchase bicycles during the period of the partnership. Dimension Data is also the Official Technology Partner of A.S.O., and was responsible for processing and analysing the data collated from the riders via sensors located under their saddles at this year’s Tour de France. Through its beta live tracking site , millions of fans were able to follow the race and their favourite riders real-time for the first time. Over five million records were processed during each of the 21 stages, while 664,000 fans visited the race data site during the course of the tour. About Dimension Data Founded in 1983, Dimension Data plc is an ICT services and solutions provider that uses its technology expertise, global service delivery capability, and entrepreneurial spirit to accelerate the business ambitions of its clients. Dimension Data is a member of the NTT Group. www.dimensiondata.com . About Ryder Cycling Ryder Cycling founded Team MTN-Qhubeka in 2007, steadily working its way up from a regional team to now being a Continental Pro team with bases in South Africa and Italy. The team rides for a purpose to assist in developing cycling on the African continent with the goal to give talented African riders a path into the pro peloton while raising funds for the Qhubeka Charity. In 2015, Team MTN-Qhubeka p/b Samsung created a campaign to help them mobilise 5,000 kids on bicycles. To contribute to the #BicyclesChangeLives Campaign, click here. Qhubeka is an Nguni word that means “to progress”, “to move forward”. Qhubeka (qhubeka.org) is World Bicycle Relief's program in South Africa. World Bicycle Relief (worldbicyclerelief.org) is a global non-profit organization dedicated to advancing education, health and economic opportunities by providing simple, sustainable transportation. Since World Bicycle Relief’s founding in 2005, it has delivered more than 220,000 specially designed, locally assembled bicycles to people in need. To contribute to the #BicyclesChangeLives Campaign, click here.", "external_links": [], "published": "2015-09-25T16:11:00.000+03:00", "crawled": "2015-09-25T23:17:42.576+03:00", "highlightTitle": ""}