{"organizations": ["US Patent and Trademark Office", "South Florida Chamber of Commerce", "US Congress", "Shop World Patent Marketing", "IDC", "US Chamber of Commerce", "Association for Manufacturing Excellence", "World Donald Trump", "International Licensing Industry Merchandisers' Association", "National Association of Manufacturers", "New York Inventor Exchange", "The New York Inventor Exchange", "Counter-Terrorism Board", "International Institute for Counter-Terrorism", "US Military", "Better Business Bureau", "Dun and Bradstreet", "Miami Beach Chamber of Commerce", "Greater Miami Chamber of Commerce", "Embassy", "International Institute of Counter-Terrorism", "Congress", "Sharon Hotel", "FEMA", "Defense Force", "Cooper Family", "New York Inventor Exchange World Patent Marketing", "Cooper Idea Foundation The Cooper Idea Foundation", "Advisory Board Member", "Committee on Homeland Security", "Shop World Patent Marketing World Patent Marketing", "Marine Corps", "Cooper Idea Foundation", "ICT", "Google", "Patent Greatest Inventors of Our Time Greatest Patents of All Time Early Failures of Successful Entrepreneurs Great Entrepreneurs Who Began Life Poor Youngest Inventors of All Time"], "uuid": "d246c02860f7b0cfe8e5cf496f8f55e559dd5b35", "thread": {"social": {"gplus": {"shares": 0}, "pinterest": {"shares": 0}, "vk": {"shares": 0}, "linkedin": {"shares": 0}, "facebook": {"likes": 0, "shares": 0, "comments": 0}, "stumbledupon": {"shares": 0}}, "site_full": "www.consumerelectronicsnet.com", "main_image": "", "site_section": "http://feeds2.feedburner.com/Cen-ConsumerElectronicsNet-technologyNews", "section_title": "CEN - Consumer Electronics Net-Technology News", "url": "http://www.consumerelectronicsnet.com/articles/viewarticle.jsp?id=4063574", "country": "US", "title": "US Congress Honors Counter Terrorism Expert and World Patent Marketing Advisory Board Member, General Nitzan Nuriel, During Week of September 11", "performance_score": 0, "site": "consumerelectronicsnet.com", "participants_count": 0, "title_full": "US Congress Honors Counter Terrorism Expert and World Patent Marketing Advisory Board Member, General Nitzan Nuriel, During Week of September 11", "spam_score": 0.0, "site_type": "news", "published": "2015-09-10T22:00:00.000+03:00", "replies_count": 0, "uuid": "d246c02860f7b0cfe8e5cf496f8f55e559dd5b35"}, "author": "", "url": "http://www.consumerelectronicsnet.com/articles/viewarticle.jsp?id=4063574", "ord_in_thread": 0, "title": "US Congress Honors Counter Terrorism Expert and World Patent Marketing Advisory Board Member, General Nitzan Nuriel, During Week of September 11", "locations": ["United States", "US", "Taiwan", "Macomb County", "Israel", "Iowa", "Israeli", "America", "New York", "Washington DC", "Herzilya", "LIMA", "China", "South Korea"], "entities": {"persons": [], "locations": [], "organizations": []}, "highlightText": "", "language": "english", "persons": ["Scott Cooper", "Aileen Marty", "Da Vinci", "Christopher R. Seaver", "Moti Horenstein", "Scott J. Cooper", "Nitzan", "Nuriel", "Omar Rivero", "Nitzan Nuriel", "Matthew Whitaker", "Richard Sulaka", "Peter T. King"], "text": "US Congress Honors Counter Terrorism Expert and World Patent Marketing Advisory Board Member, General Nitzan Nuriel, During Week of September 11 September 10, 2015 -- New York, NY (PRWEB) September 10, 2015 World Patent Marketing, a vertically integrated manufacturer and distributor of patented products, announced that Advisory Board Member, Brig. Gen (Res.) Nitzan Nuriel, received an Honorary Citation from the United States Congress on Monday, Sept. 7, 2015, for outstanding contributions to world security and counter-terrorism. \"We are thrilled,\" said Scott J. Cooper, CEO and Creative Director of World Patent Marketing. \"A Congressional Citation is a huge honor. Then again, Nitzan has had an amazing career, he has been an exceptional leader in the war on global terror. He has one of the quickest minds I have ever come across and a profound knowledge of the issues involved. Good job Nitzan, we couldn't be more proud to have you as a colleague and Board Member.\" The award was presented by Congressman Peter T. King, former Chairman and ranking member of the Committee on Homeland Security, on the first day of the prestigious World Summit on Counter-Terrorism, held by the International Institute of Counter-Terrorism (ICT). This was the ICT's 15th International conference and it was attended by over 1,000 of the world's top decision makers in defense, intelligence, and security. 60 countries were in attendance. The Conference was held at the Sharon Hotel and the IDC in Herzilya. Congressman King announced that Nuriel was honored with this prestigious award because of his work in supporting the International Institute for Counter-Terrorism from its inception in 1996, five years before September 11, 2001. Nuriel was one of the earliest advocates and supporters of the important project, which sought to bring together leaders of the intelligence, diplomatic and defense communities for communication and information. Throughout Nuriels career he has been known for his leadership and advocacy of the necessity to take a firm stand on terrorism to increase global security and safety. Nuriel is currently a Research Fellow at the International Institute of Counter-Terrorism. From 2007 to 2012 he was the Director of the Counter-Terrorism Board under the Israeli Prime Minister's Office. As a young man he served in the Israeli Defense Force, and rose through the ranks of command to eventually obtain the title of Brigadier General. Among his positions, he was posted as Military Attach√© to the Israeli Embassy in Washington DC, where he served as the official liaison between the US Military, Marine Corps, Special Operations Command, FEMA and Homeland Security. He received the Legion of Merit from the President of the United States for his accomplishments in maintaining promoting world security. World Patent Marketing offers the warmest congratulations to Advisory Board Member Nitzan Nuriel. About World Patent Marketing World Patent Marketing is a vertically integrated manufacturer and engineer of patented products. The company is broken into eight operating divisions. These include WPM Research, WPM Patents, WPM Web & Apps, WPM Prototyping, WPM Manufacturing, WPM Capital Ventures, WPM Social Media and WPM Retail. The company offers these products to inventors, law firms and emerging growth companies. WPM Research: evaluates the commercial potential of patents through its proprietary study, The Patent Invention Technical Analysis (PITA). WPM Patents: develops intellectual property strategies, writes and files patent applications with the US Patent and Trademark Office and other patent offices around the world. WPM Web & Apps: offers complete development services for web site and mobile apps, including: research, design, code, application of skins, testing, and distribution. Also offers top quality design and artwork, a necessary element in the crowded field of web site and mobile apps. WPM Prototyping: works with clients to develop one or more types of prototype, including: appearance, proof of concept, functional model or a production level prototype. WPM Manufacturing: provides overseas production from all 14 major industrial zones in China, Taiwan and South Korea. Having access to a staff on the ground in China makes all the difference in achieving the best price, quality, and turnaround time. WPM Capital Ventures: provides seed funding for startups. Seed funding is the earliest stage of venture funding. WPM's goal is to get you through the first phase. This usually means: get you to the point where youve built something impressive enough to raise money on a larger scale. Then we can introduce you to later stage investorsor occasionally even acquirers. WPM Social Media: has created an innovative, specialized approach that we use to power social media marketing for some of the world's best brands. Brands choose us because, as one of the world's most innovative companies, we know how to turn business objectives into realities in creative, strategic and measurable ways. WPM Retail: Offers shopping online, in person, on mobile devices and with social media. To be successful today, companies need to be able to sell products in as many different ways as possible. World Patent Marketing Reviews World Patent Marketing is the only patent services company in history to be awarded a five star review rating from Consumer Affairs, Google, Trustpilot, Shopper Approved, Customer Lobby, Yellow Pages, Yelp, Reseller Ratings and My Three Cents. World Patent Marketing has received accredited status and is an A+ Rated Member of the Better Business Bureau. World Patent Marketing is also a proud member of Dun and Bradstreet, the US Chamber of Commerce, the Association for Manufacturing Excellence and the International Licensing Industry Merchandisers' Association (LIMA). World Patent Marketing is also a proud member of the National Association of Manufacturers, the South Florida Chamber of Commerce, the Greater Miami Chamber of Commerce, and the Miami Beach Chamber of Commerce and The New York Inventor Exchange. Scott J. Cooper, CEO and Creative Director, World Patent Marketing Moti Horenstein, Direct of Security Risk Management, World Patent Marketing Aileen Marty, MD, Professor and Scientist Nitzan Nuriel, Brigadier General (Res)., Israel Defense Forces Omar Rivero, Founder of Occupy Democrats Christopher R. Seaver, MD, Da Vinci Robotics Surgeon Richard Sulaka, Macomb County Deputy Public Works Commissioner Matthew Whitaker, Former US Attorney, Iowa WORLD PATENT MARKETING AFFILIATES The New York Inventor Exchange World Patent Marketing launched The New York Inventor Exchange on January 1, 2015. It is the first of its kind marketplace. It will level the playing field for small inventors being bullied out of the manufacturing and mobile app development marketplaces by multi-national corporations with deep pockets. The New York Inventor Exchange diverse markets span inventors, entrepreneurs, manufacturers, engineers, and mobile app developers. Invention Town World Patent Marketing has also announced the launch of InventionTown.com, America's Inventor Watchdog. Shop World Patent Marketing World Patent Marketing launched Shop World Patent Marketing as another retail distribution channel for manufactured products. The Cooper Idea Foundation The Cooper Idea Foundation is dedicated to providing funding for special causes around the world. Established by the Cooper Family, the Foundation believes that innovation is vital to the state of the worlds children. Led by Scott Cooper, the Foundations goal is to help young people push the boundaries of whats possible and create a future they want. Our goal is to raise expectations and the hopes and dreams of every child on Earth.On June 9, 2015, The Cooper Idea Foundation and World Patent Marketing Pledged $250,000 to Inventors and Engineers Youth Village and most recently dedicated The Cooper Kindergarten. The Cooper Idea Foundation has funded an educational video series on YouTube for World Patent Marketing . Recent Videos Include: The History of the Patent Greatest Inventors of Our Time Greatest Patents of All Time Early Failures of Successful Entrepreneurs Great Entrepreneurs Who Began Life Poor Youngest Inventors of All Time Immigrants That Made It Big Social Media Sites That Changed the World Donald Trump - What World Patent Marketing's Customers Can Learn Lessons From the Men Who Built America Submit Your Idea to World Patent Marketing! \nRead the full story at http://www.prweb.com/releases/worldpatentmarketing/nitzan-nuriel/prweb12953381.htm .", "external_links": [], "published": "2015-09-10T22:00:00.000+03:00", "crawled": "2015-09-11T05:06:22.919+03:00", "highlightTitle": ""}