{"organizations": ["Iron Mountain Inc.", "PRTC", "PureTech Health", "PureTech", "Biogen", "Science & Technology PureTech", "KPMG", "PureTech Health plc"], "uuid": "c27076b24f6319fac8aa83cda85a0c1975db435e", "thread": {"social": {"gplus": {"shares": 0}, "pinterest": {"shares": 0}, "vk": {"shares": 0}, "linkedin": {"shares": 0}, "facebook": {"likes": 0, "shares": 0, "comments": 0}, "stumbledupon": {"shares": 0}}, "site_full": "science-technology.news-articles.net", "main_image": "", "site_section": "http://science-technology.news-articles.net/content/rss.php", "section_title": "Science and Technology @ News Articles Network", "url": "http://science-technology.news-articles.net/content/puretech-appoints-michael-maclean-chief-financial-officer.xhtml", "country": "US", "title": "PureTech Appoints Michael MacLean as Chief Financial Officer", "performance_score": 0, "site": "news-articles.net", "participants_count": 0, "title_full": "PureTech Appoints Michael MacLean as Chief Financial Officer", "spam_score": 0.0, "site_type": "news", "published": "2015-09-14T13:53:00.000+03:00", "replies_count": 0, "uuid": "c27076b24f6319fac8aa83cda85a0c1975db435e"}, "author": "", "url": "http://science-technology.news-articles.net/content/puretech-appoints-michael-maclean-chief-financial-officer.xhtml", "ord_in_thread": 0, "title": "PureTech Appoints Michael MacLean as Chief Financial Officer", "locations": ["Massachusetts", "PureTech", "Boston", "BOSTON"], "entities": {"persons": [], "locations": [], "organizations": []}, "highlightText": "", "language": "english", "persons": ["MacLean", "Daphne Zohar", "Michael MacLean", "Michael"], "text": "PureTech Appoints Michael MacLean as Chief Financial Officer » Science & Technology PureTech Appoints Michael MacLean as Chief Financial Officer -- BOSTON, September 14,   PureTech Health (PRNewsFoto/PureTech Health)  ><- stripped tags -> BOSTON , September 14,   PureTech Health plc (\"PureTech\" or the \"Company\", LSE: PRTC), a science-driven healthcare company seeking to develop disruptive solutions to address unmet medical needs and improve the lives of patients, today announced that Michael MacLean has been appointed to PureTech's management team as Chief Financial Officer and Executive Vice President. (Logo: [[UEdFZ2NtVnNQVndpYm05bWIyeHNiM2RjSWlCdmJtTnNhV05yUFNkc2FXNXJUMjVEYkdsamF5aDBhR2x6S1NjZ2RHRnlaMlYwUFNkZllteGhibXNuSUdoeVpXWTlYQ0pvZEhSd09pOHZjR2h2ZEc5ekxuQnlibVYzYzNkcGNtVXVZMjl0TDNCeWJtZ3ZNakF4TlRBNU1UUXZNalkyTURJeVRFOUhUMXdpSUhKbGJEMWNJbTV2Wm05c2JHOTNYQ0krYUhSMGNEb3ZMM0JvYjNSdmN5NXdjbTVsZDNOM2FYSmxMbU52YlM5d2NtNW9Mekl3TVRVd09URTBMekkyTmpBeU1reFBSMDg4TDJFK3w=]] ) Michael MacLean joins PureTech from Iron Mountain Inc. (NYSE: IRM ), the FORTUNE 1000 global storage and information management company, where he was Chief Financial Officer of its North American business overseeing $2.2bn of annual revenue and approximately $1bn of EBITDA. Previously, Mr. MacLean was Senior Vice President, Finance and Chief Accounting Officer at Biogen (NASDAQ: BIIB ), a global biopharmaceutical company with annual revenues of more than $9bn , during which time he managed many of the finance and accounting functions and was responsible for structuring and managing collaborations and strategic acquisitions. He also was an audit partner at global public accounting firms including KPMG, one of the largest professional services companies in the world where he supported global clients in industries including pharmaceuticals, medical devices and diagnostics. Daphne Zohar, Co-Founder and CEO of PureTech commented: \"We are pleased to welcome Michael to PureTech as our Chief Financial Officer. His wealth of experience in finance and accounting across multiple disciplines, including deal structuring and acquisitions in the healthcare sector, will be a great addition to PureTech as our growth stage companies move towards commercialization.\" Michael MacLean commented: \"In my various roles, I've looked closely at many businesses in the healthcare sector and PureTech stands out as truly innovative. I look forward to joining the stellar PureTech team and contributing during this exciting phase of growth for the Company.\" About PureTech PureTech (PureTech Health plc, PRTC.L) is a science-driven healthcare company, seeking to solve some of today's toughest health challenges through disruptive approaches. Based in Boston, Massachusetts , PureTech has a pipeline of 12 operating companies, seven of which are \"growth stage\" with external validation including strategic partnerships, outside funding, proof-of-concept or peer review in prestigious scientific journals. PureTech is problem-focused and solution-agnostic, looking beyond traditional disciplines and approaching healthcare problems from different perspectives. Focusing on areas of significant unmet medical need, PureTech evaluates more than 650 ideas per year, prioritizing, selecting and testing what it believes to be the most scientifically and commercially promising concepts to advance. PureTech's leading team and board, along with an advisory network of more than 50 experts across multiple disciplines, gives PureTech access to potentially groundbreaking science and technological innovations. For more information, visit http://www.puretechhealth.com and connect with us on Twitter . PureTech Forward-Looking Statement This press release contains statements that are or may be forward-looking statements, including statements that relate to the company's future prospects, developments and strategies. The forward-looking statements are based on current expectations and are subject to known and unknown risks and uncertainties that could cause actual results, performance and achievements to differ materially from current expectations, including, but not limited to, those risks and uncertainties described in the risk factors included in the company's regulatory filings. These forward-looking statements are based on assumptions regarding the present and future business strategies of the company and the environment in which it will operate in the future. Each forward-looking statement speaks only as at the date of this press release. Except as required by law, regulatory requirement, the Listing Rules and the Disclosure and Transparency Rules, neither the company nor any other party intends to update or revise these forward-looking statements, whether as a result of new information, future events or otherwise. \nSOURCE PureTech Health Served by: 127.0.0.1 ~ (c) 2004 - 2015, News Articles Network » Categories", "external_links": [], "published": "2015-09-14T13:53:00.000+03:00", "crawled": "2015-09-14T13:40:33.578+03:00", "highlightTitle": ""}