{"organizations": ["Cepsa", "Global Pacific & Partners", "Ophir Energy Plc", "Dominion Petroleum Limited", "Coastal Energy Corp", "Impact Oil & Gas", "Rabobank", "Networking Reception   Banking, Finance & Investment , Business & Economy", "Buren Lawyers B.V.", "Summer Party", "Preng & Associates", "West Holland Foreign Investment Agency"], "uuid": "7ab17b55552c263d4f8594d63e2242ac44860fb1", "thread": {"social": {"gplus": {"shares": 0}, "pinterest": {"shares": 0}, "vk": {"shares": 0}, "linkedin": {"shares": 0}, "facebook": {"likes": 0, "shares": 0, "comments": 0}, "stumbledupon": {"shares": 0}}, "site_full": "energy.einnews.com", "main_image": "http://www.einpresswire.com/image/medium/19463/the-hague-2.jpeg", "site_section": "http://feeds.feedburner.com/EnergyTechnologyNews", "section_title": "Energy Technology News", "url": "http://energy.einnews.com/pr_news/287410901/world-upstream-petroafricanus-clubs-summer-party-and-networking-reception?ref=rss&lcode=Q8Z974Xrm3E5GSKZmElRYNfdOF_bPLVe50Qnj3WwjgM%3D", "country": "US", "title": "World Upstream / PetroAfricanus Clubs – Summer Party and Networking Reception", "performance_score": 0, "site": "einnews.com", "participants_count": 0, "title_full": "World Upstream / PetroAfricanus Clubs – Summer Party and Networking Reception", "spam_score": 0.0, "site_type": "news", "published": "2015-09-21T12:46:00.000+03:00", "replies_count": 0, "uuid": "7ab17b55552c263d4f8594d63e2242ac44860fb1"}, "author": "", "url": "http://energy.einnews.com/pr_news/287410901/world-upstream-petroafricanus-clubs-summer-party-and-networking-reception?ref=rss&lcode=Q8Z974Xrm3E5GSKZmElRYNfdOF_bPLVe50Qnj3WwjgM%3D", "ord_in_thread": 0, "title": "World Upstream / PetroAfricanus Clubs – Summer Party and Networking Reception", "locations": ["The Netherlands", "Philippines", "Hague", "UK North Sea", "Calgary", "Houston", "Geneva", "East Africa", "Northwest Africa", "Cape Town", "SPTEC", "Europe", "Guyane", "London", "The Hague", "South America", "Singapore", "Paris", "Southeast Asia"], "entities": {"persons": [], "locations": [], "organizations": []}, "highlightText": "", "language": "english", "persons": ["Ingrid van Engelshoven", "Andrew Cochran"], "text": "  Banking, Finance & Investment , Business & Economy ... World Upstream / PetroAfricanus Clubs – Summer Party and Networking Reception THE HAGUE, THE NETHERLANDS, September 21,   On Wednesday 23rd September 2015, Global Pacific & Partners, World Trade Center (The Hague), West Holland Foreign Investment Agency and The Municipality of The Hague will host a reception for oil and gas industry executives. This Reception forms part of Global Pacific & Partners’ international network of industry events held in London, Houston, Calgary, Singapore, Paris, Geneva and Cape Town. The Vice Mayor of The Hague, Ingrid van Engelshoven, will welcome attendees to the World Trade Centre as the City of The Hague seeks to further its influence in the oil and gas sector both in The Netherlands and abroad. The Reception will act to connect senior-level corporate players and facilitate critical industry interests by providing a unique networking forum with peers and players within the worldwide oil and gas industry across the value chain. Rabobank and Buren Lawyers B.V., CGG, SPTEC, Impact Oil & Gas and Preng & Associates sponsor The Reception. Guest speaker for the evening is Mr. Andrew Cochran, Chairman of Hague and London Oil (\"HALO\") Plc, an international oil and gas company recently established in The Hague. Andrew Cochran was the Executive Director of Coastal Energy Corp until March 2014, when it was sold to Cepsa in a $2.5B transaction. Prior to that he was Chief Executive Officer of Dominion Petroleum Limited following his appointment on 3 November 2009 until its successful sale to Ophir Energy Plc in February 2012. Hague and London Oil opened its office in The Hague in 2014 and is a robust independent upstream business with a global portfolio of assets. The Current portfolio is comprised of assets in Southeast Asia (Philippines), South America (Guyane), Europe (UK North Sea), East Africa (Juan de Nova) and Northwest Africa (SADR). Source: Global Pacific & Partners", "external_links": [], "published": "2015-09-21T12:46:00.000+03:00", "crawled": "2015-09-22T04:58:55.477+03:00", "highlightTitle": ""}