{"organizations": ["Nokia Oyj", "Chartered Financial Analyst", "Advanced Micro Devices", "Marvell Technology Group Ltd", "Marvell Technology Group", "Yingli Green Energy Technology Stocks Under Review", "S&P", "Nokia Corporation", "Zynga Inc.", "CFA Institute", "Yingli Green Energy Holding Co Ltd", "Nokia Oyj Nokia Oyj", "Yingli Green Energy   09:31:26 Technology Stocks Under Review", "ACI Association", "Zynga", "Zynga Inc", "Active Charter Investors Association", "Nokia", "Yingli Green Energy Holding Company Limited", "Advanced Micro Devices, Inc.", "Zynga Inc Zynga Inc", "MRVL", "AMD", "Yingli Green Energy Holding Co Ltd Yingli Green Energy Holding Co Ltd", "Marvell Technology Group Ltd.", "Advanced Micro Devices Inc", "Advanced Micro Devices Inc Advanced Micro Devices Inc"], "uuid": "986cabc0a58c3d4cd70fd26498581a1b17e1dd21", "thread": {"social": {"gplus": {"shares": 0}, "pinterest": {"shares": 0}, "vk": {"shares": 0}, "linkedin": {"shares": 0}, "facebook": {"likes": 0, "shares": 0, "comments": 0}, "stumbledupon": {"shares": 0}}, "site_full": "science-technology.news-articles.net", "main_image": "", "site_section": "http://science-technology.news-articles.net/content/rss.php", "section_title": "Science and Technology @ News Articles Network", "url": "http://science-technology.news-articles.net/content/technology-stocks-under-review-zynga-marvell-group-nokia-advanced-micro-devices-yingli-green-energy.xhtml", "country": "US", "title": "Technology Stocks Under Review - Zynga, Marvell Technology Group, Nokia, Advanced Micro Devices and Yingli Green Energy", "performance_score": 0, "site": "news-articles.net", "participants_count": 0, "title_full": "Technology Stocks Under Review - Zynga, Marvell Technology Group, Nokia, Advanced Micro Devices and Yingli Green Energy", "spam_score": 0.0, "site_type": "news", "published": "2015-09-30T19:58:00.000+03:00", "replies_count": 0, "uuid": "986cabc0a58c3d4cd70fd26498581a1b17e1dd21"}, "author": "", "url": "http://science-technology.news-articles.net/content/technology-stocks-under-review-zynga-marvell-group-nokia-advanced-micro-devices-yingli-green-energy.xhtml", "ord_in_thread": 0, "title": "Technology Stocks Under Review - Zynga, Marvell Technology Group, Nokia, Advanced Micro Devices and Yingli Green Energy", "locations": ["Belarus", "Iran", "Cuba", "Canada", "Syria", "North Korea", "NEW YORK", "Sudan", "Somalia"], "entities": {"persons": [], "locations": [], "organizations": []}, "highlightText": "", "language": "english", "persons": ["Rohit Tuli"], "text": "Technology Stocks Under Review - Zynga, Marvell Technology Group, Nokia, Advanced Micro Devices and Yingli Green Energy   09:31:26 Technology Stocks Under Review - Zynga, Marvell Technology Group, Nokia, Advanced Micro... -- NEW YORK, September   <-   NEW YORK , September   ACI Association has initiated research coverage on the following equities: Zynga Inc. (NASDAQ: ZNGA ), Marvell Technology Group Ltd. (NASDAQ: MRVL ), Nokia Corporation (NYSE: NOK ), Advanced Micro Devices, Inc. (NASDAQ: AMD ), Yingli Green Energy Holding Company Limited (NYSE: YGE ). On Tuesday, September 29, 2015 , NASDAQ ended at 4,517.32, down 0.59%, Dow Jones advanced 0.30% to finish the day at 16,049.13 and the S&P closed at 1,884.09, up 0.12%. Register for your complimentary reports at the links given below. Zynga Inc Zynga Inc's stock edged lower by 3.91% to close Tuesday's session at USD 2.21 . The company's shares oscillated between USD 2.20 and USD 2.33 , marking a new 52-week low during the session. The stock recorded a trading volume of 11.41 million shares, which was above its 50-day daily average volume of 11.05 million shares and below its 52-week average volume of 14.93 million shares. Over the last three days, Zynga Inc's shares have declined by 7.14% and in the past one week it has moved down 8.68%. Furthermore, over the last three months, the stock has lost 22.73% and in the past six months, the shares have shed 22.46%. Sign up and read the free notes on ZNGA at: http://www.aciassociation.com/ZNGA.pdf Marvell Technology Group Ltd The stock of Marvell Technology Group Ltd remained unchanged from the previous day session to close at USD 9.05 . The shares of the company moved in the range of USD 8.93 and USD 9.29 . A trading volume of 10.51 million shares was recorded, which was greater than its 150-day daily average volume of 7.09 million shares and above its 52-week average volume of 6.90 million shares. Over the last five days, Marvell Technology Group Ltd's shares have advanced 2.38% and in the past one month, it has lost 18.62%. Additionally, over the last three months, the stock has declined 31.36% and in the past six months, the shares have registered a loss of 38.44%. Marvell Technology Group Ltd has a current dividend yield of 2.65%. The stock is trading at a price to book ratio of 0.91 against the historical PB ratio of 1.55. Register for free on ACI Association and access the latest research on MRVL at: http://www.aciassociation.com/MRVL.pdf Nokia Oyj Nokia Oyj's stock increased by 1.86% to close Tuesday's session at USD 6.58 . The company's shares fluctuated in the range of USD 6.48 and USD 6.64 . A total of 9.83 million shares exchanged hands, which was lesser than its 50-day daily average volume of 10.92 million shares and was below its 52-week average volume of 17.56 million shares. Over the last three days Nokia Oyj's shares have declined by 1.20% and in the past one week it has moved up 0.92%. Furthermore, over the last three months, the stock has lost 3.94% and in the past six months, the shares have shed 13.19%. Nokia Oyj has a current dividend yield of 2.41%. Further, the company is trading at a price to earnings ratio of 12.19 and a price to book ratio of 2.36. This compares to a historical PE ratio of 20.77 and the historical PB ratio of 2.75. Additionally, the stock is trading at a price to cash flow ratio of 9.04 and price to sales ratio of 1.60. The complete research on NOK is available for free at: http://www.aciassociation.com/NOK.pdf Advanced Micro Devices Inc Advanced Micro Devices Inc's stock added 0.60% to close Tuesday's session at USD 1.67 . The company's shares oscillated between USD 1.65 and USD 1.69 . The stock recorded a trading volume of 7.01 million shares, which was below its 50-day daily average volume of 11.39 million shares and below its 52-week average volume of 16.18 million shares. Over the last five days, Advanced Micro Devices Inc's shares have declined by 3.47% and in the past one month, it has lost 6.18%. In addition, over the last three months, the stock has lost 30.42% and year to date, the shares have shed 37.45%. The stock is trading at a price to book ratio of 3.81 against the historical PB ratio of 11.00. Free in-depth research on AMD is available at: http://www.aciassociation.com/AMD.pdf Yingli Green Energy Holding Co Ltd Yingli Green Energy Holding Co Ltd's stock declined 21.46% to close Tuesday's session at USD 0.33 . The share price vacillated between USD 0.33 and USD 0.42 , marking a new 52-week low during the session. The stock recorded a trading volume of 4.19 million shares, which was above its 50-day daily average volume of 1.27 million shares and above its 52-week average volume of 2.00 million shares. Over the last three days, Yingli Green Energy Holding Co Ltd's shares have declined by 19.93% and in the past one week it has moved down 28.63%. Moreover, in the last six months, the stock has lost 82.25% and year to date, the shares have shed 86.03%. The complimentary notes on YGE can be downloaded in PDF format at: http://www.aciassociation.com/YGE.pdf About ACI Association: Active Charter Investors Association (\"ACI Association\") produces regular sponsored and non-sponsored reports, articles, stock market blogs, and popular investment newsletters covering equities listed on NYSE and NASDAQ and micro-cap stocks. ACI Association has two distinct and independent departments. One department produces non-sponsored analyst certified content generally in the form of press releases, articles and reports covering equities listed on NYSE and NASDAQ and the other produces sponsored content (in most cases not reviewed by a registered analyst), which typically consists of compensated investment newsletters, articles and reports covering listed stocks and micro-caps. Such sponsored content is outside the scope of procedures detailed below. ACI Association has not been compensated; directly or indirectly; for producing or publishing this document. PRESS RELEASE PROCEDURES: The non-sponsored content contained herein has been prepared by a writer (the \"Author\") and is fact checked and reviewed by a third party research service company (the \"Reviewer\"). Rohit Tuli , a CFAÂ® charter holder (the \"Sponsor\"), provides necessary guidance in preparing the document templates. The Reviewer has reviewed and revised the content, as necessary, based on sound investment judgment and publicly available information which is believed to be reliable. The Reviewer and the Sponsor have not performed any independent investigations or forensic audits to validate the information herein. Unless otherwise noted, any content outside of this document has no association with the Author, the Reviewer, or the Sponsor (collectively referred to as the \"Production Team\") in any way. The Production Team is compensated on a fixed monthly basis and do not hold any positions of interest in any of the securities mentioned herein. The information in this release has been sourced from a third party data base. NO WARRANTY ACI Association, the Author, the Reviewer and the Sponsor (collectively referred to as the \"Publishers\") are not responsible for any error which may be occasioned at the time of printing of this document or any error, mistake or shortcoming. No liability is accepted by the Publishers whatsoever for any direct, indirect or consequential loss arising from the use of this document. The Publishers expressly disclaim any fiduciary responsibility or liability for any consequences, financial or otherwise arising from any reliance placed on the information in this document. Additionally, the Publishers do not (1) guarantee the accuracy, timeliness, completeness or correct sequencing of the information, or (2) warrant any results from use of the information. The included information is subject to change without notice. NOT AN OFFERING This document is not intended as an offering, recommendation, or a solicitation of an offer to buy or sell the securities mentioned or discussed, and is to be used for informational purposes only. Please read all associated disclosures and disclaimers in full before investing. Neither ACI Association nor any party affiliated with us is a registered investment adviser or broker-dealer with any agency or in any jurisdiction whatsoever. To download our report(s), read our disclosures, or for more information, visit http://www.aciassociation.com/ . RESTRICTIONS ACI Association is not available to residents of Belarus , Cuba , Canada , Iran , North Korea , Sudan , Syria or Somalia . CFAÂ® and Chartered Financial AnalystÂ® are registered trademarks owned by CFA Institute.", "external_links": [], "published": "2015-09-30T19:58:00.000+03:00", "crawled": "2015-09-30T19:44:33.707+03:00", "highlightTitle": ""}