{"organizations": ["MySQL", "University Of Albany School Of Business", "IBM Watson", "Lighthouse Research and Advisory", "Merrill Lynch", "Tech Conference", "Citibank", "Morgan Stanley", "Brandon Hall Group", "MariaDB Foundation", "New York Marriott Marquis"], "uuid": "417d9678fc8475322ed943c0b1f2d0a674f565a1", "thread": {"social": {"gplus": {"shares": 0}, "pinterest": {"shares": 0}, "vk": {"shares": 0}, "linkedin": {"shares": 0}, "facebook": {"likes": 0, "shares": 0, "comments": 0}, "stumbledupon": {"shares": 0}}, "site_full": "www.24-7pressrelease.com", "main_image": "http://www.24-7pressrelease.com/images/icon-247pressrelease.jpg", "site_section": "http://rss.24-7pressrelease.com/rss/technology_software.xml", "section_title": "Press Release and Top Technology   Software News From 24-7 Press Release Newswire", "url": "http://www.24-7pressrelease.com/press-release/worlds-first-open-source-hr-tech-conference-in-new-york-this-week-413414.php", "country": "US", "title": "World's First Open Source HR Tech Conference in New York This Week", "performance_score": 0, "site": "24-7pressrelease.com", "participants_count": 0, "title_full": "World's First Open Source HR Tech Conference in New York This Week", "spam_score": 0.0, "site_type": "news", "published": "2015-09-29T10:00:00.000+03:00", "replies_count": 0, "uuid": "417d9678fc8475322ed943c0b1f2d0a674f565a1"}, "author": "", "url": "http://www.24-7pressrelease.com/press-release/worlds-first-open-source-hr-tech-conference-in-new-york-this-week-413414.php", "ord_in_thread": 0, "title": "World's First Open Source HR Tech Conference in New York This Week", "locations": ["New York City", "New York", "NJ", "SECAUCUS", "HRIS"], "entities": {"persons": [], "locations": [], "organizations": []}, "highlightText": "", "language": "english", "persons": ["Sujee Saparamadu", "Johnson", "Congdon", "Saparamadu", "Axmark", "Lee Congdon", "David Axmark", "Lagunas", "Kyle Lagunas", "Richard Johnson"], "text": "World's First Open Source HR Tech Conference in New York This Week Rapidly Growing, Global OrangeHRM Community to Gather in New York for Premier Annual Event. OHRMCon will become the world's largest HR gathering in the years to come SECAUCUS, NJ, September 29,   OHRMCon, the world's first open source Human Resources software conference , launches this week in New York City. Bringing together industry experts, thought leaders, and participants from the fields of open source, HR, and HR tech management, the conference is slated to run October 1-2, 2015, at the New York Marriott Marquis hotel. At OHRMCon, attendees will learn and discuss trends in HR tech, network with colleagues, and participate in the open source community. Just some of the conference speakers include: Sujee Saparamadu : With more than 17 years in the field of information technology, Mr. Saparamadu is the co-founder and CEO of OrangeHRM. Mr. Saparamadu has extensive experience developing and launching enterprise applications for Morgan Stanley, Merrill Lynch, and others. Challenges to the HR industry, and how to make the most of human resource information systems (HRIS) are just two of the topics for discussion by Mr. Saparamadu. Lee Congdon : Mr. Congdon is the CIO of Red Hat. With Red Hat since 2007, Mr. Congdon has a deep background in information technology through his work with Capital One, Nasdaq, and Citibank. Considered a visionary in the field, Mr. Congdon has the long-view of what is needed for enterprise leadership in an industry that evolves daily. Expected to discuss the dynamic state of the Open organization, Mr. Congdon is a thought leader on criteria for remaining relevant in a rapidly changing world. Kyle Lagunas : As Principal Analyst at Lighthouse Research and Advisory, Mr. Lagunas specializes in recruitment. Look for Mr. Lagunas to discuss latest thoughts, techniques, and positive strategies for talent acquisition. Formerly with Brandon Hall Group, and Software Advice, Mr. Lagunas is an expert in sourcing, recruiting, hiring, and retaining talent. Dr. Richard Johnson : As Department Chair and Associate Professor at the University Of Albany School Of Business, Dr. Johnson is an expert in HRIS, e-learning, and human motivation. He is uniquely knowledgeable in human-computer interaction in the HR realm, and his keynote presentation will help gauge your business readiness in the global competition for top talent. David Axmark : Co-founder of MySQL, Mr. Axmark is an expert in the OS community. Currently working with the MariaDB Foundation, Mr. Axmark will discuss the billion-dollar development journey of MySQL, and his vision for the future of OS. \"We are excited to launch our first user conference,\" said Co-founder & CEO of OrangeHRM, Sujee Saparamadu. \"I believe OHRMCon will become the world's largest HR gathering in the years to come.\" Furthermore OHRMCon 2015 will see the launch of a state of the art ATS, with a wide range of options for candidate sourcing, an integrated interview assistant and decsion support system with predictive analytics and personality insights powered by IBM Watson. These are just some of the areas for discussion at OHRMCon. Attend a Thursday morning, hands-on, workshop to understand the key capabilities of your OrangeHRM system. Solve HR and tech challenges, meet associates, and stay on the developing edge of HRIS by attending OHRMCon next week in New York. About OrangeHRM Launched in 2005, OrangeHRM is the world's most popular open source HR software, utilized by more than two million people. OrangeHRM offers scalable, open-source and SaaS human resource management solutions to businesses and organizations around the globe. # # #", "external_links": [], "published": "2015-09-29T10:00:00.000+03:00", "crawled": "2015-09-29T11:57:43.810+03:00", "highlightTitle": ""}