{"organizations": ["Yardi Launches New Data Centre", "Yardi Cloud", "Yardi Investment Suite", "Yardi Orion ® Business Intelligence"], "uuid": "94e9bed1908d6756f903ceebbc8d2010a92facc2", "thread": {"social": {"gplus": {"shares": 0}, "pinterest": {"shares": 0}, "vk": {"shares": 0}, "linkedin": {"shares": 0}, "facebook": {"likes": 0, "shares": 0, "comments": 0}, "stumbledupon": {"shares": 0}}, "site_full": "businesswireindia.com", "main_image": "", "site_section": "http://businesswireindia.com/RSSFeeds/subcat-technology.xml", "section_title": "BusinessWire India.com - Technology", "url": "http://businesswireindia.com/news/news-details/yardi-launches-new-data-centre-singapore/45075", "country": "US", "title": "Yardi Launches New Data Centre in Singapore", "performance_score": 0, "site": "businesswireindia.com", "participants_count": 0, "title_full": "Yardi Launches New Data Centre in Singapore", "spam_score": 0.0, "site_type": "news", "published": "2015-09-03T08:14:00.000+03:00", "replies_count": 0, "uuid": "94e9bed1908d6756f903ceebbc8d2010a92facc2"}, "author": "", "url": "http://businesswireindia.com/news/news-details/yardi-launches-new-data-centre-singapore/45075", "ord_in_thread": 0, "title": "Yardi Launches New Data Centre in Singapore", "locations": ["Yardi Launches New Data Centre", "North America", "Canada", "Singapore Yardi", "Singapore", "Yardi Voyager", "Yardi", "Australia", "Europe", "Asia", "Southeast Asia", "Middle East"], "entities": {"persons": [], "locations": [], "organizations": []}, "highlightText": "", "language": "english", "persons": ["Neal Gemassmer", "Yardi"], "text": "Thursday, September 3, 2015 10:44AM IST (5:14AM GMT) Yardi Launches New Data Centre in Singapore Facility joins a worldwide network of secure, scalable data management Singapore Yardi ® is meeting the data security and infrastructure needs of its rapidly growing client base in Southeast Asia by opening a new data centre in Singapore. The Singapore data centre adds to a network of more than 10 centres in North America, Canada, Europe, Asia and Australia. Together they form the Yardi Cloud, a secure, scalable and cost-effective software provisioning and data management solution that relieves clients of IT infrastructure, support services and security responsibilities. “This step will help our clients in Asia gain the greatest possible value from their Yardi Voyager ® , the foundation of a comprehensive back office and front office technology solution. The Singapore data centre extends to our growing roster of Asia-based clients the Yardi Cloud’s fast, best practice-based solution deployments, painless upgrades and reduced overhead and capital costs,” said Neal Gemassmer, vice president of international for Yardi. Yardi’s data centres are protected by multiple firewalls, onsite security, video surveillance, biometric screening, real-time offsite replication, fire suppression systems and other electronic and physical protections. About Yardi Now in its fourth decade, Yardi ® is committed to the design, development and support of software for real estate investment management and property management. With the Yardi Commercial Suite ™ , Yardi Residential Suite ™ , Yardi Investment Suite ™ and Yardi Orion ® Business Intelligence, the Yardi Voyager ® platform is a complete real estate management solution. It includes operations, accounting and services with portfolio-wide business intelligence and platform-wide mobility. Yardi serves clients worldwide from offices in Australia, Asia, Middle East, Europe and North America. For more information, visit www.yardi.com/asia .", "external_links": [], "published": "2015-09-03T08:14:00.000+03:00", "crawled": "2015-09-03T16:45:57.831+03:00", "highlightTitle": ""}